ansor_log/rocm-MI100/ResNet/rocm-ResNet-75.json
{"i": [["[\"817107844ff3a9e513e2b591bc12641a\", [32, 3072], [1, 3072], [1], [32, 1]]", "rocm -keys=rocm,gpu -max_num_threads=256 -max_shared_memory_per_block=65536 -max_threads_per_block=256 -mcpu=gfx908 -mtriple=amdgcn-amd-amdhsa-hcc -thread_warp_size=64", [-1, 16, 64, 65536, 2147483647, 1024, 16, 64], "", 0, []], [[], [["SP", 2, 0, 32, [1, 4, 1, 2], 1], ["SP", 2, 5, 1, [1, 1, 1, 1], 1], ["SP", 2, 10, 3072, [16, 32], 1], ["RE", 2, [0, 5, 1, 6, 2, 7, 10, 11, 3, 8, 12, 4, 9]], ["FSP", 4, 0, 0, 3], ["FSP", 4, 4, 1, 3], ["RE", 4, [0, 4, 1, 5, 2, 6, 3, 7]], ["CA", 2, 4, 5], ["CHR", 1, "shared", [2]], ["CA", 2, 3, 6], ["CHR", 0, "shared", [3]], ["CA", 1, 4, 6], ["FU", 6, [0, 1]], ["AN", 6, 0, 5], ["FU", 6, [1, 2]], ["AN", 6, 1, 4], ["FU", 6, [2, 3]], ["AN", 6, 2, 6], ["FU", 3, [0, 1]], ["SP", 3, 0, 512, [1], 1], ["AN", 3, 1, 2], ["FFSP", 3, 0, [1, 0], 1, 1], ["AN", 3, 1, 6], ["FU", 1, [0, 1]], ["SP", 1, 0, 1024, [4], 1], ["AN", 1, 1, 2], ["FFSP", 1, 0, [1, 0], 1, 1], ["AN", 1, 1, 6], ["PR", 4, 0, "auto_unroll_max_step$512"]]]], "r": [[0.000172721], 0, 3.62961, 1695336007], "v": "v0.6"}
{"i": [["[\"817107844ff3a9e513e2b591bc12641a\", [32, 3072], [1, 3072], [1], [32, 1]]", "rocm -keys=rocm,gpu -max_num_threads=256 -max_shared_memory_per_block=65536 -max_threads_per_block=256 -mcpu=gfx908 -mtriple=amdgcn-amd-amdhsa-hcc -thread_warp_size=64", [-1, 16, 64, 65536, 2147483647, 1024, 16, 64], "", 0, []], [[], [["SP", 2, 0, 32, [1, 2, 8, 2], 1], ["SP", 2, 5, 1, [1, 1, 1, 1], 1], ["SP", 2, 10, 3072, [1, 4], 1], ["RE", 2, [0, 5, 1, 6, 2, 7, 10, 11, 3, 8, 12, 4, 9]], ["FSP", 4, 0, 0, 3], ["FSP", 4, 4, 1, 3], ["RE", 4, [0, 4, 1, 5, 2, 6, 3, 7]], ["CA", 2, 4, 5], ["CHR", 1, "shared", [2]], ["CA", 2, 3, 6], ["CHR", 0, "shared", [3]], ["CA", 1, 4, 6], ["FU", 6, [0, 1]], ["AN", 6, 0, 5], ["FU", 6, [1, 2]], ["AN", 6, 1, 4], ["FU", 6, [2, 3]], ["AN", 6, 2, 6], ["FU", 3, [0, 1]], ["SP", 3, 0, 4, [2], 1], ["AN", 3, 1, 2], ["FFSP", 3, 0, [1, 0], 1, 1], ["AN", 3, 1, 6], ["FU", 1, [0, 1]], ["SP", 1, 0, 32, [1], 1], ["AN", 1, 1, 2], ["FFSP", 1, 0, [1, 0], 1, 1], ["AN", 1, 1, 6], ["PR", 4, 0, "auto_unroll_max_step$64"]]]], "r": [[0.0036627], 0, 1.47179, 1695336008], "v": "v0.6"}
{"i": [["[\"817107844ff3a9e513e2b591bc12641a\", [32, 3072], [1, 3072], [1], [32, 1]]", "rocm -keys=rocm,gpu -max_num_threads=256 -max_shared_memory_per_block=65536 -max_threads_per_block=256 -mcpu=gfx908 -mtriple=amdgcn-amd-amdhsa-hcc -thread_warp_size=64", [-1, 16, 64, 65536, 2147483647, 1024, 16, 64], "", 0, []], [[], [["SP", 2, 0, 32, [1, 2, 1, 16], 1], ["SP", 2, 5, 1, [1, 1, 1, 1], 1], ["SP", 2, 10, 3072, [4, 4], 1], ["RE", 2, [0, 5, 1, 6, 2, 7, 10, 11, 3, 8, 12, 4, 9]], ["FSP", 4, 0, 0, 3], ["FSP", 4, 4, 1, 3], ["RE", 4, [0, 4, 1, 5, 2, 6, 3, 7]], ["CA", 2, 4, 5], ["CHR", 1, "shared", [2]], ["CA", 2, 3, 6], ["CHR", 0, "shared", [3]], ["CA", 1, 4, 6], ["FU", 6, [0, 1]], ["AN", 6, 0, 5], ["FU", 6, [1, 2]], ["AN", 6, 1, 4], ["FU", 6, [2, 3]], ["AN", 6, 2, 6], ["FU", 3, [0, 1]], ["SP", 3, 0, 16, [1], 1], ["AN", 3, 1, 2], ["FFSP", 3, 0, [1, 0], 1, 1], ["AN", 3, 1, 6], ["FU", 1, [0, 1]], ["SP", 1, 0, 256, [1], 1], ["AN", 1, 1, 2], ["FFSP", 1, 0, [1, 0], 1, 1], ["AN", 1, 1, 6], ["PR", 4, 0, "auto_unroll_max_step$512"]]]], "r": [[0.00301948], 0, 3.50439, 1695336008], "v": "v0.6"}
{"i": [["[\"817107844ff3a9e513e2b591bc12641a\", [32, 3072], [1, 3072], [1], [32, 1]]", "rocm -keys=rocm,gpu -max_num_threads=256 -max_shared_memory_per_block=65536 -max_threads_per_block=256 -mcpu=gfx908 -mtriple=amdgcn-amd-amdhsa-hcc -thread_warp_size=64", [-1, 16, 64, 65536, 2147483647, 1024, 16, 64], "", 0, []], [[], [["SP", 2, 0, 32, [2, 1, 4, 1], 1], ["SP", 2, 5, 1, [1, 1, 1, 1], 1], ["SP", 2, 10, 3072, [8, 24], 1], ["RE", 2, [0, 5, 1, 6, 2, 7, 10, 11, 3, 8, 12, 4, 9]], ["FSP", 4, 0, 0, 3], ["FSP", 4, 4, 1, 3], ["RE", 4, [0, 4, 1, 5, 2, 6, 3, 7]], ["CA", 2, 4, 5], ["CHR", 1, "shared", [2]], ["CA", 2, 3, 6], ["CHR", 0, "shared", [3]], ["CA", 1, 4, 6], ["FU", 6, [0, 1]], ["AN", 6, 0, 5], ["FU", 6, [1, 2]], ["AN", 6, 1, 4], ["FU", 6, [2, 3]], ["AN", 6, 2, 6], ["FU", 3, [0, 1]], ["SP", 3, 0, 16, [1], 1], ["AN", 3, 1, 2], ["FFSP", 3, 0, [1, 0], 1, 1], ["AN", 3, 1, 6], ["FU", 1, [0, 1]], ["SP", 1, 0, 16, [4], 1], ["AN", 1, 1, 2], ["FFSP", 1, 0, [1, 0], 1, 1], ["AN", 1, 1, 6], ["PR", 4, 0, "auto_unroll_max_step$512"]]]], "r": [[0.000503696], 0, 3.783, 1695336008], "v": "v0.6"}
{"i": [["[\"817107844ff3a9e513e2b591bc12641a\", [32, 3072], [1, 3072], [1], [32, 1]]", "rocm -keys=rocm,gpu -max_num_threads=256 -max_shared_memory_per_block=65536 -max_threads_per_block=256 -mcpu=gfx908 -mtriple=amdgcn-amd-amdhsa-hcc -thread_warp_size=64", [-1, 16, 64, 65536, 2147483647, 1024, 16, 64], "", 0, []], [[], [["SP", 2, 0, 32, [2, 2, 4, 2], 1], ["SP", 2, 5, 1, [1, 1, 1, 1], 1], ["SP", 2, 10, 3072, [32, 2], 1], ["RE", 2, [0, 5, 1, 6, 2, 7, 10, 11, 3, 8, 12, 4, 9]], ["FSP", 4, 0, 0, 3], ["FSP", 4, 4, 1, 3], ["RE", 4, [0, 4, 1, 5, 2, 6, 3, 7]], ["CA", 2, 4, 5], ["CHR", 1, "shared", [2]], ["CA", 2, 3, 6], ["CHR", 0, "shared", [3]], ["CA", 1, 4, 6], ["FU", 6, [0, 1]], ["AN", 6, 0, 5], ["FU", 6, [1, 2]], ["AN", 6, 1, 4], ["FU", 6, [2, 3]], ["AN", 6, 2, 6], ["FU", 3, [0, 1]], ["SP", 3, 0, 64, [1], 1], ["AN", 3, 1, 2], ["FFSP", 3, 0, [1, 0], 1, 1], ["AN", 3, 1, 6], ["FU", 1, [0, 1]], ["SP", 1, 0, 512, [1], 1], ["AN", 1, 1, 2], ["FFSP", 1, 0, [1, 0], 1, 1], ["AN", 1, 1, 6], ["PR", 4, 0, "auto_unroll_max_step$512"]]]], "r": [[0.00513779], 0, 1.48504, 1695336010], "v": "v0.6"}
{"i": [["[\"817107844ff3a9e513e2b591bc12641a\", [32, 3072], [1, 3072], [1], [32, 1]]", "rocm -keys=rocm,gpu -max_num_threads=256 -max_shared_memory_per_block=65536 -max_threads_per_block=256 -mcpu=gfx908 -mtriple=amdgcn-amd-amdhsa-hcc -thread_warp_size=64", [-1, 16, 64, 65536, 2147483647, 1024, 16, 64], "", 0, []], [[], [["SP", 2, 0, 32, [1, 2, 1, 1], 1], ["SP", 2, 5, 1, [1, 1, 1, 1], 1], ["SP", 2, 10, 3072, [8, 32], 1], ["RE", 2, [0, 5, 1, 6, 2, 7, 10, 11, 3, 8, 12, 4, 9]], ["FSP", 4, 0, 0, 3], ["FSP", 4, 4, 1, 3], ["RE", 4, [0, 4, 1, 5, 2, 6, 3, 7]], ["CA", 2, 4, 5], ["CHR", 1, "shared", [2]], ["CA", 2, 3, 6], ["CHR", 0, "shared", [3]], ["CA", 1, 4, 6], ["FU", 6, [0, 1]], ["AN", 6, 0, 5], ["FU", 6, [1, 2]], ["AN", 6, 1, 4], ["FU", 6, [2, 3]], ["AN", 6, 2, 6], ["FU", 3, [0, 1]], ["SP", 3, 0, 32, [1], 1], ["AN", 3, 1, 2], ["FFSP", 3, 0, [1, 0], 1, 1], ["AN", 3, 1, 6], ["FU", 1, [0, 1]], ["SP", 1, 0, 32, [1], 1], ["AN", 1, 1, 2], ["FFSP", 1, 0, [1, 0], 1, 1], ["AN", 1, 1, 6], ["PR", 4, 0, "auto_unroll_max_step$512"]]]], "r": [[0.000132587], 0, 3.41163, 1695336010], "v": "v0.6"}
{"i": [["[\"817107844ff3a9e513e2b591bc12641a\", [32, 3072], [1, 3072], [1], [32, 1]]", "rocm -keys=rocm,gpu -max_num_threads=256 -max_shared_memory_per_block=65536 -max_threads_per_block=256 -mcpu=gfx908 -mtriple=amdgcn-amd-amdhsa-hcc -thread_warp_size=64", [-1, 16, 64, 65536, 2147483647, 1024, 16, 64], "", 0, []], [[], [["SP", 2, 0, 32, [1, 1, 1, 2], 1], ["SP", 2, 5, 1, [1, 1, 1, 1], 1], ["SP", 2, 10, 3072, [4, 2], 1], ["RE", 2, [0, 5, 1, 6, 2, 7, 10, 11, 3, 8, 12, 4, 9]], ["FSP", 4, 0, 0, 3], ["FSP", 4, 4, 1, 3], ["RE", 4, [0, 4, 1, 5, 2, 6, 3, 7]], ["CA", 2, 4, 5], ["CHR", 1, "shared", [2]], ["CA", 2, 3, 6], ["CHR", 0, "shared", [3]], ["CA", 1, 4, 6], ["FU", 6, [0, 1]], ["AN", 6, 0, 5], ["FU", 6, [1, 2]], ["AN", 6, 1, 4], ["FU", 6, [2, 3]], ["AN", 6, 2, 6], ["FU", 3, [0, 1]], ["SP", 3, 0, 8, [1], 1], ["AN", 3, 1, 2], ["FFSP", 3, 0, [1, 0], 1, 1], ["AN", 3, 1, 6], ["FU", 1, [0, 1]], ["SP", 1, 0, 16, [2], 1], ["AN", 1, 1, 2], ["FFSP", 1, 0, [1, 0], 1, 1], ["AN", 1, 1, 6], ["PR", 4, 0, "auto_unroll_max_step$0"]]]], "r": [[0.000231904], 0, 0.930008, 1695336010], "v": "v0.6"}
{"i": [["[\"817107844ff3a9e513e2b591bc12641a\", [32, 3072], [1, 3072], [1], [32, 1]]", "rocm -keys=rocm,gpu -max_num_threads=256 -max_shared_memory_per_block=65536 -max_threads_per_block=256 -mcpu=gfx908 -mtriple=amdgcn-amd-amdhsa-hcc -thread_warp_size=64", [-1, 16, 64, 65536, 2147483647, 1024, 16, 64], "", 0, []], [[], [["SP", 2, 0, 32, [1, 1, 2, 16], 1], ["SP", 2, 5, 1, [1, 1, 1, 1], 1], ["SP", 2, 10, 3072, [2, 16], 1], ["RE", 2, [0, 5, 1, 6, 2, 7, 10, 11, 3, 8, 12, 4, 9]], ["FSP", 4, 0, 0, 3], ["FSP", 4, 4, 1, 3], ["RE", 4, [0, 4, 1, 5, 2, 6, 3, 7]], ["CA", 2, 4, 5], ["CHR", 1, "shared", [2]], ["CA", 2, 3, 6], ["CHR", 0, "shared", [3]], ["CA", 1, 4, 6], ["FU", 6, [0, 1]], ["AN", 6, 0, 5], ["FU", 6, [1, 2]], ["AN", 6, 1, 4], ["FU", 6, [2, 3]], ["AN", 6, 2, 6], ["FU", 3, [0, 1]], ["SP", 3, 0, 32, [4], 1], ["AN", 3, 1, 2], ["FFSP", 3, 0, [1, 0], 1, 1], ["AN", 3, 1, 6], ["FU", 1, [0, 1]], ["SP", 1, 0, 512, [2], 1], ["AN", 1, 1, 2], ["FFSP", 1, 0, [1, 0], 1, 1], ["AN", 1, 1, 6], ["PR", 4, 0, "auto_unroll_max_step$0"]]]], "r": [[0.00389337], 0, 2.19766, 1695336011], "v": "v0.6"}
{"i": [["[\"817107844ff3a9e513e2b591bc12641a\", [32, 3072], [1, 3072], [1], [32, 1]]", "rocm -keys=rocm,gpu -max_num_threads=256 -max_shared_memory_per_block=65536 -max_threads_per_block=256 -mcpu=gfx908 -mtriple=amdgcn-amd-amdhsa-hcc -thread_warp_size=64", [-1, 16, 64, 65536, 2147483647, 1024, 16, 64], "", 0, []], [[], [["SP", 2, 0, 32, [8, 4, 1, 1], 1], ["SP", 2, 5, 1, [1, 1, 1, 1], 1], ["SP", 2, 10, 3072, [3, 64], 1], ["RE", 2, [0, 5, 1, 6, 2, 7, 10, 11, 3, 8, 12, 4, 9]], ["FSP", 4, 0, 0, 3], ["FSP", 4, 4, 1, 3], ["RE", 4, [0, 4, 1, 5, 2, 6, 3, 7]], ["CA", 2, 4, 5], ["CHR", 1, "shared", [2]], ["CA", 2, 3, 6], ["CHR", 0, "shared", [3]], ["CA", 1, 4, 6], ["FU", 6, [0, 1]], ["AN", 6, 0, 5], ["FU", 6, [1, 2]], ["AN", 6, 1, 4], ["FU", 6, [2, 3]], ["AN", 6, 2, 6], ["FU", 3, [0, 1]], ["SP", 3, 0, 96, [1], 1], ["AN", 3, 1, 2], ["FFSP", 3, 0, [1, 0], 1, 1], ["AN", 3, 1, 6], ["FU", 1, [0, 1]], ["SP", 1, 0, 96, [4], 1], ["AN", 1, 1, 2], ["FFSP", 1, 0, [1, 0], 1, 1], ["AN", 1, 1, 6], ["PR", 4, 0, "auto_unroll_max_step$16"]]]], "r": [[0.00213741], 0, 1.53578, 1695336012], "v": "v0.6"}
{"i": [["[\"817107844ff3a9e513e2b591bc12641a\", [32, 3072], [1, 3072], [1], [32, 1]]", "rocm -keys=rocm,gpu -max_num_threads=256 -max_shared_memory_per_block=65536 -max_threads_per_block=256 -mcpu=gfx908 -mtriple=amdgcn-amd-amdhsa-hcc -thread_warp_size=64", [-1, 16, 64, 65536, 2147483647, 1024, 16, 64], "", 0, []], [[], [["SP", 2, 0, 32, [1, 1, 2, 4], 1], ["SP", 2, 5, 1, [1, 1, 1, 1], 1], ["SP", 2, 10, 3072, [4, 8], 1], ["RE", 2, [0, 5, 1, 6, 2, 7, 10, 11, 3, 8, 12, 4, 9]], ["FSP", 4, 0, 0, 3], ["FSP", 4, 4, 1, 3], ["RE", 4, [0, 4, 1, 5, 2, 6, 3, 7]], ["CA", 2, 4, 5], ["CHR", 1, "shared", [2]], ["CA", 2, 3, 6], ["CHR", 0, "shared", [3]], ["CA", 1, 4, 6], ["FU", 6, [0, 1]], ["AN", 6, 0, 5], ["FU", 6, [1, 2]], ["AN", 6, 1, 4], ["FU", 6, [2, 3]], ["AN", 6, 2, 6], ["FU", 3, [0, 1]], ["SP", 3, 0, 32, [1], 1], ["AN", 3, 1, 2], ["FFSP", 3, 0, [1, 0], 1, 1], ["AN", 3, 1, 6], ["FU", 1, [0, 1]], ["SP", 1, 0, 256, [1], 1], ["AN", 1, 1, 2], ["FFSP", 1, 0, [1, 0], 1, 1], ["AN", 1, 1, 6], ["PR", 4, 0, "auto_unroll_max_step$1024"]]]], "r": [[0.000446394], 0, 2.0888, 1695336012], "v": "v0.6"}
{"i": [["[\"817107844ff3a9e513e2b591bc12641a\", [32, 3072], [1, 3072], [1], [32, 1]]", "rocm -keys=rocm,gpu -max_num_threads=256 -max_shared_memory_per_block=65536 -max_threads_per_block=256 -mcpu=gfx908 -mtriple=amdgcn-amd-amdhsa-hcc -thread_warp_size=64", [-1, 16, 64, 65536, 2147483647, 1024, 16, 64], "", 0, []], [[], [["SP", 2, 0, 32, [2, 2, 4, 2], 1], ["SP", 2, 5, 1, [1, 1, 1, 1], 1], ["SP", 2, 10, 3072, [1, 8], 1], ["RE", 2, [0, 5, 1, 6, 2, 7, 10, 11, 3, 8, 12, 4, 9]], ["FSP", 4, 0, 0, 3], ["FSP", 4, 4, 1, 3], ["RE", 4, [0, 4, 1, 5, 2, 6, 3, 7]], ["CA", 2, 4, 5], ["CHR", 1, "shared", [2]], ["CA", 2, 3, 6], ["CHR", 0, "shared", [3]], ["CA", 1, 4, 6], ["FU", 6, [0, 1]], ["AN", 6, 0, 5], ["FU", 6, [1, 2]], ["AN", 6, 1, 4], ["FU", 6, [2, 3]], ["AN", 6, 2, 6], ["FU", 3, [0, 1]], ["SP", 3, 0, 8, [1], 1], ["AN", 3, 1, 2], ["FFSP", 3, 0, [1, 0], 1, 1], ["AN", 3, 1, 6], ["FU", 1, [0, 1]], ["SP", 1, 0, 64, [1], 1], ["AN", 1, 1, 2], ["FFSP", 1, 0, [1, 0], 1, 1], ["AN", 1, 1, 6], ["PR", 4, 0, "auto_unroll_max_step$512"]]]], "r": [[0.00363009], 0, 2.32944, 1695336013], "v": "v0.6"}
{"i": [["[\"817107844ff3a9e513e2b591bc12641a\", [32, 3072], [1, 3072], [1], [32, 1]]", "rocm -keys=rocm,gpu -max_num_threads=256 -max_shared_memory_per_block=65536 -max_threads_per_block=256 -mcpu=gfx908 -mtriple=amdgcn-amd-amdhsa-hcc -thread_warp_size=64", [-1, 16, 64, 65536, 2147483647, 1024, 16, 64], "", 0, []], [[], [["SP", 2, 0, 32, [2, 1, 1, 8], 1], ["SP", 2, 5, 1, [1, 1, 1, 1], 1], ["SP", 2, 10, 3072, [384, 1], 1], ["RE", 2, [0, 5, 1, 6, 2, 7, 10, 11, 3, 8, 12, 4, 9]], ["FSP", 4, 0, 0, 3], ["FSP", 4, 4, 1, 3], ["RE", 4, [0, 4, 1, 5, 2, 6, 3, 7]], ["CA", 2, 4, 5], ["CHR", 1, "shared", [2]], ["CA", 2, 3, 6], ["CHR", 0, "shared", [3]], ["CA", 1, 4, 6], ["FU", 6, [0, 1]], ["AN", 6, 0, 5], ["FU", 6, [1, 2]], ["AN", 6, 1, 4], ["FU", 6, [2, 3]], ["AN", 6, 2, 6], ["FU", 3, [0, 1]], ["SP", 3, 0, 384, [2], 1], ["AN", 3, 1, 2], ["FFSP", 3, 0, [1, 0], 1, 1], ["AN", 3, 1, 6], ["FU", 1, [0, 1]], ["SP", 1, 0, 3072, [1], 1], ["AN", 1, 1, 2], ["FFSP", 1, 0, [1, 0], 1, 1], ["AN", 1, 1, 6], ["PR", 4, 0, "auto_unroll_max_step$0"]]]], "r": [[0.0045835], 0, 0.934004, 1695336013], "v": "v0.6"}
{"i": [["[\"817107844ff3a9e513e2b591bc12641a\", [32, 3072], [1, 3072], [1], [32, 1]]", "rocm -keys=rocm,gpu -max_num_threads=256 -max_shared_memory_per_block=65536 -max_threads_per_block=256 -mcpu=gfx908 -mtriple=amdgcn-amd-amdhsa-hcc -thread_warp_size=64", [-1, 16, 64, 65536, 2147483647, 1024, 16, 64], "", 0, []], [[], [["SP", 2, 0, 32, [2, 1, 4, 4], 1], ["SP", 2, 5, 1, [1, 1, 1, 1], 1], ["SP", 2, 10, 3072, [32, 6], 1], ["RE", 2, [0, 5, 1, 6, 2, 7, 10, 11, 3, 8, 12, 4, 9]], ["FSP", 4, 0, 0, 3], ["FSP", 4, 4, 1, 3], ["RE", 4, [0, 4, 1, 5, 2, 6, 3, 7]], ["CA", 2, 4, 5], ["CHR", 1, "shared", [2]], ["CA", 2, 3, 6], ["CHR", 0, "shared", [3]], ["CA", 1, 4, 6], ["FU", 6, [0, 1]], ["AN", 6, 0, 5], ["FU", 6, [1, 2]], ["AN", 6, 1, 4], ["FU", 6, [2, 3]], ["AN", 6, 2, 6], ["FU", 3, [0, 1]], ["SP", 3, 0, 192, [1], 1], ["AN", 3, 1, 2], ["FFSP", 3, 0, [1, 0], 1, 1], ["AN", 3, 1, 6], ["FU", 1, [0, 1]], ["SP", 1, 0, 3072, [1], 1], ["AN", 1, 1, 2], ["FFSP", 1, 0, [1, 0], 1, 1], ["AN", 1, 1, 6], ["PR", 4, 0, "auto_unroll_max_step$0"]]]], "r": [[0.00761797], 0, 1.86822, 1695336014], "v": "v0.6"}
{"i": [["[\"817107844ff3a9e513e2b591bc12641a\", [32, 3072], [1, 3072], [1], [32, 1]]", "rocm -keys=rocm,gpu -max_num_threads=256 -max_shared_memory_per_block=65536 -max_threads_per_block=256 -mcpu=gfx908 -mtriple=amdgcn-amd-amdhsa-hcc -thread_warp_size=64", [-1, 16, 64, 65536, 2147483647, 1024, 16, 64], "", 0, []], [[], [["SP", 2, 0, 32, [8, 2, 1, 1], 1], ["SP", 2, 5, 1, [1, 1, 1, 1], 1], ["SP", 2, 10, 3072, [1, 2], 1], ["RE", 2, [0, 5, 1, 6, 2, 7, 10, 11, 3, 8, 12, 4, 9]], ["FSP", 4, 0, 0, 3], ["FSP", 4, 4, 1, 3], ["RE", 4, [0, 4, 1, 5, 2, 6, 3, 7]], ["CA", 2, 4, 5], ["CHR", 1, "shared", [2]], ["CA", 2, 3, 6], ["CHR", 0, "shared", [3]], ["CA", 1, 4, 6], ["FU", 6, [0, 1]], ["AN", 6, 0, 5], ["FU", 6, [1, 2]], ["AN", 6, 1, 4], ["FU", 6, [2, 3]], ["AN", 6, 2, 6], ["FU", 3, [0, 1]], ["SP", 3, 0, 2, [1], 1], ["AN", 3, 1, 2], ["FFSP", 3, 0, [1, 0], 1, 1], ["AN", 3, 1, 6], ["FU", 1, [0, 1]], ["SP", 1, 0, 2, [1], 1], ["AN", 1, 1, 2], ["FFSP", 1, 0, [1, 0], 1, 1], ["AN", 1, 1, 6], ["PR", 4, 0, "auto_unroll_max_step$1024"]]]], "r": [[0.000809999], 0, 1.03255, 1695336014], "v": "v0.6"}
{"i": [["[\"817107844ff3a9e513e2b591bc12641a\", [32, 3072], [1, 3072], [1], [32, 1]]", "rocm -keys=rocm,gpu -max_num_threads=256 -max_shared_memory_per_block=65536 -max_threads_per_block=256 -mcpu=gfx908 -mtriple=amdgcn-amd-amdhsa-hcc -thread_warp_size=64", [-1, 16, 64, 65536, 2147483647, 1024, 16, 64], "", 0, []], [[], [["SP", 2, 0, 32, [4, 1, 1, 2], 1], ["SP", 2, 5, 1, [1, 1, 1, 1], 1], ["SP", 2, 10, 3072, [48, 2], 1], ["RE", 2, [0, 5, 1, 6, 2, 7, 10, 11, 3, 8, 12, 4, 9]], ["FSP", 4, 0, 0, 3], ["FSP", 4, 4, 1, 3], ["RE", 4, [0, 4, 1, 5, 2, 6, 3, 7]], ["CA", 2, 4, 5], ["CHR", 1, "shared", [2]], ["CA", 2, 3, 6], ["CHR", 0, "shared", [3]], ["CA", 1, 4, 6], ["FU", 6, [0, 1]], ["AN", 6, 0, 5], ["FU", 6, [1, 2]], ["AN", 6, 1, 4], ["FU", 6, [2, 3]], ["AN", 6, 2, 6], ["FU", 3, [0, 1]], ["SP", 3, 0, 96, [3], 1], ["AN", 3, 1, 2], ["FFSP", 3, 0, [1, 0], 1, 1], ["AN", 3, 1, 6], ["FU", 1, [0, 1]], ["SP", 1, 0, 192, [1], 1], ["AN", 1, 1, 2], ["FFSP", 1, 0, [1, 0], 1, 1], ["AN", 1, 1, 6], ["PR", 4, 0, "auto_unroll_max_step$64"]]]], "r": [[0.00210325], 0, 1.10551, 1695336015], "v": "v0.6"}
{"i": [["[\"817107844ff3a9e513e2b591bc12641a\", [32, 3072], [1, 3072], [1], [32, 1]]", "rocm -keys=rocm,gpu -max_num_threads=256 -max_shared_memory_per_block=65536 -max_threads_per_block=256 -mcpu=gfx908 -mtriple=amdgcn-amd-amdhsa-hcc -thread_warp_size=64", [-1, 16, 64, 65536, 2147483647, 1024, 16, 64], "", 0, []], [[], [["SP", 2, 0, 32, [4, 2, 4, 1], 1], ["SP", 2, 5, 1, [1, 1, 1, 1], 1], ["SP", 2, 10, 3072, [96, 2], 1], ["RE", 2, [0, 5, 1, 6, 2, 7, 10, 11, 3, 8, 12, 4, 9]], ["FSP", 4, 0, 0, 3], ["FSP", 4, 4, 1, 3], ["RE", 4, [0, 4, 1, 5, 2, 6, 3, 7]], ["CA", 2, 4, 5], ["CHR", 1, "shared", [2]], ["CA", 2, 3, 6], ["CHR", 0, "shared", [3]], ["CA", 1, 4, 6], ["FU", 6, [0, 1]], ["AN", 6, 0, 5], ["FU", 6, [1, 2]], ["AN", 6, 1, 4], ["FU", 6, [2, 3]], ["AN", 6, 2, 6], ["FU", 3, [0, 1]], ["SP", 3, 0, 192, [1], 1], ["AN", 3, 1, 2], ["FFSP", 3, 0, [1, 0], 1, 1], ["AN", 3, 1, 6], ["FU", 1, [0, 1]], ["SP", 1, 0, 768, [2], 1], ["AN", 1, 1, 2], ["FFSP", 1, 0, [1, 0], 1, 1], ["AN", 1, 1, 6], ["PR", 4, 0, "auto_unroll_max_step$0"]]]], "r": [[0.0043809], 0, 1.9431, 1695336015], "v": "v0.6"}
{"i": [["[\"817107844ff3a9e513e2b591bc12641a\", [32, 3072], [1, 3072], [1], [32, 1]]", "rocm -keys=rocm,gpu -max_num_threads=256 -max_shared_memory_per_block=65536 -max_threads_per_block=256 -mcpu=gfx908 -mtriple=amdgcn-amd-amdhsa-hcc -thread_warp_size=64", [-1, 16, 64, 65536, 2147483647, 1024, 16, 64], "", 0, []], [[], [["SP", 2, 0, 32, [2, 4, 1, 2], 1], ["SP", 2, 5, 1, [1, 1, 1, 1], 1], ["SP", 2, 10, 3072, [1, 2], 1], ["RE", 2, [0, 5, 1, 6, 2, 7, 10, 11, 3, 8, 12, 4, 9]], ["FSP", 4, 0, 0, 3], ["FSP", 4, 4, 1, 3], ["RE", 4, [0, 4, 1, 5, 2, 6, 3, 7]], ["CA", 2, 4, 5], ["CHR", 1, "shared", [2]], ["CA", 2, 3, 6], ["CHR", 0, "shared", [3]], ["CA", 1, 4, 6], ["FU", 6, [0, 1]], ["AN", 6, 0, 5], ["FU", 6, [1, 2]], ["AN", 6, 1, 4], ["FU", 6, [2, 3]], ["AN", 6, 2, 6], ["FU", 3, [0, 1]], ["SP", 3, 0, 2, [2], 1], ["AN", 3, 1, 2], ["FFSP", 3, 0, [1, 0], 1, 1], ["AN", 3, 1, 6], ["FU", 1, [0, 1]], ["SP", 1, 0, 4, [1], 1], ["AN", 1, 1, 2], ["FFSP", 1, 0, [1, 0], 1, 1], ["AN", 1, 1, 6], ["PR", 4, 0, "auto_unroll_max_step$16"]]]], "r": [[0.000804511], 0, 1.27784, 1695336016], "v": "v0.6"}
{"i": [["[\"817107844ff3a9e513e2b591bc12641a\", [32, 3072], [1, 3072], [1], [32, 1]]", "rocm -keys=rocm,gpu -max_num_threads=256 -max_shared_memory_per_block=65536 -max_threads_per_block=256 -mcpu=gfx908 -mtriple=amdgcn-amd-amdhsa-hcc -thread_warp_size=64", [-1, 16, 64, 65536, 2147483647, 1024, 16, 64], "", 0, []], [[], [["SP", 2, 0, 32, [2, 1, 1, 2], 1], ["SP", 2, 5, 1, [1, 1, 1, 1], 1], ["SP", 2, 10, 3072, [32, 2], 1], ["RE", 2, [0, 5, 1, 6, 2, 7, 10, 11, 3, 8, 12, 4, 9]], ["FSP", 4, 0, 0, 3], ["FSP", 4, 4, 1, 3], ["RE", 4, [0, 4, 1, 5, 2, 6, 3, 7]], ["CA", 2, 4, 5], ["CHR", 1, "shared", [2]], ["CA", 2, 3, 6], ["CHR", 0, "shared", [3]], ["CA", 1, 4, 6], ["FU", 6, [0, 1]], ["AN", 6, 0, 5], ["FU", 6, [1, 2]], ["AN", 6, 1, 4], ["FU", 6, [2, 3]], ["AN", 6, 2, 6], ["FU", 3, [0, 1]], ["SP", 3, 0, 64, [1], 1], ["AN", 3, 1, 2], ["FFSP", 3, 0, [1, 0], 1, 1], ["AN", 3, 1, 6], ["FU", 1, [0, 1]], ["SP", 1, 0, 128, [4], 1], ["AN", 1, 1, 2], ["FFSP", 1, 0, [1, 0], 1, 1], ["AN", 1, 1, 6], ["PR", 4, 0, "auto_unroll_max_step$512"]]]], "r": [[0.000260564], 0, 1.95893, 1695336017], "v": "v0.6"}
{"i": [["[\"817107844ff3a9e513e2b591bc12641a\", [32, 3072], [1, 3072], [1], [32, 1]]", "rocm -keys=rocm,gpu -max_num_threads=256 -max_shared_memory_per_block=65536 -max_threads_per_block=256 -mcpu=gfx908 -mtriple=amdgcn-amd-amdhsa-hcc -thread_warp_size=64", [-1, 16, 64, 65536, 2147483647, 1024, 16, 64], "", 0, []], [[], [["SP", 2, 0, 32, [1, 1, 1, 4], 1], ["SP", 2, 5, 1, [1, 1, 1, 1], 1], ["SP", 2, 10, 3072, [96, 32], 1], ["RE", 2, [0, 5, 1, 6, 2, 7, 10, 11, 3, 8, 12, 4, 9]], ["FSP", 4, 0, 0, 3], ["FSP", 4, 4, 1, 3], ["RE", 4, [0, 4, 1, 5, 2, 6, 3, 7]], ["CA", 2, 4, 5], ["CHR", 1, "shared", [2]], ["CA", 2, 3, 6], ["CHR", 0, "shared", [3]], ["CA", 1, 4, 6], ["FU", 6, [0, 1]], ["AN", 6, 0, 5], ["FU", 6, [1, 2]], ["AN", 6, 1, 4], ["FU", 6, [2, 3]], ["AN", 6, 2, 6], ["FU", 3, [0, 1]], ["SP", 3, 0, 96, [1], 1], ["AN", 3, 1, 2], ["FFSP", 3, 0, [1, 0], 1, 1], ["AN", 3, 1, 6], ["FU", 1, [0, 1]], ["SP", 1, 0, 384, [4], 1], ["AN", 1, 1, 2], ["FFSP", 1, 0, [1, 0], 1, 1], ["AN", 1, 1, 6], ["PR", 4, 0, "auto_unroll_max_step$0"]]]], "r": [[0.000283807], 0, 1.35908, 1695336017], "v": "v0.6"}
{"i": [["[\"817107844ff3a9e513e2b591bc12641a\", [32, 3072], [1, 3072], [1], [32, 1]]", "rocm -keys=rocm,gpu -max_num_threads=256 -max_shared_memory_per_block=65536 -max_threads_per_block=256 -mcpu=gfx908 -mtriple=amdgcn-amd-amdhsa-hcc -thread_warp_size=64", [-1, 16, 64, 65536, 2147483647, 1024, 16, 64], "", 0, []], [[], [["SP", 2, 0, 32, [4, 4, 1, 1], 1], ["SP", 2, 5, 1, [1, 1, 1, 1], 1], ["SP", 2, 10, 3072, [8, 1], 1], ["RE", 2, [0, 5, 1, 6, 2, 7, 10, 11, 3, 8, 12, 4, 9]], ["FSP", 4, 0, 0, 3], ["FSP", 4, 4, 1, 3], ["RE", 4, [0, 4, 1, 5, 2, 6, 3, 7]], ["CA", 2, 4, 5], ["CHR", 1, "shared", [2]], ["CA", 2, 3, 6], ["CHR", 0, "shared", [3]], ["CA", 1, 4, 6], ["FU", 6, [0, 1]], ["AN", 6, 0, 5], ["FU", 6, [1, 2]], ["AN", 6, 1, 4], ["FU", 6, [2, 3]], ["AN", 6, 2, 6], ["FU", 3, [0, 1]], ["SP", 3, 0, 8, [4], 1], ["AN", 3, 1, 2], ["FFSP", 3, 0, [1, 0], 1, 1], ["AN", 3, 1, 6], ["FU", 1, [0, 1]], ["SP", 1, 0, 32, [1], 1], ["AN", 1, 1, 2], ["FFSP", 1, 0, [1, 0], 1, 1], ["AN", 1, 1, 6], ["PR", 4, 0, "auto_unroll_max_step$512"]]]], "r": [[0.000395344], 0, 1.09072, 1695336017], "v": "v0.6"}
{"i": [["[\"817107844ff3a9e513e2b591bc12641a\", [32, 3072], [1, 3072], [1], [32, 1]]", "rocm -keys=rocm,gpu -max_num_threads=256 -max_shared_memory_per_block=65536 -max_threads_per_block=256 -mcpu=gfx908 -mtriple=amdgcn-amd-amdhsa-hcc -thread_warp_size=64", [-1, 16, 64, 65536, 2147483647, 1024, 16, 64], "", 0, []], [[], [["SP", 2, 0, 32, [2, 2, 1, 1], 1], ["SP", 2, 5, 1, [1, 1, 1, 1], 1], ["SP", 2, 10, 3072, [3, 32], 1], ["RE", 2, [0, 5, 1, 6, 2, 7, 10, 11, 3, 8, 12, 4, 9]], ["FSP", 4, 0, 0, 3], ["FSP", 4, 4, 1, 3], ["RE", 4, [0, 4, 1, 5, 2, 6, 3, 7]], ["CA", 2, 4, 5], ["CHR", 1, "shared", [2]], ["CA", 2, 3, 6], ["CHR", 0, "shared", [3]], ["CA", 1, 4, 6], ["FU", 6, [0, 1]], ["AN", 6, 0, 5], ["FU", 6, [1, 2]], ["AN", 6, 1, 4], ["FU", 6, [2, 3]], ["AN", 6, 2, 6], ["FU", 3, [0, 1]], ["SP", 3, 0, 96, [1], 1], ["AN", 3, 1, 2], ["FFSP", 3, 0, [1, 0], 1, 1], ["AN", 3, 1, 6], ["FU", 1, [0, 1]], ["SP", 1, 0, 96, [1], 1], ["AN", 1, 1, 2], ["FFSP", 1, 0, [1, 0], 1, 1], ["AN", 1, 1, 6], ["PR", 4, 0, "auto_unroll_max_step$0"]]]], "r": [[0.000701205], 0, 2.08074, 1695336019], "v": "v0.6"}
{"i": [["[\"817107844ff3a9e513e2b591bc12641a\", [32, 3072], [1, 3072], [1], [32, 1]]", "rocm -keys=rocm,gpu -max_num_threads=256 -max_shared_memory_per_block=65536 -max_threads_per_block=256 -mcpu=gfx908 -mtriple=amdgcn-amd-amdhsa-hcc -thread_warp_size=64", [-1, 16, 64, 65536, 2147483647, 1024, 16, 64], "", 0, []], [[], [["SP", 2, 0, 32, [1, 2, 2, 2], 1], ["SP", 2, 5, 1, [1, 1, 1, 1], 1], ["SP", 2, 10, 3072, [1, 1], 1], ["RE", 2, [0, 5, 1, 6, 2, 7, 10, 11, 3, 8, 12, 4, 9]], ["FSP", 4, 0, 0, 3], ["FSP", 4, 4, 1, 3], ["RE", 4, [0, 4, 1, 5, 2, 6, 3, 7]], ["CA", 2, 4, 5], ["CHR", 1, "shared", [2]], ["CA", 2, 3, 6], ["CHR", 0, "shared", [3]], ["CA", 1, 4, 6], ["FU", 6, [0, 1]], ["AN", 6, 0, 5], ["FU", 6, [1, 2]], ["AN", 6, 1, 4], ["FU", 6, [2, 3]], ["AN", 6, 2, 6], ["FU", 3, [0, 1]], ["SP", 3, 0, 256, [32], 1], ["AN", 3, 1, 2], ["FFSP", 3, 0, [1, 0], 1, 1], ["AN", 3, 1, 6], ["FU", 1, [0, 1]], ["SP", 1, 0, 1024, [1], 1], ["AN", 1, 1, 2], ["FFSP", 1, 0, [1, 0], 1, 1], ["AN", 1, 1, 6], ["PR", 4, 0, "auto_unroll_max_step$1024"]]]], "r": [[0.00116734], 0, 1.07974, 1695336019], "v": "v0.6"}
{"i": [["[\"817107844ff3a9e513e2b591bc12641a\", [32, 3072], [1, 3072], [1], [32, 1]]", "rocm -keys=rocm,gpu -max_num_threads=256 -max_shared_memory_per_block=65536 -max_threads_per_block=256 -mcpu=gfx908 -mtriple=amdgcn-amd-amdhsa-hcc -thread_warp_size=64", [-1, 16, 64, 65536, 2147483647, 1024, 16, 64], "", 0, []], [[], [["SP", 2, 0, 32, [16, 2, 1, 1], 1], ["SP", 2, 5, 1, [1, 1, 1, 1], 1], ["SP", 2, 10, 3072, [2, 64], 1], ["RE", 2, [0, 5, 1, 6, 2, 7, 10, 11, 3, 8, 12, 4, 9]], ["FSP", 4, 0, 0, 3], ["FSP", 4, 4, 1, 3], ["RE", 4, [0, 4, 1, 5, 2, 6, 3, 7]], ["CA", 2, 4, 5], ["CHR", 1, "shared", [2]], ["CA", 2, 3, 6], ["CHR", 0, "shared", [3]], ["CA", 1, 4, 6], ["FU", 6, [0, 1]], ["AN", 6, 0, 5], ["FU", 6, [1, 2]], ["AN", 6, 1, 4], ["FU", 6, [2, 3]], ["AN", 6, 2, 6], ["FU", 3, [0, 1]], ["SP", 3, 0, 128, [1], 1], ["AN", 3, 1, 2], ["FFSP", 3, 0, [1, 0], 1, 1], ["AN", 3, 1, 6], ["FU", 1, [0, 1]], ["SP", 1, 0, 128, [4], 1], ["AN", 1, 1, 2], ["FFSP", 1, 0, [1, 0], 1, 1], ["AN", 1, 1, 6], ["PR", 4, 0, "auto_unroll_max_step$16"]]]], "r": [[0.00404527], 0, 1.67012, 1695336019], "v": "v0.6"}
{"i": [["[\"817107844ff3a9e513e2b591bc12641a\", [32, 3072], [1, 3072], [1], [32, 1]]", "rocm -keys=rocm,gpu -max_num_threads=256 -max_shared_memory_per_block=65536 -max_threads_per_block=256 -mcpu=gfx908 -mtriple=amdgcn-amd-amdhsa-hcc -thread_warp_size=64", [-1, 16, 64, 65536, 2147483647, 1024, 16, 64], "", 0, []], [[], [["SP", 2, 0, 32, [2, 2, 1, 4], 1], ["SP", 2, 5, 1, [1, 1, 1, 1], 1], ["SP", 2, 10, 3072, [4, 6], 1], ["RE", 2, [0, 5, 1, 6, 2, 7, 10, 11, 3, 8, 12, 4, 9]], ["FSP", 4, 0, 0, 3], ["FSP", 4, 4, 1, 3], ["RE", 4, [0, 4, 1, 5, 2, 6, 3, 7]], ["CA", 2, 4, 5], ["CHR", 1, "shared", [2]], ["CA", 2, 3, 6], ["CHR", 0, "shared", [3]], ["CA", 1, 4, 6], ["FU", 6, [0, 1]], ["AN", 6, 0, 5], ["FU", 6, [1, 2]], ["AN", 6, 1, 4], ["FU", 6, [2, 3]], ["AN", 6, 2, 6], ["FU", 3, [0, 1]], ["SP", 3, 0, 24, [2], 1], ["AN", 3, 1, 2], ["FFSP", 3, 0, [1, 0], 1, 1], ["AN", 3, 1, 6], ["FU", 1, [0, 1]], ["SP", 1, 0, 96, [1], 1], ["AN", 1, 1, 2], ["FFSP", 1, 0, [1, 0], 1, 1], ["AN", 1, 1, 6], ["PR", 4, 0, "auto_unroll_max_step$512"]]]], "r": [[0.000457538], 0, 2.88205, 1695336020], "v": "v0.6"}
{"i": [["[\"817107844ff3a9e513e2b591bc12641a\", [32, 3072], [1, 3072], [1], [32, 1]]", "rocm -keys=rocm,gpu -max_num_threads=256 -max_shared_memory_per_block=65536 -max_threads_per_block=256 -mcpu=gfx908 -mtriple=amdgcn-amd-amdhsa-hcc -thread_warp_size=64", [-1, 16, 64, 65536, 2147483647, 1024, 16, 64], "", 0, []], [[], [["SP", 2, 0, 32, [1, 1, 4, 1], 1], ["SP", 2, 5, 1, [1, 1, 1, 1], 1], ["SP", 2, 10, 3072, [1, 3], 1], ["RE", 2, [0, 5, 1, 6, 2, 7, 10, 11, 3, 8, 12, 4, 9]], ["FSP", 4, 0, 0, 3], ["FSP", 4, 4, 1, 3], ["RE", 4, [0, 4, 1, 5, 2, 6, 3, 7]], ["CA", 2, 4, 5], ["CHR", 1, "shared", [2]], ["CA", 2, 3, 6], ["CHR", 0, "shared", [3]], ["CA", 1, 4, 6], ["FU", 6, [0, 1]], ["AN", 6, 0, 5], ["FU", 6, [1, 2]], ["AN", 6, 1, 4], ["FU", 6, [2, 3]], ["AN", 6, 2, 6], ["FU", 3, [0, 1]], ["SP", 3, 0, 3, [3], 1], ["AN", 3, 1, 2], ["FFSP", 3, 0, [1, 0], 1, 1], ["AN", 3, 1, 6], ["FU", 1, [0, 1]], ["SP", 1, 0, 12, [4], 1], ["AN", 1, 1, 2], ["FFSP", 1, 0, [1, 0], 1, 1], ["AN", 1, 1, 6], ["PR", 4, 0, "auto_unroll_max_step$512"]]]], "r": [[0.000637304], 0, 1.20921, 1695336021], "v": "v0.6"}
{"i": [["[\"817107844ff3a9e513e2b591bc12641a\", [32, 3072], [1, 3072], [1], [32, 1]]", "rocm -keys=rocm,gpu -max_num_threads=256 -max_shared_memory_per_block=65536 -max_threads_per_block=256 -mcpu=gfx908 -mtriple=amdgcn-amd-amdhsa-hcc -thread_warp_size=64", [-1, 16, 64, 65536, 2147483647, 1024, 16, 64], "", 0, []], [[], [["SP", 2, 0, 32, [2, 2, 1, 1], 1], ["SP", 2, 5, 1, [1, 1, 1, 1], 1], ["SP", 2, 10, 3072, [3, 32], 1], ["RE", 2, [0, 5, 1, 6, 2, 7, 10, 11, 3, 8, 12, 4, 9]], ["FSP", 4, 0, 0, 3], ["FSP", 4, 4, 1, 3], ["RE", 4, [0, 4, 1, 5, 2, 6, 3, 7]], ["CA", 2, 4, 5], ["CHR", 1, "shared", [2]], ["CA", 2, 3, 6], ["CHR", 0, "shared", [3]], ["CA", 1, 4, 6], ["FU", 6, [0, 1]], ["AN", 6, 0, 5], ["FU", 6, [1, 2]], ["AN", 6, 1, 4], ["FU", 6, [2, 3]], ["AN", 6, 2, 6], ["FU", 3, [0, 1]], ["SP", 3, 0, 96, [3], 1], ["AN", 3, 1, 2], ["FFSP", 3, 0, [1, 0], 1, 1], ["AN", 3, 1, 6], ["FU", 1, [0, 1]], ["SP", 1, 0, 96, [3], 1], ["AN", 1, 1, 2], ["FFSP", 1, 0, [1, 0], 1, 1], ["AN", 1, 1, 6], ["PR", 4, 0, "auto_unroll_max_step$64"]]]], "r": [[0.000137005], 0, 1.72591, 1695336021], "v": "v0.6"}
{"i": [["[\"817107844ff3a9e513e2b591bc12641a\", [32, 3072], [1, 3072], [1], [32, 1]]", "rocm -keys=rocm,gpu -max_num_threads=256 -max_shared_memory_per_block=65536 -max_threads_per_block=256 -mcpu=gfx908 -mtriple=amdgcn-amd-amdhsa-hcc -thread_warp_size=64", [-1, 16, 64, 65536, 2147483647, 1024, 16, 64], "", 0, []], [[], [["SP", 2, 0, 32, [1, 1, 2, 8], 1], ["SP", 2, 5, 1, [1, 1, 1, 1], 1], ["SP", 2, 10, 3072, [24, 8], 1], ["RE", 2, [0, 5, 1, 6, 2, 7, 10, 11, 3, 8, 12, 4, 9]], ["FSP", 4, 0, 0, 3], ["FSP", 4, 4, 1, 3], ["RE", 4, [0, 4, 1, 5, 2, 6, 3, 7]], ["CA", 2, 4, 5], ["CHR", 1, "shared", [2]], ["CA", 2, 3, 6], ["CHR", 0, "shared", [3]], ["CA", 1, 4, 6], ["FU", 6, [0, 1]], ["AN", 6, 0, 5], ["FU", 6, [1, 2]], ["AN", 6, 1, 4], ["FU", 6, [2, 3]], ["AN", 6, 2, 6], ["FU", 3, [0, 1]], ["SP", 3, 0, 96, [1], 1], ["AN", 3, 1, 2], ["FFSP", 3, 0, [1, 0], 1, 1], ["AN", 3, 1, 6], ["FU", 1, [0, 1]], ["SP", 1, 0, 1536, [1], 1], ["AN", 1, 1, 2], ["FFSP", 1, 0, [1, 0], 1, 1], ["AN", 1, 1, 6], ["PR", 4, 0, "auto_unroll_max_step$0"]]]], "r": [[0.00371458], 0, 1.344, 1695336022], "v": "v0.6"}
{"i": [["[\"817107844ff3a9e513e2b591bc12641a\", [32, 3072], [1, 3072], [1], [32, 1]]", "rocm -keys=rocm,gpu -max_num_threads=256 -max_shared_memory_per_block=65536 -max_threads_per_block=256 -mcpu=gfx908 -mtriple=amdgcn-amd-amdhsa-hcc -thread_warp_size=64", [-1, 16, 64, 65536, 2147483647, 1024, 16, 64], "", 0, []], [[], [["SP", 2, 0, 32, [8, 1, 2, 2], 1], ["SP", 2, 5, 1, [1, 1, 1, 1], 1], ["SP", 2, 10, 3072, [64, 3], 1], ["RE", 2, [0, 5, 1, 6, 2, 7, 10, 11, 3, 8, 12, 4, 9]], ["FSP", 4, 0, 0, 3], ["FSP", 4, 4, 1, 3], ["RE", 4, [0, 4, 1, 5, 2, 6, 3, 7]], ["CA", 2, 4, 5], ["CHR", 1, "shared", [2]], ["CA", 2, 3, 6], ["CHR", 0, "shared", [3]], ["CA", 1, 4, 6], ["FU", 6, [0, 1]], ["AN", 6, 0, 5], ["FU", 6, [1, 2]], ["AN", 6, 1, 4], ["FU", 6, [2, 3]], ["AN", 6, 2, 6], ["FU", 3, [0, 1]], ["SP", 3, 0, 192, [1], 1], ["AN", 3, 1, 2], ["FFSP", 3, 0, [1, 0], 1, 1], ["AN", 3, 1, 6], ["FU", 1, [0, 1]], ["SP", 1, 0, 384, [1], 1], ["AN", 1, 1, 2], ["FFSP", 1, 0, [1, 0], 1, 1], ["AN", 1, 1, 6], ["PR", 4, 0, "auto_unroll_max_step$1024"]]]], "r": [[0.0078014], 0, 1.78685, 1695336022], "v": "v0.6"}
{"i": [["[\"817107844ff3a9e513e2b591bc12641a\", [32, 3072], [1, 3072], [1], [32, 1]]", "rocm -keys=rocm,gpu -max_num_threads=256 -max_shared_memory_per_block=65536 -max_threads_per_block=256 -mcpu=gfx908 -mtriple=amdgcn-amd-amdhsa-hcc -thread_warp_size=64", [-1, 16, 64, 65536, 2147483647, 1024, 16, 64], "", 0, []], [[], [["SP", 2, 0, 32, [1, 16, 1, 2], 1], ["SP", 2, 5, 1, [1, 1, 1, 1], 1], ["SP", 2, 10, 3072, [2, 64], 1], ["RE", 2, [0, 5, 1, 6, 2, 7, 10, 11, 3, 8, 12, 4, 9]], ["FSP", 4, 0, 0, 3], ["FSP", 4, 4, 1, 3], ["RE", 4, [0, 4, 1, 5, 2, 6, 3, 7]], ["CA", 2, 4, 5], ["CHR", 1, "shared", [2]], ["CA", 2, 3, 6], ["CHR", 0, "shared", [3]], ["CA", 1, 4, 6], ["FU", 6, [0, 1]], ["AN", 6, 0, 5], ["FU", 6, [1, 2]], ["AN", 6, 1, 4], ["FU", 6, [2, 3]], ["AN", 6, 2, 6], ["FU", 3, [0, 1]], ["SP", 3, 0, 128, [1], 1], ["AN", 3, 1, 2], ["FFSP", 3, 0, [1, 0], 1, 1], ["AN", 3, 1, 6], ["FU", 1, [0, 1]], ["SP", 1, 0, 2048, [1], 1], ["AN", 1, 1, 2], ["FFSP", 1, 0, [1, 0], 1, 1], ["AN", 1, 1, 6], ["PR", 4, 0, "auto_unroll_max_step$1024"]]]], "r": [[0.000683005], 0, 3.89544, 1695336023], "v": "v0.6"}
{"i": [["[\"817107844ff3a9e513e2b591bc12641a\", [32, 3072], [1, 3072], [1], [32, 1]]", "rocm -keys=rocm,gpu -max_num_threads=256 -max_shared_memory_per_block=65536 -max_threads_per_block=256 -mcpu=gfx908 -mtriple=amdgcn-amd-amdhsa-hcc -thread_warp_size=64", [-1, 16, 64, 65536, 2147483647, 1024, 16, 64], "", 0, []], [[], [["SP", 2, 0, 32, [1, 2, 8, 1], 1], ["SP", 2, 5, 1, [1, 1, 1, 1], 1], ["SP", 2, 10, 3072, [12, 4], 1], ["RE", 2, [0, 5, 1, 6, 2, 7, 10, 11, 3, 8, 12, 4, 9]], ["FSP", 4, 0, 0, 3], ["FSP", 4, 4, 1, 3], ["RE", 4, [0, 4, 1, 5, 2, 6, 3, 7]], ["CA", 2, 4, 5], ["CHR", 1, "shared", [2]], ["CA", 2, 3, 6], ["CHR", 0, "shared", [3]], ["CA", 1, 4, 6], ["FU", 6, [0, 1]], ["AN", 6, 0, 5], ["FU", 6, [1, 2]], ["AN", 6, 1, 4], ["FU", 6, [2, 3]], ["AN", 6, 2, 6], ["FU", 3, [0, 1]], ["SP", 3, 0, 4, [1], 1], ["AN", 3, 1, 2], ["FFSP", 3, 0, [1, 0], 1, 1], ["AN", 3, 1, 6], ["FU", 1, [0, 1]], ["SP", 1, 0, 32, [1], 1], ["AN", 1, 1, 2], ["FFSP", 1, 0, [1, 0], 1, 1], ["AN", 1, 1, 6], ["PR", 4, 0, "auto_unroll_max_step$16"]]]], "r": [[0.00364381], 0, 1.22056, 1695336023], "v": "v0.6"}
{"i": [["[\"817107844ff3a9e513e2b591bc12641a\", [32, 3072], [1, 3072], [1], [32, 1]]", "rocm -keys=rocm,gpu -max_num_threads=256 -max_shared_memory_per_block=65536 -max_threads_per_block=256 -mcpu=gfx908 -mtriple=amdgcn-amd-amdhsa-hcc -thread_warp_size=64", [-1, 16, 64, 65536, 2147483647, 1024, 16, 64], "", 0, []], [[], [["SP", 2, 0, 32, [1, 8, 2, 1], 1], ["SP", 2, 5, 1, [1, 1, 1, 1], 1], ["SP", 2, 10, 3072, [24, 16], 1], ["RE", 2, [0, 5, 1, 6, 2, 7, 10, 11, 3, 8, 12, 4, 9]], ["FSP", 4, 0, 0, 3], ["FSP", 4, 4, 1, 3], ["RE", 4, [0, 4, 1, 5, 2, 6, 3, 7]], ["CA", 2, 4, 5], ["CHR", 1, "shared", [2]], ["CA", 2, 3, 6], ["CHR", 0, "shared", [3]], ["CA", 1, 4, 6], ["FU", 6, [0, 1]], ["AN", 6, 0, 5], ["FU", 6, [1, 2]], ["AN", 6, 1, 4], ["FU", 6, [2, 3]], ["AN", 6, 2, 6], ["FU", 3, [0, 1]], ["SP", 3, 0, 384, [1], 1], ["AN", 3, 1, 2], ["FFSP", 3, 0, [1, 0], 1, 1], ["AN", 3, 1, 6], ["FU", 1, [0, 1]], ["SP", 1, 0, 768, [2], 1], ["AN", 1, 1, 2], ["FFSP", 1, 0, [1, 0], 1, 1], ["AN", 1, 1, 6], ["PR", 4, 0, "auto_unroll_max_step$512"]]]], "r": [[0.000147939], 0, 4.60895, 1695336024], "v": "v0.6"}
{"i": [["[\"817107844ff3a9e513e2b591bc12641a\", [32, 3072], [1, 3072], [1], [32, 1]]", "rocm -keys=rocm,gpu -max_num_threads=256 -max_shared_memory_per_block=65536 -max_threads_per_block=256 -mcpu=gfx908 -mtriple=amdgcn-amd-amdhsa-hcc -thread_warp_size=64", [-1, 16, 64, 65536, 2147483647, 1024, 16, 64], "", 0, []], [[], [["SP", 2, 0, 32, [8, 2, 1, 1], 1], ["SP", 2, 5, 1, [1, 1, 1, 1], 1], ["SP", 2, 10, 3072, [16, 24], 1], ["RE", 2, [0, 5, 1, 6, 2, 7, 10, 11, 3, 8, 12, 4, 9]], ["FSP", 4, 0, 0, 3], ["FSP", 4, 4, 1, 3], ["RE", 4, [0, 4, 1, 5, 2, 6, 3, 7]], ["CA", 2, 4, 5], ["CHR", 1, "shared", [2]], ["CA", 2, 3, 6], ["CHR", 0, "shared", [3]], ["CA", 1, 4, 6], ["FU", 6, [0, 1]], ["AN", 6, 0, 5], ["FU", 6, [1, 2]], ["AN", 6, 1, 4], ["FU", 6, [2, 3]], ["AN", 6, 2, 6], ["FU", 3, [0, 1]], ["SP", 3, 0, 384, [1], 1], ["AN", 3, 1, 2], ["FFSP", 3, 0, [1, 0], 1, 1], ["AN", 3, 1, 6], ["FU", 1, [0, 1]], ["SP", 1, 0, 3072, [4], 1], ["AN", 1, 1, 2], ["FFSP", 1, 0, [1, 0], 1, 1], ["AN", 1, 1, 6], ["PR", 4, 0, "auto_unroll_max_step$0"]]]], "r": [[0.00212641], 0, 1.33588, 1695336024], "v": "v0.6"}
{"i": [["[\"817107844ff3a9e513e2b591bc12641a\", [32, 3072], [1, 3072], [1], [32, 1]]", "rocm -keys=rocm,gpu -max_num_threads=256 -max_shared_memory_per_block=65536 -max_threads_per_block=256 -mcpu=gfx908 -mtriple=amdgcn-amd-amdhsa-hcc -thread_warp_size=64", [-1, 16, 64, 65536, 2147483647, 1024, 16, 64], "", 0, []], [[], [["SP", 2, 0, 32, [8, 1, 2, 2], 1], ["SP", 2, 5, 1, [1, 1, 1, 1], 1], ["SP", 2, 10, 3072, [32, 6], 1], ["RE", 2, [0, 5, 1, 6, 2, 7, 10, 11, 3, 8, 12, 4, 9]], ["FSP", 4, 0, 0, 3], ["FSP", 4, 4, 1, 3], ["RE", 4, [0, 4, 1, 5, 2, 6, 3, 7]], ["CA", 2, 4, 5], ["CHR", 1, "shared", [2]], ["CA", 2, 3, 6], ["CHR", 0, "shared", [3]], ["CA", 1, 4, 6], ["FU", 6, [0, 1]], ["AN", 6, 0, 5], ["FU", 6, [1, 2]], ["AN", 6, 1, 4], ["FU", 6, [2, 3]], ["AN", 6, 2, 6], ["FU", 3, [0, 1]], ["SP", 3, 0, 192, [1], 1], ["AN", 3, 1, 2], ["FFSP", 3, 0, [1, 0], 1, 1], ["AN", 3, 1, 6], ["FU", 1, [0, 1]], ["SP", 1, 0, 768, [1], 1], ["AN", 1, 1, 2], ["FFSP", 1, 0, [1, 0], 1, 1], ["AN", 1, 1, 6], ["PR", 4, 0, "auto_unroll_max_step$1024"]]]], "r": [[0.00778005], 0, 2.1022, 1695336025], "v": "v0.6"}
{"i": [["[\"817107844ff3a9e513e2b591bc12641a\", [32, 3072], [1, 3072], [1], [32, 1]]", "rocm -keys=rocm,gpu -max_num_threads=256 -max_shared_memory_per_block=65536 -max_threads_per_block=256 -mcpu=gfx908 -mtriple=amdgcn-amd-amdhsa-hcc -thread_warp_size=64", [-1, 16, 64, 65536, 2147483647, 1024, 16, 64], "", 0, []], [[], [["SP", 2, 0, 32, [1, 2, 2, 2], 1], ["SP", 2, 5, 1, [1, 1, 1, 1], 1], ["SP", 2, 10, 3072, [384, 1], 1], ["RE", 2, [0, 5, 1, 6, 2, 7, 10, 11, 3, 8, 12, 4, 9]], ["FSP", 4, 0, 0, 3], ["FSP", 4, 4, 1, 3], ["RE", 4, [0, 4, 1, 5, 2, 6, 3, 7]], ["CA", 2, 4, 5], ["CHR", 1, "shared", [2]], ["CA", 2, 3, 6], ["CHR", 0, "shared", [3]], ["CA", 1, 4, 6], ["FU", 6, [0, 1]], ["AN", 6, 0, 5], ["FU", 6, [1, 2]], ["AN", 6, 1, 4], ["FU", 6, [2, 3]], ["AN", 6, 2, 6], ["FU", 3, [0, 1]], ["SP", 3, 0, 768, [4], 1], ["AN", 3, 1, 2], ["FFSP", 3, 0, [1, 0], 1, 1], ["AN", 3, 1, 6], ["FU", 1, [0, 1]], ["SP", 1, 0, 3072, [1], 1], ["AN", 1, 1, 2], ["FFSP", 1, 0, [1, 0], 1, 1], ["AN", 1, 1, 6], ["PR", 4, 0, "auto_unroll_max_step$512"]]]], "r": [[0.00135329], 0, 1.0625, 1695336025], "v": "v0.6"}
{"i": [["[\"817107844ff3a9e513e2b591bc12641a\", [32, 3072], [1, 3072], [1], [32, 1]]", "rocm -keys=rocm,gpu -max_num_threads=256 -max_shared_memory_per_block=65536 -max_threads_per_block=256 -mcpu=gfx908 -mtriple=amdgcn-amd-amdhsa-hcc -thread_warp_size=64", [-1, 16, 64, 65536, 2147483647, 1024, 16, 64], "", 0, []], [[], [["SP", 2, 0, 32, [1, 4, 1, 8], 1], ["SP", 2, 5, 1, [1, 1, 1, 1], 1], ["SP", 2, 10, 3072, [1, 64], 1], ["RE", 2, [0, 5, 1, 6, 2, 7, 10, 11, 3, 8, 12, 4, 9]], ["FSP", 4, 0, 0, 3], ["FSP", 4, 4, 1, 3], ["RE", 4, [0, 4, 1, 5, 2, 6, 3, 7]], ["CA", 2, 4, 5], ["CHR", 1, "shared", [2]], ["CA", 2, 3, 6], ["CHR", 0, "shared", [3]], ["CA", 1, 4, 6], ["FU", 6, [0, 1]], ["AN", 6, 0, 5], ["FU", 6, [1, 2]], ["AN", 6, 1, 4], ["FU", 6, [2, 3]], ["AN", 6, 2, 6], ["FU", 3, [0, 1]], ["SP", 3, 0, 1, [1], 1], ["AN", 3, 1, 2], ["FFSP", 3, 0, [1, 0], 1, 1], ["AN", 3, 1, 6], ["FU", 1, [0, 1]], ["SP", 1, 0, 8, [1], 1], ["AN", 1, 1, 2], ["FFSP", 1, 0, [1, 0], 1, 1], ["AN", 1, 1, 6], ["PR", 4, 0, "auto_unroll_max_step$64"]]]], "r": [[0.00282145], 0, 0.938587, 1695336026], "v": "v0.6"}
{"i": [["[\"817107844ff3a9e513e2b591bc12641a\", [32, 3072], [1, 3072], [1], [32, 1]]", "rocm -keys=rocm,gpu -max_num_threads=256 -max_shared_memory_per_block=65536 -max_threads_per_block=256 -mcpu=gfx908 -mtriple=amdgcn-amd-amdhsa-hcc -thread_warp_size=64", [-1, 16, 64, 65536, 2147483647, 1024, 16, 64], "", 0, []], [[], [["SP", 2, 0, 32, [1, 2, 1, 16], 1], ["SP", 2, 5, 1, [1, 1, 1, 1], 1], ["SP", 2, 10, 3072, [32, 2], 1], ["RE", 2, [0, 5, 1, 6, 2, 7, 10, 11, 3, 8, 12, 4, 9]], ["FSP", 4, 0, 0, 3], ["FSP", 4, 4, 1, 3], ["RE", 4, [0, 4, 1, 5, 2, 6, 3, 7]], ["CA", 2, 4, 5], ["CHR", 1, "shared", [2]], ["CA", 2, 3, 6], ["CHR", 0, "shared", [3]], ["CA", 1, 4, 6], ["FU", 6, [0, 1]], ["AN", 6, 0, 5], ["FU", 6, [1, 2]], ["AN", 6, 1, 4], ["FU", 6, [2, 3]], ["AN", 6, 2, 6], ["FU", 3, [0, 1]], ["SP", 3, 0, 64, [1], 1], ["AN", 3, 1, 2], ["FFSP", 3, 0, [1, 0], 1, 1], ["AN", 3, 1, 6], ["FU", 1, [0, 1]], ["SP", 1, 0, 1024, [1], 1], ["AN", 1, 1, 2], ["FFSP", 1, 0, [1, 0], 1, 1], ["AN", 1, 1, 6], ["PR", 4, 0, "auto_unroll_max_step$64"]]]], "r": [[0.00590698], 0, 0.97999, 1695336026], "v": "v0.6"}
{"i": [["[\"817107844ff3a9e513e2b591bc12641a\", [32, 3072], [1, 3072], [1], [32, 1]]", "rocm -keys=rocm,gpu -max_num_threads=256 -max_shared_memory_per_block=65536 -max_threads_per_block=256 -mcpu=gfx908 -mtriple=amdgcn-amd-amdhsa-hcc -thread_warp_size=64", [-1, 16, 64, 65536, 2147483647, 1024, 16, 64], "", 0, []], [[], [["SP", 2, 0, 32, [1, 1, 2, 8], 1], ["SP", 2, 5, 1, [1, 1, 1, 1], 1], ["SP", 2, 10, 3072, [24, 4], 1], ["RE", 2, [0, 5, 1, 6, 2, 7, 10, 11, 3, 8, 12, 4, 9]], ["FSP", 4, 0, 0, 3], ["FSP", 4, 4, 1, 3], ["RE", 4, [0, 4, 1, 5, 2, 6, 3, 7]], ["CA", 2, 4, 5], ["CHR", 1, "shared", [2]], ["CA", 2, 3, 6], ["CHR", 0, "shared", [3]], ["CA", 1, 4, 6], ["FU", 6, [0, 1]], ["AN", 6, 0, 5], ["FU", 6, [1, 2]], ["AN", 6, 1, 4], ["FU", 6, [2, 3]], ["AN", 6, 2, 6], ["FU", 3, [0, 1]], ["SP", 3, 0, 96, [1], 1], ["AN", 3, 1, 2], ["FFSP", 3, 0, [1, 0], 1, 1], ["AN", 3, 1, 6], ["FU", 1, [0, 1]], ["SP", 1, 0, 1536, [1], 1], ["AN", 1, 1, 2], ["FFSP", 1, 0, [1, 0], 1, 1], ["AN", 1, 1, 6], ["PR", 4, 0, "auto_unroll_max_step$16"]]]], "r": [[0.00408589], 0, 1.46453, 1695336027], "v": "v0.6"}
{"i": [["[\"817107844ff3a9e513e2b591bc12641a\", [32, 3072], [1, 3072], [1], [32, 1]]", "rocm -keys=rocm,gpu -max_num_threads=256 -max_shared_memory_per_block=65536 -max_threads_per_block=256 -mcpu=gfx908 -mtriple=amdgcn-amd-amdhsa-hcc -thread_warp_size=64", [-1, 16, 64, 65536, 2147483647, 1024, 16, 64], "", 0, []], [[], [["SP", 2, 0, 32, [2, 1, 4, 4], 1], ["SP", 2, 5, 1, [1, 1, 1, 1], 1], ["SP", 2, 10, 3072, [32, 4], 1], ["RE", 2, [0, 5, 1, 6, 2, 7, 10, 11, 3, 8, 12, 4, 9]], ["FSP", 4, 0, 0, 3], ["FSP", 4, 4, 1, 3], ["RE", 4, [0, 4, 1, 5, 2, 6, 3, 7]], ["CA", 2, 4, 5], ["CHR", 1, "shared", [2]], ["CA", 2, 3, 6], ["CHR", 0, "shared", [3]], ["CA", 1, 4, 6], ["FU", 6, [0, 1]], ["AN", 6, 0, 5], ["FU", 6, [1, 2]], ["AN", 6, 1, 4], ["FU", 6, [2, 3]], ["AN", 6, 2, 6], ["FU", 3, [0, 1]], ["SP", 3, 0, 256, [1], 1], ["AN", 3, 1, 2], ["FFSP", 3, 0, [1, 0], 1, 1], ["AN", 3, 1, 6], ["FU", 1, [0, 1]], ["SP", 1, 0, 4096, [1], 1], ["AN", 1, 1, 2], ["FFSP", 1, 0, [1, 0], 1, 1], ["AN", 1, 1, 6], ["PR", 4, 0, "auto_unroll_max_step$1024"]]]], "r": [[0.00464222], 0, 1.64784, 1695336028], "v": "v0.6"}
{"i": [["[\"817107844ff3a9e513e2b591bc12641a\", [32, 3072], [1, 3072], [1], [32, 1]]", "rocm -keys=rocm,gpu -max_num_threads=256 -max_shared_memory_per_block=65536 -max_threads_per_block=256 -mcpu=gfx908 -mtriple=amdgcn-amd-amdhsa-hcc -thread_warp_size=64", [-1, 16, 64, 65536, 2147483647, 1024, 16, 64], "", 0, []], [[], [["SP", 2, 0, 32, [1, 1, 1, 16], 1], ["SP", 2, 5, 1, [1, 1, 1, 1], 1], ["SP", 2, 10, 3072, [32, 12], 1], ["RE", 2, [0, 5, 1, 6, 2, 7, 10, 11, 3, 8, 12, 4, 9]], ["FSP", 4, 0, 0, 3], ["FSP", 4, 4, 1, 3], ["RE", 4, [0, 4, 1, 5, 2, 6, 3, 7]], ["CA", 2, 4, 5], ["CHR", 1, "shared", [2]], ["CA", 2, 3, 6], ["CHR", 0, "shared", [3]], ["CA", 1, 4, 6], ["FU", 6, [0, 1]], ["AN", 6, 0, 5], ["FU", 6, [1, 2]], ["AN", 6, 1, 4], ["FU", 6, [2, 3]], ["AN", 6, 2, 6], ["FU", 3, [0, 1]], ["SP", 3, 0, 384, [1], 1], ["AN", 3, 1, 2], ["FFSP", 3, 0, [1, 0], 1, 1], ["AN", 3, 1, 6], ["FU", 1, [0, 1]], ["SP", 1, 0, 3072, [1], 1], ["AN", 1, 1, 2], ["FFSP", 1, 0, [1, 0], 1, 1], ["AN", 1, 1, 6], ["PR", 4, 0, "auto_unroll_max_step$0"]]]], "r": [[0.00506928], 0, 1.00162, 1695336028], "v": "v0.6"}
{"i": [["[\"817107844ff3a9e513e2b591bc12641a\", [32, 3072], [1, 3072], [1], [32, 1]]", "rocm -keys=rocm,gpu -max_num_threads=256 -max_shared_memory_per_block=65536 -max_threads_per_block=256 -mcpu=gfx908 -mtriple=amdgcn-amd-amdhsa-hcc -thread_warp_size=64", [-1, 16, 64, 65536, 2147483647, 1024, 16, 64], "", 0, []], [[], [["SP", 2, 0, 32, [2, 4, 4, 1], 1], ["SP", 2, 5, 1, [1, 1, 1, 1], 1], ["SP", 2, 10, 3072, [3, 4], 1], ["RE", 2, [0, 5, 1, 6, 2, 7, 10, 11, 3, 8, 12, 4, 9]], ["FSP", 4, 0, 0, 3], ["FSP", 4, 4, 1, 3], ["RE", 4, [0, 4, 1, 5, 2, 6, 3, 7]], ["CA", 2, 4, 5], ["CHR", 1, "shared", [2]], ["CA", 2, 3, 6], ["CHR", 0, "shared", [3]], ["CA", 1, 4, 6], ["FU", 6, [0, 1]], ["AN", 6, 0, 5], ["FU", 6, [1, 2]], ["AN", 6, 1, 4], ["FU", 6, [2, 3]], ["AN", 6, 2, 6], ["FU", 3, [0, 1]], ["SP", 3, 0, 12, [1], 1], ["AN", 3, 1, 2], ["FFSP", 3, 0, [1, 0], 1, 1], ["AN", 3, 1, 6], ["FU", 1, [0, 1]], ["SP", 1, 0, 48, [1], 1], ["AN", 1, 1, 2], ["FFSP", 1, 0, [1, 0], 1, 1], ["AN", 1, 1, 6], ["PR", 4, 0, "auto_unroll_max_step$512"]]]], "r": [[0.00213365], 0, 1.85721, 1695336028], "v": "v0.6"}
{"i": [["[\"817107844ff3a9e513e2b591bc12641a\", [32, 3072], [1, 3072], [1], [32, 1]]", "rocm -keys=rocm,gpu -max_num_threads=256 -max_shared_memory_per_block=65536 -max_threads_per_block=256 -mcpu=gfx908 -mtriple=amdgcn-amd-amdhsa-hcc -thread_warp_size=64", [-1, 16, 64, 65536, 2147483647, 1024, 16, 64], "", 0, []], [[], [["SP", 2, 0, 32, [1, 1, 2, 2], 1], ["SP", 2, 5, 1, [1, 1, 1, 1], 1], ["SP", 2, 10, 3072, [128, 6], 1], ["RE", 2, [0, 5, 1, 6, 2, 7, 10, 11, 3, 8, 12, 4, 9]], ["FSP", 4, 0, 0, 3], ["FSP", 4, 4, 1, 3], ["RE", 4, [0, 4, 1, 5, 2, 6, 3, 7]], ["CA", 2, 4, 5], ["CHR", 1, "shared", [2]], ["CA", 2, 3, 6], ["CHR", 0, "shared", [3]], ["CA", 1, 4, 6], ["FU", 6, [0, 1]], ["AN", 6, 0, 5], ["FU", 6, [1, 2]], ["AN", 6, 1, 4], ["FU", 6, [2, 3]], ["AN", 6, 2, 6], ["FU", 3, [0, 1]], ["SP", 3, 0, 768, [1], 1], ["AN", 3, 1, 2], ["FFSP", 3, 0, [1, 0], 1, 1], ["AN", 3, 1, 6], ["FU", 1, [0, 1]], ["SP", 1, 0, 3072, [1], 1], ["AN", 1, 1, 2], ["FFSP", 1, 0, [1, 0], 1, 1], ["AN", 1, 1, 6], ["PR", 4, 0, "auto_unroll_max_step$1024"]]]], "r": [[0.00102234], 0, 2.80832, 1695336030], "v": "v0.6"}
{"i": [["[\"817107844ff3a9e513e2b591bc12641a\", [32, 3072], [1, 3072], [1], [32, 1]]", "rocm -keys=rocm,gpu -max_num_threads=256 -max_shared_memory_per_block=65536 -max_threads_per_block=256 -mcpu=gfx908 -mtriple=amdgcn-amd-amdhsa-hcc -thread_warp_size=64", [-1, 16, 64, 65536, 2147483647, 1024, 16, 64], "", 0, []], [[], [["SP", 2, 0, 32, [4, 1, 1, 4], 1], ["SP", 2, 5, 1, [1, 1, 1, 1], 1], ["SP", 2, 10, 3072, [4, 1], 1], ["RE", 2, [0, 5, 1, 6, 2, 7, 10, 11, 3, 8, 12, 4, 9]], ["FSP", 4, 0, 0, 3], ["FSP", 4, 4, 1, 3], ["RE", 4, [0, 4, 1, 5, 2, 6, 3, 7]], ["CA", 2, 4, 5], ["CHR", 1, "shared", [2]], ["CA", 2, 3, 6], ["CHR", 0, "shared", [3]], ["CA", 1, 4, 6], ["FU", 6, [0, 1]], ["AN", 6, 0, 5], ["FU", 6, [1, 2]], ["AN", 6, 1, 4], ["FU", 6, [2, 3]], ["AN", 6, 2, 6], ["FU", 3, [0, 1]], ["SP", 3, 0, 8, [4], 1], ["AN", 3, 1, 2], ["FFSP", 3, 0, [1, 0], 1, 1], ["AN", 3, 1, 6], ["FU", 1, [0, 1]], ["SP", 1, 0, 32, [1], 1], ["AN", 1, 1, 2], ["FFSP", 1, 0, [1, 0], 1, 1], ["AN", 1, 1, 6], ["PR", 4, 0, "auto_unroll_max_step$512"]]]], "r": [[0.000896275], 0, 1.17956, 1695336030], "v": "v0.6"}
{"i": [["[\"817107844ff3a9e513e2b591bc12641a\", [32, 3072], [1, 3072], [1], [32, 1]]", "rocm -keys=rocm,gpu -max_num_threads=256 -max_shared_memory_per_block=65536 -max_threads_per_block=256 -mcpu=gfx908 -mtriple=amdgcn-amd-amdhsa-hcc -thread_warp_size=64", [-1, 16, 64, 65536, 2147483647, 1024, 16, 64], "", 0, []], [[], [["SP", 2, 0, 32, [1, 8, 1, 1], 1], ["SP", 2, 5, 1, [1, 1, 1, 1], 1], ["SP", 2, 10, 3072, [768, 2], 1], ["RE", 2, [0, 5, 1, 6, 2, 7, 10, 11, 3, 8, 12, 4, 9]], ["FSP", 4, 0, 0, 3], ["FSP", 4, 4, 1, 3], ["RE", 4, [0, 4, 1, 5, 2, 6, 3, 7]], ["CA", 2, 4, 5], ["CHR", 1, "shared", [2]], ["CA", 2, 3, 6], ["CHR", 0, "shared", [3]], ["CA", 1, 4, 6], ["FU", 6, [0, 1]], ["AN", 6, 0, 5], ["FU", 6, [1, 2]], ["AN", 6, 1, 4], ["FU", 6, [2, 3]], ["AN", 6, 2, 6], ["FU", 3, [0, 1]], ["SP", 3, 0, 1536, [4], 1], ["AN", 3, 1, 2], ["FFSP", 3, 0, [1, 0], 1, 1], ["AN", 3, 1, 6], ["FU", 1, [0, 1]], ["SP", 1, 0, 1536, [1], 1], ["AN", 1, 1, 2], ["FFSP", 1, 0, [1, 0], 1, 1], ["AN", 1, 1, 6], ["PR", 4, 0, "auto_unroll_max_step$64"]]]], "r": [[0.000423035], 0, 1.04171, 1695336030], "v": "v0.6"}
{"i": [["[\"817107844ff3a9e513e2b591bc12641a\", [32, 3072], [1, 3072], [1], [32, 1]]", "rocm -keys=rocm,gpu -max_num_threads=256 -max_shared_memory_per_block=65536 -max_threads_per_block=256 -mcpu=gfx908 -mtriple=amdgcn-amd-amdhsa-hcc -thread_warp_size=64", [-1, 16, 64, 65536, 2147483647, 1024, 16, 64], "", 0, []], [[], [["SP", 2, 0, 32, [4, 1, 2, 4], 1], ["SP", 2, 5, 1, [1, 1, 1, 1], 1], ["SP", 2, 10, 3072, [4, 4], 1], ["RE", 2, [0, 5, 1, 6, 2, 7, 10, 11, 3, 8, 12, 4, 9]], ["FSP", 4, 0, 0, 3], ["FSP", 4, 4, 1, 3], ["RE", 4, [0, 4, 1, 5, 2, 6, 3, 7]], ["CA", 2, 4, 5], ["CHR", 1, "shared", [2]], ["CA", 2, 3, 6], ["CHR", 0, "shared", [3]], ["CA", 1, 4, 6], ["FU", 6, [0, 1]], ["AN", 6, 0, 5], ["FU", 6, [1, 2]], ["AN", 6, 1, 4], ["FU", 6, [2, 3]], ["AN", 6, 2, 6], ["FU", 3, [0, 1]], ["SP", 3, 0, 16, [4], 1], ["AN", 3, 1, 2], ["FFSP", 3, 0, [1, 0], 1, 1], ["AN", 3, 1, 6], ["FU", 1, [0, 1]], ["SP", 1, 0, 64, [1], 1], ["AN", 1, 1, 2], ["FFSP", 1, 0, [1, 0], 1, 1], ["AN", 1, 1, 6], ["PR", 4, 0, "auto_unroll_max_step$64"]]]], "r": [[0.00398944], 0, 1.36391, 1695336031], "v": "v0.6"}
{"i": [["[\"817107844ff3a9e513e2b591bc12641a\", [32, 3072], [1, 3072], [1], [32, 1]]", "rocm -keys=rocm,gpu -max_num_threads=256 -max_shared_memory_per_block=65536 -max_threads_per_block=256 -mcpu=gfx908 -mtriple=amdgcn-amd-amdhsa-hcc -thread_warp_size=64", [-1, 16, 64, 65536, 2147483647, 1024, 16, 64], "", 0, []], [[], [["SP", 2, 0, 32, [1, 32, 1, 1], 1], ["SP", 2, 5, 1, [1, 1, 1, 1], 1], ["SP", 2, 10, 3072, [16, 24], 1], ["RE", 2, [0, 5, 1, 6, 2, 7, 10, 11, 3, 8, 12, 4, 9]], ["FSP", 4, 0, 0, 3], ["FSP", 4, 4, 1, 3], ["RE", 4, [0, 4, 1, 5, 2, 6, 3, 7]], ["CA", 2, 4, 5], ["CHR", 1, "shared", [2]], ["CA", 2, 3, 6], ["CHR", 0, "shared", [3]], ["CA", 1, 4, 6], ["FU", 6, [0, 1]], ["AN", 6, 0, 5], ["FU", 6, [1, 2]], ["AN", 6, 1, 4], ["FU", 6, [2, 3]], ["AN", 6, 2, 6], ["FU", 3, [0, 1]], ["SP", 3, 0, 384, [1], 1], ["AN", 3, 1, 2], ["FFSP", 3, 0, [1, 0], 1, 1], ["AN", 3, 1, 6], ["FU", 1, [0, 1]], ["SP", 1, 0, 6144, [1], 1], ["AN", 1, 1, 2], ["FFSP", 1, 0, [1, 0], 1, 1], ["AN", 1, 1, 6], ["PR", 4, 0, "auto_unroll_max_step$512"]]]], "r": [[0.000104833], 0, 4.82738, 1695336032], "v": "v0.6"}
{"i": [["[\"817107844ff3a9e513e2b591bc12641a\", [32, 3072], [1, 3072], [1], [32, 1]]", "rocm -keys=rocm,gpu -max_num_threads=256 -max_shared_memory_per_block=65536 -max_threads_per_block=256 -mcpu=gfx908 -mtriple=amdgcn-amd-amdhsa-hcc -thread_warp_size=64", [-1, 16, 64, 65536, 2147483647, 1024, 16, 64], "", 0, []], [[], [["SP", 2, 0, 32, [1, 2, 4, 1], 1], ["SP", 2, 5, 1, [1, 1, 1, 1], 1], ["SP", 2, 10, 3072, [1, 2], 1], ["RE", 2, [0, 5, 1, 6, 2, 7, 10, 11, 3, 8, 12, 4, 9]], ["FSP", 4, 0, 0, 3], ["FSP", 4, 4, 1, 3], ["RE", 4, [0, 4, 1, 5, 2, 6, 3, 7]], ["CA", 2, 4, 5], ["CHR", 1, "shared", [2]], ["CA", 2, 3, 6], ["CHR", 0, "shared", [3]], ["CA", 1, 4, 6], ["FU", 6, [0, 1]], ["AN", 6, 0, 5], ["FU", 6, [1, 2]], ["AN", 6, 1, 4], ["FU", 6, [2, 3]], ["AN", 6, 2, 6], ["FU", 3, [0, 1]], ["SP", 3, 0, 6, [1], 1], ["AN", 3, 1, 2], ["FFSP", 3, 0, [1, 0], 1, 1], ["AN", 3, 1, 6], ["FU", 1, [0, 1]], ["SP", 1, 0, 24, [1], 1], ["AN", 1, 1, 2], ["FFSP", 1, 0, [1, 0], 1, 1], ["AN", 1, 1, 6], ["PR", 4, 0, "auto_unroll_max_step$512"]]]], "r": [[0.000608886], 0, 0.908501, 1695336032], "v": "v0.6"}
{"i": [["[\"817107844ff3a9e513e2b591bc12641a\", [32, 3072], [1, 3072], [1], [32, 1]]", "rocm -keys=rocm,gpu -max_num_threads=256 -max_shared_memory_per_block=65536 -max_threads_per_block=256 -mcpu=gfx908 -mtriple=amdgcn-amd-amdhsa-hcc -thread_warp_size=64", [-1, 16, 64, 65536, 2147483647, 1024, 16, 64], "", 0, []], [[], [["SP", 2, 0, 32, [1, 2, 1, 1], 1], ["SP", 2, 5, 1, [1, 1, 1, 1], 1], ["SP", 2, 10, 3072, [16, 2], 1], ["RE", 2, [0, 5, 1, 6, 2, 7, 10, 11, 3, 8, 12, 4, 9]], ["FSP", 4, 0, 0, 3], ["FSP", 4, 4, 1, 3], ["RE", 4, [0, 4, 1, 5, 2, 6, 3, 7]], ["CA", 2, 4, 5], ["CHR", 1, "shared", [2]], ["CA", 2, 3, 6], ["CHR", 0, "shared", [3]], ["CA", 1, 4, 6], ["FU", 6, [0, 1]], ["AN", 6, 0, 5], ["FU", 6, [1, 2]], ["AN", 6, 1, 4], ["FU", 6, [2, 3]], ["AN", 6, 2, 6], ["FU", 3, [0, 1]], ["SP", 3, 0, 768, [1], 1], ["AN", 3, 1, 2], ["FFSP", 3, 0, [1, 0], 1, 1], ["AN", 3, 1, 6], ["FU", 1, [0, 1]], ["SP", 1, 0, 1536, [1], 1], ["AN", 1, 1, 2], ["FFSP", 1, 0, [1, 0], 1, 1], ["AN", 1, 1, 6], ["PR", 4, 0, "auto_unroll_max_step$0"]]]], "r": [[0.000391595], 0, 1.10922, 1695336032], "v": "v0.6"}
{"i": [["[\"817107844ff3a9e513e2b591bc12641a\", [32, 3072], [1, 3072], [1], [32, 1]]", "rocm -keys=rocm,gpu -max_num_threads=256 -max_shared_memory_per_block=65536 -max_threads_per_block=256 -mcpu=gfx908 -mtriple=amdgcn-amd-amdhsa-hcc -thread_warp_size=64", [-1, 16, 64, 65536, 2147483647, 1024, 16, 64], "", 0, []], [[], [["SP", 2, 0, 32, [1, 32, 1, 1], 1], ["SP", 2, 5, 1, [1, 1, 1, 1], 1], ["SP", 2, 10, 3072, [6, 64], 1], ["RE", 2, [0, 5, 1, 6, 2, 7, 10, 11, 3, 8, 12, 4, 9]], ["FSP", 4, 0, 0, 3], ["FSP", 4, 4, 1, 3], ["RE", 4, [0, 4, 1, 5, 2, 6, 3, 7]], ["CA", 2, 4, 5], ["CHR", 1, "shared", [2]], ["CA", 2, 3, 6], ["CHR", 0, "shared", [3]], ["CA", 1, 4, 6], ["FU", 6, [0, 1]], ["AN", 6, 0, 5], ["FU", 6, [1, 2]], ["AN", 6, 1, 4], ["FU", 6, [2, 3]], ["AN", 6, 2, 6], ["FU", 3, [0, 1]], ["SP", 3, 0, 6, [1], 1], ["AN", 3, 1, 2], ["FFSP", 3, 0, [1, 0], 1, 1], ["AN", 3, 1, 6], ["FU", 1, [0, 1]], ["SP", 1, 0, 96, [1], 1], ["AN", 1, 1, 2], ["FFSP", 1, 0, [1, 0], 1, 1], ["AN", 1, 1, 6], ["PR", 4, 0, "auto_unroll_max_step$1024"]]]], "r": [[0.000104809], 0, 4.80429, 1695336033], "v": "v0.6"}
{"i": [["[\"817107844ff3a9e513e2b591bc12641a\", [32, 3072], [1, 3072], [1], [32, 1]]", "rocm -keys=rocm,gpu -max_num_threads=256 -max_shared_memory_per_block=65536 -max_threads_per_block=256 -mcpu=gfx908 -mtriple=amdgcn-amd-amdhsa-hcc -thread_warp_size=64", [-1, 16, 64, 65536, 2147483647, 1024, 16, 64], "", 0, []], [[], [["SP", 2, 0, 32, [2, 4, 1, 4], 1], ["SP", 2, 5, 1, [1, 1, 1, 1], 1], ["SP", 2, 10, 3072, [16, 8], 1], ["RE", 2, [0, 5, 1, 6, 2, 7, 10, 11, 3, 8, 12, 4, 9]], ["FSP", 4, 0, 0, 3], ["FSP", 4, 4, 1, 3], ["RE", 4, [0, 4, 1, 5, 2, 6, 3, 7]], ["CA", 2, 4, 5], ["CHR", 1, "shared", [2]], ["CA", 2, 3, 6], ["CHR", 0, "shared", [3]], ["CA", 1, 4, 6], ["FU", 6, [0, 1]], ["AN", 6, 0, 5], ["FU", 6, [1, 2]], ["AN", 6, 1, 4], ["FU", 6, [2, 3]], ["AN", 6, 2, 6], ["FU", 3, [0, 1]], ["SP", 3, 0, 128, [1], 1], ["AN", 3, 1, 2], ["FFSP", 3, 0, [1, 0], 1, 1], ["AN", 3, 1, 6], ["FU", 1, [0, 1]], ["SP", 1, 0, 512, [1], 1], ["AN", 1, 1, 2], ["FFSP", 1, 0, [1, 0], 1, 1], ["AN", 1, 1, 6], ["PR", 4, 0, "auto_unroll_max_step$16"]]]], "r": [[0.00157756], 0, 1.51174, 1695336034], "v": "v0.6"}
{"i": [["[\"817107844ff3a9e513e2b591bc12641a\", [32, 3072], [1, 3072], [1], [32, 1]]", "rocm -keys=rocm,gpu -max_num_threads=256 -max_shared_memory_per_block=65536 -max_threads_per_block=256 -mcpu=gfx908 -mtriple=amdgcn-amd-amdhsa-hcc -thread_warp_size=64", [-1, 16, 64, 65536, 2147483647, 1024, 16, 64], "", 0, []], [[], [["SP", 2, 0, 32, [1, 8, 1, 2], 1], ["SP", 2, 5, 1, [1, 1, 1, 1], 1], ["SP", 2, 10, 3072, [16, 12], 1], ["RE", 2, [0, 5, 1, 6, 2, 7, 10, 11, 3, 8, 12, 4, 9]], ["FSP", 4, 0, 0, 3], ["FSP", 4, 4, 1, 3], ["RE", 4, [0, 4, 1, 5, 2, 6, 3, 7]], ["CA", 2, 4, 5], ["CHR", 1, "shared", [2]], ["CA", 2, 3, 6], ["CHR", 0, "shared", [3]], ["CA", 1, 4, 6], ["FU", 6, [0, 1]], ["AN", 6, 0, 5], ["FU", 6, [1, 2]], ["AN", 6, 1, 4], ["FU", 6, [2, 3]], ["AN", 6, 2, 6], ["FU", 3, [0, 1]], ["SP", 3, 0, 16, [16], 1], ["AN", 3, 1, 2], ["FFSP", 3, 0, [1, 0], 1, 1], ["AN", 3, 1, 6], ["FU", 1, [0, 1]], ["SP", 1, 0, 32, [1], 1], ["AN", 1, 1, 2], ["FFSP", 1, 0, [1, 0], 1, 1], ["AN", 1, 1, 6], ["PR", 4, 0, "auto_unroll_max_step$1024"]]]], "r": [[0.000235803], 0, 4.0125, 1695336034], "v": "v0.6"}
{"i": [["[\"817107844ff3a9e513e2b591bc12641a\", [32, 3072], [1, 3072], [1], [32, 1]]", "rocm -keys=rocm,gpu -max_num_threads=256 -max_shared_memory_per_block=65536 -max_threads_per_block=256 -mcpu=gfx908 -mtriple=amdgcn-amd-amdhsa-hcc -thread_warp_size=64", [-1, 16, 64, 65536, 2147483647, 1024, 16, 64], "", 0, []], [[], [["SP", 2, 0, 32, [1, 1, 1, 1], 1], ["SP", 2, 5, 1, [1, 1, 1, 1], 1], ["SP", 2, 10, 3072, [1, 1], 1], ["RE", 2, [0, 5, 1, 6, 2, 7, 10, 11, 3, 8, 12, 4, 9]], ["FSP", 4, 0, 0, 3], ["FSP", 4, 4, 1, 3], ["RE", 4, [0, 4, 1, 5, 2, 6, 3, 7]], ["CA", 2, 4, 5], ["CHR", 1, "shared", [2]], ["CA", 2, 3, 6], ["CHR", 0, "shared", [3]], ["CA", 1, 4, 6], ["FU", 6, [0, 1]], ["AN", 6, 0, 5], ["FU", 6, [1, 2]], ["AN", 6, 1, 4], ["FU", 6, [2, 3]], ["AN", 6, 2, 6], ["FU", 3, [0, 1]], ["SP", 3, 0, 8, [1], 1], ["AN", 3, 1, 2], ["FFSP", 3, 0, [1, 0], 1, 1], ["AN", 3, 1, 6], ["FU", 1, [0, 1]], ["SP", 1, 0, 32, [1], 1], ["AN", 1, 1, 2], ["FFSP", 1, 0, [1, 0], 1, 1], ["AN", 1, 1, 6], ["PR", 4, 0, "auto_unroll_max_step$512"]]]], "r": [[5.73647e-05], 0, 0.807975, 1695336035], "v": "v0.6"}
{"i": [["[\"817107844ff3a9e513e2b591bc12641a\", [32, 3072], [1, 3072], [1], [32, 1]]", "rocm -keys=rocm,gpu -max_num_threads=256 -max_shared_memory_per_block=65536 -max_threads_per_block=256 -mcpu=gfx908 -mtriple=amdgcn-amd-amdhsa-hcc -thread_warp_size=64", [-1, 16, 64, 65536, 2147483647, 1024, 16, 64], "", 0, []], [[], [["SP", 2, 0, 32, [2, 4, 1, 1], 1], ["SP", 2, 5, 1, [1, 1, 1, 1], 1], ["SP", 2, 10, 3072, [8, 24], 1], ["RE", 2, [0, 5, 1, 6, 2, 7, 10, 11, 3, 8, 12, 4, 9]], ["FSP", 4, 0, 0, 3], ["FSP", 4, 4, 1, 3], ["RE", 4, [0, 4, 1, 5, 2, 6, 3, 7]], ["CA", 2, 4, 5], ["CHR", 1, "shared", [2]], ["CA", 2, 3, 6], ["CHR", 0, "shared", [3]], ["CA", 1, 4, 6], ["FU", 6, [0, 1]], ["AN", 6, 0, 5], ["FU", 6, [1, 2]], ["AN", 6, 1, 4], ["FU", 6, [2, 3]], ["AN", 6, 2, 6], ["FU", 3, [0, 1]], ["SP", 3, 0, 16, [1], 1], ["AN", 3, 1, 2], ["FFSP", 3, 0, [1, 0], 1, 1], ["AN", 3, 1, 6], ["FU", 1, [0, 1]], ["SP", 1, 0, 16, [1], 1], ["AN", 1, 1, 2], ["FFSP", 1, 0, [1, 0], 1, 1], ["AN", 1, 1, 6], ["PR", 4, 0, "auto_unroll_max_step$512"]]]], "r": [[0.000189662], 0, 4.4847, 1695336035], "v": "v0.6"}
{"i": [["[\"817107844ff3a9e513e2b591bc12641a\", [32, 3072], [1, 3072], [1], [32, 1]]", "rocm -keys=rocm,gpu -max_num_threads=256 -max_shared_memory_per_block=65536 -max_threads_per_block=256 -mcpu=gfx908 -mtriple=amdgcn-amd-amdhsa-hcc -thread_warp_size=64", [-1, 16, 64, 65536, 2147483647, 1024, 16, 64], "", 0, []], [[], [["SP", 2, 0, 32, [16, 1, 1, 1], 1], ["SP", 2, 5, 1, [1, 1, 1, 1], 1], ["SP", 2, 10, 3072, [16, 32], 1], ["RE", 2, [0, 5, 1, 6, 2, 7, 10, 11, 3, 8, 12, 4, 9]], ["FSP", 4, 0, 0, 3], ["FSP", 4, 4, 1, 3], ["RE", 4, [0, 4, 1, 5, 2, 6, 3, 7]], ["CA", 2, 4, 5], ["CHR", 1, "shared", [2]], ["CA", 2, 3, 6], ["CHR", 0, "shared", [3]], ["CA", 1, 4, 6], ["FU", 6, [0, 1]], ["AN", 6, 0, 5], ["FU", 6, [1, 2]], ["AN", 6, 1, 4], ["FU", 6, [2, 3]], ["AN", 6, 2, 6], ["FU", 3, [0, 1]], ["SP", 3, 0, 256, [4], 1], ["AN", 3, 1, 2], ["FFSP", 3, 0, [1, 0], 1, 1], ["AN", 3, 1, 6], ["FU", 1, [0, 1]], ["SP", 1, 0, 2048, [1], 1], ["AN", 1, 1, 2], ["FFSP", 1, 0, [1, 0], 1, 1], ["AN", 1, 1, 6], ["PR", 4, 0, "auto_unroll_max_step$64"]]]], "r": [[0.00221173], 0, 1.26783, 1695336036], "v": "v0.6"}
{"i": [["[\"817107844ff3a9e513e2b591bc12641a\", [32, 3072], [1, 3072], [1], [32, 1]]", "rocm -keys=rocm,gpu -max_num_threads=256 -max_shared_memory_per_block=65536 -max_threads_per_block=256 -mcpu=gfx908 -mtriple=amdgcn-amd-amdhsa-hcc -thread_warp_size=64", [-1, 16, 64, 65536, 2147483647, 1024, 16, 64], "", 0, []], [[], [["SP", 2, 0, 32, [2, 4, 1, 2], 1], ["SP", 2, 5, 1, [1, 1, 1, 1], 1], ["SP", 2, 10, 3072, [4, 24], 1], ["RE", 2, [0, 5, 1, 6, 2, 7, 10, 11, 3, 8, 12, 4, 9]], ["FSP", 4, 0, 0, 3], ["FSP", 4, 4, 1, 3], ["RE", 4, [0, 4, 1, 5, 2, 6, 3, 7]], ["CA", 2, 4, 5], ["CHR", 1, "shared", [2]], ["CA", 2, 3, 6], ["CHR", 0, "shared", [3]], ["CA", 1, 4, 6], ["FU", 6, [0, 1]], ["AN", 6, 0, 5], ["FU", 6, [1, 2]], ["AN", 6, 1, 4], ["FU", 6, [2, 3]], ["AN", 6, 2, 6], ["FU", 3, [0, 1]], ["SP", 3, 0, 96, [1], 1], ["AN", 3, 1, 2], ["FFSP", 3, 0, [1, 0], 1, 1], ["AN", 3, 1, 6], ["FU", 1, [0, 1]], ["SP", 1, 0, 192, [3], 1], ["AN", 1, 1, 2], ["FFSP", 1, 0, [1, 0], 1, 1], ["AN", 1, 1, 6], ["PR", 4, 0, "auto_unroll_max_step$1024"]]]], "r": [[0.000527986], 0, 2.89131, 1695336036], "v": "v0.6"}
{"i": [["[\"817107844ff3a9e513e2b591bc12641a\", [32, 3072], [1, 3072], [1], [32, 1]]", "rocm -keys=rocm,gpu -max_num_threads=256 -max_shared_memory_per_block=65536 -max_threads_per_block=256 -mcpu=gfx908 -mtriple=amdgcn-amd-amdhsa-hcc -thread_warp_size=64", [-1, 16, 64, 65536, 2147483647, 1024, 16, 64], "", 0, []], [[], [["SP", 2, 0, 32, [1, 4, 4, 1], 1], ["SP", 2, 5, 1, [1, 1, 1, 1], 1], ["SP", 2, 10, 3072, [1, 1], 1], ["RE", 2, [0, 5, 1, 6, 2, 7, 10, 11, 3, 8, 12, 4, 9]], ["FSP", 4, 0, 0, 3], ["FSP", 4, 4, 1, 3], ["RE", 4, [0, 4, 1, 5, 2, 6, 3, 7]], ["CA", 2, 4, 5], ["CHR", 1, "shared", [2]], ["CA", 2, 3, 6], ["CHR", 0, "shared", [3]], ["CA", 1, 4, 6], ["FU", 6, [0, 1]], ["AN", 6, 0, 5], ["FU", 6, [1, 2]], ["AN", 6, 1, 4], ["FU", 6, [2, 3]], ["AN", 6, 2, 6], ["FU", 3, [0, 1]], ["SP", 3, 0, 1, [1], 1], ["AN", 3, 1, 2], ["FFSP", 3, 0, [1, 0], 1, 1], ["AN", 3, 1, 6], ["FU", 1, [0, 1]], ["SP", 1, 0, 4, [1], 1], ["AN", 1, 1, 2], ["FFSP", 1, 0, [1, 0], 1, 1], ["AN", 1, 1, 6], ["PR", 4, 0, "auto_unroll_max_step$16"]]]], "r": [[0.00117299], 0, 0.861312, 1695336037], "v": "v0.6"}
{"i": [["[\"817107844ff3a9e513e2b591bc12641a\", [32, 3072], [1, 3072], [1], [32, 1]]", "rocm -keys=rocm,gpu -max_num_threads=256 -max_shared_memory_per_block=65536 -max_threads_per_block=256 -mcpu=gfx908 -mtriple=amdgcn-amd-amdhsa-hcc -thread_warp_size=64", [-1, 16, 64, 65536, 2147483647, 1024, 16, 64], "", 0, []], [[], [["SP", 2, 0, 32, [1, 2, 2, 8], 1], ["SP", 2, 5, 1, [1, 1, 1, 1], 1], ["SP", 2, 10, 3072, [12, 2], 1], ["RE", 2, [0, 5, 1, 6, 2, 7, 10, 11, 3, 8, 12, 4, 9]], ["FSP", 4, 0, 0, 3], ["FSP", 4, 4, 1, 3], ["RE", 4, [0, 4, 1, 5, 2, 6, 3, 7]], ["CA", 2, 4, 5], ["CHR", 1, "shared", [2]], ["CA", 2, 3, 6], ["CHR", 0, "shared", [3]], ["CA", 1, 4, 6], ["FU", 6, [0, 1]], ["AN", 6, 0, 5], ["FU", 6, [1, 2]], ["AN", 6, 1, 4], ["FU", 6, [2, 3]], ["AN", 6, 2, 6], ["FU", 3, [0, 1]], ["SP", 3, 0, 24, [1], 1], ["AN", 3, 1, 2], ["FFSP", 3, 0, [1, 0], 1, 1], ["AN", 3, 1, 6], ["FU", 1, [0, 1]], ["SP", 1, 0, 384, [1], 1], ["AN", 1, 1, 2], ["FFSP", 1, 0, [1, 0], 1, 1], ["AN", 1, 1, 6], ["PR", 4, 0, "auto_unroll_max_step$512"]]]], "r": [[0.00271703], 0, 4.5001, 1695336037], "v": "v0.6"}
{"i": [["[\"817107844ff3a9e513e2b591bc12641a\", [32, 3072], [1, 3072], [1], [32, 1]]", "rocm -keys=rocm,gpu -max_num_threads=256 -max_shared_memory_per_block=65536 -max_threads_per_block=256 -mcpu=gfx908 -mtriple=amdgcn-amd-amdhsa-hcc -thread_warp_size=64", [-1, 16, 64, 65536, 2147483647, 1024, 16, 64], "", 0, []], [[], [["SP", 2, 0, 32, [4, 2, 2, 2], 1], ["SP", 2, 5, 1, [1, 1, 1, 1], 1], ["SP", 2, 10, 3072, [4, 4], 1], ["RE", 2, [0, 5, 1, 6, 2, 7, 10, 11, 3, 8, 12, 4, 9]], ["FSP", 4, 0, 0, 3], ["FSP", 4, 4, 1, 3], ["RE", 4, [0, 4, 1, 5, 2, 6, 3, 7]], ["CA", 2, 4, 5], ["CHR", 1, "shared", [2]], ["CA", 2, 3, 6], ["CHR", 0, "shared", [3]], ["CA", 1, 4, 6], ["FU", 6, [0, 1]], ["AN", 6, 0, 5], ["FU", 6, [1, 2]], ["AN", 6, 1, 4], ["FU", 6, [2, 3]], ["AN", 6, 2, 6], ["FU", 3, [0, 1]], ["SP", 3, 0, 16, [4], 1], ["AN", 3, 1, 2], ["FFSP", 3, 0, [1, 0], 1, 1], ["AN", 3, 1, 6], ["FU", 1, [0, 1]], ["SP", 1, 0, 64, [1], 1], ["AN", 1, 1, 2], ["FFSP", 1, 0, [1, 0], 1, 1], ["AN", 1, 1, 6], ["PR", 4, 0, "auto_unroll_max_step$64"]]]], "r": [[0.00406561], 0, 1.24102, 1695336038], "v": "v0.6"}
{"i": [["[\"817107844ff3a9e513e2b591bc12641a\", [32, 3072], [1, 3072], [1], [32, 1]]", "rocm -keys=rocm,gpu -max_num_threads=256 -max_shared_memory_per_block=65536 -max_threads_per_block=256 -mcpu=gfx908 -mtriple=amdgcn-amd-amdhsa-hcc -thread_warp_size=64", [-1, 16, 64, 65536, 2147483647, 1024, 16, 64], "", 0, []], [[], [["SP", 2, 0, 32, [16, 1, 1, 1], 1], ["SP", 2, 5, 1, [1, 1, 1, 1], 1], ["SP", 2, 10, 3072, [96, 1], 1], ["RE", 2, [0, 5, 1, 6, 2, 7, 10, 11, 3, 8, 12, 4, 9]], ["FSP", 4, 0, 0, 3], ["FSP", 4, 4, 1, 3], ["RE", 4, [0, 4, 1, 5, 2, 6, 3, 7]], ["CA", 2, 4, 5], ["CHR", 1, "shared", [2]], ["CA", 2, 3, 6], ["CHR", 0, "shared", [3]], ["CA", 1, 4, 6], ["FU", 6, [0, 1]], ["AN", 6, 0, 5], ["FU", 6, [1, 2]], ["AN", 6, 1, 4], ["FU", 6, [2, 3]], ["AN", 6, 2, 6], ["FU", 3, [0, 1]], ["SP", 3, 0, 96, [1], 1], ["AN", 3, 1, 2], ["FFSP", 3, 0, [1, 0], 1, 1], ["AN", 3, 1, 6], ["FU", 1, [0, 1]], ["SP", 1, 0, 96, [1], 1], ["AN", 1, 1, 2], ["FFSP", 1, 0, [1, 0], 1, 1], ["AN", 1, 1, 6], ["PR", 4, 0, "auto_unroll_max_step$1024"]]]], "r": [[0.00462168], 0, 0.994564, 1695336039], "v": "v0.6"}
