ansor_log/rocm-MI100/ResNet/rocm-ResNet-50.json
{"i": [["[\"817107844ff3a9e513e2b591bc12641a\", [32, 3072], [1, 3072], [1], [32, 1]]", "rocm -keys=rocm,gpu -max_num_threads=256 -max_shared_memory_per_block=65536 -max_threads_per_block=256 -mcpu=gfx908 -mtriple=amdgcn-amd-amdhsa-hcc -thread_warp_size=64", [-1, 16, 64, 65536, 2147483647, 1024, 16, 64], "", 0, []], [[], [["SP", 2, 0, 32, [4, 1, 1, 2], 1], ["SP", 2, 5, 1, [1, 1, 1, 1], 1], ["SP", 2, 10, 3072, [2, 3], 1], ["RE", 2, [0, 5, 1, 6, 2, 7, 10, 11, 3, 8, 12, 4, 9]], ["FSP", 4, 0, 0, 3], ["FSP", 4, 4, 1, 3], ["RE", 4, [0, 4, 1, 5, 2, 6, 3, 7]], ["CA", 2, 4, 5], ["CHR", 1, "shared", [2]], ["CA", 2, 3, 6], ["CHR", 0, "shared", [3]], ["CA", 1, 4, 6], ["FU", 6, [0, 1]], ["AN", 6, 0, 5], ["FU", 6, [1, 2]], ["AN", 6, 1, 4], ["FU", 6, [2, 3]], ["AN", 6, 2, 6], ["FU", 3, [0, 1]], ["SP", 3, 0, 6, [3], 1], ["AN", 3, 1, 2], ["FFSP", 3, 0, [1, 0], 1, 1], ["AN", 3, 1, 6], ["FU", 1, [0, 1]], ["SP", 1, 0, 6, [1], 1], ["AN", 1, 1, 2], ["FFSP", 1, 0, [1, 0], 1, 1], ["AN", 1, 1, 6], ["PR", 4, 0, "auto_unroll_max_step$64"]]]], "r": [[0.00053972], 0, 1.66418, 1695335117], "v": "v0.6"}
{"i": [["[\"817107844ff3a9e513e2b591bc12641a\", [32, 3072], [1, 3072], [1], [32, 1]]", "rocm -keys=rocm,gpu -max_num_threads=256 -max_shared_memory_per_block=65536 -max_threads_per_block=256 -mcpu=gfx908 -mtriple=amdgcn-amd-amdhsa-hcc -thread_warp_size=64", [-1, 16, 64, 65536, 2147483647, 1024, 16, 64], "", 0, []], [[], [["SP", 2, 0, 32, [1, 16, 1, 1], 1], ["SP", 2, 5, 1, [1, 1, 1, 1], 1], ["SP", 2, 10, 3072, [1, 8], 1], ["RE", 2, [0, 5, 1, 6, 2, 7, 10, 11, 3, 8, 12, 4, 9]], ["FSP", 4, 0, 0, 3], ["FSP", 4, 4, 1, 3], ["RE", 4, [0, 4, 1, 5, 2, 6, 3, 7]], ["CA", 2, 4, 5], ["CHR", 1, "shared", [2]], ["CA", 2, 3, 6], ["CHR", 0, "shared", [3]], ["CA", 1, 4, 6], ["FU", 6, [0, 1]], ["AN", 6, 0, 5], ["FU", 6, [1, 2]], ["AN", 6, 1, 4], ["FU", 6, [2, 3]], ["AN", 6, 2, 6], ["FU", 3, [0, 1]], ["SP", 3, 0, 8, [1], 1], ["AN", 3, 1, 2], ["FFSP", 3, 0, [1, 0], 1, 1], ["AN", 3, 1, 6], ["FU", 1, [0, 1]], ["SP", 1, 0, 8, [1], 1], ["AN", 1, 1, 2], ["FFSP", 1, 0, [1, 0], 1, 1], ["AN", 1, 1, 6], ["PR", 4, 0, "auto_unroll_max_step$64"]]]], "r": [[0.000224347], 0, 0.949667, 1695335117], "v": "v0.6"}
{"i": [["[\"817107844ff3a9e513e2b591bc12641a\", [32, 3072], [1, 3072], [1], [32, 1]]", "rocm -keys=rocm,gpu -max_num_threads=256 -max_shared_memory_per_block=65536 -max_threads_per_block=256 -mcpu=gfx908 -mtriple=amdgcn-amd-amdhsa-hcc -thread_warp_size=64", [-1, 16, 64, 65536, 2147483647, 1024, 16, 64], "", 0, []], [[], [["SP", 2, 0, 32, [1, 1, 1, 2], 1], ["SP", 2, 5, 1, [1, 1, 1, 1], 1], ["SP", 2, 10, 3072, [4, 12], 1], ["RE", 2, [0, 5, 1, 6, 2, 7, 10, 11, 3, 8, 12, 4, 9]], ["FSP", 4, 0, 0, 3], ["FSP", 4, 4, 1, 3], ["RE", 4, [0, 4, 1, 5, 2, 6, 3, 7]], ["CA", 2, 4, 5], ["CHR", 1, "shared", [2]], ["CA", 2, 3, 6], ["CHR", 0, "shared", [3]], ["CA", 1, 4, 6], ["FU", 6, [0, 1]], ["AN", 6, 0, 5], ["FU", 6, [1, 2]], ["AN", 6, 1, 4], ["FU", 6, [2, 3]], ["AN", 6, 2, 6], ["FU", 3, [0, 1]], ["SP", 3, 0, 48, [1], 1], ["AN", 3, 1, 2], ["FFSP", 3, 0, [1, 0], 1, 1], ["AN", 3, 1, 6], ["FU", 1, [0, 1]], ["SP", 1, 0, 96, [1], 1], ["AN", 1, 1, 2], ["FFSP", 1, 0, [1, 0], 1, 1], ["AN", 1, 1, 6], ["PR", 4, 0, "auto_unroll_max_step$16"]]]], "r": [[0.000606351], 0, 1.04259, 1695335117], "v": "v0.6"}
{"i": [["[\"817107844ff3a9e513e2b591bc12641a\", [32, 3072], [1, 3072], [1], [32, 1]]", "rocm -keys=rocm,gpu -max_num_threads=256 -max_shared_memory_per_block=65536 -max_threads_per_block=256 -mcpu=gfx908 -mtriple=amdgcn-amd-amdhsa-hcc -thread_warp_size=64", [-1, 16, 64, 65536, 2147483647, 1024, 16, 64], "", 0, []], [[], [["SP", 2, 0, 32, [2, 2, 1, 2], 1], ["SP", 2, 5, 1, [1, 1, 1, 1], 1], ["SP", 2, 10, 3072, [1, 2], 1], ["RE", 2, [0, 5, 1, 6, 2, 7, 10, 11, 3, 8, 12, 4, 9]], ["FSP", 4, 0, 0, 3], ["FSP", 4, 4, 1, 3], ["RE", 4, [0, 4, 1, 5, 2, 6, 3, 7]], ["CA", 2, 4, 5], ["CHR", 1, "shared", [2]], ["CA", 2, 3, 6], ["CHR", 0, "shared", [3]], ["CA", 1, 4, 6], ["FU", 6, [0, 1]], ["AN", 6, 0, 5], ["FU", 6, [1, 2]], ["AN", 6, 1, 4], ["FU", 6, [2, 3]], ["AN", 6, 2, 6], ["FU", 3, [0, 1]], ["SP", 3, 0, 2, [1], 1], ["AN", 3, 1, 2], ["FFSP", 3, 0, [1, 0], 1, 1], ["AN", 3, 1, 6], ["FU", 1, [0, 1]], ["SP", 1, 0, 4, [1], 1], ["AN", 1, 1, 2], ["FFSP", 1, 0, [1, 0], 1, 1], ["AN", 1, 1, 6], ["PR", 4, 0, "auto_unroll_max_step$0"]]]], "r": [[0.00150561], 0, 1.07127, 1695335118], "v": "v0.6"}
{"i": [["[\"817107844ff3a9e513e2b591bc12641a\", [32, 3072], [1, 3072], [1], [32, 1]]", "rocm -keys=rocm,gpu -max_num_threads=256 -max_shared_memory_per_block=65536 -max_threads_per_block=256 -mcpu=gfx908 -mtriple=amdgcn-amd-amdhsa-hcc -thread_warp_size=64", [-1, 16, 64, 65536, 2147483647, 1024, 16, 64], "", 0, []], [[], [["SP", 2, 0, 32, [2, 1, 2, 4], 1], ["SP", 2, 5, 1, [1, 1, 1, 1], 1], ["SP", 2, 10, 3072, [3, 1], 1], ["RE", 2, [0, 5, 1, 6, 2, 7, 10, 11, 3, 8, 12, 4, 9]], ["FSP", 4, 0, 0, 3], ["FSP", 4, 4, 1, 3], ["RE", 4, [0, 4, 1, 5, 2, 6, 3, 7]], ["CA", 2, 4, 5], ["CHR", 1, "shared", [2]], ["CA", 2, 3, 6], ["CHR", 0, "shared", [3]], ["CA", 1, 4, 6], ["FU", 6, [0, 1]], ["AN", 6, 0, 5], ["FU", 6, [1, 2]], ["AN", 6, 1, 4], ["FU", 6, [2, 3]], ["AN", 6, 2, 6], ["FU", 3, [0, 1]], ["SP", 3, 0, 3, [3], 1], ["AN", 3, 1, 2], ["FFSP", 3, 0, [1, 0], 1, 1], ["AN", 3, 1, 6], ["FU", 1, [0, 1]], ["SP", 1, 0, 24, [1], 1], ["AN", 1, 1, 2], ["FFSP", 1, 0, [1, 0], 1, 1], ["AN", 1, 1, 6], ["PR", 4, 0, "auto_unroll_max_step$64"]]]], "r": [[0.00105762], 0, 1.43195, 1695335119], "v": "v0.6"}
{"i": [["[\"817107844ff3a9e513e2b591bc12641a\", [32, 3072], [1, 3072], [1], [32, 1]]", "rocm -keys=rocm,gpu -max_num_threads=256 -max_shared_memory_per_block=65536 -max_threads_per_block=256 -mcpu=gfx908 -mtriple=amdgcn-amd-amdhsa-hcc -thread_warp_size=64", [-1, 16, 64, 65536, 2147483647, 1024, 16, 64], "", 0, []], [[], [["SP", 2, 0, 32, [4, 1, 1, 4], 1], ["SP", 2, 5, 1, [1, 1, 1, 1], 1], ["SP", 2, 10, 3072, [128, 2], 1], ["RE", 2, [0, 5, 1, 6, 2, 7, 10, 11, 3, 8, 12, 4, 9]], ["FSP", 4, 0, 0, 3], ["FSP", 4, 4, 1, 3], ["RE", 4, [0, 4, 1, 5, 2, 6, 3, 7]], ["CA", 2, 4, 5], ["CHR", 1, "shared", [2]], ["CA", 2, 3, 6], ["CHR", 0, "shared", [3]], ["CA", 1, 4, 6], ["FU", 6, [0, 1]], ["AN", 6, 0, 5], ["FU", 6, [1, 2]], ["AN", 6, 1, 4], ["FU", 6, [2, 3]], ["AN", 6, 2, 6], ["FU", 3, [0, 1]], ["SP", 3, 0, 256, [2], 1], ["AN", 3, 1, 2], ["FFSP", 3, 0, [1, 0], 1, 1], ["AN", 3, 1, 6], ["FU", 1, [0, 1]], ["SP", 1, 0, 1024, [2], 1], ["AN", 1, 1, 2], ["FFSP", 1, 0, [1, 0], 1, 1], ["AN", 1, 1, 6], ["PR", 4, 0, "auto_unroll_max_step$0"]]]], "r": [[0.00218198], 0, 1.11697, 1695335119], "v": "v0.6"}
{"i": [["[\"817107844ff3a9e513e2b591bc12641a\", [32, 3072], [1, 3072], [1], [32, 1]]", "rocm -keys=rocm,gpu -max_num_threads=256 -max_shared_memory_per_block=65536 -max_threads_per_block=256 -mcpu=gfx908 -mtriple=amdgcn-amd-amdhsa-hcc -thread_warp_size=64", [-1, 16, 64, 65536, 2147483647, 1024, 16, 64], "", 0, []], [[], [["SP", 2, 0, 32, [1, 8, 1, 2], 1], ["SP", 2, 5, 1, [1, 1, 1, 1], 1], ["SP", 2, 10, 3072, [4, 4], 1], ["RE", 2, [0, 5, 1, 6, 2, 7, 10, 11, 3, 8, 12, 4, 9]], ["FSP", 4, 0, 0, 3], ["FSP", 4, 4, 1, 3], ["RE", 4, [0, 4, 1, 5, 2, 6, 3, 7]], ["CA", 2, 4, 5], ["CHR", 1, "shared", [2]], ["CA", 2, 3, 6], ["CHR", 0, "shared", [3]], ["CA", 1, 4, 6], ["FU", 6, [0, 1]], ["AN", 6, 0, 5], ["FU", 6, [1, 2]], ["AN", 6, 1, 4], ["FU", 6, [2, 3]], ["AN", 6, 2, 6], ["FU", 3, [0, 1]], ["SP", 3, 0, 192, [1], 1], ["AN", 3, 1, 2], ["FFSP", 3, 0, [1, 0], 1, 1], ["AN", 3, 1, 6], ["FU", 1, [0, 1]], ["SP", 1, 0, 384, [12], 1], ["AN", 1, 1, 2], ["FFSP", 1, 0, [1, 0], 1, 1], ["AN", 1, 1, 6], ["PR", 4, 0, "auto_unroll_max_step$64"]]]], "r": [[0.00046534], 0, 1.23794, 1695335120], "v": "v0.6"}
{"i": [["[\"817107844ff3a9e513e2b591bc12641a\", [32, 3072], [1, 3072], [1], [32, 1]]", "rocm -keys=rocm,gpu -max_num_threads=256 -max_shared_memory_per_block=65536 -max_threads_per_block=256 -mcpu=gfx908 -mtriple=amdgcn-amd-amdhsa-hcc -thread_warp_size=64", [-1, 16, 64, 65536, 2147483647, 1024, 16, 64], "", 0, []], [[], [["SP", 2, 0, 32, [1, 4, 1, 4], 1], ["SP", 2, 5, 1, [1, 1, 1, 1], 1], ["SP", 2, 10, 3072, [384, 2], 1], ["RE", 2, [0, 5, 1, 6, 2, 7, 10, 11, 3, 8, 12, 4, 9]], ["FSP", 4, 0, 0, 3], ["FSP", 4, 4, 1, 3], ["RE", 4, [0, 4, 1, 5, 2, 6, 3, 7]], ["CA", 2, 4, 5], ["CHR", 1, "shared", [2]], ["CA", 2, 3, 6], ["CHR", 0, "shared", [3]], ["CA", 1, 4, 6], ["FU", 6, [0, 1]], ["AN", 6, 0, 5], ["FU", 6, [1, 2]], ["AN", 6, 1, 4], ["FU", 6, [2, 3]], ["AN", 6, 2, 6], ["FU", 3, [0, 1]], ["SP", 3, 0, 768, [1], 1], ["AN", 3, 1, 2], ["FFSP", 3, 0, [1, 0], 1, 1], ["AN", 3, 1, 6], ["FU", 1, [0, 1]], ["SP", 1, 0, 3072, [1], 1], ["AN", 1, 1, 2], ["FFSP", 1, 0, [1, 0], 1, 1], ["AN", 1, 1, 6], ["PR", 4, 0, "auto_unroll_max_step$64"]]]], "r": [[0.00148603], 0, 1.50869, 1695335120], "v": "v0.6"}
{"i": [["[\"817107844ff3a9e513e2b591bc12641a\", [32, 3072], [1, 3072], [1], [32, 1]]", "rocm -keys=rocm,gpu -max_num_threads=256 -max_shared_memory_per_block=65536 -max_threads_per_block=256 -mcpu=gfx908 -mtriple=amdgcn-amd-amdhsa-hcc -thread_warp_size=64", [-1, 16, 64, 65536, 2147483647, 1024, 16, 64], "", 0, []], [[], [["SP", 2, 0, 32, [8, 1, 1, 2], 1], ["SP", 2, 5, 1, [1, 1, 1, 1], 1], ["SP", 2, 10, 3072, [2, 6], 1], ["RE", 2, [0, 5, 1, 6, 2, 7, 10, 11, 3, 8, 12, 4, 9]], ["FSP", 4, 0, 0, 3], ["FSP", 4, 4, 1, 3], ["RE", 4, [0, 4, 1, 5, 2, 6, 3, 7]], ["CA", 2, 4, 5], ["CHR", 1, "shared", [2]], ["CA", 2, 3, 6], ["CHR", 0, "shared", [3]], ["CA", 1, 4, 6], ["FU", 6, [0, 1]], ["AN", 6, 0, 5], ["FU", 6, [1, 2]], ["AN", 6, 1, 4], ["FU", 6, [2, 3]], ["AN", 6, 2, 6], ["FU", 3, [0, 1]], ["SP", 3, 0, 12, [4], 1], ["AN", 3, 1, 2], ["FFSP", 3, 0, [1, 0], 1, 1], ["AN", 3, 1, 6], ["FU", 1, [0, 1]], ["SP", 1, 0, 12, [2], 1], ["AN", 1, 1, 2], ["FFSP", 1, 0, [1, 0], 1, 1], ["AN", 1, 1, 6], ["PR", 4, 0, "auto_unroll_max_step$16"]]]], "r": [[0.00158062], 0, 1.49265, 1695335121], "v": "v0.6"}
{"i": [["[\"817107844ff3a9e513e2b591bc12641a\", [32, 3072], [1, 3072], [1], [32, 1]]", "rocm -keys=rocm,gpu -max_num_threads=256 -max_shared_memory_per_block=65536 -max_threads_per_block=256 -mcpu=gfx908 -mtriple=amdgcn-amd-amdhsa-hcc -thread_warp_size=64", [-1, 16, 64, 65536, 2147483647, 1024, 16, 64], "", 0, []], [[], [["SP", 2, 0, 32, [8, 1, 1, 2], 1], ["SP", 2, 5, 1, [1, 1, 1, 1], 1], ["SP", 2, 10, 3072, [6, 1], 1], ["RE", 2, [0, 5, 1, 6, 2, 7, 10, 11, 3, 8, 12, 4, 9]], ["FSP", 4, 0, 0, 3], ["FSP", 4, 4, 1, 3], ["RE", 4, [0, 4, 1, 5, 2, 6, 3, 7]], ["CA", 2, 4, 5], ["CHR", 1, "shared", [2]], ["CA", 2, 3, 6], ["CHR", 0, "shared", [3]], ["CA", 1, 4, 6], ["FU", 6, [0, 1]], ["AN", 6, 0, 5], ["FU", 6, [1, 2]], ["AN", 6, 1, 4], ["FU", 6, [2, 3]], ["AN", 6, 2, 6], ["FU", 3, [0, 1]], ["SP", 3, 0, 6, [1], 1], ["AN", 3, 1, 2], ["FFSP", 3, 0, [1, 0], 1, 1], ["AN", 3, 1, 6], ["FU", 1, [0, 1]], ["SP", 1, 0, 6, [1], 1], ["AN", 1, 1, 2], ["FFSP", 1, 0, [1, 0], 1, 1], ["AN", 1, 1, 6], ["PR", 4, 0, "auto_unroll_max_step$1024"]]]], "r": [[0.000867535], 0, 1.45185, 1695335122], "v": "v0.6"}
{"i": [["[\"817107844ff3a9e513e2b591bc12641a\", [32, 3072], [1, 3072], [1], [32, 1]]", "rocm -keys=rocm,gpu -max_num_threads=256 -max_shared_memory_per_block=65536 -max_threads_per_block=256 -mcpu=gfx908 -mtriple=amdgcn-amd-amdhsa-hcc -thread_warp_size=64", [-1, 16, 64, 65536, 2147483647, 1024, 16, 64], "", 0, []], [[], [["SP", 2, 0, 32, [2, 1, 1, 8], 1], ["SP", 2, 5, 1, [1, 1, 1, 1], 1], ["SP", 2, 10, 3072, [2, 48], 1], ["RE", 2, [0, 5, 1, 6, 2, 7, 10, 11, 3, 8, 12, 4, 9]], ["FSP", 4, 0, 0, 3], ["FSP", 4, 4, 1, 3], ["RE", 4, [0, 4, 1, 5, 2, 6, 3, 7]], ["CA", 2, 4, 5], ["CHR", 1, "shared", [2]], ["CA", 2, 3, 6], ["CHR", 0, "shared", [3]], ["CA", 1, 4, 6], ["FU", 6, [0, 1]], ["AN", 6, 0, 5], ["FU", 6, [1, 2]], ["AN", 6, 1, 4], ["FU", 6, [2, 3]], ["AN", 6, 2, 6], ["FU", 3, [0, 1]], ["SP", 3, 0, 96, [1], 1], ["AN", 3, 1, 2], ["FFSP", 3, 0, [1, 0], 1, 1], ["AN", 3, 1, 6], ["FU", 1, [0, 1]], ["SP", 1, 0, 1536, [1], 1], ["AN", 1, 1, 2], ["FFSP", 1, 0, [1, 0], 1, 1], ["AN", 1, 1, 6], ["PR", 4, 0, "auto_unroll_max_step$16"]]]], "r": [[0.00463315], 0, 1.05167, 1695335122], "v": "v0.6"}
{"i": [["[\"817107844ff3a9e513e2b591bc12641a\", [32, 3072], [1, 3072], [1], [32, 1]]", "rocm -keys=rocm,gpu -max_num_threads=256 -max_shared_memory_per_block=65536 -max_threads_per_block=256 -mcpu=gfx908 -mtriple=amdgcn-amd-amdhsa-hcc -thread_warp_size=64", [-1, 16, 64, 65536, 2147483647, 1024, 16, 64], "", 0, []], [[], [["SP", 2, 0, 32, [1, 8, 2, 1], 1], ["SP", 2, 5, 1, [1, 1, 1, 1], 1], ["SP", 2, 10, 3072, [1, 4], 1], ["RE", 2, [0, 5, 1, 6, 2, 7, 10, 11, 3, 8, 12, 4, 9]], ["FSP", 4, 0, 0, 3], ["FSP", 4, 4, 1, 3], ["RE", 4, [0, 4, 1, 5, 2, 6, 3, 7]], ["CA", 2, 4, 5], ["CHR", 1, "shared", [2]], ["CA", 2, 3, 6], ["CHR", 0, "shared", [3]], ["CA", 1, 4, 6], ["FU", 6, [0, 1]], ["AN", 6, 0, 5], ["FU", 6, [1, 2]], ["AN", 6, 1, 4], ["FU", 6, [2, 3]], ["AN", 6, 2, 6], ["FU", 3, [0, 1]], ["SP", 3, 0, 4, [1], 1], ["AN", 3, 1, 2], ["FFSP", 3, 0, [1, 0], 1, 1], ["AN", 3, 1, 6], ["FU", 1, [0, 1]], ["SP", 1, 0, 16, [2], 1], ["AN", 1, 1, 2], ["FFSP", 1, 0, [1, 0], 1, 1], ["AN", 1, 1, 6], ["PR", 4, 0, "auto_unroll_max_step$16"]]]], "r": [[0.000371483], 0, 0.91665, 1695335122], "v": "v0.6"}
{"i": [["[\"817107844ff3a9e513e2b591bc12641a\", [32, 3072], [1, 3072], [1], [32, 1]]", "rocm -keys=rocm,gpu -max_num_threads=256 -max_shared_memory_per_block=65536 -max_threads_per_block=256 -mcpu=gfx908 -mtriple=amdgcn-amd-amdhsa-hcc -thread_warp_size=64", [-1, 16, 64, 65536, 2147483647, 1024, 16, 64], "", 0, []], [[], [["SP", 2, 0, 32, [1, 2, 16, 1], 1], ["SP", 2, 5, 1, [1, 1, 1, 1], 1], ["SP", 2, 10, 3072, [48, 2], 1], ["RE", 2, [0, 5, 1, 6, 2, 7, 10, 11, 3, 8, 12, 4, 9]], ["FSP", 4, 0, 0, 3], ["FSP", 4, 4, 1, 3], ["RE", 4, [0, 4, 1, 5, 2, 6, 3, 7]], ["CA", 2, 4, 5], ["CHR", 1, "shared", [2]], ["CA", 2, 3, 6], ["CHR", 0, "shared", [3]], ["CA", 1, 4, 6], ["FU", 6, [0, 1]], ["AN", 6, 0, 5], ["FU", 6, [1, 2]], ["AN", 6, 1, 4], ["FU", 6, [2, 3]], ["AN", 6, 2, 6], ["FU", 3, [0, 1]], ["SP", 3, 0, 384, [1], 1], ["AN", 3, 1, 2], ["FFSP", 3, 0, [1, 0], 1, 1], ["AN", 3, 1, 6], ["FU", 1, [0, 1]], ["SP", 1, 0, 6144, [1], 1], ["AN", 1, 1, 2], ["FFSP", 1, 0, [1, 0], 1, 1], ["AN", 1, 1, 6], ["PR", 4, 0, "auto_unroll_max_step$512"]]]], "r": [[0.00706985], 0, 1.49777, 1695335124], "v": "v0.6"}
{"i": [["[\"817107844ff3a9e513e2b591bc12641a\", [32, 3072], [1, 3072], [1], [32, 1]]", "rocm -keys=rocm,gpu -max_num_threads=256 -max_shared_memory_per_block=65536 -max_threads_per_block=256 -mcpu=gfx908 -mtriple=amdgcn-amd-amdhsa-hcc -thread_warp_size=64", [-1, 16, 64, 65536, 2147483647, 1024, 16, 64], "", 0, []], [[], [["SP", 2, 0, 32, [1, 2, 2, 1], 1], ["SP", 2, 5, 1, [1, 1, 1, 1], 1], ["SP", 2, 10, 3072, [2, 4], 1], ["RE", 2, [0, 5, 1, 6, 2, 7, 10, 11, 3, 8, 12, 4, 9]], ["FSP", 4, 0, 0, 3], ["FSP", 4, 4, 1, 3], ["RE", 4, [0, 4, 1, 5, 2, 6, 3, 7]], ["CA", 2, 4, 5], ["CHR", 1, "shared", [2]], ["CA", 2, 3, 6], ["CHR", 0, "shared", [3]], ["CA", 1, 4, 6], ["FU", 6, [0, 1]], ["AN", 6, 0, 5], ["FU", 6, [1, 2]], ["AN", 6, 1, 4], ["FU", 6, [2, 3]], ["AN", 6, 2, 6], ["FU", 3, [0, 1]], ["SP", 3, 0, 8, [1], 1], ["AN", 3, 1, 2], ["FFSP", 3, 0, [1, 0], 1, 1], ["AN", 3, 1, 6], ["FU", 1, [0, 1]], ["SP", 1, 0, 16, [1], 1], ["AN", 1, 1, 2], ["FFSP", 1, 0, [1, 0], 1, 1], ["AN", 1, 1, 6], ["PR", 4, 0, "auto_unroll_max_step$1024"]]]], "r": [[0.000566091], 0, 0.955602, 1695335124], "v": "v0.6"}
{"i": [["[\"817107844ff3a9e513e2b591bc12641a\", [32, 3072], [1, 3072], [1], [32, 1]]", "rocm -keys=rocm,gpu -max_num_threads=256 -max_shared_memory_per_block=65536 -max_threads_per_block=256 -mcpu=gfx908 -mtriple=amdgcn-amd-amdhsa-hcc -thread_warp_size=64", [-1, 16, 64, 65536, 2147483647, 1024, 16, 64], "", 0, []], [[], [["SP", 2, 0, 32, [4, 2, 2, 1], 1], ["SP", 2, 5, 1, [1, 1, 1, 1], 1], ["SP", 2, 10, 3072, [2, 24], 1], ["RE", 2, [0, 5, 1, 6, 2, 7, 10, 11, 3, 8, 12, 4, 9]], ["FSP", 4, 0, 0, 3], ["FSP", 4, 4, 1, 3], ["RE", 4, [0, 4, 1, 5, 2, 6, 3, 7]], ["CA", 2, 4, 5], ["CHR", 1, "shared", [2]], ["CA", 2, 3, 6], ["CHR", 0, "shared", [3]], ["CA", 1, 4, 6], ["FU", 6, [0, 1]], ["AN", 6, 0, 5], ["FU", 6, [1, 2]], ["AN", 6, 1, 4], ["FU", 6, [2, 3]], ["AN", 6, 2, 6], ["FU", 3, [0, 1]], ["SP", 3, 0, 12, [1], 1], ["AN", 3, 1, 2], ["FFSP", 3, 0, [1, 0], 1, 1], ["AN", 3, 1, 6], ["FU", 1, [0, 1]], ["SP", 1, 0, 12, [1], 1], ["AN", 1, 1, 2], ["FFSP", 1, 0, [1, 0], 1, 1], ["AN", 1, 1, 6], ["PR", 4, 0, "auto_unroll_max_step$1024"]]]], "r": [[0.000440551], 0, 4.66452, 1695335124], "v": "v0.6"}
{"i": [["[\"817107844ff3a9e513e2b591bc12641a\", [32, 3072], [1, 3072], [1], [32, 1]]", "rocm -keys=rocm,gpu -max_num_threads=256 -max_shared_memory_per_block=65536 -max_threads_per_block=256 -mcpu=gfx908 -mtriple=amdgcn-amd-amdhsa-hcc -thread_warp_size=64", [-1, 16, 64, 65536, 2147483647, 1024, 16, 64], "", 0, []], [[], [["SP", 2, 0, 32, [4, 4, 1, 2], 1], ["SP", 2, 5, 1, [1, 1, 1, 1], 1], ["SP", 2, 10, 3072, [24, 1], 1], ["RE", 2, [0, 5, 1, 6, 2, 7, 10, 11, 3, 8, 12, 4, 9]], ["FSP", 4, 0, 0, 3], ["FSP", 4, 4, 1, 3], ["RE", 4, [0, 4, 1, 5, 2, 6, 3, 7]], ["CA", 2, 4, 5], ["CHR", 1, "shared", [2]], ["CA", 2, 3, 6], ["CHR", 0, "shared", [3]], ["CA", 1, 4, 6], ["FU", 6, [0, 1]], ["AN", 6, 0, 5], ["FU", 6, [1, 2]], ["AN", 6, 1, 4], ["FU", 6, [2, 3]], ["AN", 6, 2, 6], ["FU", 3, [0, 1]], ["SP", 3, 0, 24, [1], 1], ["AN", 3, 1, 2], ["FFSP", 3, 0, [1, 0], 1, 1], ["AN", 3, 1, 6], ["FU", 1, [0, 1]], ["SP", 1, 0, 48, [1], 1], ["AN", 1, 1, 2], ["FFSP", 1, 0, [1, 0], 1, 1], ["AN", 1, 1, 6], ["PR", 4, 0, "auto_unroll_max_step$1024"]]]], "r": [[0.00206313], 0, 2.82412, 1695335125], "v": "v0.6"}
{"i": [["[\"817107844ff3a9e513e2b591bc12641a\", [32, 3072], [1, 3072], [1], [32, 1]]", "rocm -keys=rocm,gpu -max_num_threads=256 -max_shared_memory_per_block=65536 -max_threads_per_block=256 -mcpu=gfx908 -mtriple=amdgcn-amd-amdhsa-hcc -thread_warp_size=64", [-1, 16, 64, 65536, 2147483647, 1024, 16, 64], "", 0, []], [[], [["SP", 2, 0, 32, [2, 2, 1, 1], 1], ["SP", 2, 5, 1, [1, 1, 1, 1], 1], ["SP", 2, 10, 3072, [1, 8], 1], ["RE", 2, [0, 5, 1, 6, 2, 7, 10, 11, 3, 8, 12, 4, 9]], ["FSP", 4, 0, 0, 3], ["FSP", 4, 4, 1, 3], ["RE", 4, [0, 4, 1, 5, 2, 6, 3, 7]], ["CA", 2, 4, 5], ["CHR", 1, "shared", [2]], ["CA", 2, 3, 6], ["CHR", 0, "shared", [3]], ["CA", 1, 4, 6], ["FU", 6, [0, 1]], ["AN", 6, 0, 5], ["FU", 6, [1, 2]], ["AN", 6, 1, 4], ["FU", 6, [2, 3]], ["AN", 6, 2, 6], ["FU", 3, [0, 1]], ["SP", 3, 0, 8, [1], 1], ["AN", 3, 1, 2], ["FFSP", 3, 0, [1, 0], 1, 1], ["AN", 3, 1, 6], ["FU", 1, [0, 1]], ["SP", 1, 0, 8, [2], 1], ["AN", 1, 1, 2], ["FFSP", 1, 0, [1, 0], 1, 1], ["AN", 1, 1, 6], ["PR", 4, 0, "auto_unroll_max_step$64"]]]], "r": [[0.000497079], 0, 1.16636, 1695335126], "v": "v0.6"}
{"i": [["[\"817107844ff3a9e513e2b591bc12641a\", [32, 3072], [1, 3072], [1], [32, 1]]", "rocm -keys=rocm,gpu -max_num_threads=256 -max_shared_memory_per_block=65536 -max_threads_per_block=256 -mcpu=gfx908 -mtriple=amdgcn-amd-amdhsa-hcc -thread_warp_size=64", [-1, 16, 64, 65536, 2147483647, 1024, 16, 64], "", 0, []], [[], [["SP", 2, 0, 32, [4, 1, 2, 4], 1], ["SP", 2, 5, 1, [1, 1, 1, 1], 1], ["SP", 2, 10, 3072, [64, 2], 1], ["RE", 2, [0, 5, 1, 6, 2, 7, 10, 11, 3, 8, 12, 4, 9]], ["FSP", 4, 0, 0, 3], ["FSP", 4, 4, 1, 3], ["RE", 4, [0, 4, 1, 5, 2, 6, 3, 7]], ["CA", 2, 4, 5], ["CHR", 1, "shared", [2]], ["CA", 2, 3, 6], ["CHR", 0, "shared", [3]], ["CA", 1, 4, 6], ["FU", 6, [0, 1]], ["AN", 6, 0, 5], ["FU", 6, [1, 2]], ["AN", 6, 1, 4], ["FU", 6, [2, 3]], ["AN", 6, 2, 6], ["FU", 3, [0, 1]], ["SP", 3, 0, 128, [1], 1], ["AN", 3, 1, 2], ["FFSP", 3, 0, [1, 0], 1, 1], ["AN", 3, 1, 6], ["FU", 1, [0, 1]], ["SP", 1, 0, 1024, [1], 1], ["AN", 1, 1, 2], ["FFSP", 1, 0, [1, 0], 1, 1], ["AN", 1, 1, 6], ["PR", 4, 0, "auto_unroll_max_step$64"]]]], "r": [[0.00401887], 0, 1.40301, 1695335126], "v": "v0.6"}
{"i": [["[\"817107844ff3a9e513e2b591bc12641a\", [32, 3072], [1, 3072], [1], [32, 1]]", "rocm -keys=rocm,gpu -max_num_threads=256 -max_shared_memory_per_block=65536 -max_threads_per_block=256 -mcpu=gfx908 -mtriple=amdgcn-amd-amdhsa-hcc -thread_warp_size=64", [-1, 16, 64, 65536, 2147483647, 1024, 16, 64], "", 0, []], [[], [["SP", 2, 0, 32, [8, 2, 2, 1], 1], ["SP", 2, 5, 1, [1, 1, 1, 1], 1], ["SP", 2, 10, 3072, [1, 12], 1], ["RE", 2, [0, 5, 1, 6, 2, 7, 10, 11, 3, 8, 12, 4, 9]], ["FSP", 4, 0, 0, 3], ["FSP", 4, 4, 1, 3], ["RE", 4, [0, 4, 1, 5, 2, 6, 3, 7]], ["CA", 2, 4, 5], ["CHR", 1, "shared", [2]], ["CA", 2, 3, 6], ["CHR", 0, "shared", [3]], ["CA", 1, 4, 6], ["FU", 6, [0, 1]], ["AN", 6, 0, 5], ["FU", 6, [1, 2]], ["AN", 6, 1, 4], ["FU", 6, [2, 3]], ["AN", 6, 2, 6], ["FU", 3, [0, 1]], ["SP", 3, 0, 48, [1], 1], ["AN", 3, 1, 2], ["FFSP", 3, 0, [1, 0], 1, 1], ["AN", 3, 1, 6], ["FU", 1, [0, 1]], ["SP", 1, 0, 96, [1], 1], ["AN", 1, 1, 2], ["FFSP", 1, 0, [1, 0], 1, 1], ["AN", 1, 1, 6], ["PR", 4, 0, "auto_unroll_max_step$0"]]]], "r": [[0.00393265], 0, 1.38303, 1695335127], "v": "v0.6"}
{"i": [["[\"817107844ff3a9e513e2b591bc12641a\", [32, 3072], [1, 3072], [1], [32, 1]]", "rocm -keys=rocm,gpu -max_num_threads=256 -max_shared_memory_per_block=65536 -max_threads_per_block=256 -mcpu=gfx908 -mtriple=amdgcn-amd-amdhsa-hcc -thread_warp_size=64", [-1, 16, 64, 65536, 2147483647, 1024, 16, 64], "", 0, []], [[], [["SP", 2, 0, 32, [4, 4, 2, 1], 1], ["SP", 2, 5, 1, [1, 1, 1, 1], 1], ["SP", 2, 10, 3072, [6, 1], 1], ["RE", 2, [0, 5, 1, 6, 2, 7, 10, 11, 3, 8, 12, 4, 9]], ["FSP", 4, 0, 0, 3], ["FSP", 4, 4, 1, 3], ["RE", 4, [0, 4, 1, 5, 2, 6, 3, 7]], ["CA", 2, 4, 5], ["CHR", 1, "shared", [2]], ["CA", 2, 3, 6], ["CHR", 0, "shared", [3]], ["CA", 1, 4, 6], ["FU", 6, [0, 1]], ["AN", 6, 0, 5], ["FU", 6, [1, 2]], ["AN", 6, 1, 4], ["FU", 6, [2, 3]], ["AN", 6, 2, 6], ["FU", 3, [0, 1]], ["SP", 3, 0, 6, [1], 1], ["AN", 3, 1, 2], ["FFSP", 3, 0, [1, 0], 1, 1], ["AN", 3, 1, 6], ["FU", 1, [0, 1]], ["SP", 1, 0, 12, [1], 1], ["AN", 1, 1, 2], ["FFSP", 1, 0, [1, 0], 1, 1], ["AN", 1, 1, 6], ["PR", 4, 0, "auto_unroll_max_step$0"]]]], "r": [[0.00371521], 0, 1.08772, 1695335127], "v": "v0.6"}
{"i": [["[\"817107844ff3a9e513e2b591bc12641a\", [32, 3072], [1, 3072], [1], [32, 1]]", "rocm -keys=rocm,gpu -max_num_threads=256 -max_shared_memory_per_block=65536 -max_threads_per_block=256 -mcpu=gfx908 -mtriple=amdgcn-amd-amdhsa-hcc -thread_warp_size=64", [-1, 16, 64, 65536, 2147483647, 1024, 16, 64], "", 0, []], [[], [["SP", 2, 0, 32, [16, 1, 1, 2], 1], ["SP", 2, 5, 1, [1, 1, 1, 1], 1], ["SP", 2, 10, 3072, [1, 48], 1], ["RE", 2, [0, 5, 1, 6, 2, 7, 10, 11, 3, 8, 12, 4, 9]], ["FSP", 4, 0, 0, 3], ["FSP", 4, 4, 1, 3], ["RE", 4, [0, 4, 1, 5, 2, 6, 3, 7]], ["CA", 2, 4, 5], ["CHR", 1, "shared", [2]], ["CA", 2, 3, 6], ["CHR", 0, "shared", [3]], ["CA", 1, 4, 6], ["FU", 6, [0, 1]], ["AN", 6, 0, 5], ["FU", 6, [1, 2]], ["AN", 6, 1, 4], ["FU", 6, [2, 3]], ["AN", 6, 2, 6], ["FU", 3, [0, 1]], ["SP", 3, 0, 8, [1], 1], ["AN", 3, 1, 2], ["FFSP", 3, 0, [1, 0], 1, 1], ["AN", 3, 1, 6], ["FU", 1, [0, 1]], ["SP", 1, 0, 16, [1], 1], ["AN", 1, 1, 2], ["FFSP", 1, 0, [1, 0], 1, 1], ["AN", 1, 1, 6], ["PR", 4, 0, "auto_unroll_max_step$1024"]]]], "r": [[0.0096769], 0, 1.26651, 1695335128], "v": "v0.6"}
{"i": [["[\"817107844ff3a9e513e2b591bc12641a\", [32, 3072], [1, 3072], [1], [32, 1]]", "rocm -keys=rocm,gpu -max_num_threads=256 -max_shared_memory_per_block=65536 -max_threads_per_block=256 -mcpu=gfx908 -mtriple=amdgcn-amd-amdhsa-hcc -thread_warp_size=64", [-1, 16, 64, 65536, 2147483647, 1024, 16, 64], "", 0, []], [[], [["SP", 2, 0, 32, [4, 4, 1, 1], 1], ["SP", 2, 5, 1, [1, 1, 1, 1], 1], ["SP", 2, 10, 3072, [32, 3], 1], ["RE", 2, [0, 5, 1, 6, 2, 7, 10, 11, 3, 8, 12, 4, 9]], ["FSP", 4, 0, 0, 3], ["FSP", 4, 4, 1, 3], ["RE", 4, [0, 4, 1, 5, 2, 6, 3, 7]], ["CA", 2, 4, 5], ["CHR", 1, "shared", [2]], ["CA", 2, 3, 6], ["CHR", 0, "shared", [3]], ["CA", 1, 4, 6], ["FU", 6, [0, 1]], ["AN", 6, 0, 5], ["FU", 6, [1, 2]], ["AN", 6, 1, 4], ["FU", 6, [2, 3]], ["AN", 6, 2, 6], ["FU", 3, [0, 1]], ["SP", 3, 0, 96, [1], 1], ["AN", 3, 1, 2], ["FFSP", 3, 0, [1, 0], 1, 1], ["AN", 3, 1, 6], ["FU", 1, [0, 1]], ["SP", 1, 0, 96, [1], 1], ["AN", 1, 1, 2], ["FFSP", 1, 0, [1, 0], 1, 1], ["AN", 1, 1, 6], ["PR", 4, 0, "auto_unroll_max_step$1024"]]]], "r": [[0.000214309], 0, 4.92942, 1695335128], "v": "v0.6"}
{"i": [["[\"817107844ff3a9e513e2b591bc12641a\", [32, 3072], [1, 3072], [1], [32, 1]]", "rocm -keys=rocm,gpu -max_num_threads=256 -max_shared_memory_per_block=65536 -max_threads_per_block=256 -mcpu=gfx908 -mtriple=amdgcn-amd-amdhsa-hcc -thread_warp_size=64", [-1, 16, 64, 65536, 2147483647, 1024, 16, 64], "", 0, []], [[], [["SP", 2, 0, 32, [4, 1, 1, 2], 1], ["SP", 2, 5, 1, [1, 1, 1, 1], 1], ["SP", 2, 10, 3072, [64, 6], 1], ["RE", 2, [0, 5, 1, 6, 2, 7, 10, 11, 3, 8, 12, 4, 9]], ["FSP", 4, 0, 0, 3], ["FSP", 4, 4, 1, 3], ["RE", 4, [0, 4, 1, 5, 2, 6, 3, 7]], ["CA", 2, 4, 5], ["CHR", 1, "shared", [2]], ["CA", 2, 3, 6], ["CHR", 0, "shared", [3]], ["CA", 1, 4, 6], ["FU", 6, [0, 1]], ["AN", 6, 0, 5], ["FU", 6, [1, 2]], ["AN", 6, 1, 4], ["FU", 6, [2, 3]], ["AN", 6, 2, 6], ["FU", 3, [0, 1]], ["SP", 3, 0, 384, [1], 1], ["AN", 3, 1, 2], ["FFSP", 3, 0, [1, 0], 1, 1], ["AN", 3, 1, 6], ["FU", 1, [0, 1]], ["SP", 1, 0, 768, [1], 1], ["AN", 1, 1, 2], ["FFSP", 1, 0, [1, 0], 1, 1], ["AN", 1, 1, 6], ["PR", 4, 0, "auto_unroll_max_step$1024"]]]], "r": [[0.0020838], 0, 2.04105, 1695335129], "v": "v0.6"}
{"i": [["[\"817107844ff3a9e513e2b591bc12641a\", [32, 3072], [1, 3072], [1], [32, 1]]", "rocm -keys=rocm,gpu -max_num_threads=256 -max_shared_memory_per_block=65536 -max_threads_per_block=256 -mcpu=gfx908 -mtriple=amdgcn-amd-amdhsa-hcc -thread_warp_size=64", [-1, 16, 64, 65536, 2147483647, 1024, 16, 64], "", 0, []], [[], [["SP", 2, 0, 32, [2, 1, 4, 4], 1], ["SP", 2, 5, 1, [1, 1, 1, 1], 1], ["SP", 2, 10, 3072, [16, 4], 1], ["RE", 2, [0, 5, 1, 6, 2, 7, 10, 11, 3, 8, 12, 4, 9]], ["FSP", 4, 0, 0, 3], ["FSP", 4, 4, 1, 3], ["RE", 4, [0, 4, 1, 5, 2, 6, 3, 7]], ["CA", 2, 4, 5], ["CHR", 1, "shared", [2]], ["CA", 2, 3, 6], ["CHR", 0, "shared", [3]], ["CA", 1, 4, 6], ["FU", 6, [0, 1]], ["AN", 6, 0, 5], ["FU", 6, [1, 2]], ["AN", 6, 1, 4], ["FU", 6, [2, 3]], ["AN", 6, 2, 6], ["FU", 3, [0, 1]], ["SP", 3, 0, 64, [1], 1], ["AN", 3, 1, 2], ["FFSP", 3, 0, [1, 0], 1, 1], ["AN", 3, 1, 6], ["FU", 1, [0, 1]], ["SP", 1, 0, 1024, [1], 1], ["AN", 1, 1, 2], ["FFSP", 1, 0, [1, 0], 1, 1], ["AN", 1, 1, 6], ["PR", 4, 0, "auto_unroll_max_step$512"]]]], "r": [[0.00519038], 0, 1.33444, 1695335129], "v": "v0.6"}
{"i": [["[\"817107844ff3a9e513e2b591bc12641a\", [32, 3072], [1, 3072], [1], [32, 1]]", "rocm -keys=rocm,gpu -max_num_threads=256 -max_shared_memory_per_block=65536 -max_threads_per_block=256 -mcpu=gfx908 -mtriple=amdgcn-amd-amdhsa-hcc -thread_warp_size=64", [-1, 16, 64, 65536, 2147483647, 1024, 16, 64], "", 0, []], [[], [["SP", 2, 0, 32, [1, 1, 1, 1], 1], ["SP", 2, 5, 1, [1, 1, 1, 1], 1], ["SP", 2, 10, 3072, [4, 8], 1], ["RE", 2, [0, 5, 1, 6, 2, 7, 10, 11, 3, 8, 12, 4, 9]], ["FSP", 4, 0, 0, 3], ["FSP", 4, 4, 1, 3], ["RE", 4, [0, 4, 1, 5, 2, 6, 3, 7]], ["CA", 2, 4, 5], ["CHR", 1, "shared", [2]], ["CA", 2, 3, 6], ["CHR", 0, "shared", [3]], ["CA", 1, 4, 6], ["FU", 6, [0, 1]], ["AN", 6, 0, 5], ["FU", 6, [1, 2]], ["AN", 6, 1, 4], ["FU", 6, [2, 3]], ["AN", 6, 2, 6], ["FU", 3, [0, 1]], ["SP", 3, 0, 32, [2], 1], ["AN", 3, 1, 2], ["FFSP", 3, 0, [1, 0], 1, 1], ["AN", 3, 1, 6], ["FU", 1, [0, 1]], ["SP", 1, 0, 32, [1], 1], ["AN", 1, 1, 2], ["FFSP", 1, 0, [1, 0], 1, 1], ["AN", 1, 1, 6], ["PR", 4, 0, "auto_unroll_max_step$16"]]]], "r": [[9.82113e-05], 0, 1.315, 1695335130], "v": "v0.6"}
{"i": [["[\"817107844ff3a9e513e2b591bc12641a\", [32, 3072], [1, 3072], [1], [32, 1]]", "rocm -keys=rocm,gpu -max_num_threads=256 -max_shared_memory_per_block=65536 -max_threads_per_block=256 -mcpu=gfx908 -mtriple=amdgcn-amd-amdhsa-hcc -thread_warp_size=64", [-1, 16, 64, 65536, 2147483647, 1024, 16, 64], "", 0, []], [[], [["SP", 2, 0, 32, [4, 2, 1, 4], 1], ["SP", 2, 5, 1, [1, 1, 1, 1], 1], ["SP", 2, 10, 3072, [16, 6], 1], ["RE", 2, [0, 5, 1, 6, 2, 7, 10, 11, 3, 8, 12, 4, 9]], ["FSP", 4, 0, 0, 3], ["FSP", 4, 4, 1, 3], ["RE", 4, [0, 4, 1, 5, 2, 6, 3, 7]], ["CA", 2, 4, 5], ["CHR", 1, "shared", [2]], ["CA", 2, 3, 6], ["CHR", 0, "shared", [3]], ["CA", 1, 4, 6], ["FU", 6, [0, 1]], ["AN", 6, 0, 5], ["FU", 6, [1, 2]], ["AN", 6, 1, 4], ["FU", 6, [2, 3]], ["AN", 6, 2, 6], ["FU", 3, [0, 1]], ["SP", 3, 0, 192, [1], 1], ["AN", 3, 1, 2], ["FFSP", 3, 0, [1, 0], 1, 1], ["AN", 3, 1, 6], ["FU", 1, [0, 1]], ["SP", 1, 0, 768, [1], 1], ["AN", 1, 1, 2], ["FFSP", 1, 0, [1, 0], 1, 1], ["AN", 1, 1, 6], ["PR", 4, 0, "auto_unroll_max_step$0"]]]], "r": [[0.00756633], 0, 1.41132, 1695335131], "v": "v0.6"}
{"i": [["[\"817107844ff3a9e513e2b591bc12641a\", [32, 3072], [1, 3072], [1], [32, 1]]", "rocm -keys=rocm,gpu -max_num_threads=256 -max_shared_memory_per_block=65536 -max_threads_per_block=256 -mcpu=gfx908 -mtriple=amdgcn-amd-amdhsa-hcc -thread_warp_size=64", [-1, 16, 64, 65536, 2147483647, 1024, 16, 64], "", 0, []], [[], [["SP", 2, 0, 32, [2, 2, 1, 8], 1], ["SP", 2, 5, 1, [1, 1, 1, 1], 1], ["SP", 2, 10, 3072, [2, 1], 1], ["RE", 2, [0, 5, 1, 6, 2, 7, 10, 11, 3, 8, 12, 4, 9]], ["FSP", 4, 0, 0, 3], ["FSP", 4, 4, 1, 3], ["RE", 4, [0, 4, 1, 5, 2, 6, 3, 7]], ["CA", 2, 4, 5], ["CHR", 1, "shared", [2]], ["CA", 2, 3, 6], ["CHR", 0, "shared", [3]], ["CA", 1, 4, 6], ["FU", 6, [0, 1]], ["AN", 6, 0, 5], ["FU", 6, [1, 2]], ["AN", 6, 1, 4], ["FU", 6, [2, 3]], ["AN", 6, 2, 6], ["FU", 3, [0, 1]], ["SP", 3, 0, 2, [1], 1], ["AN", 3, 1, 2], ["FFSP", 3, 0, [1, 0], 1, 1], ["AN", 3, 1, 6], ["FU", 1, [0, 1]], ["SP", 1, 0, 16, [1], 1], ["AN", 1, 1, 2], ["FFSP", 1, 0, [1, 0], 1, 1], ["AN", 1, 1, 6], ["PR", 4, 0, "auto_unroll_max_step$1024"]]]], "r": [[0.00425174], 0, 1.15677, 1695335131], "v": "v0.6"}
{"i": [["[\"817107844ff3a9e513e2b591bc12641a\", [32, 3072], [1, 3072], [1], [32, 1]]", "rocm -keys=rocm,gpu -max_num_threads=256 -max_shared_memory_per_block=65536 -max_threads_per_block=256 -mcpu=gfx908 -mtriple=amdgcn-amd-amdhsa-hcc -thread_warp_size=64", [-1, 16, 64, 65536, 2147483647, 1024, 16, 64], "", 0, []], [[], [["SP", 2, 0, 32, [4, 4, 1, 2], 1], ["SP", 2, 5, 1, [1, 1, 1, 1], 1], ["SP", 2, 10, 3072, [2, 64], 1], ["RE", 2, [0, 5, 1, 6, 2, 7, 10, 11, 3, 8, 12, 4, 9]], ["FSP", 4, 0, 0, 3], ["FSP", 4, 4, 1, 3], ["RE", 4, [0, 4, 1, 5, 2, 6, 3, 7]], ["CA", 2, 4, 5], ["CHR", 1, "shared", [2]], ["CA", 2, 3, 6], ["CHR", 0, "shared", [3]], ["CA", 1, 4, 6], ["FU", 6, [0, 1]], ["AN", 6, 0, 5], ["FU", 6, [1, 2]], ["AN", 6, 1, 4], ["FU", 6, [2, 3]], ["AN", 6, 2, 6], ["FU", 3, [0, 1]], ["SP", 3, 0, 256, [1], 1], ["AN", 3, 1, 2], ["FFSP", 3, 0, [1, 0], 1, 1], ["AN", 3, 1, 6], ["FU", 1, [0, 1]], ["SP", 1, 0, 512, [1], 1], ["AN", 1, 1, 2], ["FFSP", 1, 0, [1, 0], 1, 1], ["AN", 1, 1, 6], ["PR", 4, 0, "auto_unroll_max_step$16"]]]], "r": [[0.00286023], 0, 1.22527, 1695335131], "v": "v0.6"}
{"i": [["[\"817107844ff3a9e513e2b591bc12641a\", [32, 3072], [1, 3072], [1], [32, 1]]", "rocm -keys=rocm,gpu -max_num_threads=256 -max_shared_memory_per_block=65536 -max_threads_per_block=256 -mcpu=gfx908 -mtriple=amdgcn-amd-amdhsa-hcc -thread_warp_size=64", [-1, 16, 64, 65536, 2147483647, 1024, 16, 64], "", 0, []], [[], [["SP", 2, 0, 32, [4, 2, 2, 1], 1], ["SP", 2, 5, 1, [1, 1, 1, 1], 1], ["SP", 2, 10, 3072, [1, 12], 1], ["RE", 2, [0, 5, 1, 6, 2, 7, 10, 11, 3, 8, 12, 4, 9]], ["FSP", 4, 0, 0, 3], ["FSP", 4, 4, 1, 3], ["RE", 4, [0, 4, 1, 5, 2, 6, 3, 7]], ["CA", 2, 4, 5], ["CHR", 1, "shared", [2]], ["CA", 2, 3, 6], ["CHR", 0, "shared", [3]], ["CA", 1, 4, 6], ["FU", 6, [0, 1]], ["AN", 6, 0, 5], ["FU", 6, [1, 2]], ["AN", 6, 1, 4], ["FU", 6, [2, 3]], ["AN", 6, 2, 6], ["FU", 3, [0, 1]], ["SP", 3, 0, 192, [4], 1], ["AN", 3, 1, 2], ["FFSP", 3, 0, [1, 0], 1, 1], ["AN", 3, 1, 6], ["FU", 1, [0, 1]], ["SP", 1, 0, 384, [1], 1], ["AN", 1, 1, 2], ["FFSP", 1, 0, [1, 0], 1, 1], ["AN", 1, 1, 6], ["PR", 4, 0, "auto_unroll_max_step$16"]]]], "r": [[0.00247366], 0, 1.41468, 1695335133], "v": "v0.6"}
{"i": [["[\"817107844ff3a9e513e2b591bc12641a\", [32, 3072], [1, 3072], [1], [32, 1]]", "rocm -keys=rocm,gpu -max_num_threads=256 -max_shared_memory_per_block=65536 -max_threads_per_block=256 -mcpu=gfx908 -mtriple=amdgcn-amd-amdhsa-hcc -thread_warp_size=64", [-1, 16, 64, 65536, 2147483647, 1024, 16, 64], "", 0, []], [[], [["SP", 2, 0, 32, [2, 4, 2, 1], 1], ["SP", 2, 5, 1, [1, 1, 1, 1], 1], ["SP", 2, 10, 3072, [24, 2], 1], ["RE", 2, [0, 5, 1, 6, 2, 7, 10, 11, 3, 8, 12, 4, 9]], ["FSP", 4, 0, 0, 3], ["FSP", 4, 4, 1, 3], ["RE", 4, [0, 4, 1, 5, 2, 6, 3, 7]], ["CA", 2, 4, 5], ["CHR", 1, "shared", [2]], ["CA", 2, 3, 6], ["CHR", 0, "shared", [3]], ["CA", 1, 4, 6], ["FU", 6, [0, 1]], ["AN", 6, 0, 5], ["FU", 6, [1, 2]], ["AN", 6, 1, 4], ["FU", 6, [2, 3]], ["AN", 6, 2, 6], ["FU", 3, [0, 1]], ["SP", 3, 0, 48, [1], 1], ["AN", 3, 1, 2], ["FFSP", 3, 0, [1, 0], 1, 1], ["AN", 3, 1, 6], ["FU", 1, [0, 1]], ["SP", 1, 0, 96, [1], 1], ["AN", 1, 1, 2], ["FFSP", 1, 0, [1, 0], 1, 1], ["AN", 1, 1, 6], ["PR", 4, 0, "auto_unroll_max_step$512"]]]], "r": [[0.000306245], 0, 2.59046, 1695335133], "v": "v0.6"}
{"i": [["[\"817107844ff3a9e513e2b591bc12641a\", [32, 3072], [1, 3072], [1], [32, 1]]", "rocm -keys=rocm,gpu -max_num_threads=256 -max_shared_memory_per_block=65536 -max_threads_per_block=256 -mcpu=gfx908 -mtriple=amdgcn-amd-amdhsa-hcc -thread_warp_size=64", [-1, 16, 64, 65536, 2147483647, 1024, 16, 64], "", 0, []], [[], [["SP", 2, 0, 32, [1, 1, 2, 1], 1], ["SP", 2, 5, 1, [1, 1, 1, 1], 1], ["SP", 2, 10, 3072, [12, 1], 1], ["RE", 2, [0, 5, 1, 6, 2, 7, 10, 11, 3, 8, 12, 4, 9]], ["FSP", 4, 0, 0, 3], ["FSP", 4, 4, 1, 3], ["RE", 4, [0, 4, 1, 5, 2, 6, 3, 7]], ["CA", 2, 4, 5], ["CHR", 1, "shared", [2]], ["CA", 2, 3, 6], ["CHR", 0, "shared", [3]], ["CA", 1, 4, 6], ["FU", 6, [0, 1]], ["AN", 6, 0, 5], ["FU", 6, [1, 2]], ["AN", 6, 1, 4], ["FU", 6, [2, 3]], ["AN", 6, 2, 6], ["FU", 3, [0, 1]], ["SP", 3, 0, 12, [1], 1], ["AN", 3, 1, 2], ["FFSP", 3, 0, [1, 0], 1, 1], ["AN", 3, 1, 6], ["FU", 1, [0, 1]], ["SP", 1, 0, 24, [1], 1], ["AN", 1, 1, 2], ["FFSP", 1, 0, [1, 0], 1, 1], ["AN", 1, 1, 6], ["PR", 4, 0, "auto_unroll_max_step$1024"]]]], "r": [[0.000189603], 0, 1.13155, 1695335133], "v": "v0.6"}
{"i": [["[\"817107844ff3a9e513e2b591bc12641a\", [32, 3072], [1, 3072], [1], [32, 1]]", "rocm -keys=rocm,gpu -max_num_threads=256 -max_shared_memory_per_block=65536 -max_threads_per_block=256 -mcpu=gfx908 -mtriple=amdgcn-amd-amdhsa-hcc -thread_warp_size=64", [-1, 16, 64, 65536, 2147483647, 1024, 16, 64], "", 0, []], [[], [["SP", 2, 0, 32, [1, 2, 1, 4], 1], ["SP", 2, 5, 1, [1, 1, 1, 1], 1], ["SP", 2, 10, 3072, [1, 1], 1], ["RE", 2, [0, 5, 1, 6, 2, 7, 10, 11, 3, 8, 12, 4, 9]], ["FSP", 4, 0, 0, 3], ["FSP", 4, 4, 1, 3], ["RE", 4, [0, 4, 1, 5, 2, 6, 3, 7]], ["CA", 2, 4, 5], ["CHR", 1, "shared", [2]], ["CA", 2, 3, 6], ["CHR", 0, "shared", [3]], ["CA", 1, 4, 6], ["FU", 6, [0, 1]], ["AN", 6, 0, 5], ["FU", 6, [1, 2]], ["AN", 6, 1, 4], ["FU", 6, [2, 3]], ["AN", 6, 2, 6], ["FU", 3, [0, 1]], ["SP", 3, 0, 48, [1], 1], ["AN", 3, 1, 2], ["FFSP", 3, 0, [1, 0], 1, 1], ["AN", 3, 1, 6], ["FU", 1, [0, 1]], ["SP", 1, 0, 96, [3], 1], ["AN", 1, 1, 2], ["FFSP", 1, 0, [1, 0], 1, 1], ["AN", 1, 1, 6], ["PR", 4, 0, "auto_unroll_max_step$512"]]]], "r": [[0.00116669], 0, 0.90141, 1695335134], "v": "v0.6"}
{"i": [["[\"817107844ff3a9e513e2b591bc12641a\", [32, 3072], [1, 3072], [1], [32, 1]]", "rocm -keys=rocm,gpu -max_num_threads=256 -max_shared_memory_per_block=65536 -max_threads_per_block=256 -mcpu=gfx908 -mtriple=amdgcn-amd-amdhsa-hcc -thread_warp_size=64", [-1, 16, 64, 65536, 2147483647, 1024, 16, 64], "", 0, []], [[], [["SP", 2, 0, 32, [4, 4, 2, 1], 1], ["SP", 2, 5, 1, [1, 1, 1, 1], 1], ["SP", 2, 10, 3072, [2, 48], 1], ["RE", 2, [0, 5, 1, 6, 2, 7, 10, 11, 3, 8, 12, 4, 9]], ["FSP", 4, 0, 0, 3], ["FSP", 4, 4, 1, 3], ["RE", 4, [0, 4, 1, 5, 2, 6, 3, 7]], ["CA", 2, 4, 5], ["CHR", 1, "shared", [2]], ["CA", 2, 3, 6], ["CHR", 0, "shared", [3]], ["CA", 1, 4, 6], ["FU", 6, [0, 1]], ["AN", 6, 0, 5], ["FU", 6, [1, 2]], ["AN", 6, 1, 4], ["FU", 6, [2, 3]], ["AN", 6, 2, 6], ["FU", 3, [0, 1]], ["SP", 3, 0, 96, [1], 1], ["AN", 3, 1, 2], ["FFSP", 3, 0, [1, 0], 1, 1], ["AN", 3, 1, 6], ["FU", 1, [0, 1]], ["SP", 1, 0, 192, [1], 1], ["AN", 1, 1, 2], ["FFSP", 1, 0, [1, 0], 1, 1], ["AN", 1, 1, 6], ["PR", 4, 0, "auto_unroll_max_step$64"]]]], "r": [[0.00360981], 0, 1.44922, 1695335135], "v": "v0.6"}
{"i": [["[\"817107844ff3a9e513e2b591bc12641a\", [32, 3072], [1, 3072], [1], [32, 1]]", "rocm -keys=rocm,gpu -max_num_threads=256 -max_shared_memory_per_block=65536 -max_threads_per_block=256 -mcpu=gfx908 -mtriple=amdgcn-amd-amdhsa-hcc -thread_warp_size=64", [-1, 16, 64, 65536, 2147483647, 1024, 16, 64], "", 0, []], [[], [["SP", 2, 0, 32, [4, 1, 8, 1], 1], ["SP", 2, 5, 1, [1, 1, 1, 1], 1], ["SP", 2, 10, 3072, [48, 1], 1], ["RE", 2, [0, 5, 1, 6, 2, 7, 10, 11, 3, 8, 12, 4, 9]], ["FSP", 4, 0, 0, 3], ["FSP", 4, 4, 1, 3], ["RE", 4, [0, 4, 1, 5, 2, 6, 3, 7]], ["CA", 2, 4, 5], ["CHR", 1, "shared", [2]], ["CA", 2, 3, 6], ["CHR", 0, "shared", [3]], ["CA", 1, 4, 6], ["FU", 6, [0, 1]], ["AN", 6, 0, 5], ["FU", 6, [1, 2]], ["AN", 6, 1, 4], ["FU", 6, [2, 3]], ["AN", 6, 2, 6], ["FU", 3, [0, 1]], ["SP", 3, 0, 192, [32], 1], ["AN", 3, 1, 2], ["FFSP", 3, 0, [1, 0], 1, 1], ["AN", 3, 1, 6], ["FU", 1, [0, 1]], ["SP", 1, 0, 1536, [1], 1], ["AN", 1, 1, 2], ["FFSP", 1, 0, [1, 0], 1, 1], ["AN", 1, 1, 6], ["PR", 4, 0, "auto_unroll_max_step$0"]]]], "r": [[0.00757507], 0, 1.08112, 1695335135], "v": "v0.6"}
{"i": [["[\"817107844ff3a9e513e2b591bc12641a\", [32, 3072], [1, 3072], [1], [32, 1]]", "rocm -keys=rocm,gpu -max_num_threads=256 -max_shared_memory_per_block=65536 -max_threads_per_block=256 -mcpu=gfx908 -mtriple=amdgcn-amd-amdhsa-hcc -thread_warp_size=64", [-1, 16, 64, 65536, 2147483647, 1024, 16, 64], "", 0, []], [[], [["SP", 2, 0, 32, [8, 2, 1, 1], 1], ["SP", 2, 5, 1, [1, 1, 1, 1], 1], ["SP", 2, 10, 3072, [2, 6], 1], ["RE", 2, [0, 5, 1, 6, 2, 7, 10, 11, 3, 8, 12, 4, 9]], ["FSP", 4, 0, 0, 3], ["FSP", 4, 4, 1, 3], ["RE", 4, [0, 4, 1, 5, 2, 6, 3, 7]], ["CA", 2, 4, 5], ["CHR", 1, "shared", [2]], ["CA", 2, 3, 6], ["CHR", 0, "shared", [3]], ["CA", 1, 4, 6], ["FU", 6, [0, 1]], ["AN", 6, 0, 5], ["FU", 6, [1, 2]], ["AN", 6, 1, 4], ["FU", 6, [2, 3]], ["AN", 6, 2, 6], ["FU", 3, [0, 1]], ["SP", 3, 0, 12, [4], 1], ["AN", 3, 1, 2], ["FFSP", 3, 0, [1, 0], 1, 1], ["AN", 3, 1, 6], ["FU", 1, [0, 1]], ["SP", 1, 0, 12, [1], 1], ["AN", 1, 1, 2], ["FFSP", 1, 0, [1, 0], 1, 1], ["AN", 1, 1, 6], ["PR", 4, 0, "auto_unroll_max_step$1024"]]]], "r": [[0.000540779], 0, 1.33467, 1695335136], "v": "v0.6"}
{"i": [["[\"817107844ff3a9e513e2b591bc12641a\", [32, 3072], [1, 3072], [1], [32, 1]]", "rocm -keys=rocm,gpu -max_num_threads=256 -max_shared_memory_per_block=65536 -max_threads_per_block=256 -mcpu=gfx908 -mtriple=amdgcn-amd-amdhsa-hcc -thread_warp_size=64", [-1, 16, 64, 65536, 2147483647, 1024, 16, 64], "", 0, []], [[], [["SP", 2, 0, 32, [1, 1, 4, 4], 1], ["SP", 2, 5, 1, [1, 1, 1, 1], 1], ["SP", 2, 10, 3072, [8, 2], 1], ["RE", 2, [0, 5, 1, 6, 2, 7, 10, 11, 3, 8, 12, 4, 9]], ["FSP", 4, 0, 0, 3], ["FSP", 4, 4, 1, 3], ["RE", 4, [0, 4, 1, 5, 2, 6, 3, 7]], ["CA", 2, 4, 5], ["CHR", 1, "shared", [2]], ["CA", 2, 3, 6], ["CHR", 0, "shared", [3]], ["CA", 1, 4, 6], ["FU", 6, [0, 1]], ["AN", 6, 0, 5], ["FU", 6, [1, 2]], ["AN", 6, 1, 4], ["FU", 6, [2, 3]], ["AN", 6, 2, 6], ["FU", 3, [0, 1]], ["SP", 3, 0, 16, [1], 1], ["AN", 3, 1, 2], ["FFSP", 3, 0, [1, 0], 1, 1], ["AN", 3, 1, 6], ["FU", 1, [0, 1]], ["SP", 1, 0, 256, [1], 1], ["AN", 1, 1, 2], ["FFSP", 1, 0, [1, 0], 1, 1], ["AN", 1, 1, 6], ["PR", 4, 0, "auto_unroll_max_step$0"]]]], "r": [[0.00212082], 0, 1.21521, 1695335136], "v": "v0.6"}
{"i": [["[\"817107844ff3a9e513e2b591bc12641a\", [32, 3072], [1, 3072], [1], [32, 1]]", "rocm -keys=rocm,gpu -max_num_threads=256 -max_shared_memory_per_block=65536 -max_threads_per_block=256 -mcpu=gfx908 -mtriple=amdgcn-amd-amdhsa-hcc -thread_warp_size=64", [-1, 16, 64, 65536, 2147483647, 1024, 16, 64], "", 0, []], [[], [["SP", 2, 0, 32, [1, 4, 2, 2], 1], ["SP", 2, 5, 1, [1, 1, 1, 1], 1], ["SP", 2, 10, 3072, [2, 24], 1], ["RE", 2, [0, 5, 1, 6, 2, 7, 10, 11, 3, 8, 12, 4, 9]], ["FSP", 4, 0, 0, 3], ["FSP", 4, 4, 1, 3], ["RE", 4, [0, 4, 1, 5, 2, 6, 3, 7]], ["CA", 2, 4, 5], ["CHR", 1, "shared", [2]], ["CA", 2, 3, 6], ["CHR", 0, "shared", [3]], ["CA", 1, 4, 6], ["FU", 6, [0, 1]], ["AN", 6, 0, 5], ["FU", 6, [1, 2]], ["AN", 6, 1, 4], ["FU", 6, [2, 3]], ["AN", 6, 2, 6], ["FU", 3, [0, 1]], ["SP", 3, 0, 48, [8], 1], ["AN", 3, 1, 2], ["FFSP", 3, 0, [1, 0], 1, 1], ["AN", 3, 1, 6], ["FU", 1, [0, 1]], ["SP", 1, 0, 192, [1], 1], ["AN", 1, 1, 2], ["FFSP", 1, 0, [1, 0], 1, 1], ["AN", 1, 1, 6], ["PR", 4, 0, "auto_unroll_max_step$512"]]]], "r": [[0.000258424], 0, 2.31206, 1695335137], "v": "v0.6"}
{"i": [["[\"817107844ff3a9e513e2b591bc12641a\", [32, 3072], [1, 3072], [1], [32, 1]]", "rocm -keys=rocm,gpu -max_num_threads=256 -max_shared_memory_per_block=65536 -max_threads_per_block=256 -mcpu=gfx908 -mtriple=amdgcn-amd-amdhsa-hcc -thread_warp_size=64", [-1, 16, 64, 65536, 2147483647, 1024, 16, 64], "", 0, []], [[], [["SP", 2, 0, 32, [2, 1, 1, 2], 1], ["SP", 2, 5, 1, [1, 1, 1, 1], 1], ["SP", 2, 10, 3072, [2, 2], 1], ["RE", 2, [0, 5, 1, 6, 2, 7, 10, 11, 3, 8, 12, 4, 9]], ["FSP", 4, 0, 0, 3], ["FSP", 4, 4, 1, 3], ["RE", 4, [0, 4, 1, 5, 2, 6, 3, 7]], ["CA", 2, 4, 5], ["CHR", 1, "shared", [2]], ["CA", 2, 3, 6], ["CHR", 0, "shared", [3]], ["CA", 1, 4, 6], ["FU", 6, [0, 1]], ["AN", 6, 0, 5], ["FU", 6, [1, 2]], ["AN", 6, 1, 4], ["FU", 6, [2, 3]], ["AN", 6, 2, 6], ["FU", 3, [0, 1]], ["SP", 3, 0, 96, [1], 1], ["AN", 3, 1, 2], ["FFSP", 3, 0, [1, 0], 1, 1], ["AN", 3, 1, 6], ["FU", 1, [0, 1]], ["SP", 1, 0, 192, [1], 1], ["AN", 1, 1, 2], ["FFSP", 1, 0, [1, 0], 1, 1], ["AN", 1, 1, 6], ["PR", 4, 0, "auto_unroll_max_step$512"]]]], "r": [[0.000330196], 0, 0.887794, 1695335138], "v": "v0.6"}
{"i": [["[\"817107844ff3a9e513e2b591bc12641a\", [32, 3072], [1, 3072], [1], [32, 1]]", "rocm -keys=rocm,gpu -max_num_threads=256 -max_shared_memory_per_block=65536 -max_threads_per_block=256 -mcpu=gfx908 -mtriple=amdgcn-amd-amdhsa-hcc -thread_warp_size=64", [-1, 16, 64, 65536, 2147483647, 1024, 16, 64], "", 0, []], [[], [["SP", 2, 0, 32, [2, 1, 1, 1], 1], ["SP", 2, 5, 1, [1, 1, 1, 1], 1], ["SP", 2, 10, 3072, [16, 2], 1], ["RE", 2, [0, 5, 1, 6, 2, 7, 10, 11, 3, 8, 12, 4, 9]], ["FSP", 4, 0, 0, 3], ["FSP", 4, 4, 1, 3], ["RE", 4, [0, 4, 1, 5, 2, 6, 3, 7]], ["CA", 2, 4, 5], ["CHR", 1, "shared", [2]], ["CA", 2, 3, 6], ["CHR", 0, "shared", [3]], ["CA", 1, 4, 6], ["FU", 6, [0, 1]], ["AN", 6, 0, 5], ["FU", 6, [1, 2]], ["AN", 6, 1, 4], ["FU", 6, [2, 3]], ["AN", 6, 2, 6], ["FU", 3, [0, 1]], ["SP", 3, 0, 512, [1], 1], ["AN", 3, 1, 2], ["FFSP", 3, 0, [1, 0], 1, 1], ["AN", 3, 1, 6], ["FU", 1, [0, 1]], ["SP", 1, 0, 512, [1], 1], ["AN", 1, 1, 2], ["FFSP", 1, 0, [1, 0], 1, 1], ["AN", 1, 1, 6], ["PR", 4, 0, "auto_unroll_max_step$1024"]]]], "r": [[0.000172974], 0, 1.30996, 1695335138], "v": "v0.6"}
{"i": [["[\"817107844ff3a9e513e2b591bc12641a\", [32, 3072], [1, 3072], [1], [32, 1]]", "rocm -keys=rocm,gpu -max_num_threads=256 -max_shared_memory_per_block=65536 -max_threads_per_block=256 -mcpu=gfx908 -mtriple=amdgcn-amd-amdhsa-hcc -thread_warp_size=64", [-1, 16, 64, 65536, 2147483647, 1024, 16, 64], "", 0, []], [[], [["SP", 2, 0, 32, [8, 2, 2, 1], 1], ["SP", 2, 5, 1, [1, 1, 1, 1], 1], ["SP", 2, 10, 3072, [1, 48], 1], ["RE", 2, [0, 5, 1, 6, 2, 7, 10, 11, 3, 8, 12, 4, 9]], ["FSP", 4, 0, 0, 3], ["FSP", 4, 4, 1, 3], ["RE", 4, [0, 4, 1, 5, 2, 6, 3, 7]], ["CA", 2, 4, 5], ["CHR", 1, "shared", [2]], ["CA", 2, 3, 6], ["CHR", 0, "shared", [3]], ["CA", 1, 4, 6], ["FU", 6, [0, 1]], ["AN", 6, 0, 5], ["FU", 6, [1, 2]], ["AN", 6, 1, 4], ["FU", 6, [2, 3]], ["AN", 6, 2, 6], ["FU", 3, [0, 1]], ["SP", 3, 0, 48, [1], 1], ["AN", 3, 1, 2], ["FFSP", 3, 0, [1, 0], 1, 1], ["AN", 3, 1, 6], ["FU", 1, [0, 1]], ["SP", 1, 0, 192, [1], 1], ["AN", 1, 1, 2], ["FFSP", 1, 0, [1, 0], 1, 1], ["AN", 1, 1, 6], ["PR", 4, 0, "auto_unroll_max_step$1024"]]]], "r": [[0.00276616], 0, 10.7516, 1695335138], "v": "v0.6"}
{"i": [["[\"817107844ff3a9e513e2b591bc12641a\", [32, 3072], [1, 3072], [1], [32, 1]]", "rocm -keys=rocm,gpu -max_num_threads=256 -max_shared_memory_per_block=65536 -max_threads_per_block=256 -mcpu=gfx908 -mtriple=amdgcn-amd-amdhsa-hcc -thread_warp_size=64", [-1, 16, 64, 65536, 2147483647, 1024, 16, 64], "", 0, []], [[], [["SP", 2, 0, 32, [2, 2, 8, 1], 1], ["SP", 2, 5, 1, [1, 1, 1, 1], 1], ["SP", 2, 10, 3072, [48, 8], 1], ["RE", 2, [0, 5, 1, 6, 2, 7, 10, 11, 3, 8, 12, 4, 9]], ["FSP", 4, 0, 0, 3], ["FSP", 4, 4, 1, 3], ["RE", 4, [0, 4, 1, 5, 2, 6, 3, 7]], ["CA", 2, 4, 5], ["CHR", 1, "shared", [2]], ["CA", 2, 3, 6], ["CHR", 0, "shared", [3]], ["CA", 1, 4, 6], ["FU", 6, [0, 1]], ["AN", 6, 0, 5], ["FU", 6, [1, 2]], ["AN", 6, 1, 4], ["FU", 6, [2, 3]], ["AN", 6, 2, 6], ["FU", 3, [0, 1]], ["SP", 3, 0, 384, [1], 1], ["AN", 3, 1, 2], ["FFSP", 3, 0, [1, 0], 1, 1], ["AN", 3, 1, 6], ["FU", 1, [0, 1]], ["SP", 1, 0, 3072, [2], 1], ["AN", 1, 1, 2], ["FFSP", 1, 0, [1, 0], 1, 1], ["AN", 1, 1, 6], ["PR", 4, 0, "auto_unroll_max_step$0"]]]], "r": [[0.00410432], 0, 1.64482, 1695335140], "v": "v0.6"}
{"i": [["[\"817107844ff3a9e513e2b591bc12641a\", [32, 3072], [1, 3072], [1], [32, 1]]", "rocm -keys=rocm,gpu -max_num_threads=256 -max_shared_memory_per_block=65536 -max_threads_per_block=256 -mcpu=gfx908 -mtriple=amdgcn-amd-amdhsa-hcc -thread_warp_size=64", [-1, 16, 64, 65536, 2147483647, 1024, 16, 64], "", 0, []], [[], [["SP", 2, 0, 32, [1, 1, 4, 4], 1], ["SP", 2, 5, 1, [1, 1, 1, 1], 1], ["SP", 2, 10, 3072, [4, 1], 1], ["RE", 2, [0, 5, 1, 6, 2, 7, 10, 11, 3, 8, 12, 4, 9]], ["FSP", 4, 0, 0, 3], ["FSP", 4, 4, 1, 3], ["RE", 4, [0, 4, 1, 5, 2, 6, 3, 7]], ["CA", 2, 4, 5], ["CHR", 1, "shared", [2]], ["CA", 2, 3, 6], ["CHR", 0, "shared", [3]], ["CA", 1, 4, 6], ["FU", 6, [0, 1]], ["AN", 6, 0, 5], ["FU", 6, [1, 2]], ["AN", 6, 1, 4], ["FU", 6, [2, 3]], ["AN", 6, 2, 6], ["FU", 3, [0, 1]], ["SP", 3, 0, 4, [1], 1], ["AN", 3, 1, 2], ["FFSP", 3, 0, [1, 0], 1, 1], ["AN", 3, 1, 6], ["FU", 1, [0, 1]], ["SP", 1, 0, 64, [1], 1], ["AN", 1, 1, 2], ["FFSP", 1, 0, [1, 0], 1, 1], ["AN", 1, 1, 6], ["PR", 4, 0, "auto_unroll_max_step$0"]]]], "r": [[0.0012394], 0, 1.20183, 1695335140], "v": "v0.6"}
{"i": [["[\"817107844ff3a9e513e2b591bc12641a\", [32, 3072], [1, 3072], [1], [32, 1]]", "rocm -keys=rocm,gpu -max_num_threads=256 -max_shared_memory_per_block=65536 -max_threads_per_block=256 -mcpu=gfx908 -mtriple=amdgcn-amd-amdhsa-hcc -thread_warp_size=64", [-1, 16, 64, 65536, 2147483647, 1024, 16, 64], "", 0, []], [[], [["SP", 2, 0, 32, [2, 1, 8, 2], 1], ["SP", 2, 5, 1, [1, 1, 1, 1], 1], ["SP", 2, 10, 3072, [1, 1], 1], ["RE", 2, [0, 5, 1, 6, 2, 7, 10, 11, 3, 8, 12, 4, 9]], ["FSP", 4, 0, 0, 3], ["FSP", 4, 4, 1, 3], ["RE", 4, [0, 4, 1, 5, 2, 6, 3, 7]], ["CA", 2, 4, 5], ["CHR", 1, "shared", [2]], ["CA", 2, 3, 6], ["CHR", 0, "shared", [3]], ["CA", 1, 4, 6], ["FU", 6, [0, 1]], ["AN", 6, 0, 5], ["FU", 6, [1, 2]], ["AN", 6, 1, 4], ["FU", 6, [2, 3]], ["AN", 6, 2, 6], ["FU", 3, [0, 1]], ["SP", 3, 0, 384, [1], 1], ["AN", 3, 1, 2], ["FFSP", 3, 0, [1, 0], 1, 1], ["AN", 3, 1, 6], ["FU", 1, [0, 1]], ["SP", 1, 0, 6144, [1], 1], ["AN", 1, 1, 2], ["FFSP", 1, 0, [1, 0], 1, 1], ["AN", 1, 1, 6], ["PR", 4, 0, "auto_unroll_max_step$64"]]]], "r": [[0.00229757], 0, 0.997585, 1695335140], "v": "v0.6"}
{"i": [["[\"817107844ff3a9e513e2b591bc12641a\", [32, 3072], [1, 3072], [1], [32, 1]]", "rocm -keys=rocm,gpu -max_num_threads=256 -max_shared_memory_per_block=65536 -max_threads_per_block=256 -mcpu=gfx908 -mtriple=amdgcn-amd-amdhsa-hcc -thread_warp_size=64", [-1, 16, 64, 65536, 2147483647, 1024, 16, 64], "", 0, []], [[], [["SP", 2, 0, 32, [2, 1, 2, 2], 1], ["SP", 2, 5, 1, [1, 1, 1, 1], 1], ["SP", 2, 10, 3072, [32, 32], 1], ["RE", 2, [0, 5, 1, 6, 2, 7, 10, 11, 3, 8, 12, 4, 9]], ["FSP", 4, 0, 0, 3], ["FSP", 4, 4, 1, 3], ["RE", 4, [0, 4, 1, 5, 2, 6, 3, 7]], ["CA", 2, 4, 5], ["CHR", 1, "shared", [2]], ["CA", 2, 3, 6], ["CHR", 0, "shared", [3]], ["CA", 1, 4, 6], ["FU", 6, [0, 1]], ["AN", 6, 0, 5], ["FU", 6, [1, 2]], ["AN", 6, 1, 4], ["FU", 6, [2, 3]], ["AN", 6, 2, 6], ["FU", 3, [0, 1]], ["SP", 3, 0, 512, [1], 1], ["AN", 3, 1, 2], ["FFSP", 3, 0, [1, 0], 1, 1], ["AN", 3, 1, 6], ["FU", 1, [0, 1]], ["SP", 1, 0, 2048, [1], 1], ["AN", 1, 1, 2], ["FFSP", 1, 0, [1, 0], 1, 1], ["AN", 1, 1, 6], ["PR", 4, 0, "auto_unroll_max_step$512"]]]], "r": [[0.00112158], 0, 1.79132, 1695335141], "v": "v0.6"}
{"i": [["[\"817107844ff3a9e513e2b591bc12641a\", [32, 3072], [1, 3072], [1], [32, 1]]", "rocm -keys=rocm,gpu -max_num_threads=256 -max_shared_memory_per_block=65536 -max_threads_per_block=256 -mcpu=gfx908 -mtriple=amdgcn-amd-amdhsa-hcc -thread_warp_size=64", [-1, 16, 64, 65536, 2147483647, 1024, 16, 64], "", 0, []], [[], [["SP", 2, 0, 32, [4, 2, 1, 1], 1], ["SP", 2, 5, 1, [1, 1, 1, 1], 1], ["SP", 2, 10, 3072, [384, 4], 1], ["RE", 2, [0, 5, 1, 6, 2, 7, 10, 11, 3, 8, 12, 4, 9]], ["FSP", 4, 0, 0, 3], ["FSP", 4, 4, 1, 3], ["RE", 4, [0, 4, 1, 5, 2, 6, 3, 7]], ["CA", 2, 4, 5], ["CHR", 1, "shared", [2]], ["CA", 2, 3, 6], ["CHR", 0, "shared", [3]], ["CA", 1, 4, 6], ["FU", 6, [0, 1]], ["AN", 6, 0, 5], ["FU", 6, [1, 2]], ["AN", 6, 1, 4], ["FU", 6, [2, 3]], ["AN", 6, 2, 6], ["FU", 3, [0, 1]], ["SP", 3, 0, 1536, [1], 1], ["AN", 3, 1, 2], ["FFSP", 3, 0, [1, 0], 1, 1], ["AN", 3, 1, 6], ["FU", 1, [0, 1]], ["SP", 1, 0, 1536, [1], 1], ["AN", 1, 1, 2], ["FFSP", 1, 0, [1, 0], 1, 1], ["AN", 1, 1, 6], ["PR", 4, 0, "auto_unroll_max_step$0"]]]], "r": [[0.00139265], 0, 1.3557, 1695335142], "v": "v0.6"}
{"i": [["[\"817107844ff3a9e513e2b591bc12641a\", [32, 3072], [1, 3072], [1], [32, 1]]", "rocm -keys=rocm,gpu -max_num_threads=256 -max_shared_memory_per_block=65536 -max_threads_per_block=256 -mcpu=gfx908 -mtriple=amdgcn-amd-amdhsa-hcc -thread_warp_size=64", [-1, 16, 64, 65536, 2147483647, 1024, 16, 64], "", 0, []], [[], [["SP", 2, 0, 32, [1, 2, 1, 8], 1], ["SP", 2, 5, 1, [1, 1, 1, 1], 1], ["SP", 2, 10, 3072, [128, 2], 1], ["RE", 2, [0, 5, 1, 6, 2, 7, 10, 11, 3, 8, 12, 4, 9]], ["FSP", 4, 0, 0, 3], ["FSP", 4, 4, 1, 3], ["RE", 4, [0, 4, 1, 5, 2, 6, 3, 7]], ["CA", 2, 4, 5], ["CHR", 1, "shared", [2]], ["CA", 2, 3, 6], ["CHR", 0, "shared", [3]], ["CA", 1, 4, 6], ["FU", 6, [0, 1]], ["AN", 6, 0, 5], ["FU", 6, [1, 2]], ["AN", 6, 1, 4], ["FU", 6, [2, 3]], ["AN", 6, 2, 6], ["FU", 3, [0, 1]], ["SP", 3, 0, 256, [1], 1], ["AN", 3, 1, 2], ["FFSP", 3, 0, [1, 0], 1, 1], ["AN", 3, 1, 6], ["FU", 1, [0, 1]], ["SP", 1, 0, 1024, [1], 1], ["AN", 1, 1, 2], ["FFSP", 1, 0, [1, 0], 1, 1], ["AN", 1, 1, 6], ["PR", 4, 0, "auto_unroll_max_step$16"]]]], "r": [[0.00281514], 0, 0.978718, 1695335142], "v": "v0.6"}
{"i": [["[\"817107844ff3a9e513e2b591bc12641a\", [32, 3072], [1, 3072], [1], [32, 1]]", "rocm -keys=rocm,gpu -max_num_threads=256 -max_shared_memory_per_block=65536 -max_threads_per_block=256 -mcpu=gfx908 -mtriple=amdgcn-amd-amdhsa-hcc -thread_warp_size=64", [-1, 16, 64, 65536, 2147483647, 1024, 16, 64], "", 0, []], [[], [["SP", 2, 0, 32, [4, 4, 2, 1], 1], ["SP", 2, 5, 1, [1, 1, 1, 1], 1], ["SP", 2, 10, 3072, [8, 12], 1], ["RE", 2, [0, 5, 1, 6, 2, 7, 10, 11, 3, 8, 12, 4, 9]], ["FSP", 4, 0, 0, 3], ["FSP", 4, 4, 1, 3], ["RE", 4, [0, 4, 1, 5, 2, 6, 3, 7]], ["CA", 2, 4, 5], ["CHR", 1, "shared", [2]], ["CA", 2, 3, 6], ["CHR", 0, "shared", [3]], ["CA", 1, 4, 6], ["FU", 6, [0, 1]], ["AN", 6, 0, 5], ["FU", 6, [1, 2]], ["AN", 6, 1, 4], ["FU", 6, [2, 3]], ["AN", 6, 2, 6], ["FU", 3, [0, 1]], ["SP", 3, 0, 96, [1], 1], ["AN", 3, 1, 2], ["FFSP", 3, 0, [1, 0], 1, 1], ["AN", 3, 1, 6], ["FU", 1, [0, 1]], ["SP", 1, 0, 192, [1], 1], ["AN", 1, 1, 2], ["FFSP", 1, 0, [1, 0], 1, 1], ["AN", 1, 1, 6], ["PR", 4, 0, "auto_unroll_max_step$0"]]]], "r": [[0.00380592], 0, 1.33577, 1695335143], "v": "v0.6"}
{"i": [["[\"817107844ff3a9e513e2b591bc12641a\", [32, 3072], [1, 3072], [1], [32, 1]]", "rocm -keys=rocm,gpu -max_num_threads=256 -max_shared_memory_per_block=65536 -max_threads_per_block=256 -mcpu=gfx908 -mtriple=amdgcn-amd-amdhsa-hcc -thread_warp_size=64", [-1, 16, 64, 65536, 2147483647, 1024, 16, 64], "", 0, []], [[], [["SP", 2, 0, 32, [1, 1, 4, 2], 1], ["SP", 2, 5, 1, [1, 1, 1, 1], 1], ["SP", 2, 10, 3072, [6, 4], 1], ["RE", 2, [0, 5, 1, 6, 2, 7, 10, 11, 3, 8, 12, 4, 9]], ["FSP", 4, 0, 0, 3], ["FSP", 4, 4, 1, 3], ["RE", 4, [0, 4, 1, 5, 2, 6, 3, 7]], ["CA", 2, 4, 5], ["CHR", 1, "shared", [2]], ["CA", 2, 3, 6], ["CHR", 0, "shared", [3]], ["CA", 1, 4, 6], ["FU", 6, [0, 1]], ["AN", 6, 0, 5], ["FU", 6, [1, 2]], ["AN", 6, 1, 4], ["FU", 6, [2, 3]], ["AN", 6, 2, 6], ["FU", 3, [0, 1]], ["SP", 3, 0, 24, [1], 1], ["AN", 3, 1, 2], ["FFSP", 3, 0, [1, 0], 1, 1], ["AN", 3, 1, 6], ["FU", 1, [0, 1]], ["SP", 1, 0, 192, [1], 1], ["AN", 1, 1, 2], ["FFSP", 1, 0, [1, 0], 1, 1], ["AN", 1, 1, 6], ["PR", 4, 0, "auto_unroll_max_step$0"]]]], "r": [[0.00223609], 0, 1.12633, 1695335143], "v": "v0.6"}
{"i": [["[\"817107844ff3a9e513e2b591bc12641a\", [32, 3072], [1, 3072], [1], [32, 1]]", "rocm -keys=rocm,gpu -max_num_threads=256 -max_shared_memory_per_block=65536 -max_threads_per_block=256 -mcpu=gfx908 -mtriple=amdgcn-amd-amdhsa-hcc -thread_warp_size=64", [-1, 16, 64, 65536, 2147483647, 1024, 16, 64], "", 0, []], [[], [["SP", 2, 0, 32, [4, 2, 1, 2], 1], ["SP", 2, 5, 1, [1, 1, 1, 1], 1], ["SP", 2, 10, 3072, [6, 1], 1], ["RE", 2, [0, 5, 1, 6, 2, 7, 10, 11, 3, 8, 12, 4, 9]], ["FSP", 4, 0, 0, 3], ["FSP", 4, 4, 1, 3], ["RE", 4, [0, 4, 1, 5, 2, 6, 3, 7]], ["CA", 2, 4, 5], ["CHR", 1, "shared", [2]], ["CA", 2, 3, 6], ["CHR", 0, "shared", [3]], ["CA", 1, 4, 6], ["FU", 6, [0, 1]], ["AN", 6, 0, 5], ["FU", 6, [1, 2]], ["AN", 6, 1, 4], ["FU", 6, [2, 3]], ["AN", 6, 2, 6], ["FU", 3, [0, 1]], ["SP", 3, 0, 6, [1], 1], ["AN", 3, 1, 2], ["FFSP", 3, 0, [1, 0], 1, 1], ["AN", 3, 1, 6], ["FU", 1, [0, 1]], ["SP", 1, 0, 6, [1], 1], ["AN", 1, 1, 2], ["FFSP", 1, 0, [1, 0], 1, 1], ["AN", 1, 1, 6], ["PR", 4, 0, "auto_unroll_max_step$1024"]]]], "r": [[0.00052712], 0, 1.46452, 1695335144], "v": "v0.6"}
{"i": [["[\"817107844ff3a9e513e2b591bc12641a\", [32, 3072], [1, 3072], [1], [32, 1]]", "rocm -keys=rocm,gpu -max_num_threads=256 -max_shared_memory_per_block=65536 -max_threads_per_block=256 -mcpu=gfx908 -mtriple=amdgcn-amd-amdhsa-hcc -thread_warp_size=64", [-1, 16, 64, 65536, 2147483647, 1024, 16, 64], "", 0, []], [[], [["SP", 2, 0, 32, [2, 2, 1, 1], 1], ["SP", 2, 5, 1, [1, 1, 1, 1], 1], ["SP", 2, 10, 3072, [768, 1], 1], ["RE", 2, [0, 5, 1, 6, 2, 7, 10, 11, 3, 8, 12, 4, 9]], ["FSP", 4, 0, 0, 3], ["FSP", 4, 4, 1, 3], ["RE", 4, [0, 4, 1, 5, 2, 6, 3, 7]], ["CA", 2, 4, 5], ["CHR", 1, "shared", [2]], ["CA", 2, 3, 6], ["CHR", 0, "shared", [3]], ["CA", 1, 4, 6], ["FU", 6, [0, 1]], ["AN", 6, 0, 5], ["FU", 6, [1, 2]], ["AN", 6, 1, 4], ["FU", 6, [2, 3]], ["AN", 6, 2, 6], ["FU", 3, [0, 1]], ["SP", 3, 0, 24, [1], 1], ["AN", 3, 1, 2], ["FFSP", 3, 0, [1, 0], 1, 1], ["AN", 3, 1, 6], ["FU", 1, [0, 1]], ["SP", 1, 0, 24, [1], 1], ["AN", 1, 1, 2], ["FFSP", 1, 0, [1, 0], 1, 1], ["AN", 1, 1, 6], ["PR", 4, 0, "auto_unroll_max_step$512"]]]], "r": [[0.000805201], 0, 2.5335, 1695335145], "v": "v0.6"}
{"i": [["[\"817107844ff3a9e513e2b591bc12641a\", [32, 3072], [1, 3072], [1], [32, 1]]", "rocm -keys=rocm,gpu -max_num_threads=256 -max_shared_memory_per_block=65536 -max_threads_per_block=256 -mcpu=gfx908 -mtriple=amdgcn-amd-amdhsa-hcc -thread_warp_size=64", [-1, 16, 64, 65536, 2147483647, 1024, 16, 64], "", 0, []], [[], [["SP", 2, 0, 32, [4, 1, 2, 4], 1], ["SP", 2, 5, 1, [1, 1, 1, 1], 1], ["SP", 2, 10, 3072, [2, 12], 1], ["RE", 2, [0, 5, 1, 6, 2, 7, 10, 11, 3, 8, 12, 4, 9]], ["FSP", 4, 0, 0, 3], ["FSP", 4, 4, 1, 3], ["RE", 4, [0, 4, 1, 5, 2, 6, 3, 7]], ["CA", 2, 4, 5], ["CHR", 1, "shared", [2]], ["CA", 2, 3, 6], ["CHR", 0, "shared", [3]], ["CA", 1, 4, 6], ["FU", 6, [0, 1]], ["AN", 6, 0, 5], ["FU", 6, [1, 2]], ["AN", 6, 1, 4], ["FU", 6, [2, 3]], ["AN", 6, 2, 6], ["FU", 3, [0, 1]], ["SP", 3, 0, 24, [1], 1], ["AN", 3, 1, 2], ["FFSP", 3, 0, [1, 0], 1, 1], ["AN", 3, 1, 6], ["FU", 1, [0, 1]], ["SP", 1, 0, 192, [1], 1], ["AN", 1, 1, 2], ["FFSP", 1, 0, [1, 0], 1, 1], ["AN", 1, 1, 6], ["PR", 4, 0, "auto_unroll_max_step$16"]]]], "r": [[0.00734104], 0, 0.905135, 1695335145], "v": "v0.6"}
{"i": [["[\"817107844ff3a9e513e2b591bc12641a\", [32, 3072], [1, 3072], [1], [32, 1]]", "rocm -keys=rocm,gpu -max_num_threads=256 -max_shared_memory_per_block=65536 -max_threads_per_block=256 -mcpu=gfx908 -mtriple=amdgcn-amd-amdhsa-hcc -thread_warp_size=64", [-1, 16, 64, 65536, 2147483647, 1024, 16, 64], "", 0, []], [[], [["SP", 2, 0, 32, [1, 2, 2, 2], 1], ["SP", 2, 5, 1, [1, 1, 1, 1], 1], ["SP", 2, 10, 3072, [2, 4], 1], ["RE", 2, [0, 5, 1, 6, 2, 7, 10, 11, 3, 8, 12, 4, 9]], ["FSP", 4, 0, 0, 3], ["FSP", 4, 4, 1, 3], ["RE", 4, [0, 4, 1, 5, 2, 6, 3, 7]], ["CA", 2, 4, 5], ["CHR", 1, "shared", [2]], ["CA", 2, 3, 6], ["CHR", 0, "shared", [3]], ["CA", 1, 4, 6], ["FU", 6, [0, 1]], ["AN", 6, 0, 5], ["FU", 6, [1, 2]], ["AN", 6, 1, 4], ["FU", 6, [2, 3]], ["AN", 6, 2, 6], ["FU", 3, [0, 1]], ["SP", 3, 0, 8, [4], 1], ["AN", 3, 1, 2], ["FFSP", 3, 0, [1, 0], 1, 1], ["AN", 3, 1, 6], ["FU", 1, [0, 1]], ["SP", 1, 0, 64, [1], 1], ["AN", 1, 1, 2], ["FFSP", 1, 0, [1, 0], 1, 1], ["AN", 1, 1, 6], ["PR", 4, 0, "auto_unroll_max_step$512"]]]], "r": [[0.0003942], 0, 0.867095, 1695335145], "v": "v0.6"}
{"i": [["[\"817107844ff3a9e513e2b591bc12641a\", [32, 3072], [1, 3072], [1], [32, 1]]", "rocm -keys=rocm,gpu -max_num_threads=256 -max_shared_memory_per_block=65536 -max_threads_per_block=256 -mcpu=gfx908 -mtriple=amdgcn-amd-amdhsa-hcc -thread_warp_size=64", [-1, 16, 64, 65536, 2147483647, 1024, 16, 64], "", 0, []], [[], [["SP", 2, 0, 32, [2, 2, 2, 4], 1], ["SP", 2, 5, 1, [1, 1, 1, 1], 1], ["SP", 2, 10, 3072, [4, 8], 1], ["RE", 2, [0, 5, 1, 6, 2, 7, 10, 11, 3, 8, 12, 4, 9]], ["FSP", 4, 0, 0, 3], ["FSP", 4, 4, 1, 3], ["RE", 4, [0, 4, 1, 5, 2, 6, 3, 7]], ["CA", 2, 4, 5], ["CHR", 1, "shared", [2]], ["CA", 2, 3, 6], ["CHR", 0, "shared", [3]], ["CA", 1, 4, 6], ["FU", 6, [0, 1]], ["AN", 6, 0, 5], ["FU", 6, [1, 2]], ["AN", 6, 1, 4], ["FU", 6, [2, 3]], ["AN", 6, 2, 6], ["FU", 3, [0, 1]], ["SP", 3, 0, 32, [1], 1], ["AN", 3, 1, 2], ["FFSP", 3, 0, [1, 0], 1, 1], ["AN", 3, 1, 6], ["FU", 1, [0, 1]], ["SP", 1, 0, 256, [1], 1], ["AN", 1, 1, 2], ["FFSP", 1, 0, [1, 0], 1, 1], ["AN", 1, 1, 6], ["PR", 4, 0, "auto_unroll_max_step$16"]]]], "r": [[0.00313495], 0, 1.37503, 1695335146], "v": "v0.6"}
{"i": [["[\"817107844ff3a9e513e2b591bc12641a\", [32, 3072], [1, 3072], [1], [32, 1]]", "rocm -keys=rocm,gpu -max_num_threads=256 -max_shared_memory_per_block=65536 -max_threads_per_block=256 -mcpu=gfx908 -mtriple=amdgcn-amd-amdhsa-hcc -thread_warp_size=64", [-1, 16, 64, 65536, 2147483647, 1024, 16, 64], "", 0, []], [[], [["SP", 2, 0, 32, [4, 1, 1, 4], 1], ["SP", 2, 5, 1, [1, 1, 1, 1], 1], ["SP", 2, 10, 3072, [128, 2], 1], ["RE", 2, [0, 5, 1, 6, 2, 7, 10, 11, 3, 8, 12, 4, 9]], ["FSP", 4, 0, 0, 3], ["FSP", 4, 4, 1, 3], ["RE", 4, [0, 4, 1, 5, 2, 6, 3, 7]], ["CA", 2, 4, 5], ["CHR", 1, "shared", [2]], ["CA", 2, 3, 6], ["CHR", 0, "shared", [3]], ["CA", 1, 4, 6], ["FU", 6, [0, 1]], ["AN", 6, 0, 5], ["FU", 6, [1, 2]], ["AN", 6, 1, 4], ["FU", 6, [2, 3]], ["AN", 6, 2, 6], ["FU", 3, [0, 1]], ["SP", 3, 0, 256, [2], 1], ["AN", 3, 1, 2], ["FFSP", 3, 0, [1, 0], 1, 1], ["AN", 3, 1, 6], ["FU", 1, [0, 1]], ["SP", 1, 0, 1024, [4], 1], ["AN", 1, 1, 2], ["FFSP", 1, 0, [1, 0], 1, 1], ["AN", 1, 1, 6], ["PR", 4, 0, "auto_unroll_max_step$0"]]]], "r": [[0.00188706], 0, 0.952652, 1695335147], "v": "v0.6"}
{"i": [["[\"817107844ff3a9e513e2b591bc12641a\", [32, 3072], [1, 3072], [1], [32, 1]]", "rocm -keys=rocm,gpu -max_num_threads=256 -max_shared_memory_per_block=65536 -max_threads_per_block=256 -mcpu=gfx908 -mtriple=amdgcn-amd-amdhsa-hcc -thread_warp_size=64", [-1, 16, 64, 65536, 2147483647, 1024, 16, 64], "", 0, []], [[], [["SP", 2, 0, 32, [1, 1, 1, 32], 1], ["SP", 2, 5, 1, [1, 1, 1, 1], 1], ["SP", 2, 10, 3072, [4, 24], 1], ["RE", 2, [0, 5, 1, 6, 2, 7, 10, 11, 3, 8, 12, 4, 9]], ["FSP", 4, 0, 0, 3], ["FSP", 4, 4, 1, 3], ["RE", 4, [0, 4, 1, 5, 2, 6, 3, 7]], ["CA", 2, 4, 5], ["CHR", 1, "shared", [2]], ["CA", 2, 3, 6], ["CHR", 0, "shared", [3]], ["CA", 1, 4, 6], ["FU", 6, [0, 1]], ["AN", 6, 0, 5], ["FU", 6, [1, 2]], ["AN", 6, 1, 4], ["FU", 6, [2, 3]], ["AN", 6, 2, 6], ["FU", 3, [0, 1]], ["SP", 3, 0, 96, [1], 1], ["AN", 3, 1, 2], ["FFSP", 3, 0, [1, 0], 1, 1], ["AN", 3, 1, 6], ["FU", 1, [0, 1]], ["SP", 1, 0, 3072, [1], 1], ["AN", 1, 1, 2], ["FFSP", 1, 0, [1, 0], 1, 1], ["AN", 1, 1, 6], ["PR", 4, 0, "auto_unroll_max_step$0"]]]], "r": [[0.00957368], 0, 1.17214, 1695335147], "v": "v0.6"}
{"i": [["[\"817107844ff3a9e513e2b591bc12641a\", [32, 3072], [1, 3072], [1], [32, 1]]", "rocm -keys=rocm,gpu -max_num_threads=256 -max_shared_memory_per_block=65536 -max_threads_per_block=256 -mcpu=gfx908 -mtriple=amdgcn-amd-amdhsa-hcc -thread_warp_size=64", [-1, 16, 64, 65536, 2147483647, 1024, 16, 64], "", 0, []], [[], [["SP", 2, 0, 32, [4, 2, 1, 2], 1], ["SP", 2, 5, 1, [1, 1, 1, 1], 1], ["SP", 2, 10, 3072, [12, 1], 1], ["RE", 2, [0, 5, 1, 6, 2, 7, 10, 11, 3, 8, 12, 4, 9]], ["FSP", 4, 0, 0, 3], ["FSP", 4, 4, 1, 3], ["RE", 4, [0, 4, 1, 5, 2, 6, 3, 7]], ["CA", 2, 4, 5], ["CHR", 1, "shared", [2]], ["CA", 2, 3, 6], ["CHR", 0, "shared", [3]], ["CA", 1, 4, 6], ["FU", 6, [0, 1]], ["AN", 6, 0, 5], ["FU", 6, [1, 2]], ["AN", 6, 1, 4], ["FU", 6, [2, 3]], ["AN", 6, 2, 6], ["FU", 3, [0, 1]], ["SP", 3, 0, 768, [1], 1], ["AN", 3, 1, 2], ["FFSP", 3, 0, [1, 0], 1, 1], ["AN", 3, 1, 6], ["FU", 1, [0, 1]], ["SP", 1, 0, 1536, [1], 1], ["AN", 1, 1, 2], ["FFSP", 1, 0, [1, 0], 1, 1], ["AN", 1, 1, 6], ["PR", 4, 0, "auto_unroll_max_step$1024"]]]], "r": [[0.000433411], 0, 1.36317, 1695335147], "v": "v0.6"}
{"i": [["[\"817107844ff3a9e513e2b591bc12641a\", [32, 3072], [1, 3072], [1], [32, 1]]", "rocm -keys=rocm,gpu -max_num_threads=256 -max_shared_memory_per_block=65536 -max_threads_per_block=256 -mcpu=gfx908 -mtriple=amdgcn-amd-amdhsa-hcc -thread_warp_size=64", [-1, 16, 64, 65536, 2147483647, 1024, 16, 64], "", 0, []], [[], [["SP", 2, 0, 32, [1, 4, 2, 4], 1], ["SP", 2, 5, 1, [1, 1, 1, 1], 1], ["SP", 2, 10, 3072, [1, 3], 1], ["RE", 2, [0, 5, 1, 6, 2, 7, 10, 11, 3, 8, 12, 4, 9]], ["FSP", 4, 0, 0, 3], ["FSP", 4, 4, 1, 3], ["RE", 4, [0, 4, 1, 5, 2, 6, 3, 7]], ["CA", 2, 4, 5], ["CHR", 1, "shared", [2]], ["CA", 2, 3, 6], ["CHR", 0, "shared", [3]], ["CA", 1, 4, 6], ["FU", 6, [0, 1]], ["AN", 6, 0, 5], ["FU", 6, [1, 2]], ["AN", 6, 1, 4], ["FU", 6, [2, 3]], ["AN", 6, 2, 6], ["FU", 3, [0, 1]], ["SP", 3, 0, 3, [1], 1], ["AN", 3, 1, 2], ["FFSP", 3, 0, [1, 0], 1, 1], ["AN", 3, 1, 6], ["FU", 1, [0, 1]], ["SP", 1, 0, 6, [2], 1], ["AN", 1, 1, 2], ["FFSP", 1, 0, [1, 0], 1, 1], ["AN", 1, 1, 6], ["PR", 4, 0, "auto_unroll_max_step$64"]]]], "r": [[0.00126292], 0, 1.32566, 1695335149], "v": "v0.6"}
{"i": [["[\"817107844ff3a9e513e2b591bc12641a\", [32, 3072], [1, 3072], [1], [32, 1]]", "rocm -keys=rocm,gpu -max_num_threads=256 -max_shared_memory_per_block=65536 -max_threads_per_block=256 -mcpu=gfx908 -mtriple=amdgcn-amd-amdhsa-hcc -thread_warp_size=64", [-1, 16, 64, 65536, 2147483647, 1024, 16, 64], "", 0, []], [[], [["SP", 2, 0, 32, [1, 4, 2, 2], 1], ["SP", 2, 5, 1, [1, 1, 1, 1], 1], ["SP", 2, 10, 3072, [8, 16], 1], ["RE", 2, [0, 5, 1, 6, 2, 7, 10, 11, 3, 8, 12, 4, 9]], ["FSP", 4, 0, 0, 3], ["FSP", 4, 4, 1, 3], ["RE", 4, [0, 4, 1, 5, 2, 6, 3, 7]], ["CA", 2, 4, 5], ["CHR", 1, "shared", [2]], ["CA", 2, 3, 6], ["CHR", 0, "shared", [3]], ["CA", 1, 4, 6], ["FU", 6, [0, 1]], ["AN", 6, 0, 5], ["FU", 6, [1, 2]], ["AN", 6, 1, 4], ["FU", 6, [2, 3]], ["AN", 6, 2, 6], ["FU", 3, [0, 1]], ["SP", 3, 0, 128, [1], 1], ["AN", 3, 1, 2], ["FFSP", 3, 0, [1, 0], 1, 1], ["AN", 3, 1, 6], ["FU", 1, [0, 1]], ["SP", 1, 0, 512, [1], 1], ["AN", 1, 1, 2], ["FFSP", 1, 0, [1, 0], 1, 1], ["AN", 1, 1, 6], ["PR", 4, 0, "auto_unroll_max_step$16"]]]], "r": [[0.000886707], 0, 1.15506, 1695335149], "v": "v0.6"}
