ansor_log/rocm-MI100/CNN/rocm-CNN-25.json
{"i": [["[\"990586ac95c316d6af64e8ddc5165a26\", [8192, 1152], [128, 1152], [128], [8192, 128]]", "rocm -keys=rocm,gpu -max_num_threads=256 -max_shared_memory_per_block=65536 -max_threads_per_block=256 -mcpu=gfx908 -mtriple=amdgcn-amd-amdhsa-hcc -thread_warp_size=64", [-1, 16, 64, 65536, 2147483647, 1024, 16, 64], "", 0, []], [[], [["CI", 5], ["CI", 4], ["SP", 2, 0, 8192, [1, 128, 2, 1], 1], ["SP", 2, 5, 128, [2, 4, 1, 2], 1], ["SP", 2, 10, 1152, [8, 3], 1], ["RE", 2, [0, 5, 1, 6, 2, 7, 10, 11, 3, 8, 12, 4, 9]], ["FSP", 6, 0, 2, 3], ["FSP", 6, 4, 3, 3], ["RE", 6, [0, 4, 1, 5, 2, 6, 3, 7]], ["CA", 2, 6, 5], ["CHR", 1, "shared", [2]], ["CA", 2, 3, 6], ["CHR", 0, "shared", [3]], ["CA", 1, 4, 6], ["FU", 8, [0, 1]], ["AN", 8, 0, 5], ["FU", 8, [1, 2]], ["AN", 8, 1, 4], ["FU", 8, [2, 3]], ["AN", 8, 2, 6], ["FU", 3, [0, 1]], ["SP", 3, 0, 384, [1], 1], ["AN", 3, 1, 2], ["FFSP", 3, 0, [3, 2], 1, 1], ["AN", 3, 1, 6], ["FU", 1, [0, 1]], ["SP", 1, 0, 48, [8], 1], ["AN", 1, 1, 2], ["FFSP", 1, 0, [3, 2], 1, 1], ["AN", 1, 1, 6], ["PR", 4, 0, "auto_unroll_max_step$0"]]]], "r": [[0.00243153], 0, 2.69499, 1695324355], "v": "v0.6"}
{"i": [["[\"990586ac95c316d6af64e8ddc5165a26\", [8192, 1152], [128, 1152], [128], [8192, 128]]", "rocm -keys=rocm,gpu -max_num_threads=256 -max_shared_memory_per_block=65536 -max_threads_per_block=256 -mcpu=gfx908 -mtriple=amdgcn-amd-amdhsa-hcc -thread_warp_size=64", [-1, 16, 64, 65536, 2147483647, 1024, 16, 64], "", 0, []], [[], [["CI", 5], ["CI", 4], ["SP", 2, 0, 8192, [1, 16, 4, 64], 1], ["SP", 2, 5, 128, [1, 4, 2, 8], 1], ["SP", 2, 10, 1152, [3, 1], 1], ["RE", 2, [0, 5, 1, 6, 2, 7, 10, 11, 3, 8, 12, 4, 9]], ["FSP", 6, 0, 2, 3], ["FSP", 6, 4, 3, 3], ["RE", 6, [0, 4, 1, 5, 2, 6, 3, 7]], ["CA", 2, 6, 5], ["CHR", 1, "shared", [2]], ["CA", 2, 3, 6], ["CHR", 0, "shared", [3]], ["CA", 1, 4, 6], ["FU", 8, [0, 1]], ["AN", 8, 0, 5], ["FU", 8, [1, 2]], ["AN", 8, 1, 4], ["FU", 8, [2, 3]], ["AN", 8, 2, 6], ["FU", 3, [0, 1]], ["SP", 3, 0, 24, [1], 1], ["AN", 3, 1, 2], ["FFSP", 3, 0, [3, 2], 1, 1], ["AN", 3, 1, 6], ["FU", 1, [0, 1]], ["SP", 1, 0, 768, [1], 1], ["AN", 1, 1, 2], ["FFSP", 1, 0, [3, 2], 1, 1], ["AN", 1, 1, 6], ["PR", 4, 0, "auto_unroll_max_step$512"]]]], "r": [[1.03233], 0, 33.1586, 1695324360], "v": "v0.6"}
{"i": [["[\"990586ac95c316d6af64e8ddc5165a26\", [8192, 1152], [128, 1152], [128], [8192, 128]]", "rocm -keys=rocm,gpu -max_num_threads=256 -max_shared_memory_per_block=65536 -max_threads_per_block=256 -mcpu=gfx908 -mtriple=amdgcn-amd-amdhsa-hcc -thread_warp_size=64", [-1, 16, 64, 65536, 2147483647, 1024, 16, 64], "", 0, []], [[], [["CI", 5], ["CI", 4], ["SP", 2, 0, 8192, [1, 32, 4, 4], 1], ["SP", 2, 5, 128, [2, 2, 4, 2], 1], ["SP", 2, 10, 1152, [3, 1], 1], ["RE", 2, [0, 5, 1, 6, 2, 7, 10, 11, 3, 8, 12, 4, 9]], ["FSP", 6, 0, 2, 3], ["FSP", 6, 4, 3, 3], ["RE", 6, [0, 4, 1, 5, 2, 6, 3, 7]], ["CA", 2, 6, 5], ["CHR", 1, "shared", [2]], ["CA", 2, 3, 6], ["CHR", 0, "shared", [3]], ["CA", 1, 4, 6], ["FU", 8, [0, 1]], ["AN", 8, 0, 5], ["FU", 8, [1, 2]], ["AN", 8, 1, 4], ["FU", 8, [2, 3]], ["AN", 8, 2, 6], ["FU", 3, [0, 1]], ["SP", 3, 0, 48, [1], 1], ["AN", 3, 1, 2], ["FFSP", 3, 0, [3, 2], 1, 1], ["AN", 3, 1, 6], ["FU", 1, [0, 1]], ["SP", 1, 0, 96, [1], 1], ["AN", 1, 1, 2], ["FFSP", 1, 0, [3, 2], 1, 1], ["AN", 1, 1, 6], ["PR", 4, 0, "auto_unroll_max_step$1024"]]]], "r": [[0.0677616], 0, 7.96917, 1695324361], "v": "v0.6"}
{"i": [["[\"990586ac95c316d6af64e8ddc5165a26\", [8192, 1152], [128, 1152], [128], [8192, 128]]", "rocm -keys=rocm,gpu -max_num_threads=256 -max_shared_memory_per_block=65536 -max_threads_per_block=256 -mcpu=gfx908 -mtriple=amdgcn-amd-amdhsa-hcc -thread_warp_size=64", [-1, 16, 64, 65536, 2147483647, 1024, 16, 64], "", 0, []], [[], [["CI", 5], ["CI", 4], ["SP", 2, 0, 8192, [1, 128, 1, 4], 1], ["SP", 2, 5, 128, [8, 2, 1, 1], 1], ["SP", 2, 10, 1152, [3, 2], 1], ["RE", 2, [0, 5, 1, 6, 2, 7, 10, 11, 3, 8, 12, 4, 9]], ["FSP", 6, 0, 2, 3], ["FSP", 6, 4, 3, 3], ["RE", 6, [0, 4, 1, 5, 2, 6, 3, 7]], ["CA", 2, 6, 5], ["CHR", 1, "shared", [2]], ["CA", 2, 3, 6], ["CHR", 0, "shared", [3]], ["CA", 1, 4, 6], ["FU", 8, [0, 1]], ["AN", 8, 0, 5], ["FU", 8, [1, 2]], ["AN", 8, 1, 4], ["FU", 8, [2, 3]], ["AN", 8, 2, 6], ["FU", 3, [0, 1]], ["SP", 3, 0, 24, [1], 1], ["AN", 3, 1, 2], ["FFSP", 3, 0, [3, 2], 1, 1], ["AN", 3, 1, 6], ["FU", 1, [0, 1]], ["SP", 1, 0, 96, [1], 1], ["AN", 1, 1, 2], ["FFSP", 1, 0, [3, 2], 1, 1], ["AN", 1, 1, 6], ["PR", 4, 0, "auto_unroll_max_step$1024"]]]], "r": [[0.00222844], 0, 2.30675, 1695324363], "v": "v0.6"}
{"i": [["[\"990586ac95c316d6af64e8ddc5165a26\", [8192, 1152], [128, 1152], [128], [8192, 128]]", "rocm -keys=rocm,gpu -max_num_threads=256 -max_shared_memory_per_block=65536 -max_threads_per_block=256 -mcpu=gfx908 -mtriple=amdgcn-amd-amdhsa-hcc -thread_warp_size=64", [-1, 16, 64, 65536, 2147483647, 1024, 16, 64], "", 0, []], [[], [["CI", 5], ["CI", 4], ["SP", 2, 0, 8192, [2, 16, 1, 2], 1], ["SP", 2, 5, 128, [1, 32, 2, 1], 1], ["SP", 2, 10, 1152, [1, 6], 1], ["RE", 2, [0, 5, 1, 6, 2, 7, 10, 11, 3, 8, 12, 4, 9]], ["FSP", 6, 0, 2, 3], ["FSP", 6, 4, 3, 3], ["RE", 6, [0, 4, 1, 5, 2, 6, 3, 7]], ["CA", 2, 6, 5], ["CHR", 1, "shared", [2]], ["CA", 2, 3, 6], ["CHR", 0, "shared", [3]], ["CA", 1, 4, 6], ["FU", 8, [0, 1]], ["AN", 8, 0, 5], ["FU", 8, [1, 2]], ["AN", 8, 1, 4], ["FU", 8, [2, 3]], ["AN", 8, 2, 6], ["FU", 3, [0, 1]], ["SP", 3, 0, 12, [3], 1], ["AN", 3, 1, 2], ["FFSP", 3, 0, [3, 2], 1, 1], ["AN", 3, 1, 6], ["FU", 1, [0, 1]], ["SP", 1, 0, 12, [1], 1], ["AN", 1, 1, 2], ["FFSP", 1, 0, [3, 2], 1, 1], ["AN", 1, 1, 6], ["PR", 4, 0, "auto_unroll_max_step$1024"]]]], "r": [[0.00174291], 0, 2.21505, 1695324365], "v": "v0.6"}
{"i": [["[\"990586ac95c316d6af64e8ddc5165a26\", [8192, 1152], [128, 1152], [128], [8192, 128]]", "rocm -keys=rocm,gpu -max_num_threads=256 -max_shared_memory_per_block=65536 -max_threads_per_block=256 -mcpu=gfx908 -mtriple=amdgcn-amd-amdhsa-hcc -thread_warp_size=64", [-1, 16, 64, 65536, 2147483647, 1024, 16, 64], "", 0, []], [[], [["CI", 5], ["CI", 4], ["SP", 2, 0, 8192, [4, 16, 2, 2], 1], ["SP", 2, 5, 128, [1, 16, 1, 4], 1], ["SP", 2, 10, 1152, [1, 12], 1], ["RE", 2, [0, 5, 1, 6, 2, 7, 10, 11, 3, 8, 12, 4, 9]], ["FSP", 6, 0, 2, 3], ["FSP", 6, 4, 3, 3], ["RE", 6, [0, 4, 1, 5, 2, 6, 3, 7]], ["CA", 2, 6, 5], ["CHR", 1, "shared", [2]], ["CA", 2, 3, 6], ["CHR", 0, "shared", [3]], ["CA", 1, 4, 6], ["FU", 8, [0, 1]], ["AN", 8, 0, 5], ["FU", 8, [1, 2]], ["AN", 8, 1, 4], ["FU", 8, [2, 3]], ["AN", 8, 2, 6], ["FU", 3, [0, 1]], ["SP", 3, 0, 96, [1], 1], ["AN", 3, 1, 2], ["FFSP", 3, 0, [3, 2], 1, 1], ["AN", 3, 1, 6], ["FU", 1, [0, 1]], ["SP", 1, 0, 48, [3], 1], ["AN", 1, 1, 2], ["FFSP", 1, 0, [3, 2], 1, 1], ["AN", 1, 1, 6], ["PR", 4, 0, "auto_unroll_max_step$64"]]]], "r": [[0.00168073], 0, 2.26403, 1695324366], "v": "v0.6"}
{"i": [["[\"990586ac95c316d6af64e8ddc5165a26\", [8192, 1152], [128, 1152], [128], [8192, 128]]", "rocm -keys=rocm,gpu -max_num_threads=256 -max_shared_memory_per_block=65536 -max_threads_per_block=256 -mcpu=gfx908 -mtriple=amdgcn-amd-amdhsa-hcc -thread_warp_size=64", [-1, 16, 64, 65536, 2147483647, 1024, 16, 64], "", 0, []], [[], [["CI", 5], ["CI", 4], ["SP", 2, 0, 8192, [1, 32, 1, 4], 1], ["SP", 2, 5, 128, [2, 16, 4, 1], 1], ["SP", 2, 10, 1152, [1, 3], 1], ["RE", 2, [0, 5, 1, 6, 2, 7, 10, 11, 3, 8, 12, 4, 9]], ["FSP", 6, 0, 2, 3], ["FSP", 6, 4, 3, 3], ["RE", 6, [0, 4, 1, 5, 2, 6, 3, 7]], ["CA", 2, 6, 5], ["CHR", 1, "shared", [2]], ["CA", 2, 3, 6], ["CHR", 0, "shared", [3]], ["CA", 1, 4, 6], ["FU", 8, [0, 1]], ["AN", 8, 0, 5], ["FU", 8, [1, 2]], ["AN", 8, 1, 4], ["FU", 8, [2, 3]], ["AN", 8, 2, 6], ["FU", 3, [0, 1]], ["SP", 3, 0, 12, [12], 1], ["AN", 3, 1, 2], ["FFSP", 3, 0, [3, 2], 1, 1], ["AN", 3, 1, 6], ["FU", 1, [0, 1]], ["SP", 1, 0, 12, [6], 1], ["AN", 1, 1, 2], ["FFSP", 1, 0, [3, 2], 1, 1], ["AN", 1, 1, 6], ["PR", 4, 0, "auto_unroll_max_step$0"]]]], "r": [[0.0019724], 0, 1.99213, 1695324367], "v": "v0.6"}
{"i": [["[\"990586ac95c316d6af64e8ddc5165a26\", [8192, 1152], [128, 1152], [128], [8192, 128]]", "rocm -keys=rocm,gpu -max_num_threads=256 -max_shared_memory_per_block=65536 -max_threads_per_block=256 -mcpu=gfx908 -mtriple=amdgcn-amd-amdhsa-hcc -thread_warp_size=64", [-1, 16, 64, 65536, 2147483647, 1024, 16, 64], "", 0, []], [[], [["CI", 5], ["CI", 4], ["SP", 2, 0, 8192, [16, 16, 1, 1], 1], ["SP", 2, 5, 128, [1, 8, 1, 2], 1], ["SP", 2, 10, 1152, [6, 3], 1], ["RE", 2, [0, 5, 1, 6, 2, 7, 10, 11, 3, 8, 12, 4, 9]], ["FSP", 6, 0, 2, 3], ["FSP", 6, 4, 3, 3], ["RE", 6, [0, 4, 1, 5, 2, 6, 3, 7]], ["CA", 2, 6, 5], ["CHR", 1, "shared", [2]], ["CA", 2, 3, 6], ["CHR", 0, "shared", [3]], ["CA", 1, 4, 6], ["FU", 8, [0, 1]], ["AN", 8, 0, 5], ["FU", 8, [1, 2]], ["AN", 8, 1, 4], ["FU", 8, [2, 3]], ["AN", 8, 2, 6], ["FU", 3, [0, 1]], ["SP", 3, 0, 72, [1], 1], ["AN", 3, 1, 2], ["FFSP", 3, 0, [3, 2], 1, 1], ["AN", 3, 1, 6], ["FU", 1, [0, 1]], ["SP", 1, 0, 18, [1], 1], ["AN", 1, 1, 2], ["FFSP", 1, 0, [3, 2], 1, 1], ["AN", 1, 1, 6], ["PR", 4, 0, "auto_unroll_max_step$512"]]]], "r": [[0.00324239], 0, 2.58894, 1695324368], "v": "v0.6"}
{"i": [["[\"990586ac95c316d6af64e8ddc5165a26\", [8192, 1152], [128, 1152], [128], [8192, 128]]", "rocm -keys=rocm,gpu -max_num_threads=256 -max_shared_memory_per_block=65536 -max_threads_per_block=256 -mcpu=gfx908 -mtriple=amdgcn-amd-amdhsa-hcc -thread_warp_size=64", [-1, 16, 64, 65536, 2147483647, 1024, 16, 64], "", 0, []], [[], [["CI", 5], ["CI", 4], ["SP", 2, 0, 8192, [4, 4, 1, 16], 1], ["SP", 2, 5, 128, [4, 16, 1, 1], 1], ["SP", 2, 10, 1152, [4, 2], 1], ["RE", 2, [0, 5, 1, 6, 2, 7, 10, 11, 3, 8, 12, 4, 9]], ["FSP", 6, 0, 2, 3], ["FSP", 6, 4, 3, 3], ["RE", 6, [0, 4, 1, 5, 2, 6, 3, 7]], ["CA", 2, 6, 5], ["CHR", 1, "shared", [2]], ["CA", 2, 3, 6], ["CHR", 0, "shared", [3]], ["CA", 1, 4, 6], ["FU", 8, [0, 1]], ["AN", 8, 0, 5], ["FU", 8, [1, 2]], ["AN", 8, 1, 4], ["FU", 8, [2, 3]], ["AN", 8, 2, 6], ["FU", 3, [0, 1]], ["SP", 3, 0, 8, [2], 1], ["AN", 3, 1, 2], ["FFSP", 3, 0, [3, 2], 1, 1], ["AN", 3, 1, 6], ["FU", 1, [0, 1]], ["SP", 1, 0, 128, [1], 1], ["AN", 1, 1, 2], ["FFSP", 1, 0, [3, 2], 1, 1], ["AN", 1, 1, 6], ["PR", 4, 0, "auto_unroll_max_step$512"]]]], "r": [[0.0687227], 0, 6.64963, 1695324371], "v": "v0.6"}
{"i": [["[\"990586ac95c316d6af64e8ddc5165a26\", [8192, 1152], [128, 1152], [128], [8192, 128]]", "rocm -keys=rocm,gpu -max_num_threads=256 -max_shared_memory_per_block=65536 -max_threads_per_block=256 -mcpu=gfx908 -mtriple=amdgcn-amd-amdhsa-hcc -thread_warp_size=64", [-1, 16, 64, 65536, 2147483647, 1024, 16, 64], "", 0, []], [[], [["CI", 5], ["CI", 4], ["SP", 2, 0, 8192, [2, 64, 2, 8], 1], ["SP", 2, 5, 128, [4, 1, 2, 2], 1], ["SP", 2, 10, 1152, [6, 1], 1], ["RE", 2, [0, 5, 1, 6, 2, 7, 10, 11, 3, 8, 12, 4, 9]], ["FSP", 6, 0, 2, 3], ["FSP", 6, 4, 3, 3], ["RE", 6, [0, 4, 1, 5, 2, 6, 3, 7]], ["CA", 2, 6, 5], ["CHR", 1, "shared", [2]], ["CA", 2, 3, 6], ["CHR", 0, "shared", [3]], ["CA", 1, 4, 6], ["FU", 8, [0, 1]], ["AN", 8, 0, 5], ["FU", 8, [1, 2]], ["AN", 8, 1, 4], ["FU", 8, [2, 3]], ["AN", 8, 2, 6], ["FU", 3, [0, 1]], ["SP", 3, 0, 24, [3], 1], ["AN", 3, 1, 2], ["FFSP", 3, 0, [3, 2], 1, 1], ["AN", 3, 1, 6], ["FU", 1, [0, 1]], ["SP", 1, 0, 96, [1], 1], ["AN", 1, 1, 2], ["FFSP", 1, 0, [3, 2], 1, 1], ["AN", 1, 1, 6], ["PR", 4, 0, "auto_unroll_max_step$512"]]]], "r": [[0.394193], 0, 15.9921, 1695324373], "v": "v0.6"}
{"i": [["[\"990586ac95c316d6af64e8ddc5165a26\", [8192, 1152], [128, 1152], [128], [8192, 128]]", "rocm -keys=rocm,gpu -max_num_threads=256 -max_shared_memory_per_block=65536 -max_threads_per_block=256 -mcpu=gfx908 -mtriple=amdgcn-amd-amdhsa-hcc -thread_warp_size=64", [-1, 16, 64, 65536, 2147483647, 1024, 16, 64], "", 0, []], [[], [["CI", 5], ["CI", 4], ["SP", 2, 0, 8192, [1, 2, 1, 1], 1], ["SP", 2, 5, 128, [2, 8, 1, 4], 1], ["SP", 2, 10, 1152, [1, 32], 1], ["RE", 2, [0, 5, 1, 6, 2, 7, 10, 11, 3, 8, 12, 4, 9]], ["FSP", 6, 0, 2, 3], ["FSP", 6, 4, 3, 3], ["RE", 6, [0, 4, 1, 5, 2, 6, 3, 7]], ["CA", 2, 6, 5], ["CHR", 1, "shared", [2]], ["CA", 2, 3, 6], ["CHR", 0, "shared", [3]], ["CA", 1, 4, 6], ["FU", 8, [0, 1]], ["AN", 8, 0, 5], ["FU", 8, [1, 2]], ["AN", 8, 1, 4], ["FU", 8, [2, 3]], ["AN", 8, 2, 6], ["FU", 3, [0, 1]], ["SP", 3, 0, 128, [1], 1], ["AN", 3, 1, 2], ["FFSP", 3, 0, [3, 2], 1, 1], ["AN", 3, 1, 6], ["FU", 1, [0, 1]], ["SP", 1, 0, 32, [1], 1], ["AN", 1, 1, 2], ["FFSP", 1, 0, [3, 2], 1, 1], ["AN", 1, 1, 6], ["PR", 4, 0, "auto_unroll_max_step$64"]]]], "r": [[0.0178647], 0, 1.9381, 1695324374], "v": "v0.6"}
{"i": [["[\"990586ac95c316d6af64e8ddc5165a26\", [8192, 1152], [128, 1152], [128], [8192, 128]]", "rocm -keys=rocm,gpu -max_num_threads=256 -max_shared_memory_per_block=65536 -max_threads_per_block=256 -mcpu=gfx908 -mtriple=amdgcn-amd-amdhsa-hcc -thread_warp_size=64", [-1, 16, 64, 65536, 2147483647, 1024, 16, 64], "", 0, []], [[], [["CI", 5], ["CI", 4], ["SP", 2, 0, 8192, [2, 64, 1, 8], 1], ["SP", 2, 5, 128, [1, 1, 1, 64], 1], ["SP", 2, 10, 1152, [6, 2], 1], ["RE", 2, [0, 5, 1, 6, 2, 7, 10, 11, 3, 8, 12, 4, 9]], ["FSP", 6, 0, 2, 3], ["FSP", 6, 4, 3, 3], ["RE", 6, [0, 4, 1, 5, 2, 6, 3, 7]], ["CA", 2, 6, 5], ["CHR", 1, "shared", [2]], ["CA", 2, 3, 6], ["CHR", 0, "shared", [3]], ["CA", 1, 4, 6], ["FU", 8, [0, 1]], ["AN", 8, 0, 5], ["FU", 8, [1, 2]], ["AN", 8, 1, 4], ["FU", 8, [2, 3]], ["AN", 8, 2, 6], ["FU", 3, [0, 1]], ["SP", 3, 0, 768, [4], 1], ["AN", 3, 1, 2], ["FFSP", 3, 0, [3, 2], 1, 1], ["AN", 3, 1, 6], ["FU", 1, [0, 1]], ["SP", 1, 0, 96, [1], 1], ["AN", 1, 1, 2], ["FFSP", 1, 0, [3, 2], 1, 1], ["AN", 1, 1, 6], ["PR", 4, 0, "auto_unroll_max_step$64"]]]], "r": [[0.0513537], 0, 2.64881, 1695324376], "v": "v0.6"}
{"i": [["[\"990586ac95c316d6af64e8ddc5165a26\", [8192, 1152], [128, 1152], [128], [8192, 128]]", "rocm -keys=rocm,gpu -max_num_threads=256 -max_shared_memory_per_block=65536 -max_threads_per_block=256 -mcpu=gfx908 -mtriple=amdgcn-amd-amdhsa-hcc -thread_warp_size=64", [-1, 16, 64, 65536, 2147483647, 1024, 16, 64], "", 0, []], [[], [["CI", 5], ["CI", 4], ["SP", 2, 0, 8192, [1, 2, 64, 4], 1], ["SP", 2, 5, 128, [4, 16, 1, 2], 1], ["SP", 2, 10, 1152, [2, 1], 1], ["RE", 2, [0, 5, 1, 6, 2, 7, 10, 11, 3, 8, 12, 4, 9]], ["FSP", 6, 0, 2, 3], ["FSP", 6, 4, 3, 3], ["RE", 6, [0, 4, 1, 5, 2, 6, 3, 7]], ["CA", 2, 6, 5], ["CHR", 1, "shared", [2]], ["CA", 2, 3, 6], ["CHR", 0, "shared", [3]], ["CA", 1, 4, 6], ["FU", 8, [0, 1]], ["AN", 8, 0, 5], ["FU", 8, [1, 2]], ["AN", 8, 1, 4], ["FU", 8, [2, 3]], ["AN", 8, 2, 6], ["FU", 3, [0, 1]], ["SP", 3, 0, 4, [1], 1], ["AN", 3, 1, 2], ["FFSP", 3, 0, [3, 2], 1, 1], ["AN", 3, 1, 6], ["FU", 1, [0, 1]], ["SP", 1, 0, 256, [1], 1], ["AN", 1, 1, 2], ["FFSP", 1, 0, [3, 2], 1, 1], ["AN", 1, 1, 6], ["PR", 4, 0, "auto_unroll_max_step$64"]]]], "r": [[0.328378], 0, 3.9766, 1695324379], "v": "v0.6"}
{"i": [["[\"990586ac95c316d6af64e8ddc5165a26\", [8192, 1152], [128, 1152], [128], [8192, 128]]", "rocm -keys=rocm,gpu -max_num_threads=256 -max_shared_memory_per_block=65536 -max_threads_per_block=256 -mcpu=gfx908 -mtriple=amdgcn-amd-amdhsa-hcc -thread_warp_size=64", [-1, 16, 64, 65536, 2147483647, 1024, 16, 64], "", 0, []], [[], [["CI", 5], ["CI", 4], ["SP", 2, 0, 8192, [8, 8, 1, 1], 1], ["SP", 2, 5, 128, [2, 8, 4, 1], 1], ["SP", 2, 10, 1152, [2, 2], 1], ["RE", 2, [0, 5, 1, 6, 2, 7, 10, 11, 3, 8, 12, 4, 9]], ["FSP", 6, 0, 2, 3], ["FSP", 6, 4, 3, 3], ["RE", 6, [0, 4, 1, 5, 2, 6, 3, 7]], ["CA", 2, 6, 5], ["CHR", 1, "shared", [2]], ["CA", 2, 3, 6], ["CHR", 0, "shared", [3]], ["CA", 1, 4, 6], ["FU", 8, [0, 1]], ["AN", 8, 0, 5], ["FU", 8, [1, 2]], ["AN", 8, 1, 4], ["FU", 8, [2, 3]], ["AN", 8, 2, 6], ["FU", 3, [0, 1]], ["SP", 3, 0, 16, [16], 1], ["AN", 3, 1, 2], ["FFSP", 3, 0, [3, 2], 1, 1], ["AN", 3, 1, 6], ["FU", 1, [0, 1]], ["SP", 1, 0, 4, [1], 1], ["AN", 1, 1, 2], ["FFSP", 1, 0, [3, 2], 1, 1], ["AN", 1, 1, 6], ["PR", 4, 0, "auto_unroll_max_step$64"]]]], "r": [[0.00148924], 0, 2.38585, 1695324380], "v": "v0.6"}
{"i": [["[\"990586ac95c316d6af64e8ddc5165a26\", [8192, 1152], [128, 1152], [128], [8192, 128]]", "rocm -keys=rocm,gpu -max_num_threads=256 -max_shared_memory_per_block=65536 -max_threads_per_block=256 -mcpu=gfx908 -mtriple=amdgcn-amd-amdhsa-hcc -thread_warp_size=64", [-1, 16, 64, 65536, 2147483647, 1024, 16, 64], "", 0, []], [[], [["CI", 5], ["CI", 4], ["SP", 2, 0, 8192, [2, 8, 64, 1], 1], ["SP", 2, 5, 128, [1, 16, 8, 1], 1], ["SP", 2, 10, 1152, [1, 2], 1], ["RE", 2, [0, 5, 1, 6, 2, 7, 10, 11, 3, 8, 12, 4, 9]], ["FSP", 6, 0, 2, 3], ["FSP", 6, 4, 3, 3], ["RE", 6, [0, 4, 1, 5, 2, 6, 3, 7]], ["CA", 2, 6, 5], ["CHR", 1, "shared", [2]], ["CA", 2, 3, 6], ["CHR", 0, "shared", [3]], ["CA", 1, 4, 6], ["FU", 8, [0, 1]], ["AN", 8, 0, 5], ["FU", 8, [1, 2]], ["AN", 8, 1, 4], ["FU", 8, [2, 3]], ["AN", 8, 2, 6], ["FU", 3, [0, 1]], ["SP", 3, 0, 16, [1], 1], ["AN", 3, 1, 2], ["FFSP", 3, 0, [3, 2], 1, 1], ["AN", 3, 1, 6], ["FU", 1, [0, 1]], ["SP", 1, 0, 128, [1], 1], ["AN", 1, 1, 2], ["FFSP", 1, 0, [3, 2], 1, 1], ["AN", 1, 1, 6], ["PR", 4, 0, "auto_unroll_max_step$1024"]]]], "r": [[0.0276361], 0, 2.29217, 1695324381], "v": "v0.6"}
{"i": [["[\"990586ac95c316d6af64e8ddc5165a26\", [8192, 1152], [128, 1152], [128], [8192, 128]]", "rocm -keys=rocm,gpu -max_num_threads=256 -max_shared_memory_per_block=65536 -max_threads_per_block=256 -mcpu=gfx908 -mtriple=amdgcn-amd-amdhsa-hcc -thread_warp_size=64", [-1, 16, 64, 65536, 2147483647, 1024, 16, 64], "", 0, []], [[], [["CI", 5], ["CI", 4], ["SP", 2, 0, 8192, [8, 2, 1, 32], 1], ["SP", 2, 5, 128, [1, 4, 4, 4], 1], ["SP", 2, 10, 1152, [2, 8], 1], ["RE", 2, [0, 5, 1, 6, 2, 7, 10, 11, 3, 8, 12, 4, 9]], ["FSP", 6, 0, 2, 3], ["FSP", 6, 4, 3, 3], ["RE", 6, [0, 4, 1, 5, 2, 6, 3, 7]], ["CA", 2, 6, 5], ["CHR", 1, "shared", [2]], ["CA", 2, 3, 6], ["CHR", 0, "shared", [3]], ["CA", 1, 4, 6], ["FU", 8, [0, 1]], ["AN", 8, 0, 5], ["FU", 8, [1, 2]], ["AN", 8, 1, 4], ["FU", 8, [2, 3]], ["AN", 8, 2, 6], ["FU", 3, [0, 1]], ["SP", 3, 0, 256, [1], 1], ["AN", 3, 1, 2], ["FFSP", 3, 0, [3, 2], 1, 1], ["AN", 3, 1, 6], ["FU", 1, [0, 1]], ["SP", 1, 0, 64, [1], 1], ["AN", 1, 1, 2], ["FFSP", 1, 0, [3, 2], 1, 1], ["AN", 1, 1, 6], ["PR", 4, 0, "auto_unroll_max_step$64"]]]], "r": [[0.356702], 0, 3.95986, 1695324384], "v": "v0.6"}
{"i": [["[\"990586ac95c316d6af64e8ddc5165a26\", [8192, 1152], [128, 1152], [128], [8192, 128]]", "rocm -keys=rocm,gpu -max_num_threads=256 -max_shared_memory_per_block=65536 -max_threads_per_block=256 -mcpu=gfx908 -mtriple=amdgcn-amd-amdhsa-hcc -thread_warp_size=64", [-1, 16, 64, 65536, 2147483647, 1024, 16, 64], "", 0, []], [[], [["CI", 5], ["CI", 4], ["SP", 2, 0, 8192, [2, 512, 2, 1], 1], ["SP", 2, 5, 128, [1, 2, 8, 8], 1], ["SP", 2, 10, 1152, [2, 2], 1], ["RE", 2, [0, 5, 1, 6, 2, 7, 10, 11, 3, 8, 12, 4, 9]], ["FSP", 6, 0, 2, 3], ["FSP", 6, 4, 3, 3], ["RE", 6, [0, 4, 1, 5, 2, 6, 3, 7]], ["CA", 2, 6, 5], ["CHR", 1, "shared", [2]], ["CA", 2, 3, 6], ["CHR", 0, "shared", [3]], ["CA", 1, 4, 6], ["FU", 8, [0, 1]], ["AN", 8, 0, 5], ["FU", 8, [1, 2]], ["AN", 8, 1, 4], ["FU", 8, [2, 3]], ["AN", 8, 2, 6], ["FU", 3, [0, 1]], ["SP", 3, 0, 256, [64], 1], ["AN", 3, 1, 2], ["FFSP", 3, 0, [3, 2], 1, 1], ["AN", 3, 1, 6], ["FU", 1, [0, 1]], ["SP", 1, 0, 8, [1], 1], ["AN", 1, 1, 2], ["FFSP", 1, 0, [3, 2], 1, 1], ["AN", 1, 1, 6], ["PR", 4, 0, "auto_unroll_max_step$0"]]]], "r": [[0.0333114], 0, 2.54636, 1695324386], "v": "v0.6"}
{"i": [["[\"990586ac95c316d6af64e8ddc5165a26\", [8192, 1152], [128, 1152], [128], [8192, 128]]", "rocm -keys=rocm,gpu -max_num_threads=256 -max_shared_memory_per_block=65536 -max_threads_per_block=256 -mcpu=gfx908 -mtriple=amdgcn-amd-amdhsa-hcc -thread_warp_size=64", [-1, 16, 64, 65536, 2147483647, 1024, 16, 64], "", 0, []], [[], [["CI", 5], ["CI", 4], ["SP", 2, 0, 8192, [2, 64, 1, 2], 1], ["SP", 2, 5, 128, [4, 4, 1, 8], 1], ["SP", 2, 10, 1152, [2, 2], 1], ["RE", 2, [0, 5, 1, 6, 2, 7, 10, 11, 3, 8, 12, 4, 9]], ["FSP", 6, 0, 2, 3], ["FSP", 6, 4, 3, 3], ["RE", 6, [0, 4, 1, 5, 2, 6, 3, 7]], ["CA", 2, 6, 5], ["CHR", 1, "shared", [2]], ["CA", 2, 3, 6], ["CHR", 0, "shared", [3]], ["CA", 1, 4, 6], ["FU", 8, [0, 1]], ["AN", 8, 0, 5], ["FU", 8, [1, 2]], ["AN", 8, 1, 4], ["FU", 8, [2, 3]], ["AN", 8, 2, 6], ["FU", 3, [0, 1]], ["SP", 3, 0, 16, [1], 1], ["AN", 3, 1, 2], ["FFSP", 3, 0, [3, 2], 1, 1], ["AN", 3, 1, 6], ["FU", 1, [0, 1]], ["SP", 1, 0, 8, [8], 1], ["AN", 1, 1, 2], ["FFSP", 1, 0, [3, 2], 1, 1], ["AN", 1, 1, 6], ["PR", 4, 0, "auto_unroll_max_step$64"]]]], "r": [[0.00878945], 0, 3.57386, 1695324387], "v": "v0.6"}
{"i": [["[\"990586ac95c316d6af64e8ddc5165a26\", [8192, 1152], [128, 1152], [128], [8192, 128]]", "rocm -keys=rocm,gpu -max_num_threads=256 -max_shared_memory_per_block=65536 -max_threads_per_block=256 -mcpu=gfx908 -mtriple=amdgcn-amd-amdhsa-hcc -thread_warp_size=64", [-1, 16, 64, 65536, 2147483647, 1024, 16, 64], "", 0, []], [[], [["CI", 5], ["CI", 4], ["SP", 2, 0, 8192, [1, 64, 16, 1], 1], ["SP", 2, 5, 128, [1, 2, 32, 1], 1], ["SP", 2, 10, 1152, [3, 4], 1], ["RE", 2, [0, 5, 1, 6, 2, 7, 10, 11, 3, 8, 12, 4, 9]], ["FSP", 6, 0, 2, 3], ["FSP", 6, 4, 3, 3], ["RE", 6, [0, 4, 1, 5, 2, 6, 3, 7]], ["CA", 2, 6, 5], ["CHR", 1, "shared", [2]], ["CA", 2, 3, 6], ["CHR", 0, "shared", [3]], ["CA", 1, 4, 6], ["FU", 8, [0, 1]], ["AN", 8, 0, 5], ["FU", 8, [1, 2]], ["AN", 8, 1, 4], ["FU", 8, [2, 3]], ["AN", 8, 2, 6], ["FU", 3, [0, 1]], ["SP", 3, 0, 96, [1], 1], ["AN", 3, 1, 2], ["FFSP", 3, 0, [3, 2], 1, 1], ["AN", 3, 1, 6], ["FU", 1, [0, 1]], ["SP", 1, 0, 96, [1], 1], ["AN", 1, 1, 2], ["FFSP", 1, 0, [3, 2], 1, 1], ["AN", 1, 1, 6], ["PR", 4, 0, "auto_unroll_max_step$1024"]]]], "r": [[0.0354724], 0, 4.56023, 1695324389], "v": "v0.6"}
{"i": [["[\"990586ac95c316d6af64e8ddc5165a26\", [8192, 1152], [128, 1152], [128], [8192, 128]]", "rocm -keys=rocm,gpu -max_num_threads=256 -max_shared_memory_per_block=65536 -max_threads_per_block=256 -mcpu=gfx908 -mtriple=amdgcn-amd-amdhsa-hcc -thread_warp_size=64", [-1, 16, 64, 65536, 2147483647, 1024, 16, 64], "", 0, []], [[], [["CI", 5], ["CI", 4], ["SP", 2, 0, 8192, [4, 8, 8, 16], 1], ["SP", 2, 5, 128, [2, 16, 1, 2], 1], ["SP", 2, 10, 1152, [2, 1], 1], ["RE", 2, [0, 5, 1, 6, 2, 7, 10, 11, 3, 8, 12, 4, 9]], ["FSP", 6, 0, 2, 3], ["FSP", 6, 4, 3, 3], ["RE", 6, [0, 4, 1, 5, 2, 6, 3, 7]], ["CA", 2, 6, 5], ["CHR", 1, "shared", [2]], ["CA", 2, 3, 6], ["CHR", 0, "shared", [3]], ["CA", 1, 4, 6], ["FU", 8, [0, 1]], ["AN", 8, 0, 5], ["FU", 8, [1, 2]], ["AN", 8, 1, 4], ["FU", 8, [2, 3]], ["AN", 8, 2, 6], ["FU", 3, [0, 1]], ["SP", 3, 0, 4, [4], 1], ["AN", 3, 1, 2], ["FFSP", 3, 0, [3, 2], 1, 1], ["AN", 3, 1, 6], ["FU", 1, [0, 1]], ["SP", 1, 0, 256, [1], 1], ["AN", 1, 1, 2], ["FFSP", 1, 0, [3, 2], 1, 1], ["AN", 1, 1, 6], ["PR", 4, 0, "auto_unroll_max_step$64"]]]], "r": [[0.083994], 0, 2.93889, 1695324390], "v": "v0.6"}
{"i": [["[\"990586ac95c316d6af64e8ddc5165a26\", [8192, 1152], [128, 1152], [128], [8192, 128]]", "rocm -keys=rocm,gpu -max_num_threads=256 -max_shared_memory_per_block=65536 -max_threads_per_block=256 -mcpu=gfx908 -mtriple=amdgcn-amd-amdhsa-hcc -thread_warp_size=64", [-1, 16, 64, 65536, 2147483647, 1024, 16, 64], "", 0, []], [[], [["CI", 5], ["CI", 4], ["SP", 2, 0, 8192, [1, 32, 32, 1], 1], ["SP", 2, 5, 128, [1, 2, 32, 1], 1], ["SP", 2, 10, 1152, [3, 1], 1], ["RE", 2, [0, 5, 1, 6, 2, 7, 10, 11, 3, 8, 12, 4, 9]], ["FSP", 6, 0, 2, 3], ["FSP", 6, 4, 3, 3], ["RE", 6, [0, 4, 1, 5, 2, 6, 3, 7]], ["CA", 2, 6, 5], ["CHR", 1, "shared", [2]], ["CA", 2, 3, 6], ["CHR", 0, "shared", [3]], ["CA", 1, 4, 6], ["FU", 8, [0, 1]], ["AN", 8, 0, 5], ["FU", 8, [1, 2]], ["AN", 8, 1, 4], ["FU", 8, [2, 3]], ["AN", 8, 2, 6], ["FU", 3, [0, 1]], ["SP", 3, 0, 96, [8], 1], ["AN", 3, 1, 2], ["FFSP", 3, 0, [3, 2], 1, 1], ["AN", 3, 1, 6], ["FU", 1, [0, 1]], ["SP", 1, 0, 96, [1], 1], ["AN", 1, 1, 2], ["FFSP", 1, 0, [3, 2], 1, 1], ["AN", 1, 1, 6], ["PR", 4, 0, "auto_unroll_max_step$1024"]]]], "r": [[0.279176], 0, 14.3022, 1695324393], "v": "v0.6"}
{"i": [["[\"990586ac95c316d6af64e8ddc5165a26\", [8192, 1152], [128, 1152], [128], [8192, 128]]", "rocm -keys=rocm,gpu -max_num_threads=256 -max_shared_memory_per_block=65536 -max_threads_per_block=256 -mcpu=gfx908 -mtriple=amdgcn-amd-amdhsa-hcc -thread_warp_size=64", [-1, 16, 64, 65536, 2147483647, 1024, 16, 64], "", 0, []], [[], [["CI", 5], ["CI", 4], ["SP", 2, 0, 8192, [1, 16, 1, 4], 1], ["SP", 2, 5, 128, [16, 4, 1, 2], 1], ["SP", 2, 10, 1152, [6, 8], 1], ["RE", 2, [0, 5, 1, 6, 2, 7, 10, 11, 3, 8, 12, 4, 9]], ["FSP", 6, 0, 2, 3], ["FSP", 6, 4, 3, 3], ["RE", 6, [0, 4, 1, 5, 2, 6, 3, 7]], ["CA", 2, 6, 5], ["CHR", 1, "shared", [2]], ["CA", 2, 3, 6], ["CHR", 0, "shared", [3]], ["CA", 1, 4, 6], ["FU", 8, [0, 1]], ["AN", 8, 0, 5], ["FU", 8, [1, 2]], ["AN", 8, 1, 4], ["FU", 8, [2, 3]], ["AN", 8, 2, 6], ["FU", 3, [0, 1]], ["SP", 3, 0, 96, [1], 1], ["AN", 3, 1, 2], ["FFSP", 3, 0, [3, 2], 1, 1], ["AN", 3, 1, 6], ["FU", 1, [0, 1]], ["SP", 1, 0, 192, [1], 1], ["AN", 1, 1, 2], ["FFSP", 1, 0, [3, 2], 1, 1], ["AN", 1, 1, 6], ["PR", 4, 0, "auto_unroll_max_step$64"]]]], "r": [[0.104337], 0, 3.626, 1695324395], "v": "v0.6"}
{"i": [["[\"990586ac95c316d6af64e8ddc5165a26\", [8192, 1152], [128, 1152], [128], [8192, 128]]", "rocm -keys=rocm,gpu -max_num_threads=256 -max_shared_memory_per_block=65536 -max_threads_per_block=256 -mcpu=gfx908 -mtriple=amdgcn-amd-amdhsa-hcc -thread_warp_size=64", [-1, 16, 64, 65536, 2147483647, 1024, 16, 64], "", 0, []], [[], [["CI", 5], ["CI", 4], ["SP", 2, 0, 8192, [1, 128, 1, 2], 1], ["SP", 2, 5, 128, [4, 2, 2, 1], 1], ["SP", 2, 10, 1152, [1, 12], 1], ["RE", 2, [0, 5, 1, 6, 2, 7, 10, 11, 3, 8, 12, 4, 9]], ["FSP", 6, 0, 2, 3], ["FSP", 6, 4, 3, 3], ["RE", 6, [0, 4, 1, 5, 2, 6, 3, 7]], ["CA", 2, 6, 5], ["CHR", 1, "shared", [2]], ["CA", 2, 3, 6], ["CHR", 0, "shared", [3]], ["CA", 1, 4, 6], ["FU", 8, [0, 1]], ["AN", 8, 0, 5], ["FU", 8, [1, 2]], ["AN", 8, 1, 4], ["FU", 8, [2, 3]], ["AN", 8, 2, 6], ["FU", 3, [0, 1]], ["SP", 3, 0, 12, [2], 1], ["AN", 3, 1, 2], ["FFSP", 3, 0, [3, 2], 1, 1], ["AN", 3, 1, 6], ["FU", 1, [0, 1]], ["SP", 1, 0, 24, [1], 1], ["AN", 1, 1, 2], ["FFSP", 1, 0, [3, 2], 1, 1], ["AN", 1, 1, 6], ["PR", 4, 0, "auto_unroll_max_step$16"]]]], "r": [[0.00120352], 0, 2.17794, 1695324396], "v": "v0.6"}
{"i": [["[\"990586ac95c316d6af64e8ddc5165a26\", [8192, 1152], [128, 1152], [128], [8192, 128]]", "rocm -keys=rocm,gpu -max_num_threads=256 -max_shared_memory_per_block=65536 -max_threads_per_block=256 -mcpu=gfx908 -mtriple=amdgcn-amd-amdhsa-hcc -thread_warp_size=64", [-1, 16, 64, 65536, 2147483647, 1024, 16, 64], "", 0, []], [[], [["CI", 5], ["CI", 4], ["SP", 2, 0, 8192, [2, 1, 16, 4], 1], ["SP", 2, 5, 128, [1, 4, 2, 16], 1], ["SP", 2, 10, 1152, [1, 3], 1], ["RE", 2, [0, 5, 1, 6, 2, 7, 10, 11, 3, 8, 12, 4, 9]], ["FSP", 6, 0, 2, 3], ["FSP", 6, 4, 3, 3], ["RE", 6, [0, 4, 1, 5, 2, 6, 3, 7]], ["CA", 2, 6, 5], ["CHR", 1, "shared", [2]], ["CA", 2, 3, 6], ["CHR", 0, "shared", [3]], ["CA", 1, 4, 6], ["FU", 8, [0, 1]], ["AN", 8, 0, 5], ["FU", 8, [1, 2]], ["AN", 8, 1, 4], ["FU", 8, [2, 3]], ["AN", 8, 2, 6], ["FU", 3, [0, 1]], ["SP", 3, 0, 96, [1], 1], ["AN", 3, 1, 2], ["FFSP", 3, 0, [3, 2], 1, 1], ["AN", 3, 1, 6], ["FU", 1, [0, 1]], ["SP", 1, 0, 3072, [1], 1], ["AN", 1, 1, 2], ["FFSP", 1, 0, [3, 2], 1, 1], ["AN", 1, 1, 6], ["PR", 4, 0, "auto_unroll_max_step$1024"]]]], "r": [[1.61187], 0, 24.0214, 1695324404], "v": "v0.6"}
{"i": [["[\"990586ac95c316d6af64e8ddc5165a26\", [8192, 1152], [128, 1152], [128], [8192, 128]]", "rocm -keys=rocm,gpu -max_num_threads=256 -max_shared_memory_per_block=65536 -max_threads_per_block=256 -mcpu=gfx908 -mtriple=amdgcn-amd-amdhsa-hcc -thread_warp_size=64", [-1, 16, 64, 65536, 2147483647, 1024, 16, 64], "", 0, []], [[], [["CI", 5], ["CI", 4], ["SP", 2, 0, 8192, [1, 32, 1, 16], 1], ["SP", 2, 5, 128, [8, 2, 4, 1], 1], ["SP", 2, 10, 1152, [3, 2], 1], ["RE", 2, [0, 5, 1, 6, 2, 7, 10, 11, 3, 8, 12, 4, 9]], ["FSP", 6, 0, 2, 3], ["FSP", 6, 4, 3, 3], ["RE", 6, [0, 4, 1, 5, 2, 6, 3, 7]], ["CA", 2, 6, 5], ["CHR", 1, "shared", [2]], ["CA", 2, 3, 6], ["CHR", 0, "shared", [3]], ["CA", 1, 4, 6], ["FU", 8, [0, 1]], ["AN", 8, 0, 5], ["FU", 8, [1, 2]], ["AN", 8, 1, 4], ["FU", 8, [2, 3]], ["AN", 8, 2, 6], ["FU", 3, [0, 1]], ["SP", 3, 0, 24, [8], 1], ["AN", 3, 1, 2], ["FFSP", 3, 0, [3, 2], 1, 1], ["AN", 3, 1, 6], ["FU", 1, [0, 1]], ["SP", 1, 0, 96, [1], 1], ["AN", 1, 1, 2], ["FFSP", 1, 0, [3, 2], 1, 1], ["AN", 1, 1, 6], ["PR", 4, 0, "auto_unroll_max_step$1024"]]]], "r": [[0.136207], 0, 10.32, 1695324406], "v": "v0.6"}
{"i": [["[\"990586ac95c316d6af64e8ddc5165a26\", [8192, 1152], [128, 1152], [128], [8192, 128]]", "rocm -keys=rocm,gpu -max_num_threads=256 -max_shared_memory_per_block=65536 -max_threads_per_block=256 -mcpu=gfx908 -mtriple=amdgcn-amd-amdhsa-hcc -thread_warp_size=64", [-1, 16, 64, 65536, 2147483647, 1024, 16, 64], "", 0, []], [[], [["CI", 5], ["CI", 4], ["SP", 2, 0, 8192, [16, 128, 1, 1], 1], ["SP", 2, 5, 128, [1, 8, 1, 8], 1], ["SP", 2, 10, 1152, [2, 1], 1], ["RE", 2, [0, 5, 1, 6, 2, 7, 10, 11, 3, 8, 12, 4, 9]], ["FSP", 6, 0, 2, 3], ["FSP", 6, 4, 3, 3], ["RE", 6, [0, 4, 1, 5, 2, 6, 3, 7]], ["CA", 2, 6, 5], ["CHR", 1, "shared", [2]], ["CA", 2, 3, 6], ["CHR", 0, "shared", [3]], ["CA", 1, 4, 6], ["FU", 8, [0, 1]], ["AN", 8, 0, 5], ["FU", 8, [1, 2]], ["AN", 8, 1, 4], ["FU", 8, [2, 3]], ["AN", 8, 2, 6], ["FU", 3, [0, 1]], ["SP", 3, 0, 32, [1], 1], ["AN", 3, 1, 2], ["FFSP", 3, 0, [3, 2], 1, 1], ["AN", 3, 1, 6], ["FU", 1, [0, 1]], ["SP", 1, 0, 4, [2], 1], ["AN", 1, 1, 2], ["FFSP", 1, 0, [3, 2], 1, 1], ["AN", 1, 1, 6], ["PR", 4, 0, "auto_unroll_max_step$64"]]]], "r": [[0.0290215], 0, 3.42667, 1695324407], "v": "v0.6"}
{"i": [["[\"990586ac95c316d6af64e8ddc5165a26\", [8192, 1152], [128, 1152], [128], [8192, 128]]", "rocm -keys=rocm,gpu -max_num_threads=256 -max_shared_memory_per_block=65536 -max_threads_per_block=256 -mcpu=gfx908 -mtriple=amdgcn-amd-amdhsa-hcc -thread_warp_size=64", [-1, 16, 64, 65536, 2147483647, 1024, 16, 64], "", 0, []], [[], [["CI", 5], ["CI", 4], ["SP", 2, 0, 8192, [8, 8, 1, 1], 1], ["SP", 2, 5, 128, [2, 8, 4, 1], 1], ["SP", 2, 10, 1152, [2, 2], 1], ["RE", 2, [0, 5, 1, 6, 2, 7, 10, 11, 3, 8, 12, 4, 9]], ["FSP", 6, 0, 2, 3], ["FSP", 6, 4, 3, 3], ["RE", 6, [0, 4, 1, 5, 2, 6, 3, 7]], ["CA", 2, 6, 5], ["CHR", 1, "shared", [2]], ["CA", 2, 3, 6], ["CHR", 0, "shared", [3]], ["CA", 1, 4, 6], ["FU", 8, [0, 1]], ["AN", 8, 0, 5], ["FU", 8, [1, 2]], ["AN", 8, 1, 4], ["FU", 8, [2, 3]], ["AN", 8, 2, 6], ["FU", 3, [0, 1]], ["SP", 3, 0, 16, [2], 1], ["AN", 3, 1, 2], ["FFSP", 3, 0, [3, 2], 1, 1], ["AN", 3, 1, 6], ["FU", 1, [0, 1]], ["SP", 1, 0, 4, [1], 1], ["AN", 1, 1, 2], ["FFSP", 1, 0, [3, 2], 1, 1], ["AN", 1, 1, 6], ["PR", 4, 0, "auto_unroll_max_step$512"]]]], "r": [[0.00124063], 0, 2.51795, 1695324409], "v": "v0.6"}
{"i": [["[\"990586ac95c316d6af64e8ddc5165a26\", [8192, 1152], [128, 1152], [128], [8192, 128]]", "rocm -keys=rocm,gpu -max_num_threads=256 -max_shared_memory_per_block=65536 -max_threads_per_block=256 -mcpu=gfx908 -mtriple=amdgcn-amd-amdhsa-hcc -thread_warp_size=64", [-1, 16, 64, 65536, 2147483647, 1024, 16, 64], "", 0, []], [[], [["CI", 5], ["CI", 4], ["SP", 2, 0, 8192, [1, 8, 2, 2], 1], ["SP", 2, 5, 128, [2, 8, 4, 1], 1], ["SP", 2, 10, 1152, [2, 18], 1], ["RE", 2, [0, 5, 1, 6, 2, 7, 10, 11, 3, 8, 12, 4, 9]], ["FSP", 6, 0, 2, 3], ["FSP", 6, 4, 3, 3], ["RE", 6, [0, 4, 1, 5, 2, 6, 3, 7]], ["CA", 2, 6, 5], ["CHR", 1, "shared", [2]], ["CA", 2, 3, 6], ["CHR", 0, "shared", [3]], ["CA", 1, 4, 6], ["FU", 8, [0, 1]], ["AN", 8, 0, 5], ["FU", 8, [1, 2]], ["AN", 8, 1, 4], ["FU", 8, [2, 3]], ["AN", 8, 2, 6], ["FU", 3, [0, 1]], ["SP", 3, 0, 144, [2], 1], ["AN", 3, 1, 2], ["FFSP", 3, 0, [3, 2], 1, 1], ["AN", 3, 1, 6], ["FU", 1, [0, 1]], ["SP", 1, 0, 144, [1], 1], ["AN", 1, 1, 2], ["FFSP", 1, 0, [3, 2], 1, 1], ["AN", 1, 1, 6], ["PR", 4, 0, "auto_unroll_max_step$512"]]]], "r": [[0.0173763], 0, 4.06773, 1695324410], "v": "v0.6"}
{"i": [["[\"990586ac95c316d6af64e8ddc5165a26\", [8192, 1152], [128, 1152], [128], [8192, 128]]", "rocm -keys=rocm,gpu -max_num_threads=256 -max_shared_memory_per_block=65536 -max_threads_per_block=256 -mcpu=gfx908 -mtriple=amdgcn-amd-amdhsa-hcc -thread_warp_size=64", [-1, 16, 64, 65536, 2147483647, 1024, 16, 64], "", 0, []], [[], [["CI", 5], ["CI", 4], ["SP", 2, 0, 8192, [1, 32, 32, 1], 1], ["SP", 2, 5, 128, [1, 2, 32, 1], 1], ["SP", 2, 10, 1152, [3, 1], 1], ["RE", 2, [0, 5, 1, 6, 2, 7, 10, 11, 3, 8, 12, 4, 9]], ["FSP", 6, 0, 2, 3], ["FSP", 6, 4, 3, 3], ["RE", 6, [0, 4, 1, 5, 2, 6, 3, 7]], ["CA", 2, 6, 5], ["CHR", 1, "shared", [2]], ["CA", 2, 3, 6], ["CHR", 0, "shared", [3]], ["CA", 1, 4, 6], ["FU", 8, [0, 1]], ["AN", 8, 0, 5], ["FU", 8, [1, 2]], ["AN", 8, 1, 4], ["FU", 8, [2, 3]], ["AN", 8, 2, 6], ["FU", 3, [0, 1]], ["SP", 3, 0, 96, [32], 1], ["AN", 3, 1, 2], ["FFSP", 3, 0, [3, 2], 1, 1], ["AN", 3, 1, 6], ["FU", 1, [0, 1]], ["SP", 1, 0, 96, [1], 1], ["AN", 1, 1, 2], ["FFSP", 1, 0, [3, 2], 1, 1], ["AN", 1, 1, 6], ["PR", 4, 0, "auto_unroll_max_step$1024"]]]], "r": [[0.281681], 0, 13.0657, 1695324413], "v": "v0.6"}
{"i": [["[\"990586ac95c316d6af64e8ddc5165a26\", [8192, 1152], [128, 1152], [128], [8192, 128]]", "rocm -keys=rocm,gpu -max_num_threads=256 -max_shared_memory_per_block=65536 -max_threads_per_block=256 -mcpu=gfx908 -mtriple=amdgcn-amd-amdhsa-hcc -thread_warp_size=64", [-1, 16, 64, 65536, 2147483647, 1024, 16, 64], "", 0, []], [[], [["CI", 5], ["CI", 4], ["SP", 2, 0, 8192, [16, 4, 2, 16], 1], ["SP", 2, 5, 128, [1, 8, 4, 1], 1], ["SP", 2, 10, 1152, [3, 2], 1], ["RE", 2, [0, 5, 1, 6, 2, 7, 10, 11, 3, 8, 12, 4, 9]], ["FSP", 6, 0, 2, 3], ["FSP", 6, 4, 3, 3], ["RE", 6, [0, 4, 1, 5, 2, 6, 3, 7]], ["CA", 2, 6, 5], ["CHR", 1, "shared", [2]], ["CA", 2, 3, 6], ["CHR", 0, "shared", [3]], ["CA", 1, 4, 6], ["FU", 8, [0, 1]], ["AN", 8, 0, 5], ["FU", 8, [1, 2]], ["AN", 8, 1, 4], ["FU", 8, [2, 3]], ["AN", 8, 2, 6], ["FU", 3, [0, 1]], ["SP", 3, 0, 24, [1], 1], ["AN", 3, 1, 2], ["FFSP", 3, 0, [3, 2], 1, 1], ["AN", 3, 1, 6], ["FU", 1, [0, 1]], ["SP", 1, 0, 192, [1], 1], ["AN", 1, 1, 2], ["FFSP", 1, 0, [3, 2], 1, 1], ["AN", 1, 1, 6], ["PR", 4, 0, "auto_unroll_max_step$16"]]]], "r": [[0.333006], 0, 3.8865, 1695324415], "v": "v0.6"}
{"i": [["[\"990586ac95c316d6af64e8ddc5165a26\", [8192, 1152], [128, 1152], [128], [8192, 128]]", "rocm -keys=rocm,gpu -max_num_threads=256 -max_shared_memory_per_block=65536 -max_threads_per_block=256 -mcpu=gfx908 -mtriple=amdgcn-amd-amdhsa-hcc -thread_warp_size=64", [-1, 16, 64, 65536, 2147483647, 1024, 16, 64], "", 0, []], [[], [["CI", 5], ["CI", 4], ["SP", 2, 0, 8192, [1, 2, 64, 4], 1], ["SP", 2, 5, 128, [4, 16, 1, 2], 1], ["SP", 2, 10, 1152, [6, 1], 1], ["RE", 2, [0, 5, 1, 6, 2, 7, 10, 11, 3, 8, 12, 4, 9]], ["FSP", 6, 0, 2, 3], ["FSP", 6, 4, 3, 3], ["RE", 6, [0, 4, 1, 5, 2, 6, 3, 7]], ["CA", 2, 6, 5], ["CHR", 1, "shared", [2]], ["CA", 2, 3, 6], ["CHR", 0, "shared", [3]], ["CA", 1, 4, 6], ["FU", 8, [0, 1]], ["AN", 8, 0, 5], ["FU", 8, [1, 2]], ["AN", 8, 1, 4], ["FU", 8, [2, 3]], ["AN", 8, 2, 6], ["FU", 3, [0, 1]], ["SP", 3, 0, 4, [1], 1], ["AN", 3, 1, 2], ["FFSP", 3, 0, [3, 2], 1, 1], ["AN", 3, 1, 6], ["FU", 1, [0, 1]], ["SP", 1, 0, 256, [1], 1], ["AN", 1, 1, 2], ["FFSP", 1, 0, [3, 2], 1, 1], ["AN", 1, 1, 6], ["PR", 4, 0, "auto_unroll_max_step$64"]]]], "r": [[0.561865], 0, 4.41917, 1695324419], "v": "v0.6"}
{"i": [["[\"990586ac95c316d6af64e8ddc5165a26\", [8192, 1152], [128, 1152], [128], [8192, 128]]", "rocm -keys=rocm,gpu -max_num_threads=256 -max_shared_memory_per_block=65536 -max_threads_per_block=256 -mcpu=gfx908 -mtriple=amdgcn-amd-amdhsa-hcc -thread_warp_size=64", [-1, 16, 64, 65536, 2147483647, 1024, 16, 64], "", 0, []], [[], [["CI", 5], ["CI", 4], ["SP", 2, 0, 8192, [1, 32, 32, 1], 1], ["SP", 2, 5, 128, [1, 2, 32, 1], 1], ["SP", 2, 10, 1152, [3, 1], 1], ["RE", 2, [0, 5, 1, 6, 2, 7, 10, 11, 3, 8, 12, 4, 9]], ["FSP", 6, 0, 2, 3], ["FSP", 6, 4, 3, 3], ["RE", 6, [0, 4, 1, 5, 2, 6, 3, 7]], ["CA", 2, 6, 5], ["CHR", 1, "shared", [2]], ["CA", 2, 3, 6], ["CHR", 0, "shared", [3]], ["CA", 1, 4, 6], ["FU", 8, [0, 1]], ["AN", 8, 0, 5], ["FU", 8, [1, 2]], ["AN", 8, 1, 4], ["FU", 8, [2, 3]], ["AN", 8, 2, 6], ["FU", 3, [0, 1]], ["SP", 3, 0, 96, [1], 1], ["AN", 3, 1, 2], ["FFSP", 3, 0, [3, 2], 1, 1], ["AN", 3, 1, 6], ["FU", 1, [0, 1]], ["SP", 1, 0, 96, [32], 1], ["AN", 1, 1, 2], ["FFSP", 1, 0, [3, 2], 1, 1], ["AN", 1, 1, 6], ["PR", 4, 0, "auto_unroll_max_step$1024"]]]], "r": [[0.277569], 0, 13.5148, 1695324421], "v": "v0.6"}
{"i": [["[\"990586ac95c316d6af64e8ddc5165a26\", [8192, 1152], [128, 1152], [128], [8192, 128]]", "rocm -keys=rocm,gpu -max_num_threads=256 -max_shared_memory_per_block=65536 -max_threads_per_block=256 -mcpu=gfx908 -mtriple=amdgcn-amd-amdhsa-hcc -thread_warp_size=64", [-1, 16, 64, 65536, 2147483647, 1024, 16, 64], "", 0, []], [[], [["CI", 5], ["CI", 4], ["SP", 2, 0, 8192, [2, 64, 2, 1], 1], ["SP", 2, 5, 128, [1, 4, 2, 2], 1], ["SP", 2, 10, 1152, [1, 9], 1], ["RE", 2, [0, 5, 1, 6, 2, 7, 10, 11, 3, 8, 12, 4, 9]], ["FSP", 6, 0, 2, 3], ["FSP", 6, 4, 3, 3], ["RE", 6, [0, 4, 1, 5, 2, 6, 3, 7]], ["CA", 2, 6, 5], ["CHR", 1, "shared", [2]], ["CA", 2, 3, 6], ["CHR", 0, "shared", [3]], ["CA", 1, 4, 6], ["FU", 8, [0, 1]], ["AN", 8, 0, 5], ["FU", 8, [1, 2]], ["AN", 8, 1, 4], ["FU", 8, [2, 3]], ["AN", 8, 2, 6], ["FU", 3, [0, 1]], ["SP", 3, 0, 36, [1], 1], ["AN", 3, 1, 2], ["FFSP", 3, 0, [3, 2], 1, 1], ["AN", 3, 1, 6], ["FU", 1, [0, 1]], ["SP", 1, 0, 18, [1], 1], ["AN", 1, 1, 2], ["FFSP", 1, 0, [3, 2], 1, 1], ["AN", 1, 1, 6], ["PR", 4, 0, "auto_unroll_max_step$16"]]]], "r": [[0.00163598], 0, 2.54078, 1695324423], "v": "v0.6"}
{"i": [["[\"990586ac95c316d6af64e8ddc5165a26\", [8192, 1152], [128, 1152], [128], [8192, 128]]", "rocm -keys=rocm,gpu -max_num_threads=256 -max_shared_memory_per_block=65536 -max_threads_per_block=256 -mcpu=gfx908 -mtriple=amdgcn-amd-amdhsa-hcc -thread_warp_size=64", [-1, 16, 64, 65536, 2147483647, 1024, 16, 64], "", 0, []], [[], [["CI", 5], ["CI", 4], ["SP", 2, 0, 8192, [4, 64, 1, 2], 1], ["SP", 2, 5, 128, [4, 8, 1, 4], 1], ["SP", 2, 10, 1152, [2, 1], 1], ["RE", 2, [0, 5, 1, 6, 2, 7, 10, 11, 3, 8, 12, 4, 9]], ["FSP", 6, 0, 2, 3], ["FSP", 6, 4, 3, 3], ["RE", 6, [0, 4, 1, 5, 2, 6, 3, 7]], ["CA", 2, 6, 5], ["CHR", 1, "shared", [2]], ["CA", 2, 3, 6], ["CHR", 0, "shared", [3]], ["CA", 1, 4, 6], ["FU", 8, [0, 1]], ["AN", 8, 0, 5], ["FU", 8, [1, 2]], ["AN", 8, 1, 4], ["FU", 8, [2, 3]], ["AN", 8, 2, 6], ["FU", 3, [0, 1]], ["SP", 3, 0, 16, [1], 1], ["AN", 3, 1, 2], ["FFSP", 3, 0, [3, 2], 1, 1], ["AN", 3, 1, 6], ["FU", 1, [0, 1]], ["SP", 1, 0, 8, [2], 1], ["AN", 1, 1, 2], ["FFSP", 1, 0, [3, 2], 1, 1], ["AN", 1, 1, 6], ["PR", 4, 0, "auto_unroll_max_step$64"]]]], "r": [[0.00416305], 0, 3.18083, 1695324424], "v": "v0.6"}
{"i": [["[\"990586ac95c316d6af64e8ddc5165a26\", [8192, 1152], [128, 1152], [128], [8192, 128]]", "rocm -keys=rocm,gpu -max_num_threads=256 -max_shared_memory_per_block=65536 -max_threads_per_block=256 -mcpu=gfx908 -mtriple=amdgcn-amd-amdhsa-hcc -thread_warp_size=64", [-1, 16, 64, 65536, 2147483647, 1024, 16, 64], "", 0, []], [[], [["CI", 5], ["CI", 4], ["SP", 2, 0, 8192, [1, 4, 4, 2], 1], ["SP", 2, 5, 128, [2, 8, 4, 1], 1], ["SP", 2, 10, 1152, [2, 18], 1], ["RE", 2, [0, 5, 1, 6, 2, 7, 10, 11, 3, 8, 12, 4, 9]], ["FSP", 6, 0, 2, 3], ["FSP", 6, 4, 3, 3], ["RE", 6, [0, 4, 1, 5, 2, 6, 3, 7]], ["CA", 2, 6, 5], ["CHR", 1, "shared", [2]], ["CA", 2, 3, 6], ["CHR", 0, "shared", [3]], ["CA", 1, 4, 6], ["FU", 8, [0, 1]], ["AN", 8, 0, 5], ["FU", 8, [1, 2]], ["AN", 8, 1, 4], ["FU", 8, [2, 3]], ["AN", 8, 2, 6], ["FU", 3, [0, 1]], ["SP", 3, 0, 144, [2], 1], ["AN", 3, 1, 2], ["FFSP", 3, 0, [3, 2], 1, 1], ["AN", 3, 1, 6], ["FU", 1, [0, 1]], ["SP", 1, 0, 144, [1], 1], ["AN", 1, 1, 2], ["FFSP", 1, 0, [3, 2], 1, 1], ["AN", 1, 1, 6], ["PR", 4, 0, "auto_unroll_max_step$64"]]]], "r": [[0.0108857], 0, 4.05143, 1695324426], "v": "v0.6"}
{"i": [["[\"990586ac95c316d6af64e8ddc5165a26\", [8192, 1152], [128, 1152], [128], [8192, 128]]", "rocm -keys=rocm,gpu -max_num_threads=256 -max_shared_memory_per_block=65536 -max_threads_per_block=256 -mcpu=gfx908 -mtriple=amdgcn-amd-amdhsa-hcc -thread_warp_size=64", [-1, 16, 64, 65536, 2147483647, 1024, 16, 64], "", 0, []], [[], [["CI", 5], ["CI", 4], ["SP", 2, 0, 8192, [1, 1, 16, 8], 1], ["SP", 2, 5, 128, [1, 64, 1, 1], 1], ["SP", 2, 10, 1152, [1, 1], 1], ["RE", 2, [0, 5, 1, 6, 2, 7, 10, 11, 3, 8, 12, 4, 9]], ["FSP", 6, 0, 2, 3], ["FSP", 6, 4, 3, 3], ["RE", 6, [0, 4, 1, 5, 2, 6, 3, 7]], ["CA", 2, 6, 5], ["CHR", 1, "shared", [2]], ["CA", 2, 3, 6], ["CHR", 0, "shared", [3]], ["CA", 1, 4, 6], ["FU", 8, [0, 1]], ["AN", 8, 0, 5], ["FU", 8, [1, 2]], ["AN", 8, 1, 4], ["FU", 8, [2, 3]], ["AN", 8, 2, 6], ["FU", 3, [0, 1]], ["SP", 3, 0, 3, [3], 1], ["AN", 3, 1, 2], ["FFSP", 3, 0, [3, 2], 1, 1], ["AN", 3, 1, 6], ["FU", 1, [0, 1]], ["SP", 1, 0, 384, [1], 1], ["AN", 1, 1, 2], ["FFSP", 1, 0, [3, 2], 1, 1], ["AN", 1, 1, 6], ["PR", 4, 0, "auto_unroll_max_step$0"]]]], "r": [[0.00884841], 0, 3.63099, 1695324427], "v": "v0.6"}
{"i": [["[\"990586ac95c316d6af64e8ddc5165a26\", [8192, 1152], [128, 1152], [128], [8192, 128]]", "rocm -keys=rocm,gpu -max_num_threads=256 -max_shared_memory_per_block=65536 -max_threads_per_block=256 -mcpu=gfx908 -mtriple=amdgcn-amd-amdhsa-hcc -thread_warp_size=64", [-1, 16, 64, 65536, 2147483647, 1024, 16, 64], "", 0, []], [[], [["CI", 5], ["CI", 4], ["SP", 2, 0, 8192, [2, 8, 2, 16], 1], ["SP", 2, 5, 128, [1, 8, 2, 1], 1], ["SP", 2, 10, 1152, [6, 3], 1], ["RE", 2, [0, 5, 1, 6, 2, 7, 10, 11, 3, 8, 12, 4, 9]], ["FSP", 6, 0, 2, 3], ["FSP", 6, 4, 3, 3], ["RE", 6, [0, 4, 1, 5, 2, 6, 3, 7]], ["CA", 2, 6, 5], ["CHR", 1, "shared", [2]], ["CA", 2, 3, 6], ["CHR", 0, "shared", [3]], ["CA", 1, 4, 6], ["FU", 8, [0, 1]], ["AN", 8, 0, 5], ["FU", 8, [1, 2]], ["AN", 8, 1, 4], ["FU", 8, [2, 3]], ["AN", 8, 2, 6], ["FU", 3, [0, 1]], ["SP", 3, 0, 36, [1], 1], ["AN", 3, 1, 2], ["FFSP", 3, 0, [3, 2], 1, 1], ["AN", 3, 1, 6], ["FU", 1, [0, 1]], ["SP", 1, 0, 576, [1], 1], ["AN", 1, 1, 2], ["FFSP", 1, 0, [3, 2], 1, 1], ["AN", 1, 1, 6], ["PR", 4, 0, "auto_unroll_max_step$64"]]]], "r": [[0.0349575], 0, 3.95363, 1695324429], "v": "v0.6"}
{"i": [["[\"990586ac95c316d6af64e8ddc5165a26\", [8192, 1152], [128, 1152], [128], [8192, 128]]", "rocm -keys=rocm,gpu -max_num_threads=256 -max_shared_memory_per_block=65536 -max_threads_per_block=256 -mcpu=gfx908 -mtriple=amdgcn-amd-amdhsa-hcc -thread_warp_size=64", [-1, 16, 64, 65536, 2147483647, 1024, 16, 64], "", 0, []], [[], [["CI", 5], ["CI", 4], ["SP", 2, 0, 8192, [2, 8, 64, 1], 1], ["SP", 2, 5, 128, [1, 128, 1, 1], 1], ["SP", 2, 10, 1152, [1, 2], 1], ["RE", 2, [0, 5, 1, 6, 2, 7, 10, 11, 3, 8, 12, 4, 9]], ["FSP", 6, 0, 2, 3], ["FSP", 6, 4, 3, 3], ["RE", 6, [0, 4, 1, 5, 2, 6, 3, 7]], ["CA", 2, 6, 5], ["CHR", 1, "shared", [2]], ["CA", 2, 3, 6], ["CHR", 0, "shared", [3]], ["CA", 1, 4, 6], ["FU", 8, [0, 1]], ["AN", 8, 0, 5], ["FU", 8, [1, 2]], ["AN", 8, 1, 4], ["FU", 8, [2, 3]], ["AN", 8, 2, 6], ["FU", 3, [0, 1]], ["SP", 3, 0, 16, [1], 1], ["AN", 3, 1, 2], ["FFSP", 3, 0, [3, 2], 1, 1], ["AN", 3, 1, 6], ["FU", 1, [0, 1]], ["SP", 1, 0, 128, [1], 1], ["AN", 1, 1, 2], ["FFSP", 1, 0, [3, 2], 1, 1], ["AN", 1, 1, 6], ["PR", 4, 0, "auto_unroll_max_step$64"]]]], "r": [[0.00700798], 0, 4.02486, 1695324430], "v": "v0.6"}
{"i": [["[\"990586ac95c316d6af64e8ddc5165a26\", [8192, 1152], [128, 1152], [128], [8192, 128]]", "rocm -keys=rocm,gpu -max_num_threads=256 -max_shared_memory_per_block=65536 -max_threads_per_block=256 -mcpu=gfx908 -mtriple=amdgcn-amd-amdhsa-hcc -thread_warp_size=64", [-1, 16, 64, 65536, 2147483647, 1024, 16, 64], "", 0, []], [[], [["CI", 5], ["CI", 4], ["SP", 2, 0, 8192, [1, 32, 2, 2], 1], ["SP", 2, 5, 128, [2, 2, 4, 2], 1], ["SP", 2, 10, 1152, [2, 48], 1], ["RE", 2, [0, 5, 1, 6, 2, 7, 10, 11, 3, 8, 12, 4, 9]], ["FSP", 6, 0, 2, 3], ["FSP", 6, 4, 3, 3], ["RE", 6, [0, 4, 1, 5, 2, 6, 3, 7]], ["CA", 2, 6, 5], ["CHR", 1, "shared", [2]], ["CA", 2, 3, 6], ["CHR", 0, "shared", [3]], ["CA", 1, 4, 6], ["FU", 8, [0, 1]], ["AN", 8, 0, 5], ["FU", 8, [1, 2]], ["AN", 8, 1, 4], ["FU", 8, [2, 3]], ["AN", 8, 2, 6], ["FU", 3, [0, 1]], ["SP", 3, 0, 768, [4], 1], ["AN", 3, 1, 2], ["FFSP", 3, 0, [3, 2], 1, 1], ["AN", 3, 1, 6], ["FU", 1, [0, 1]], ["SP", 1, 0, 384, [1], 1], ["AN", 1, 1, 2], ["FFSP", 1, 0, [3, 2], 1, 1], ["AN", 1, 1, 6], ["PR", 4, 0, "auto_unroll_max_step$1024"]]]], "r": [[0.0201504], 0, 8.1007, 1695324431], "v": "v0.6"}
{"i": [["[\"990586ac95c316d6af64e8ddc5165a26\", [8192, 1152], [128, 1152], [128], [8192, 128]]", "rocm -keys=rocm,gpu -max_num_threads=256 -max_shared_memory_per_block=65536 -max_threads_per_block=256 -mcpu=gfx908 -mtriple=amdgcn-amd-amdhsa-hcc -thread_warp_size=64", [-1, 16, 64, 65536, 2147483647, 1024, 16, 64], "", 0, []], [[], [["CI", 5], ["CI", 4], ["SP", 2, 0, 8192, [1, 32, 32, 1], 1], ["SP", 2, 5, 128, [1, 2, 32, 1], 1], ["SP", 2, 10, 1152, [12, 1], 1], ["RE", 2, [0, 5, 1, 6, 2, 7, 10, 11, 3, 8, 12, 4, 9]], ["FSP", 6, 0, 2, 3], ["FSP", 6, 4, 3, 3], ["RE", 6, [0, 4, 1, 5, 2, 6, 3, 7]], ["CA", 2, 6, 5], ["CHR", 1, "shared", [2]], ["CA", 2, 3, 6], ["CHR", 0, "shared", [3]], ["CA", 1, 4, 6], ["FU", 8, [0, 1]], ["AN", 8, 0, 5], ["FU", 8, [1, 2]], ["AN", 8, 1, 4], ["FU", 8, [2, 3]], ["AN", 8, 2, 6], ["FU", 3, [0, 1]], ["SP", 3, 0, 96, [1], 1], ["AN", 3, 1, 2], ["FFSP", 3, 0, [3, 2], 1, 1], ["AN", 3, 1, 6], ["FU", 1, [0, 1]], ["SP", 1, 0, 96, [1], 1], ["AN", 1, 1, 2], ["FFSP", 1, 0, [3, 2], 1, 1], ["AN", 1, 1, 6], ["PR", 4, 0, "auto_unroll_max_step$0"]]]], "r": [[0.234799], 0, 2.94367, 1695324433], "v": "v0.6"}
{"i": [["[\"990586ac95c316d6af64e8ddc5165a26\", [8192, 1152], [128, 1152], [128], [8192, 128]]", "rocm -keys=rocm,gpu -max_num_threads=256 -max_shared_memory_per_block=65536 -max_threads_per_block=256 -mcpu=gfx908 -mtriple=amdgcn-amd-amdhsa-hcc -thread_warp_size=64", [-1, 16, 64, 65536, 2147483647, 1024, 16, 64], "", 0, []], [[], [["CI", 5], ["CI", 4], ["SP", 2, 0, 8192, [4, 64, 1, 2], 1], ["SP", 2, 5, 128, [4, 8, 1, 4], 1], ["SP", 2, 10, 1152, [2, 2], 1], ["RE", 2, [0, 5, 1, 6, 2, 7, 10, 11, 3, 8, 12, 4, 9]], ["FSP", 6, 0, 2, 3], ["FSP", 6, 4, 3, 3], ["RE", 6, [0, 4, 1, 5, 2, 6, 3, 7]], ["CA", 2, 6, 5], ["CHR", 1, "shared", [2]], ["CA", 2, 3, 6], ["CHR", 0, "shared", [3]], ["CA", 1, 4, 6], ["FU", 8, [0, 1]], ["AN", 8, 0, 5], ["FU", 8, [1, 2]], ["AN", 8, 1, 4], ["FU", 8, [2, 3]], ["AN", 8, 2, 6], ["FU", 3, [0, 1]], ["SP", 3, 0, 16, [1], 1], ["AN", 3, 1, 2], ["FFSP", 3, 0, [3, 2], 1, 1], ["AN", 3, 1, 6], ["FU", 1, [0, 1]], ["SP", 1, 0, 8, [1], 1], ["AN", 1, 1, 2], ["FFSP", 1, 0, [3, 2], 1, 1], ["AN", 1, 1, 6], ["PR", 4, 0, "auto_unroll_max_step$0"]]]], "r": [[0.0104409], 0, 3.22207, 1695324435], "v": "v0.6"}
{"i": [["[\"990586ac95c316d6af64e8ddc5165a26\", [8192, 1152], [128, 1152], [128], [8192, 128]]", "rocm -keys=rocm,gpu -max_num_threads=256 -max_shared_memory_per_block=65536 -max_threads_per_block=256 -mcpu=gfx908 -mtriple=amdgcn-amd-amdhsa-hcc -thread_warp_size=64", [-1, 16, 64, 65536, 2147483647, 1024, 16, 64], "", 0, []], [[], [["CI", 5], ["CI", 4], ["SP", 2, 0, 8192, [1, 128, 4, 1], 1], ["SP", 2, 5, 128, [8, 1, 8, 2], 1], ["SP", 2, 10, 1152, [1, 3], 1], ["RE", 2, [0, 5, 1, 6, 2, 7, 10, 11, 3, 8, 12, 4, 9]], ["FSP", 6, 0, 2, 3], ["FSP", 6, 4, 3, 3], ["RE", 6, [0, 4, 1, 5, 2, 6, 3, 7]], ["CA", 2, 6, 5], ["CHR", 1, "shared", [2]], ["CA", 2, 3, 6], ["CHR", 0, "shared", [3]], ["CA", 1, 4, 6], ["FU", 8, [0, 1]], ["AN", 8, 0, 5], ["FU", 8, [1, 2]], ["AN", 8, 1, 4], ["FU", 8, [2, 3]], ["AN", 8, 2, 6], ["FU", 3, [0, 1]], ["SP", 3, 0, 96, [1], 1], ["AN", 3, 1, 2], ["FFSP", 3, 0, [3, 2], 1, 1], ["AN", 3, 1, 6], ["FU", 1, [0, 1]], ["SP", 1, 0, 48, [1], 1], ["AN", 1, 1, 2], ["FFSP", 1, 0, [3, 2], 1, 1], ["AN", 1, 1, 6], ["PR", 4, 0, "auto_unroll_max_step$16"]]]], "r": [[0.0106009], 0, 2.48933, 1695324437], "v": "v0.6"}
{"i": [["[\"990586ac95c316d6af64e8ddc5165a26\", [8192, 1152], [128, 1152], [128], [8192, 128]]", "rocm -keys=rocm,gpu -max_num_threads=256 -max_shared_memory_per_block=65536 -max_threads_per_block=256 -mcpu=gfx908 -mtriple=amdgcn-amd-amdhsa-hcc -thread_warp_size=64", [-1, 16, 64, 65536, 2147483647, 1024, 16, 64], "", 0, []], [[], [["CI", 5], ["CI", 4], ["SP", 2, 0, 8192, [2, 1024, 2, 2], 1], ["SP", 2, 5, 128, [2, 1, 1, 16], 1], ["SP", 2, 10, 1152, [1, 1], 1], ["RE", 2, [0, 5, 1, 6, 2, 7, 10, 11, 3, 8, 12, 4, 9]], ["FSP", 6, 0, 2, 3], ["FSP", 6, 4, 3, 3], ["RE", 6, [0, 4, 1, 5, 2, 6, 3, 7]], ["CA", 2, 6, 5], ["CHR", 1, "shared", [2]], ["CA", 2, 3, 6], ["CHR", 0, "shared", [3]], ["CA", 1, 4, 6], ["FU", 8, [0, 1]], ["AN", 8, 0, 5], ["FU", 8, [1, 2]], ["AN", 8, 1, 4], ["FU", 8, [2, 3]], ["AN", 8, 2, 6], ["FU", 3, [0, 1]], ["SP", 3, 0, 16, [2], 1], ["AN", 3, 1, 2], ["FFSP", 3, 0, [3, 2], 1, 1], ["AN", 3, 1, 6], ["FU", 1, [0, 1]], ["SP", 1, 0, 4, [2], 1], ["AN", 1, 1, 2], ["FFSP", 1, 0, [3, 2], 1, 1], ["AN", 1, 1, 6], ["PR", 4, 0, "auto_unroll_max_step$512"]]]], "r": [[0.111576], 0, 4.55794, 1695324438], "v": "v0.6"}
{"i": [["[\"990586ac95c316d6af64e8ddc5165a26\", [8192, 1152], [128, 1152], [128], [8192, 128]]", "rocm -keys=rocm,gpu -max_num_threads=256 -max_shared_memory_per_block=65536 -max_threads_per_block=256 -mcpu=gfx908 -mtriple=amdgcn-amd-amdhsa-hcc -thread_warp_size=64", [-1, 16, 64, 65536, 2147483647, 1024, 16, 64], "", 0, []], [[], [["CI", 5], ["CI", 4], ["SP", 2, 0, 8192, [1, 32, 4, 4], 1], ["SP", 2, 5, 128, [2, 2, 4, 2], 1], ["SP", 2, 10, 1152, [3, 2], 1], ["RE", 2, [0, 5, 1, 6, 2, 7, 10, 11, 3, 8, 12, 4, 9]], ["FSP", 6, 0, 2, 3], ["FSP", 6, 4, 3, 3], ["RE", 6, [0, 4, 1, 5, 2, 6, 3, 7]], ["CA", 2, 6, 5], ["CHR", 1, "shared", [2]], ["CA", 2, 3, 6], ["CHR", 0, "shared", [3]], ["CA", 1, 4, 6], ["FU", 8, [0, 1]], ["AN", 8, 0, 5], ["FU", 8, [1, 2]], ["AN", 8, 1, 4], ["FU", 8, [2, 3]], ["AN", 8, 2, 6], ["FU", 3, [0, 1]], ["SP", 3, 0, 48, [1], 1], ["AN", 3, 1, 2], ["FFSP", 3, 0, [3, 2], 1, 1], ["AN", 3, 1, 6], ["FU", 1, [0, 1]], ["SP", 1, 0, 96, [32], 1], ["AN", 1, 1, 2], ["FFSP", 1, 0, [3, 2], 1, 1], ["AN", 1, 1, 6], ["PR", 4, 0, "auto_unroll_max_step$1024"]]]], "r": [[0.0137694], 0, 5.30716, 1695324439], "v": "v0.6"}
{"i": [["[\"990586ac95c316d6af64e8ddc5165a26\", [8192, 1152], [128, 1152], [128], [8192, 128]]", "rocm -keys=rocm,gpu -max_num_threads=256 -max_shared_memory_per_block=65536 -max_threads_per_block=256 -mcpu=gfx908 -mtriple=amdgcn-amd-amdhsa-hcc -thread_warp_size=64", [-1, 16, 64, 65536, 2147483647, 1024, 16, 64], "", 0, []], [[], [["CI", 5], ["CI", 4], ["SP", 2, 0, 8192, [2, 32, 1, 16], 1], ["SP", 2, 5, 128, [8, 2, 2, 1], 1], ["SP", 2, 10, 1152, [3, 2], 1], ["RE", 2, [0, 5, 1, 6, 2, 7, 10, 11, 3, 8, 12, 4, 9]], ["FSP", 6, 0, 2, 3], ["FSP", 6, 4, 3, 3], ["RE", 6, [0, 4, 1, 5, 2, 6, 3, 7]], ["CA", 2, 6, 5], ["CHR", 1, "shared", [2]], ["CA", 2, 3, 6], ["CHR", 0, "shared", [3]], ["CA", 1, 4, 6], ["FU", 8, [0, 1]], ["AN", 8, 0, 5], ["FU", 8, [1, 2]], ["AN", 8, 1, 4], ["FU", 8, [2, 3]], ["AN", 8, 2, 6], ["FU", 3, [0, 1]], ["SP", 3, 0, 24, [1], 1], ["AN", 3, 1, 2], ["FFSP", 3, 0, [3, 2], 1, 1], ["AN", 3, 1, 6], ["FU", 1, [0, 1]], ["SP", 1, 0, 96, [1], 1], ["AN", 1, 1, 2], ["FFSP", 1, 0, [3, 2], 1, 1], ["AN", 1, 1, 6], ["PR", 4, 0, "auto_unroll_max_step$16"]]]], "r": [[0.0234692], 0, 2.57813, 1695324442], "v": "v0.6"}
{"i": [["[\"990586ac95c316d6af64e8ddc5165a26\", [8192, 1152], [128, 1152], [128], [8192, 128]]", "rocm -keys=rocm,gpu -max_num_threads=256 -max_shared_memory_per_block=65536 -max_threads_per_block=256 -mcpu=gfx908 -mtriple=amdgcn-amd-amdhsa-hcc -thread_warp_size=64", [-1, 16, 64, 65536, 2147483647, 1024, 16, 64], "", 0, []], [[], [["CI", 5], ["CI", 4], ["SP", 2, 0, 8192, [2, 8, 64, 1], 1], ["SP", 2, 5, 128, [1, 16, 8, 1], 1], ["SP", 2, 10, 1152, [1, 2], 1], ["RE", 2, [0, 5, 1, 6, 2, 7, 10, 11, 3, 8, 12, 4, 9]], ["FSP", 6, 0, 2, 3], ["FSP", 6, 4, 3, 3], ["RE", 6, [0, 4, 1, 5, 2, 6, 3, 7]], ["CA", 2, 6, 5], ["CHR", 1, "shared", [2]], ["CA", 2, 3, 6], ["CHR", 0, "shared", [3]], ["CA", 1, 4, 6], ["FU", 8, [0, 1]], ["AN", 8, 0, 5], ["FU", 8, [1, 2]], ["AN", 8, 1, 4], ["FU", 8, [2, 3]], ["AN", 8, 2, 6], ["FU", 3, [0, 1]], ["SP", 3, 0, 16, [2], 1], ["AN", 3, 1, 2], ["FFSP", 3, 0, [3, 2], 1, 1], ["AN", 3, 1, 6], ["FU", 1, [0, 1]], ["SP", 1, 0, 128, [1], 1], ["AN", 1, 1, 2], ["FFSP", 1, 0, [3, 2], 1, 1], ["AN", 1, 1, 6], ["PR", 4, 0, "auto_unroll_max_step$1024"]]]], "r": [[0.0250127], 0, 2.21194, 1695324443], "v": "v0.6"}
{"i": [["[\"990586ac95c316d6af64e8ddc5165a26\", [8192, 1152], [128, 1152], [128], [8192, 128]]", "rocm -keys=rocm,gpu -max_num_threads=256 -max_shared_memory_per_block=65536 -max_threads_per_block=256 -mcpu=gfx908 -mtriple=amdgcn-amd-amdhsa-hcc -thread_warp_size=64", [-1, 16, 64, 65536, 2147483647, 1024, 16, 64], "", 0, []], [[], [["CI", 5], ["CI", 4], ["SP", 2, 0, 8192, [1, 64, 1, 16], 1], ["SP", 2, 5, 128, [8, 2, 1, 2], 1], ["SP", 2, 10, 1152, [3, 1], 1], ["RE", 2, [0, 5, 1, 6, 2, 7, 10, 11, 3, 8, 12, 4, 9]], ["FSP", 6, 0, 2, 3], ["FSP", 6, 4, 3, 3], ["RE", 6, [0, 4, 1, 5, 2, 6, 3, 7]], ["CA", 2, 6, 5], ["CHR", 1, "shared", [2]], ["CA", 2, 3, 6], ["CHR", 0, "shared", [3]], ["CA", 1, 4, 6], ["FU", 8, [0, 1]], ["AN", 8, 0, 5], ["FU", 8, [1, 2]], ["AN", 8, 1, 4], ["FU", 8, [2, 3]], ["AN", 8, 2, 6], ["FU", 3, [0, 1]], ["SP", 3, 0, 6, [6], 1], ["AN", 3, 1, 2], ["FFSP", 3, 0, [3, 2], 1, 1], ["AN", 3, 1, 6], ["FU", 1, [0, 1]], ["SP", 1, 0, 96, [1], 1], ["AN", 1, 1, 2], ["FFSP", 1, 0, [3, 2], 1, 1], ["AN", 1, 1, 6], ["PR", 4, 0, "auto_unroll_max_step$512"]]]], "r": [[0.0694653], 0, 4.61862, 1695324444], "v": "v0.6"}
{"i": [["[\"990586ac95c316d6af64e8ddc5165a26\", [8192, 1152], [128, 1152], [128], [8192, 128]]", "rocm -keys=rocm,gpu -max_num_threads=256 -max_shared_memory_per_block=65536 -max_threads_per_block=256 -mcpu=gfx908 -mtriple=amdgcn-amd-amdhsa-hcc -thread_warp_size=64", [-1, 16, 64, 65536, 2147483647, 1024, 16, 64], "", 0, []], [[], [["CI", 5], ["CI", 4], ["SP", 2, 0, 8192, [8, 4, 1, 2], 1], ["SP", 2, 5, 128, [2, 8, 4, 1], 1], ["SP", 2, 10, 1152, [1, 1], 1], ["RE", 2, [0, 5, 1, 6, 2, 7, 10, 11, 3, 8, 12, 4, 9]], ["FSP", 6, 0, 2, 3], ["FSP", 6, 4, 3, 3], ["RE", 6, [0, 4, 1, 5, 2, 6, 3, 7]], ["CA", 2, 6, 5], ["CHR", 1, "shared", [2]], ["CA", 2, 3, 6], ["CHR", 0, "shared", [3]], ["CA", 1, 4, 6], ["FU", 8, [0, 1]], ["AN", 8, 0, 5], ["FU", 8, [1, 2]], ["AN", 8, 1, 4], ["FU", 8, [2, 3]], ["AN", 8, 2, 6], ["FU", 3, [0, 1]], ["SP", 3, 0, 16, [1], 1], ["AN", 3, 1, 2], ["FFSP", 3, 0, [3, 2], 1, 1], ["AN", 3, 1, 6], ["FU", 1, [0, 1]], ["SP", 1, 0, 4, [1], 1], ["AN", 1, 1, 2], ["FFSP", 1, 0, [3, 2], 1, 1], ["AN", 1, 1, 6], ["PR", 4, 0, "auto_unroll_max_step$512"]]]], "r": [[0.00928928], 0, 2.79281, 1695324445], "v": "v0.6"}
{"i": [["[\"990586ac95c316d6af64e8ddc5165a26\", [8192, 1152], [128, 1152], [128], [8192, 128]]", "rocm -keys=rocm,gpu -max_num_threads=256 -max_shared_memory_per_block=65536 -max_threads_per_block=256 -mcpu=gfx908 -mtriple=amdgcn-amd-amdhsa-hcc -thread_warp_size=64", [-1, 16, 64, 65536, 2147483647, 1024, 16, 64], "", 0, []], [[], [["CI", 5], ["CI", 4], ["SP", 2, 0, 8192, [2, 16, 1, 2], 1], ["SP", 2, 5, 128, [8, 8, 2, 1], 1], ["SP", 2, 10, 1152, [4, 16], 1], ["RE", 2, [0, 5, 1, 6, 2, 7, 10, 11, 3, 8, 12, 4, 9]], ["FSP", 6, 0, 2, 3], ["FSP", 6, 4, 3, 3], ["RE", 6, [0, 4, 1, 5, 2, 6, 3, 7]], ["CA", 2, 6, 5], ["CHR", 1, "shared", [2]], ["CA", 2, 3, 6], ["CHR", 0, "shared", [3]], ["CA", 1, 4, 6], ["FU", 8, [0, 1]], ["AN", 8, 0, 5], ["FU", 8, [1, 2]], ["AN", 8, 1, 4], ["FU", 8, [2, 3]], ["AN", 8, 2, 6], ["FU", 3, [0, 1]], ["SP", 3, 0, 128, [1], 1], ["AN", 3, 1, 2], ["FFSP", 3, 0, [3, 2], 1, 1], ["AN", 3, 1, 6], ["FU", 1, [0, 1]], ["SP", 1, 0, 128, [1], 1], ["AN", 1, 1, 2], ["FFSP", 1, 0, [3, 2], 1, 1], ["AN", 1, 1, 6], ["PR", 4, 0, "auto_unroll_max_step$0"]]]], "r": [[0.00551547], 0, 3.27786, 1695324448], "v": "v0.6"}
{"i": [["[\"990586ac95c316d6af64e8ddc5165a26\", [8192, 1152], [128, 1152], [128], [8192, 128]]", "rocm -keys=rocm,gpu -max_num_threads=256 -max_shared_memory_per_block=65536 -max_threads_per_block=256 -mcpu=gfx908 -mtriple=amdgcn-amd-amdhsa-hcc -thread_warp_size=64", [-1, 16, 64, 65536, 2147483647, 1024, 16, 64], "", 0, []], [[], [["CI", 5], ["CI", 4], ["SP", 2, 0, 8192, [2, 128, 2, 1], 1], ["SP", 2, 5, 128, [1, 2, 8, 8], 1], ["SP", 2, 10, 1152, [2, 2], 1], ["RE", 2, [0, 5, 1, 6, 2, 7, 10, 11, 3, 8, 12, 4, 9]], ["FSP", 6, 0, 2, 3], ["FSP", 6, 4, 3, 3], ["RE", 6, [0, 4, 1, 5, 2, 6, 3, 7]], ["CA", 2, 6, 5], ["CHR", 1, "shared", [2]], ["CA", 2, 3, 6], ["CHR", 0, "shared", [3]], ["CA", 1, 4, 6], ["FU", 8, [0, 1]], ["AN", 8, 0, 5], ["FU", 8, [1, 2]], ["AN", 8, 1, 4], ["FU", 8, [2, 3]], ["AN", 8, 2, 6], ["FU", 3, [0, 1]], ["SP", 3, 0, 256, [1], 1], ["AN", 3, 1, 2], ["FFSP", 3, 0, [3, 2], 1, 1], ["AN", 3, 1, 6], ["FU", 1, [0, 1]], ["SP", 1, 0, 8, [1], 1], ["AN", 1, 1, 2], ["FFSP", 1, 0, [3, 2], 1, 1], ["AN", 1, 1, 6], ["PR", 4, 0, "auto_unroll_max_step$0"]]]], "r": [[0.00862638], 0, 2.28073, 1695324449], "v": "v0.6"}
{"i": [["[\"990586ac95c316d6af64e8ddc5165a26\", [8192, 1152], [128, 1152], [128], [8192, 128]]", "rocm -keys=rocm,gpu -max_num_threads=256 -max_shared_memory_per_block=65536 -max_threads_per_block=256 -mcpu=gfx908 -mtriple=amdgcn-amd-amdhsa-hcc -thread_warp_size=64", [-1, 16, 64, 65536, 2147483647, 1024, 16, 64], "", 0, []], [[], [["CI", 5], ["CI", 4], ["SP", 2, 0, 8192, [16, 1, 2, 4], 1], ["SP", 2, 5, 128, [1, 128, 1, 1], 1], ["SP", 2, 10, 1152, [1, 48], 1], ["RE", 2, [0, 5, 1, 6, 2, 7, 10, 11, 3, 8, 12, 4, 9]], ["FSP", 6, 0, 2, 3], ["FSP", 6, 4, 3, 3], ["RE", 6, [0, 4, 1, 5, 2, 6, 3, 7]], ["CA", 2, 6, 5], ["CHR", 1, "shared", [2]], ["CA", 2, 3, 6], ["CHR", 0, "shared", [3]], ["CA", 1, 4, 6], ["FU", 8, [0, 1]], ["AN", 8, 0, 5], ["FU", 8, [1, 2]], ["AN", 8, 1, 4], ["FU", 8, [2, 3]], ["AN", 8, 2, 6], ["FU", 3, [0, 1]], ["SP", 3, 0, 48, [1], 1], ["AN", 3, 1, 2], ["FFSP", 3, 0, [3, 2], 1, 1], ["AN", 3, 1, 6], ["FU", 1, [0, 1]], ["SP", 1, 0, 384, [64], 1], ["AN", 1, 1, 2], ["FFSP", 1, 0, [3, 2], 1, 1], ["AN", 1, 1, 6], ["PR", 4, 0, "auto_unroll_max_step$512"]]]], "r": [[0.0210292], 0, 4.59978, 1695324450], "v": "v0.6"}
{"i": [["[\"990586ac95c316d6af64e8ddc5165a26\", [8192, 1152], [128, 1152], [128], [8192, 128]]", "rocm -keys=rocm,gpu -max_num_threads=256 -max_shared_memory_per_block=65536 -max_threads_per_block=256 -mcpu=gfx908 -mtriple=amdgcn-amd-amdhsa-hcc -thread_warp_size=64", [-1, 16, 64, 65536, 2147483647, 1024, 16, 64], "", 0, []], [[], [["CI", 5], ["CI", 4], ["SP", 2, 0, 8192, [2, 8, 2, 2], 1], ["SP", 2, 5, 128, [8, 8, 2, 1], 1], ["SP", 2, 10, 1152, [2, 3], 1], ["RE", 2, [0, 5, 1, 6, 2, 7, 10, 11, 3, 8, 12, 4, 9]], ["FSP", 6, 0, 2, 3], ["FSP", 6, 4, 3, 3], ["RE", 6, [0, 4, 1, 5, 2, 6, 3, 7]], ["CA", 2, 6, 5], ["CHR", 1, "shared", [2]], ["CA", 2, 3, 6], ["CHR", 0, "shared", [3]], ["CA", 1, 4, 6], ["FU", 8, [0, 1]], ["AN", 8, 0, 5], ["FU", 8, [1, 2]], ["AN", 8, 1, 4], ["FU", 8, [2, 3]], ["AN", 8, 2, 6], ["FU", 3, [0, 1]], ["SP", 3, 0, 12, [1], 1], ["AN", 3, 1, 2], ["FFSP", 3, 0, [3, 2], 1, 1], ["AN", 3, 1, 6], ["FU", 1, [0, 1]], ["SP", 1, 0, 24, [1], 1], ["AN", 1, 1, 2], ["FFSP", 1, 0, [3, 2], 1, 1], ["AN", 1, 1, 6], ["PR", 4, 0, "auto_unroll_max_step$512"]]]], "r": [[0.00910479], 0, 3.85404, 1695324451], "v": "v0.6"}
{"i": [["[\"990586ac95c316d6af64e8ddc5165a26\", [8192, 1152], [128, 1152], [128], [8192, 128]]", "rocm -keys=rocm,gpu -max_num_threads=256 -max_shared_memory_per_block=65536 -max_threads_per_block=256 -mcpu=gfx908 -mtriple=amdgcn-amd-amdhsa-hcc -thread_warp_size=64", [-1, 16, 64, 65536, 2147483647, 1024, 16, 64], "", 0, []], [[], [["CI", 5], ["CI", 4], ["SP", 2, 0, 8192, [16, 16, 1, 1], 1], ["SP", 2, 5, 128, [1, 8, 1, 4], 1], ["SP", 2, 10, 1152, [1, 3], 1], ["RE", 2, [0, 5, 1, 6, 2, 7, 10, 11, 3, 8, 12, 4, 9]], ["FSP", 6, 0, 2, 3], ["FSP", 6, 4, 3, 3], ["RE", 6, [0, 4, 1, 5, 2, 6, 3, 7]], ["CA", 2, 6, 5], ["CHR", 1, "shared", [2]], ["CA", 2, 3, 6], ["CHR", 0, "shared", [3]], ["CA", 1, 4, 6], ["FU", 8, [0, 1]], ["AN", 8, 0, 5], ["FU", 8, [1, 2]], ["AN", 8, 1, 4], ["FU", 8, [2, 3]], ["AN", 8, 2, 6], ["FU", 3, [0, 1]], ["SP", 3, 0, 72, [1], 1], ["AN", 3, 1, 2], ["FFSP", 3, 0, [3, 2], 1, 1], ["AN", 3, 1, 6], ["FU", 1, [0, 1]], ["SP", 1, 0, 18, [1], 1], ["AN", 1, 1, 2], ["FFSP", 1, 0, [3, 2], 1, 1], ["AN", 1, 1, 6], ["PR", 4, 0, "auto_unroll_max_step$512"]]]], "r": [[0.00499506], 0, 2.69441, 1695324453], "v": "v0.6"}
{"i": [["[\"990586ac95c316d6af64e8ddc5165a26\", [8192, 1152], [128, 1152], [128], [8192, 128]]", "rocm -keys=rocm,gpu -max_num_threads=256 -max_shared_memory_per_block=65536 -max_threads_per_block=256 -mcpu=gfx908 -mtriple=amdgcn-amd-amdhsa-hcc -thread_warp_size=64", [-1, 16, 64, 65536, 2147483647, 1024, 16, 64], "", 0, []], [[], [["CI", 5], ["CI", 4], ["SP", 2, 0, 8192, [1, 64, 2, 2], 1], ["SP", 2, 5, 128, [2, 16, 4, 1], 1], ["SP", 2, 10, 1152, [1, 8], 1], ["RE", 2, [0, 5, 1, 6, 2, 7, 10, 11, 3, 8, 12, 4, 9]], ["FSP", 6, 0, 2, 3], ["FSP", 6, 4, 3, 3], ["RE", 6, [0, 4, 1, 5, 2, 6, 3, 7]], ["CA", 2, 6, 5], ["CHR", 1, "shared", [2]], ["CA", 2, 3, 6], ["CHR", 0, "shared", [3]], ["CA", 1, 4, 6], ["FU", 8, [0, 1]], ["AN", 8, 0, 5], ["FU", 8, [1, 2]], ["AN", 8, 1, 4], ["FU", 8, [2, 3]], ["AN", 8, 2, 6], ["FU", 3, [0, 1]], ["SP", 3, 0, 32, [2], 1], ["AN", 3, 1, 2], ["FFSP", 3, 0, [3, 2], 1, 1], ["AN", 3, 1, 6], ["FU", 1, [0, 1]], ["SP", 1, 0, 16, [4], 1], ["AN", 1, 1, 2], ["FFSP", 1, 0, [3, 2], 1, 1], ["AN", 1, 1, 6], ["PR", 4, 0, "auto_unroll_max_step$0"]]]], "r": [[0.00432065], 0, 2.06821, 1695324455], "v": "v0.6"}
{"i": [["[\"990586ac95c316d6af64e8ddc5165a26\", [8192, 1152], [128, 1152], [128], [8192, 128]]", "rocm -keys=rocm,gpu -max_num_threads=256 -max_shared_memory_per_block=65536 -max_threads_per_block=256 -mcpu=gfx908 -mtriple=amdgcn-amd-amdhsa-hcc -thread_warp_size=64", [-1, 16, 64, 65536, 2147483647, 1024, 16, 64], "", 0, []], [[], [["CI", 5], ["CI", 4], ["SP", 2, 0, 8192, [16, 1, 2, 4], 1], ["SP", 2, 5, 128, [1, 128, 1, 1], 1], ["SP", 2, 10, 1152, [1, 48], 1], ["RE", 2, [0, 5, 1, 6, 2, 7, 10, 11, 3, 8, 12, 4, 9]], ["FSP", 6, 0, 2, 3], ["FSP", 6, 4, 3, 3], ["RE", 6, [0, 4, 1, 5, 2, 6, 3, 7]], ["CA", 2, 6, 5], ["CHR", 1, "shared", [2]], ["CA", 2, 3, 6], ["CHR", 0, "shared", [3]], ["CA", 1, 4, 6], ["FU", 8, [0, 1]], ["AN", 8, 0, 5], ["FU", 8, [1, 2]], ["AN", 8, 1, 4], ["FU", 8, [2, 3]], ["AN", 8, 2, 6], ["FU", 3, [0, 1]], ["SP", 3, 0, 48, [1], 1], ["AN", 3, 1, 2], ["FFSP", 3, 0, [3, 2], 1, 1], ["AN", 3, 1, 6], ["FU", 1, [0, 1]], ["SP", 1, 0, 384, [1], 1], ["AN", 1, 1, 2], ["FFSP", 1, 0, [3, 2], 1, 1], ["AN", 1, 1, 6], ["PR", 4, 0, "auto_unroll_max_step$512"]]]], "r": [[0.019309], 0, 4.2208, 1695324456], "v": "v0.6"}
{"i": [["[\"990586ac95c316d6af64e8ddc5165a26\", [8192, 1152], [128, 1152], [128], [8192, 128]]", "rocm -keys=rocm,gpu -max_num_threads=256 -max_shared_memory_per_block=65536 -max_threads_per_block=256 -mcpu=gfx908 -mtriple=amdgcn-amd-amdhsa-hcc -thread_warp_size=64", [-1, 16, 64, 65536, 2147483647, 1024, 16, 64], "", 0, []], [[], [["CI", 5], ["CI", 4], ["SP", 2, 0, 8192, [8, 1, 4, 4], 1], ["SP", 2, 5, 128, [2, 32, 1, 1], 1], ["SP", 2, 10, 1152, [6, 8], 1], ["RE", 2, [0, 5, 1, 6, 2, 7, 10, 11, 3, 8, 12, 4, 9]], ["FSP", 6, 0, 2, 3], ["FSP", 6, 4, 3, 3], ["RE", 6, [0, 4, 1, 5, 2, 6, 3, 7]], ["CA", 2, 6, 5], ["CHR", 1, "shared", [2]], ["CA", 2, 3, 6], ["CHR", 0, "shared", [3]], ["CA", 1, 4, 6], ["FU", 8, [0, 1]], ["AN", 8, 0, 5], ["FU", 8, [1, 2]], ["AN", 8, 1, 4], ["FU", 8, [2, 3]], ["AN", 8, 2, 6], ["FU", 3, [0, 1]], ["SP", 3, 0, 48, [1], 1], ["AN", 3, 1, 2], ["FFSP", 3, 0, [3, 2], 1, 1], ["AN", 3, 1, 6], ["FU", 1, [0, 1]], ["SP", 1, 0, 768, [1], 1], ["AN", 1, 1, 2], ["FFSP", 1, 0, [3, 2], 1, 1], ["AN", 1, 1, 6], ["PR", 4, 0, "auto_unroll_max_step$16"]]]], "r": [[0.0502354], 0, 2.22217, 1695324457], "v": "v0.6"}
