ansor_log/rocm-MI100/CNN/rocm-CNN-100.json
{"i": [["[\"990586ac95c316d6af64e8ddc5165a26\", [8192, 1152], [128, 1152], [128], [8192, 128]]", "rocm -keys=rocm,gpu -max_num_threads=256 -max_shared_memory_per_block=65536 -max_threads_per_block=256 -mcpu=gfx908 -mtriple=amdgcn-amd-amdhsa-hcc -thread_warp_size=64", [-1, 16, 64, 65536, 2147483647, 1024, 16, 64], "", 0, []], [[], [["CI", 5], ["CI", 4], ["SP", 2, 0, 8192, [8, 32, 4, 2], 1], ["SP", 2, 5, 128, [1, 4, 2, 4], 1], ["SP", 2, 10, 1152, [1, 6], 1], ["RE", 2, [0, 5, 1, 6, 2, 7, 10, 11, 3, 8, 12, 4, 9]], ["FSP", 6, 0, 2, 3], ["FSP", 6, 4, 3, 3], ["RE", 6, [0, 4, 1, 5, 2, 6, 3, 7]], ["CA", 2, 6, 5], ["CHR", 1, "shared", [2]], ["CA", 2, 3, 6], ["CHR", 0, "shared", [3]], ["CA", 1, 4, 6], ["FU", 8, [0, 1]], ["AN", 8, 0, 5], ["FU", 8, [1, 2]], ["AN", 8, 1, 4], ["FU", 8, [2, 3]], ["AN", 8, 2, 6], ["FU", 3, [0, 1]], ["SP", 3, 0, 48, [1], 1], ["AN", 3, 1, 2], ["FFSP", 3, 0, [3, 2], 1, 1], ["AN", 3, 1, 6], ["FU", 1, [0, 1]], ["SP", 1, 0, 48, [4], 1], ["AN", 1, 1, 2], ["FFSP", 1, 0, [3, 2], 1, 1], ["AN", 1, 1, 6], ["PR", 4, 0, "auto_unroll_max_step$1024"]]]], "r": [[0.108241], 0, 12.9653, 1695331760], "v": "v0.6"}
{"i": [["[\"990586ac95c316d6af64e8ddc5165a26\", [8192, 1152], [128, 1152], [128], [8192, 128]]", "rocm -keys=rocm,gpu -max_num_threads=256 -max_shared_memory_per_block=65536 -max_threads_per_block=256 -mcpu=gfx908 -mtriple=amdgcn-amd-amdhsa-hcc -thread_warp_size=64", [-1, 16, 64, 65536, 2147483647, 1024, 16, 64], "", 0, []], [[], [["CI", 5], ["CI", 4], ["SP", 2, 0, 8192, [1, 16, 2, 4], 1], ["SP", 2, 5, 128, [2, 4, 1, 8], 1], ["SP", 2, 10, 1152, [1, 48], 1], ["RE", 2, [0, 5, 1, 6, 2, 7, 10, 11, 3, 8, 12, 4, 9]], ["FSP", 6, 0, 2, 3], ["FSP", 6, 4, 3, 3], ["RE", 6, [0, 4, 1, 5, 2, 6, 3, 7]], ["CA", 2, 6, 5], ["CHR", 1, "shared", [2]], ["CA", 2, 3, 6], ["CHR", 0, "shared", [3]], ["CA", 1, 4, 6], ["FU", 8, [0, 1]], ["AN", 8, 0, 5], ["FU", 8, [1, 2]], ["AN", 8, 1, 4], ["FU", 8, [2, 3]], ["AN", 8, 2, 6], ["FU", 3, [0, 1]], ["SP", 3, 0, 384, [1], 1], ["AN", 3, 1, 2], ["FFSP", 3, 0, [3, 2], 1, 1], ["AN", 3, 1, 6], ["FU", 1, [0, 1]], ["SP", 1, 0, 384, [1], 1], ["AN", 1, 1, 2], ["FFSP", 1, 0, [3, 2], 1, 1], ["AN", 1, 1, 6], ["PR", 4, 0, "auto_unroll_max_step$1024"]]]], "r": [[0.00732335], 0, 5.10843, 1695331761], "v": "v0.6"}
{"i": [["[\"990586ac95c316d6af64e8ddc5165a26\", [8192, 1152], [128, 1152], [128], [8192, 128]]", "rocm -keys=rocm,gpu -max_num_threads=256 -max_shared_memory_per_block=65536 -max_threads_per_block=256 -mcpu=gfx908 -mtriple=amdgcn-amd-amdhsa-hcc -thread_warp_size=64", [-1, 16, 64, 65536, 2147483647, 1024, 16, 64], "", 0, []], [[], [["CI", 5], ["CI", 4], ["SP", 2, 0, 8192, [2, 128, 2, 2], 1], ["SP", 2, 5, 128, [1, 4, 1, 32], 1], ["SP", 2, 10, 1152, [3, 2], 1], ["RE", 2, [0, 5, 1, 6, 2, 7, 10, 11, 3, 8, 12, 4, 9]], ["FSP", 6, 0, 2, 3], ["FSP", 6, 4, 3, 3], ["RE", 6, [0, 4, 1, 5, 2, 6, 3, 7]], ["CA", 2, 6, 5], ["CHR", 1, "shared", [2]], ["CA", 2, 3, 6], ["CHR", 0, "shared", [3]], ["CA", 1, 4, 6], ["FU", 8, [0, 1]], ["AN", 8, 0, 5], ["FU", 8, [1, 2]], ["AN", 8, 1, 4], ["FU", 8, [2, 3]], ["AN", 8, 2, 6], ["FU", 3, [0, 1]], ["SP", 3, 0, 192, [24], 1], ["AN", 3, 1, 2], ["FFSP", 3, 0, [3, 2], 1, 1], ["AN", 3, 1, 6], ["FU", 1, [0, 1]], ["SP", 1, 0, 48, [1], 1], ["AN", 1, 1, 2], ["FFSP", 1, 0, [3, 2], 1, 1], ["AN", 1, 1, 6], ["PR", 4, 0, "auto_unroll_max_step$64"]]]], "r": [[0.0719096], 0, 3.31349, 1695331762], "v": "v0.6"}
{"i": [["[\"990586ac95c316d6af64e8ddc5165a26\", [8192, 1152], [128, 1152], [128], [8192, 128]]", "rocm -keys=rocm,gpu -max_num_threads=256 -max_shared_memory_per_block=65536 -max_threads_per_block=256 -mcpu=gfx908 -mtriple=amdgcn-amd-amdhsa-hcc -thread_warp_size=64", [-1, 16, 64, 65536, 2147483647, 1024, 16, 64], "", 0, []], [[], [["CI", 5], ["CI", 4], ["SP", 2, 0, 8192, [4, 128, 1, 1], 1], ["SP", 2, 5, 128, [1, 2, 1, 8], 1], ["SP", 2, 10, 1152, [4, 6], 1], ["RE", 2, [0, 5, 1, 6, 2, 7, 10, 11, 3, 8, 12, 4, 9]], ["FSP", 6, 0, 2, 3], ["FSP", 6, 4, 3, 3], ["RE", 6, [0, 4, 1, 5, 2, 6, 3, 7]], ["CA", 2, 6, 5], ["CHR", 1, "shared", [2]], ["CA", 2, 3, 6], ["CHR", 0, "shared", [3]], ["CA", 1, 4, 6], ["FU", 8, [0, 1]], ["AN", 8, 0, 5], ["FU", 8, [1, 2]], ["AN", 8, 1, 4], ["FU", 8, [2, 3]], ["AN", 8, 2, 6], ["FU", 3, [0, 1]], ["SP", 3, 0, 96, [1], 1], ["AN", 3, 1, 2], ["FFSP", 3, 0, [3, 2], 1, 1], ["AN", 3, 1, 6], ["FU", 1, [0, 1]], ["SP", 1, 0, 24, [4], 1], ["AN", 1, 1, 2], ["FFSP", 1, 0, [3, 2], 1, 1], ["AN", 1, 1, 6], ["PR", 4, 0, "auto_unroll_max_step$16"]]]], "r": [[0.00133033], 0, 2.15197, 1695331764], "v": "v0.6"}
{"i": [["[\"990586ac95c316d6af64e8ddc5165a26\", [8192, 1152], [128, 1152], [128], [8192, 128]]", "rocm -keys=rocm,gpu -max_num_threads=256 -max_shared_memory_per_block=65536 -max_threads_per_block=256 -mcpu=gfx908 -mtriple=amdgcn-amd-amdhsa-hcc -thread_warp_size=64", [-1, 16, 64, 65536, 2147483647, 1024, 16, 64], "", 0, []], [[], [["CI", 5], ["CI", 4], ["SP", 2, 0, 8192, [2, 16, 4, 8], 1], ["SP", 2, 5, 128, [2, 4, 1, 16], 1], ["SP", 2, 10, 1152, [1, 9], 1], ["RE", 2, [0, 5, 1, 6, 2, 7, 10, 11, 3, 8, 12, 4, 9]], ["FSP", 6, 0, 2, 3], ["FSP", 6, 4, 3, 3], ["RE", 6, [0, 4, 1, 5, 2, 6, 3, 7]], ["CA", 2, 6, 5], ["CHR", 1, "shared", [2]], ["CA", 2, 3, 6], ["CHR", 0, "shared", [3]], ["CA", 1, 4, 6], ["FU", 8, [0, 1]], ["AN", 8, 0, 5], ["FU", 8, [1, 2]], ["AN", 8, 1, 4], ["FU", 8, [2, 3]], ["AN", 8, 2, 6], ["FU", 3, [0, 1]], ["SP", 3, 0, 48, [12], 1], ["AN", 3, 1, 2], ["FFSP", 3, 0, [3, 2], 1, 1], ["AN", 3, 1, 6], ["FU", 1, [0, 1]], ["SP", 1, 0, 96, [2], 1], ["AN", 1, 1, 2], ["FFSP", 1, 0, [3, 2], 1, 1], ["AN", 1, 1, 6], ["PR", 4, 0, "auto_unroll_max_step$0"]]]], "r": [[0.477295], 0, 4.69118, 1695331768], "v": "v0.6"}
{"i": [["[\"990586ac95c316d6af64e8ddc5165a26\", [8192, 1152], [128, 1152], [128], [8192, 128]]", "rocm -keys=rocm,gpu -max_num_threads=256 -max_shared_memory_per_block=65536 -max_threads_per_block=256 -mcpu=gfx908 -mtriple=amdgcn-amd-amdhsa-hcc -thread_warp_size=64", [-1, 16, 64, 65536, 2147483647, 1024, 16, 64], "", 0, []], [[], [["CI", 5], ["CI", 4], ["SP", 2, 0, 8192, [2, 32, 2, 1], 1], ["SP", 2, 5, 128, [2, 4, 1, 4], 1], ["SP", 2, 10, 1152, [4, 3], 1], ["RE", 2, [0, 5, 1, 6, 2, 7, 10, 11, 3, 8, 12, 4, 9]], ["FSP", 6, 0, 2, 3], ["FSP", 6, 4, 3, 3], ["RE", 6, [0, 4, 1, 5, 2, 6, 3, 7]], ["CA", 2, 6, 5], ["CHR", 1, "shared", [2]], ["CA", 2, 3, 6], ["CHR", 0, "shared", [3]], ["CA", 1, 4, 6], ["FU", 8, [0, 1]], ["AN", 8, 0, 5], ["FU", 8, [1, 2]], ["AN", 8, 1, 4], ["FU", 8, [2, 3]], ["AN", 8, 2, 6], ["FU", 3, [0, 1]], ["SP", 3, 0, 48, [1], 1], ["AN", 3, 1, 2], ["FFSP", 3, 0, [3, 2], 1, 1], ["AN", 3, 1, 6], ["FU", 1, [0, 1]], ["SP", 1, 0, 24, [1], 1], ["AN", 1, 1, 2], ["FFSP", 1, 0, [3, 2], 1, 1], ["AN", 1, 1, 6], ["PR", 4, 0, "auto_unroll_max_step$64"]]]], "r": [[0.000564228], 0, 2.21051, 1695331769], "v": "v0.6"}
{"i": [["[\"990586ac95c316d6af64e8ddc5165a26\", [8192, 1152], [128, 1152], [128], [8192, 128]]", "rocm -keys=rocm,gpu -max_num_threads=256 -max_shared_memory_per_block=65536 -max_threads_per_block=256 -mcpu=gfx908 -mtriple=amdgcn-amd-amdhsa-hcc -thread_warp_size=64", [-1, 16, 64, 65536, 2147483647, 1024, 16, 64], "", 0, []], [[], [["CI", 5], ["CI", 4], ["SP", 2, 0, 8192, [1, 2, 8, 8], 1], ["SP", 2, 5, 128, [2, 8, 2, 2], 1], ["SP", 2, 10, 1152, [4, 8], 1], ["RE", 2, [0, 5, 1, 6, 2, 7, 10, 11, 3, 8, 12, 4, 9]], ["FSP", 6, 0, 2, 3], ["FSP", 6, 4, 3, 3], ["RE", 6, [0, 4, 1, 5, 2, 6, 3, 7]], ["CA", 2, 6, 5], ["CHR", 1, "shared", [2]], ["CA", 2, 3, 6], ["CHR", 0, "shared", [3]], ["CA", 1, 4, 6], ["FU", 8, [0, 1]], ["AN", 8, 0, 5], ["FU", 8, [1, 2]], ["AN", 8, 1, 4], ["FU", 8, [2, 3]], ["AN", 8, 2, 6], ["FU", 3, [0, 1]], ["SP", 3, 0, 128, [1], 1], ["AN", 3, 1, 2], ["FFSP", 3, 0, [3, 2], 1, 1], ["AN", 3, 1, 6], ["FU", 1, [0, 1]], ["SP", 1, 0, 256, [1], 1], ["AN", 1, 1, 2], ["FFSP", 1, 0, [3, 2], 1, 1], ["AN", 1, 1, 6], ["PR", 4, 0, "auto_unroll_max_step$1024"]]]], "r": [[0.0584146], 0, 8.92391, 1695331770], "v": "v0.6"}
{"i": [["[\"990586ac95c316d6af64e8ddc5165a26\", [8192, 1152], [128, 1152], [128], [8192, 128]]", "rocm -keys=rocm,gpu -max_num_threads=256 -max_shared_memory_per_block=65536 -max_threads_per_block=256 -mcpu=gfx908 -mtriple=amdgcn-amd-amdhsa-hcc -thread_warp_size=64", [-1, 16, 64, 65536, 2147483647, 1024, 16, 64], "", 0, []], [[], [["CI", 5], ["CI", 4], ["SP", 2, 0, 8192, [2, 32, 2, 1], 1], ["SP", 2, 5, 128, [2, 4, 1, 4], 1], ["SP", 2, 10, 1152, [4, 24], 1], ["RE", 2, [0, 5, 1, 6, 2, 7, 10, 11, 3, 8, 12, 4, 9]], ["FSP", 6, 0, 2, 3], ["FSP", 6, 4, 3, 3], ["RE", 6, [0, 4, 1, 5, 2, 6, 3, 7]], ["CA", 2, 6, 5], ["CHR", 1, "shared", [2]], ["CA", 2, 3, 6], ["CHR", 0, "shared", [3]], ["CA", 1, 4, 6], ["FU", 8, [0, 1]], ["AN", 8, 0, 5], ["FU", 8, [1, 2]], ["AN", 8, 1, 4], ["FU", 8, [2, 3]], ["AN", 8, 2, 6], ["FU", 3, [0, 1]], ["SP", 3, 0, 48, [1], 1], ["AN", 3, 1, 2], ["FFSP", 3, 0, [3, 2], 1, 1], ["AN", 3, 1, 6], ["FU", 1, [0, 1]], ["SP", 1, 0, 24, [1], 1], ["AN", 1, 1, 2], ["FFSP", 1, 0, [3, 2], 1, 1], ["AN", 1, 1, 6], ["PR", 4, 0, "auto_unroll_max_step$64"]]]], "r": [[0.00187839], 0, 2.22816, 1695331771], "v": "v0.6"}
{"i": [["[\"990586ac95c316d6af64e8ddc5165a26\", [8192, 1152], [128, 1152], [128], [8192, 128]]", "rocm -keys=rocm,gpu -max_num_threads=256 -max_shared_memory_per_block=65536 -max_threads_per_block=256 -mcpu=gfx908 -mtriple=amdgcn-amd-amdhsa-hcc -thread_warp_size=64", [-1, 16, 64, 65536, 2147483647, 1024, 16, 64], "", 0, []], [[], [["CI", 5], ["CI", 4], ["SP", 2, 0, 8192, [4, 8, 2, 4], 1], ["SP", 2, 5, 128, [2, 8, 1, 4], 1], ["SP", 2, 10, 1152, [1, 1], 1], ["RE", 2, [0, 5, 1, 6, 2, 7, 10, 11, 3, 8, 12, 4, 9]], ["FSP", 6, 0, 2, 3], ["FSP", 6, 4, 3, 3], ["RE", 6, [0, 4, 1, 5, 2, 6, 3, 7]], ["CA", 2, 6, 5], ["CHR", 1, "shared", [2]], ["CA", 2, 3, 6], ["CHR", 0, "shared", [3]], ["CA", 1, 4, 6], ["FU", 8, [0, 1]], ["AN", 8, 0, 5], ["FU", 8, [1, 2]], ["AN", 8, 1, 4], ["FU", 8, [2, 3]], ["AN", 8, 2, 6], ["FU", 3, [0, 1]], ["SP", 3, 0, 24, [1], 1], ["AN", 3, 1, 2], ["FFSP", 3, 0, [3, 2], 1, 1], ["AN", 3, 1, 6], ["FU", 1, [0, 1]], ["SP", 1, 0, 24, [3], 1], ["AN", 1, 1, 2], ["FFSP", 1, 0, [3, 2], 1, 1], ["AN", 1, 1, 6], ["PR", 4, 0, "auto_unroll_max_step$64"]]]], "r": [[0.0745606], 0, 4.7602, 1695331774], "v": "v0.6"}
{"i": [["[\"990586ac95c316d6af64e8ddc5165a26\", [8192, 1152], [128, 1152], [128], [8192, 128]]", "rocm -keys=rocm,gpu -max_num_threads=256 -max_shared_memory_per_block=65536 -max_threads_per_block=256 -mcpu=gfx908 -mtriple=amdgcn-amd-amdhsa-hcc -thread_warp_size=64", [-1, 16, 64, 65536, 2147483647, 1024, 16, 64], "", 0, []], [[], [["CI", 5], ["CI", 4], ["SP", 2, 0, 8192, [8, 512, 1, 2], 1], ["SP", 2, 5, 128, [1, 2, 4, 16], 1], ["SP", 2, 10, 1152, [1, 1], 1], ["RE", 2, [0, 5, 1, 6, 2, 7, 10, 11, 3, 8, 12, 4, 9]], ["FSP", 6, 0, 2, 3], ["FSP", 6, 4, 3, 3], ["RE", 6, [0, 4, 1, 5, 2, 6, 3, 7]], ["CA", 2, 6, 5], ["CHR", 1, "shared", [2]], ["CA", 2, 3, 6], ["CHR", 0, "shared", [3]], ["CA", 1, 4, 6], ["FU", 8, [0, 1]], ["AN", 8, 0, 5], ["FU", 8, [1, 2]], ["AN", 8, 1, 4], ["FU", 8, [2, 3]], ["AN", 8, 2, 6], ["FU", 3, [0, 1]], ["SP", 3, 0, 32, [2], 1], ["AN", 3, 1, 2], ["FFSP", 3, 0, [3, 2], 1, 1], ["AN", 3, 1, 6], ["FU", 1, [0, 1]], ["SP", 1, 0, 2, [1], 1], ["AN", 1, 1, 2], ["FFSP", 1, 0, [3, 2], 1, 1], ["AN", 1, 1, 6], ["PR", 4, 0, "auto_unroll_max_step$64"]]]], "r": [[0.440476], 0, 10.5331, 1695331777], "v": "v0.6"}
{"i": [["[\"990586ac95c316d6af64e8ddc5165a26\", [8192, 1152], [128, 1152], [128], [8192, 128]]", "rocm -keys=rocm,gpu -max_num_threads=256 -max_shared_memory_per_block=65536 -max_threads_per_block=256 -mcpu=gfx908 -mtriple=amdgcn-amd-amdhsa-hcc -thread_warp_size=64", [-1, 16, 64, 65536, 2147483647, 1024, 16, 64], "", 0, []], [[], [["CI", 5], ["CI", 4], ["SP", 2, 0, 8192, [8, 8, 1, 1], 1], ["SP", 2, 5, 128, [1, 1, 1, 2], 1], ["SP", 2, 10, 1152, [4, 2], 1], ["RE", 2, [0, 5, 1, 6, 2, 7, 10, 11, 3, 8, 12, 4, 9]], ["FSP", 6, 0, 2, 3], ["FSP", 6, 4, 3, 3], ["RE", 6, [0, 4, 1, 5, 2, 6, 3, 7]], ["CA", 2, 6, 5], ["CHR", 1, "shared", [2]], ["CA", 2, 3, 6], ["CHR", 0, "shared", [3]], ["CA", 1, 4, 6], ["FU", 8, [0, 1]], ["AN", 8, 0, 5], ["FU", 8, [1, 2]], ["AN", 8, 1, 4], ["FU", 8, [2, 3]], ["AN", 8, 2, 6], ["FU", 3, [0, 1]], ["SP", 3, 0, 128, [1], 1], ["AN", 3, 1, 2], ["FFSP", 3, 0, [3, 2], 1, 1], ["AN", 3, 1, 6], ["FU", 1, [0, 1]], ["SP", 1, 0, 64, [1], 1], ["AN", 1, 1, 2], ["FFSP", 1, 0, [3, 2], 1, 1], ["AN", 1, 1, 6], ["PR", 4, 0, "auto_unroll_max_step$64"]]]], "r": [[0.00778592], 0, 2.54492, 1695331778], "v": "v0.6"}
{"i": [["[\"990586ac95c316d6af64e8ddc5165a26\", [8192, 1152], [128, 1152], [128], [8192, 128]]", "rocm -keys=rocm,gpu -max_num_threads=256 -max_shared_memory_per_block=65536 -max_threads_per_block=256 -mcpu=gfx908 -mtriple=amdgcn-amd-amdhsa-hcc -thread_warp_size=64", [-1, 16, 64, 65536, 2147483647, 1024, 16, 64], "", 0, []], [[], [["CI", 5], ["CI", 4], ["SP", 2, 0, 8192, [2, 2, 8, 2], 1], ["SP", 2, 5, 128, [1, 64, 2, 1], 1], ["SP", 2, 10, 1152, [1, 2], 1], ["RE", 2, [0, 5, 1, 6, 2, 7, 10, 11, 3, 8, 12, 4, 9]], ["FSP", 6, 0, 2, 3], ["FSP", 6, 4, 3, 3], ["RE", 6, [0, 4, 1, 5, 2, 6, 3, 7]], ["CA", 2, 6, 5], ["CHR", 1, "shared", [2]], ["CA", 2, 3, 6], ["CHR", 0, "shared", [3]], ["CA", 1, 4, 6], ["FU", 8, [0, 1]], ["AN", 8, 0, 5], ["FU", 8, [1, 2]], ["AN", 8, 1, 4], ["FU", 8, [2, 3]], ["AN", 8, 2, 6], ["FU", 3, [0, 1]], ["SP", 3, 0, 48, [1], 1], ["AN", 3, 1, 2], ["FFSP", 3, 0, [3, 2], 1, 1], ["AN", 3, 1, 6], ["FU", 1, [0, 1]], ["SP", 1, 0, 384, [1], 1], ["AN", 1, 1, 2], ["FFSP", 1, 0, [3, 2], 1, 1], ["AN", 1, 1, 6], ["PR", 4, 0, "auto_unroll_max_step$0"]]]], "r": [[0.00110562], 0, 2.32667, 1695331779], "v": "v0.6"}
{"i": [["[\"990586ac95c316d6af64e8ddc5165a26\", [8192, 1152], [128, 1152], [128], [8192, 128]]", "rocm -keys=rocm,gpu -max_num_threads=256 -max_shared_memory_per_block=65536 -max_threads_per_block=256 -mcpu=gfx908 -mtriple=amdgcn-amd-amdhsa-hcc -thread_warp_size=64", [-1, 16, 64, 65536, 2147483647, 1024, 16, 64], "", 0, []], [[], [["CI", 5], ["CI", 4], ["SP", 2, 0, 8192, [1, 1, 1, 2], 1], ["SP", 2, 5, 128, [1, 2, 8, 1], 1], ["SP", 2, 10, 1152, [1, 3], 1], ["RE", 2, [0, 5, 1, 6, 2, 7, 10, 11, 3, 8, 12, 4, 9]], ["FSP", 6, 0, 2, 3], ["FSP", 6, 4, 3, 3], ["RE", 6, [0, 4, 1, 5, 2, 6, 3, 7]], ["CA", 2, 6, 5], ["CHR", 1, "shared", [2]], ["CA", 2, 3, 6], ["CHR", 0, "shared", [3]], ["CA", 1, 4, 6], ["FU", 8, [0, 1]], ["AN", 8, 0, 5], ["FU", 8, [1, 2]], ["AN", 8, 1, 4], ["FU", 8, [2, 3]], ["AN", 8, 2, 6], ["FU", 3, [0, 1]], ["SP", 3, 0, 384, [1], 1], ["AN", 3, 1, 2], ["FFSP", 3, 0, [3, 2], 1, 1], ["AN", 3, 1, 6], ["FU", 1, [0, 1]], ["SP", 1, 0, 96, [1], 1], ["AN", 1, 1, 2], ["FFSP", 1, 0, [3, 2], 1, 1], ["AN", 1, 1, 6], ["PR", 4, 0, "auto_unroll_max_step$0"]]]], "r": [[0.0242328], 0, 2.47696, 1695331781], "v": "v0.6"}
{"i": [["[\"990586ac95c316d6af64e8ddc5165a26\", [8192, 1152], [128, 1152], [128], [8192, 128]]", "rocm -keys=rocm,gpu -max_num_threads=256 -max_shared_memory_per_block=65536 -max_threads_per_block=256 -mcpu=gfx908 -mtriple=amdgcn-amd-amdhsa-hcc -thread_warp_size=64", [-1, 16, 64, 65536, 2147483647, 1024, 16, 64], "", 0, []], [[], [["CI", 5], ["CI", 4], ["SP", 2, 0, 8192, [4, 4, 2, 32], 1], ["SP", 2, 5, 128, [4, 1, 1, 16], 1], ["SP", 2, 10, 1152, [1, 1], 1], ["RE", 2, [0, 5, 1, 6, 2, 7, 10, 11, 3, 8, 12, 4, 9]], ["FSP", 6, 0, 2, 3], ["FSP", 6, 4, 3, 3], ["RE", 6, [0, 4, 1, 5, 2, 6, 3, 7]], ["CA", 2, 6, 5], ["CHR", 1, "shared", [2]], ["CA", 2, 3, 6], ["CHR", 0, "shared", [3]], ["CA", 1, 4, 6], ["FU", 8, [0, 1]], ["AN", 8, 0, 5], ["FU", 8, [1, 2]], ["AN", 8, 1, 4], ["FU", 8, [2, 3]], ["AN", 8, 2, 6], ["FU", 3, [0, 1]], ["SP", 3, 0, 3, [1], 1], ["AN", 3, 1, 2], ["FFSP", 3, 0, [3, 2], 1, 1], ["AN", 3, 1, 6], ["FU", 1, [0, 1]], ["SP", 1, 0, 192, [1], 1], ["AN", 1, 1, 2], ["FFSP", 1, 0, [3, 2], 1, 1], ["AN", 1, 1, 6], ["PR", 4, 0, "auto_unroll_max_step$1024"]]]], "r": [[6.86453], 0, 38.8456, 1695331810], "v": "v0.6"}
{"i": [["[\"990586ac95c316d6af64e8ddc5165a26\", [8192, 1152], [128, 1152], [128], [8192, 128]]", "rocm -keys=rocm,gpu -max_num_threads=256 -max_shared_memory_per_block=65536 -max_threads_per_block=256 -mcpu=gfx908 -mtriple=amdgcn-amd-amdhsa-hcc -thread_warp_size=64", [-1, 16, 64, 65536, 2147483647, 1024, 16, 64], "", 0, []], [[], [["CI", 5], ["CI", 4], ["SP", 2, 0, 8192, [16, 4, 1, 2], 1], ["SP", 2, 5, 128, [1, 1, 8, 2], 1], ["SP", 2, 10, 1152, [2, 48], 1], ["RE", 2, [0, 5, 1, 6, 2, 7, 10, 11, 3, 8, 12, 4, 9]], ["FSP", 6, 0, 2, 3], ["FSP", 6, 4, 3, 3], ["RE", 6, [0, 4, 1, 5, 2, 6, 3, 7]], ["CA", 2, 6, 5], ["CHR", 1, "shared", [2]], ["CA", 2, 3, 6], ["CHR", 0, "shared", [3]], ["CA", 1, 4, 6], ["FU", 8, [0, 1]], ["AN", 8, 0, 5], ["FU", 8, [1, 2]], ["AN", 8, 1, 4], ["FU", 8, [2, 3]], ["AN", 8, 2, 6], ["FU", 3, [0, 1]], ["SP", 3, 0, 1536, [1], 1], ["AN", 3, 1, 2], ["FFSP", 3, 0, [3, 2], 1, 1], ["AN", 3, 1, 6], ["FU", 1, [0, 1]], ["SP", 1, 0, 192, [1], 1], ["AN", 1, 1, 2], ["FFSP", 1, 0, [3, 2], 1, 1], ["AN", 1, 1, 6], ["PR", 4, 0, "auto_unroll_max_step$64"]]]], "r": [[0.0732727], 0, 3.14307, 1695331811], "v": "v0.6"}
{"i": [["[\"990586ac95c316d6af64e8ddc5165a26\", [8192, 1152], [128, 1152], [128], [8192, 128]]", "rocm -keys=rocm,gpu -max_num_threads=256 -max_shared_memory_per_block=65536 -max_threads_per_block=256 -mcpu=gfx908 -mtriple=amdgcn-amd-amdhsa-hcc -thread_warp_size=64", [-1, 16, 64, 65536, 2147483647, 1024, 16, 64], "", 0, []], [[], [["CI", 5], ["CI", 4], ["SP", 2, 0, 8192, [2, 2, 4, 8], 1], ["SP", 2, 5, 128, [2, 64, 1, 1], 1], ["SP", 2, 10, 1152, [6, 4], 1], ["RE", 2, [0, 5, 1, 6, 2, 7, 10, 11, 3, 8, 12, 4, 9]], ["FSP", 6, 0, 2, 3], ["FSP", 6, 4, 3, 3], ["RE", 6, [0, 4, 1, 5, 2, 6, 3, 7]], ["CA", 2, 6, 5], ["CHR", 1, "shared", [2]], ["CA", 2, 3, 6], ["CHR", 0, "shared", [3]], ["CA", 1, 4, 6], ["FU", 8, [0, 1]], ["AN", 8, 0, 5], ["FU", 8, [1, 2]], ["AN", 8, 1, 4], ["FU", 8, [2, 3]], ["AN", 8, 2, 6], ["FU", 3, [0, 1]], ["SP", 3, 0, 24, [1], 1], ["AN", 3, 1, 2], ["FFSP", 3, 0, [3, 2], 1, 1], ["AN", 3, 1, 6], ["FU", 1, [0, 1]], ["SP", 1, 0, 384, [48], 1], ["AN", 1, 1, 2], ["FFSP", 1, 0, [3, 2], 1, 1], ["AN", 1, 1, 6], ["PR", 4, 0, "auto_unroll_max_step$16"]]]], "r": [[0.0132376], 0, 3.83755, 1695331812], "v": "v0.6"}
{"i": [["[\"990586ac95c316d6af64e8ddc5165a26\", [8192, 1152], [128, 1152], [128], [8192, 128]]", "rocm -keys=rocm,gpu -max_num_threads=256 -max_shared_memory_per_block=65536 -max_threads_per_block=256 -mcpu=gfx908 -mtriple=amdgcn-amd-amdhsa-hcc -thread_warp_size=64", [-1, 16, 64, 65536, 2147483647, 1024, 16, 64], "", 0, []], [[], [["CI", 5], ["CI", 4], ["SP", 2, 0, 8192, [2, 8, 1, 64], 1], ["SP", 2, 5, 128, [4, 2, 8, 2], 1], ["SP", 2, 10, 1152, [4, 3], 1], ["RE", 2, [0, 5, 1, 6, 2, 7, 10, 11, 3, 8, 12, 4, 9]], ["FSP", 6, 0, 2, 3], ["FSP", 6, 4, 3, 3], ["RE", 6, [0, 4, 1, 5, 2, 6, 3, 7]], ["CA", 2, 6, 5], ["CHR", 1, "shared", [2]], ["CA", 2, 3, 6], ["CHR", 0, "shared", [3]], ["CA", 1, 4, 6], ["FU", 8, [0, 1]], ["AN", 8, 0, 5], ["FU", 8, [1, 2]], ["AN", 8, 1, 4], ["FU", 8, [2, 3]], ["AN", 8, 2, 6], ["FU", 3, [0, 1]], ["SP", 3, 0, 192, [1], 1], ["AN", 3, 1, 2], ["FFSP", 3, 0, [3, 2], 1, 1], ["AN", 3, 1, 6], ["FU", 1, [0, 1]], ["SP", 1, 0, 12, [1], 1], ["AN", 1, 1, 2], ["FFSP", 1, 0, [3, 2], 1, 1], ["AN", 1, 1, 6], ["PR", 4, 0, "auto_unroll_max_step$0"]]]], "r": [[0.242699], 0, 3.64624, 1695331815], "v": "v0.6"}
{"i": [["[\"990586ac95c316d6af64e8ddc5165a26\", [8192, 1152], [128, 1152], [128], [8192, 128]]", "rocm -keys=rocm,gpu -max_num_threads=256 -max_shared_memory_per_block=65536 -max_threads_per_block=256 -mcpu=gfx908 -mtriple=amdgcn-amd-amdhsa-hcc -thread_warp_size=64", [-1, 16, 64, 65536, 2147483647, 1024, 16, 64], "", 0, []], [[], [["CI", 5], ["CI", 4], ["SP", 2, 0, 8192, [1, 8, 2, 1], 1], ["SP", 2, 5, 128, [1, 8, 2, 4], 1], ["SP", 2, 10, 1152, [24, 2], 1], ["RE", 2, [0, 5, 1, 6, 2, 7, 10, 11, 3, 8, 12, 4, 9]], ["FSP", 6, 0, 2, 3], ["FSP", 6, 4, 3, 3], ["RE", 6, [0, 4, 1, 5, 2, 6, 3, 7]], ["CA", 2, 6, 5], ["CHR", 1, "shared", [2]], ["CA", 2, 3, 6], ["CHR", 0, "shared", [3]], ["CA", 1, 4, 6], ["FU", 8, [0, 1]], ["AN", 8, 0, 5], ["FU", 8, [1, 2]], ["AN", 8, 1, 4], ["FU", 8, [2, 3]], ["AN", 8, 2, 6], ["FU", 3, [0, 1]], ["SP", 3, 0, 384, [32], 1], ["AN", 3, 1, 2], ["FFSP", 3, 0, [3, 2], 1, 1], ["AN", 3, 1, 6], ["FU", 1, [0, 1]], ["SP", 1, 0, 96, [32], 1], ["AN", 1, 1, 2], ["FFSP", 1, 0, [3, 2], 1, 1], ["AN", 1, 1, 6], ["PR", 4, 0, "auto_unroll_max_step$0"]]]], "r": [[0.00158972], 0, 2.35706, 1695331816], "v": "v0.6"}
{"i": [["[\"990586ac95c316d6af64e8ddc5165a26\", [8192, 1152], [128, 1152], [128], [8192, 128]]", "rocm -keys=rocm,gpu -max_num_threads=256 -max_shared_memory_per_block=65536 -max_threads_per_block=256 -mcpu=gfx908 -mtriple=amdgcn-amd-amdhsa-hcc -thread_warp_size=64", [-1, 16, 64, 65536, 2147483647, 1024, 16, 64], "", 0, []], [[], [["CI", 5], ["CI", 4], ["SP", 2, 0, 8192, [2, 16, 1, 16], 1], ["SP", 2, 5, 128, [1, 32, 1, 1], 1], ["SP", 2, 10, 1152, [12, 1], 1], ["RE", 2, [0, 5, 1, 6, 2, 7, 10, 11, 3, 8, 12, 4, 9]], ["FSP", 6, 0, 2, 3], ["FSP", 6, 4, 3, 3], ["RE", 6, [0, 4, 1, 5, 2, 6, 3, 7]], ["CA", 2, 6, 5], ["CHR", 1, "shared", [2]], ["CA", 2, 3, 6], ["CHR", 0, "shared", [3]], ["CA", 1, 4, 6], ["FU", 8, [0, 1]], ["AN", 8, 0, 5], ["FU", 8, [1, 2]], ["AN", 8, 1, 4], ["FU", 8, [2, 3]], ["AN", 8, 2, 6], ["FU", 3, [0, 1]], ["SP", 3, 0, 48, [1], 1], ["AN", 3, 1, 2], ["FFSP", 3, 0, [3, 2], 1, 1], ["AN", 3, 1, 6], ["FU", 1, [0, 1]], ["SP", 1, 0, 192, [1], 1], ["AN", 1, 1, 2], ["FFSP", 1, 0, [3, 2], 1, 1], ["AN", 1, 1, 6], ["PR", 4, 0, "auto_unroll_max_step$512"]]]], "r": [[0.000807966], 0, 3.32037, 1695331818], "v": "v0.6"}
{"i": [["[\"990586ac95c316d6af64e8ddc5165a26\", [8192, 1152], [128, 1152], [128], [8192, 128]]", "rocm -keys=rocm,gpu -max_num_threads=256 -max_shared_memory_per_block=65536 -max_threads_per_block=256 -mcpu=gfx908 -mtriple=amdgcn-amd-amdhsa-hcc -thread_warp_size=64", [-1, 16, 64, 65536, 2147483647, 1024, 16, 64], "", 0, []], [[], [["CI", 5], ["CI", 4], ["SP", 2, 0, 8192, [4, 4, 8, 2], 1], ["SP", 2, 5, 128, [1, 16, 2, 2], 1], ["SP", 2, 10, 1152, [4, 9], 1], ["RE", 2, [0, 5, 1, 6, 2, 7, 10, 11, 3, 8, 12, 4, 9]], ["FSP", 6, 0, 2, 3], ["FSP", 6, 4, 3, 3], ["RE", 6, [0, 4, 1, 5, 2, 6, 3, 7]], ["CA", 2, 6, 5], ["CHR", 1, "shared", [2]], ["CA", 2, 3, 6], ["CHR", 0, "shared", [3]], ["CA", 1, 4, 6], ["FU", 8, [0, 1]], ["AN", 8, 0, 5], ["FU", 8, [1, 2]], ["AN", 8, 1, 4], ["FU", 8, [2, 3]], ["AN", 8, 2, 6], ["FU", 3, [0, 1]], ["SP", 3, 0, 144, [1], 1], ["AN", 3, 1, 2], ["FFSP", 3, 0, [3, 2], 1, 1], ["AN", 3, 1, 6], ["FU", 1, [0, 1]], ["SP", 1, 0, 576, [64], 1], ["AN", 1, 1, 2], ["FFSP", 1, 0, [3, 2], 1, 1], ["AN", 1, 1, 6], ["PR", 4, 0, "auto_unroll_max_step$64"]]]], "r": [[0.00493604], 0, 3.95006, 1695331819], "v": "v0.6"}
{"i": [["[\"990586ac95c316d6af64e8ddc5165a26\", [8192, 1152], [128, 1152], [128], [8192, 128]]", "rocm -keys=rocm,gpu -max_num_threads=256 -max_shared_memory_per_block=65536 -max_threads_per_block=256 -mcpu=gfx908 -mtriple=amdgcn-amd-amdhsa-hcc -thread_warp_size=64", [-1, 16, 64, 65536, 2147483647, 1024, 16, 64], "", 0, []], [[], [["CI", 5], ["CI", 4], ["SP", 2, 0, 8192, [2, 128, 1, 1], 1], ["SP", 2, 5, 128, [8, 1, 1, 2], 1], ["SP", 2, 10, 1152, [1, 18], 1], ["RE", 2, [0, 5, 1, 6, 2, 7, 10, 11, 3, 8, 12, 4, 9]], ["FSP", 6, 0, 2, 3], ["FSP", 6, 4, 3, 3], ["RE", 6, [0, 4, 1, 5, 2, 6, 3, 7]], ["CA", 2, 6, 5], ["CHR", 1, "shared", [2]], ["CA", 2, 3, 6], ["CHR", 0, "shared", [3]], ["CA", 1, 4, 6], ["FU", 8, [0, 1]], ["AN", 8, 0, 5], ["FU", 8, [1, 2]], ["AN", 8, 1, 4], ["FU", 8, [2, 3]], ["AN", 8, 2, 6], ["FU", 3, [0, 1]], ["SP", 3, 0, 144, [1], 1], ["AN", 3, 1, 2], ["FFSP", 3, 0, [3, 2], 1, 1], ["AN", 3, 1, 6], ["FU", 1, [0, 1]], ["SP", 1, 0, 18, [1], 1], ["AN", 1, 1, 2], ["FFSP", 1, 0, [3, 2], 1, 1], ["AN", 1, 1, 6], ["PR", 4, 0, "auto_unroll_max_step$0"]]]], "r": [[0.000901121], 0, 2.69026, 1695331821], "v": "v0.6"}
{"i": [["[\"990586ac95c316d6af64e8ddc5165a26\", [8192, 1152], [128, 1152], [128], [8192, 128]]", "rocm -keys=rocm,gpu -max_num_threads=256 -max_shared_memory_per_block=65536 -max_threads_per_block=256 -mcpu=gfx908 -mtriple=amdgcn-amd-amdhsa-hcc -thread_warp_size=64", [-1, 16, 64, 65536, 2147483647, 1024, 16, 64], "", 0, []], [[], [["CI", 5], ["CI", 4], ["SP", 2, 0, 8192, [4, 16, 16, 1], 1], ["SP", 2, 5, 128, [1, 16, 1, 8], 1], ["SP", 2, 10, 1152, [8, 1], 1], ["RE", 2, [0, 5, 1, 6, 2, 7, 10, 11, 3, 8, 12, 4, 9]], ["FSP", 6, 0, 2, 3], ["FSP", 6, 4, 3, 3], ["RE", 6, [0, 4, 1, 5, 2, 6, 3, 7]], ["CA", 2, 6, 5], ["CHR", 1, "shared", [2]], ["CA", 2, 3, 6], ["CHR", 0, "shared", [3]], ["CA", 1, 4, 6], ["FU", 8, [0, 1]], ["AN", 8, 0, 5], ["FU", 8, [1, 2]], ["AN", 8, 1, 4], ["FU", 8, [2, 3]], ["AN", 8, 2, 6], ["FU", 3, [0, 1]], ["SP", 3, 0, 64, [1], 1], ["AN", 3, 1, 2], ["FFSP", 3, 0, [3, 2], 1, 1], ["AN", 3, 1, 6], ["FU", 1, [0, 1]], ["SP", 1, 0, 128, [4], 1], ["AN", 1, 1, 2], ["FFSP", 1, 0, [3, 2], 1, 1], ["AN", 1, 1, 6], ["PR", 4, 0, "auto_unroll_max_step$512"]]]], "r": [[0.139275], 0, 8.18689, 1695331823], "v": "v0.6"}
{"i": [["[\"990586ac95c316d6af64e8ddc5165a26\", [8192, 1152], [128, 1152], [128], [8192, 128]]", "rocm -keys=rocm,gpu -max_num_threads=256 -max_shared_memory_per_block=65536 -max_threads_per_block=256 -mcpu=gfx908 -mtriple=amdgcn-amd-amdhsa-hcc -thread_warp_size=64", [-1, 16, 64, 65536, 2147483647, 1024, 16, 64], "", 0, []], [[], [["CI", 5], ["CI", 4], ["SP", 2, 0, 8192, [2, 128, 4, 2], 1], ["SP", 2, 5, 128, [8, 1, 2, 1], 1], ["SP", 2, 10, 1152, [2, 2], 1], ["RE", 2, [0, 5, 1, 6, 2, 7, 10, 11, 3, 8, 12, 4, 9]], ["FSP", 6, 0, 2, 3], ["FSP", 6, 4, 3, 3], ["RE", 6, [0, 4, 1, 5, 2, 6, 3, 7]], ["CA", 2, 6, 5], ["CHR", 1, "shared", [2]], ["CA", 2, 3, 6], ["CHR", 0, "shared", [3]], ["CA", 1, 4, 6], ["FU", 8, [0, 1]], ["AN", 8, 0, 5], ["FU", 8, [1, 2]], ["AN", 8, 1, 4], ["FU", 8, [2, 3]], ["AN", 8, 2, 6], ["FU", 3, [0, 1]], ["SP", 3, 0, 8, [1], 1], ["AN", 3, 1, 2], ["FFSP", 3, 0, [3, 2], 1, 1], ["AN", 3, 1, 6], ["FU", 1, [0, 1]], ["SP", 1, 0, 32, [1], 1], ["AN", 1, 1, 2], ["FFSP", 1, 0, [3, 2], 1, 1], ["AN", 1, 1, 6], ["PR", 4, 0, "auto_unroll_max_step$0"]]]], "r": [[0.0106569], 0, 3.10526, 1695331824], "v": "v0.6"}
{"i": [["[\"990586ac95c316d6af64e8ddc5165a26\", [8192, 1152], [128, 1152], [128], [8192, 128]]", "rocm -keys=rocm,gpu -max_num_threads=256 -max_shared_memory_per_block=65536 -max_threads_per_block=256 -mcpu=gfx908 -mtriple=amdgcn-amd-amdhsa-hcc -thread_warp_size=64", [-1, 16, 64, 65536, 2147483647, 1024, 16, 64], "", 0, []], [[], [["CI", 5], ["CI", 4], ["SP", 2, 0, 8192, [1, 32, 2, 4], 1], ["SP", 2, 5, 128, [1, 16, 2, 2], 1], ["SP", 2, 10, 1152, [3, 1], 1], ["RE", 2, [0, 5, 1, 6, 2, 7, 10, 11, 3, 8, 12, 4, 9]], ["FSP", 6, 0, 2, 3], ["FSP", 6, 4, 3, 3], ["RE", 6, [0, 4, 1, 5, 2, 6, 3, 7]], ["CA", 2, 6, 5], ["CHR", 1, "shared", [2]], ["CA", 2, 3, 6], ["CHR", 0, "shared", [3]], ["CA", 1, 4, 6], ["FU", 8, [0, 1]], ["AN", 8, 0, 5], ["FU", 8, [1, 2]], ["AN", 8, 1, 4], ["FU", 8, [2, 3]], ["AN", 8, 2, 6], ["FU", 3, [0, 1]], ["SP", 3, 0, 12, [1], 1], ["AN", 3, 1, 2], ["FFSP", 3, 0, [3, 2], 1, 1], ["AN", 3, 1, 6], ["FU", 1, [0, 1]], ["SP", 1, 0, 6, [1], 1], ["AN", 1, 1, 2], ["FFSP", 1, 0, [3, 2], 1, 1], ["AN", 1, 1, 6], ["PR", 4, 0, "auto_unroll_max_step$512"]]]], "r": [[0.000776639], 0, 2.03849, 1695331825], "v": "v0.6"}
{"i": [["[\"990586ac95c316d6af64e8ddc5165a26\", [8192, 1152], [128, 1152], [128], [8192, 128]]", "rocm -keys=rocm,gpu -max_num_threads=256 -max_shared_memory_per_block=65536 -max_threads_per_block=256 -mcpu=gfx908 -mtriple=amdgcn-amd-amdhsa-hcc -thread_warp_size=64", [-1, 16, 64, 65536, 2147483647, 1024, 16, 64], "", 0, []], [[], [["CI", 5], ["CI", 4], ["SP", 2, 0, 8192, [4, 4, 2, 16], 1], ["SP", 2, 5, 128, [1, 1, 4, 32], 1], ["SP", 2, 10, 1152, [1, 24], 1], ["RE", 2, [0, 5, 1, 6, 2, 7, 10, 11, 3, 8, 12, 4, 9]], ["FSP", 6, 0, 2, 3], ["FSP", 6, 4, 3, 3], ["RE", 6, [0, 4, 1, 5, 2, 6, 3, 7]], ["CA", 2, 6, 5], ["CHR", 1, "shared", [2]], ["CA", 2, 3, 6], ["CHR", 0, "shared", [3]], ["CA", 1, 4, 6], ["FU", 8, [0, 1]], ["AN", 8, 0, 5], ["FU", 8, [1, 2]], ["AN", 8, 1, 4], ["FU", 8, [2, 3]], ["AN", 8, 2, 6], ["FU", 3, [0, 1]], ["SP", 3, 0, 48, [1], 1], ["AN", 3, 1, 2], ["FFSP", 3, 0, [3, 2], 1, 1], ["AN", 3, 1, 6], ["FU", 1, [0, 1]], ["SP", 1, 0, 768, [1], 1], ["AN", 1, 1, 2], ["FFSP", 1, 0, [3, 2], 1, 1], ["AN", 1, 1, 6], ["PR", 4, 0, "auto_unroll_max_step$0"]]]], "r": [[0.518548], 0, 5.08817, 1695331829], "v": "v0.6"}
{"i": [["[\"990586ac95c316d6af64e8ddc5165a26\", [8192, 1152], [128, 1152], [128], [8192, 128]]", "rocm -keys=rocm,gpu -max_num_threads=256 -max_shared_memory_per_block=65536 -max_threads_per_block=256 -mcpu=gfx908 -mtriple=amdgcn-amd-amdhsa-hcc -thread_warp_size=64", [-1, 16, 64, 65536, 2147483647, 1024, 16, 64], "", 0, []], [[], [["CI", 5], ["CI", 4], ["SP", 2, 0, 8192, [8, 32, 2, 2], 1], ["SP", 2, 5, 128, [1, 4, 8, 1], 1], ["SP", 2, 10, 1152, [1, 6], 1], ["RE", 2, [0, 5, 1, 6, 2, 7, 10, 11, 3, 8, 12, 4, 9]], ["FSP", 6, 0, 2, 3], ["FSP", 6, 4, 3, 3], ["RE", 6, [0, 4, 1, 5, 2, 6, 3, 7]], ["CA", 2, 6, 5], ["CHR", 1, "shared", [2]], ["CA", 2, 3, 6], ["CHR", 0, "shared", [3]], ["CA", 1, 4, 6], ["FU", 8, [0, 1]], ["AN", 8, 0, 5], ["FU", 8, [1, 2]], ["AN", 8, 1, 4], ["FU", 8, [2, 3]], ["AN", 8, 2, 6], ["FU", 3, [0, 1]], ["SP", 3, 0, 48, [1], 1], ["AN", 3, 1, 2], ["FFSP", 3, 0, [3, 2], 1, 1], ["AN", 3, 1, 6], ["FU", 1, [0, 1]], ["SP", 1, 0, 48, [1], 1], ["AN", 1, 1, 2], ["FFSP", 1, 0, [3, 2], 1, 1], ["AN", 1, 1, 6], ["PR", 4, 0, "auto_unroll_max_step$1024"]]]], "r": [[0.019315], 0, 9.95525, 1695331830], "v": "v0.6"}
{"i": [["[\"990586ac95c316d6af64e8ddc5165a26\", [8192, 1152], [128, 1152], [128], [8192, 128]]", "rocm -keys=rocm,gpu -max_num_threads=256 -max_shared_memory_per_block=65536 -max_threads_per_block=256 -mcpu=gfx908 -mtriple=amdgcn-amd-amdhsa-hcc -thread_warp_size=64", [-1, 16, 64, 65536, 2147483647, 1024, 16, 64], "", 0, []], [[], [["CI", 5], ["CI", 4], ["SP", 2, 0, 8192, [2, 8, 4, 1], 1], ["SP", 2, 5, 128, [1, 16, 1, 8], 1], ["SP", 2, 10, 1152, [2, 4], 1], ["RE", 2, [0, 5, 1, 6, 2, 7, 10, 11, 3, 8, 12, 4, 9]], ["FSP", 6, 0, 2, 3], ["FSP", 6, 4, 3, 3], ["RE", 6, [0, 4, 1, 5, 2, 6, 3, 7]], ["CA", 2, 6, 5], ["CHR", 1, "shared", [2]], ["CA", 2, 3, 6], ["CHR", 0, "shared", [3]], ["CA", 1, 4, 6], ["FU", 8, [0, 1]], ["AN", 8, 0, 5], ["FU", 8, [1, 2]], ["AN", 8, 1, 4], ["FU", 8, [2, 3]], ["AN", 8, 2, 6], ["FU", 3, [0, 1]], ["SP", 3, 0, 384, [1], 1], ["AN", 3, 1, 2], ["FFSP", 3, 0, [3, 2], 1, 1], ["AN", 3, 1, 6], ["FU", 1, [0, 1]], ["SP", 1, 0, 192, [32], 1], ["AN", 1, 1, 2], ["FFSP", 1, 0, [3, 2], 1, 1], ["AN", 1, 1, 6], ["PR", 4, 0, "auto_unroll_max_step$1024"]]]], "r": [[0.00128393], 0, 2.92919, 1695331832], "v": "v0.6"}
{"i": [["[\"990586ac95c316d6af64e8ddc5165a26\", [8192, 1152], [128, 1152], [128], [8192, 128]]", "rocm -keys=rocm,gpu -max_num_threads=256 -max_shared_memory_per_block=65536 -max_threads_per_block=256 -mcpu=gfx908 -mtriple=amdgcn-amd-amdhsa-hcc -thread_warp_size=64", [-1, 16, 64, 65536, 2147483647, 1024, 16, 64], "", 0, []], [[], [["CI", 5], ["CI", 4], ["SP", 2, 0, 8192, [8, 32, 4, 2], 1], ["SP", 2, 5, 128, [1, 4, 32, 1], 1], ["SP", 2, 10, 1152, [2, 3], 1], ["RE", 2, [0, 5, 1, 6, 2, 7, 10, 11, 3, 8, 12, 4, 9]], ["FSP", 6, 0, 2, 3], ["FSP", 6, 4, 3, 3], ["RE", 6, [0, 4, 1, 5, 2, 6, 3, 7]], ["CA", 2, 6, 5], ["CHR", 1, "shared", [2]], ["CA", 2, 3, 6], ["CHR", 0, "shared", [3]], ["CA", 1, 4, 6], ["FU", 8, [0, 1]], ["AN", 8, 0, 5], ["FU", 8, [1, 2]], ["AN", 8, 1, 4], ["FU", 8, [2, 3]], ["AN", 8, 2, 6], ["FU", 3, [0, 1]], ["SP", 3, 0, 48, [1], 1], ["AN", 3, 1, 2], ["FFSP", 3, 0, [3, 2], 1, 1], ["AN", 3, 1, 6], ["FU", 1, [0, 1]], ["SP", 1, 0, 48, [1], 1], ["AN", 1, 1, 2], ["FFSP", 1, 0, [3, 2], 1, 1], ["AN", 1, 1, 6], ["PR", 4, 0, "auto_unroll_max_step$1024"]]]], "r": [[0.044703], 0, 4.03718, 1695331833], "v": "v0.6"}
{"i": [["[\"990586ac95c316d6af64e8ddc5165a26\", [8192, 1152], [128, 1152], [128], [8192, 128]]", "rocm -keys=rocm,gpu -max_num_threads=256 -max_shared_memory_per_block=65536 -max_threads_per_block=256 -mcpu=gfx908 -mtriple=amdgcn-amd-amdhsa-hcc -thread_warp_size=64", [-1, 16, 64, 65536, 2147483647, 1024, 16, 64], "", 0, []], [[], [["CI", 5], ["CI", 4], ["SP", 2, 0, 8192, [1, 4, 2, 32], 1], ["SP", 2, 5, 128, [4, 16, 1, 1], 1], ["SP", 2, 10, 1152, [1, 3], 1], ["RE", 2, [0, 5, 1, 6, 2, 7, 10, 11, 3, 8, 12, 4, 9]], ["FSP", 6, 0, 2, 3], ["FSP", 6, 4, 3, 3], ["RE", 6, [0, 4, 1, 5, 2, 6, 3, 7]], ["CA", 2, 6, 5], ["CHR", 1, "shared", [2]], ["CA", 2, 3, 6], ["CHR", 0, "shared", [3]], ["CA", 1, 4, 6], ["FU", 8, [0, 1]], ["AN", 8, 0, 5], ["FU", 8, [1, 2]], ["AN", 8, 1, 4], ["FU", 8, [2, 3]], ["AN", 8, 2, 6], ["FU", 3, [0, 1]], ["SP", 3, 0, 3, [1], 1], ["AN", 3, 1, 2], ["FFSP", 3, 0, [3, 2], 1, 1], ["AN", 3, 1, 6], ["FU", 1, [0, 1]], ["SP", 1, 0, 192, [1], 1], ["AN", 1, 1, 2], ["FFSP", 1, 0, [3, 2], 1, 1], ["AN", 1, 1, 6], ["PR", 4, 0, "auto_unroll_max_step$1024"]]]], "r": [[0.0698126], 0, 7.03705, 1695331835], "v": "v0.6"}
{"i": [["[\"990586ac95c316d6af64e8ddc5165a26\", [8192, 1152], [128, 1152], [128], [8192, 128]]", "rocm -keys=rocm,gpu -max_num_threads=256 -max_shared_memory_per_block=65536 -max_threads_per_block=256 -mcpu=gfx908 -mtriple=amdgcn-amd-amdhsa-hcc -thread_warp_size=64", [-1, 16, 64, 65536, 2147483647, 1024, 16, 64], "", 0, []], [[], [["CI", 5], ["CI", 4], ["SP", 2, 0, 8192, [1, 64, 1, 2], 1], ["SP", 2, 5, 128, [8, 2, 2, 1], 1], ["SP", 2, 10, 1152, [2, 48], 1], ["RE", 2, [0, 5, 1, 6, 2, 7, 10, 11, 3, 8, 12, 4, 9]], ["FSP", 6, 0, 2, 3], ["FSP", 6, 4, 3, 3], ["RE", 6, [0, 4, 1, 5, 2, 6, 3, 7]], ["CA", 2, 6, 5], ["CHR", 1, "shared", [2]], ["CA", 2, 3, 6], ["CHR", 0, "shared", [3]], ["CA", 1, 4, 6], ["FU", 8, [0, 1]], ["AN", 8, 0, 5], ["FU", 8, [1, 2]], ["AN", 8, 1, 4], ["FU", 8, [2, 3]], ["AN", 8, 2, 6], ["FU", 3, [0, 1]], ["SP", 3, 0, 1536, [3], 1], ["AN", 3, 1, 2], ["FFSP", 3, 0, [3, 2], 1, 1], ["AN", 3, 1, 6], ["FU", 1, [0, 1]], ["SP", 1, 0, 192, [1], 1], ["AN", 1, 1, 2], ["FFSP", 1, 0, [3, 2], 1, 1], ["AN", 1, 1, 6], ["PR", 4, 0, "auto_unroll_max_step$0"]]]], "r": [[0.00166307], 0, 2.20201, 1695331836], "v": "v0.6"}
{"i": [["[\"990586ac95c316d6af64e8ddc5165a26\", [8192, 1152], [128, 1152], [128], [8192, 128]]", "rocm -keys=rocm,gpu -max_num_threads=256 -max_shared_memory_per_block=65536 -max_threads_per_block=256 -mcpu=gfx908 -mtriple=amdgcn-amd-amdhsa-hcc -thread_warp_size=64", [-1, 16, 64, 65536, 2147483647, 1024, 16, 64], "", 0, []], [[], [["CI", 5], ["CI", 4], ["SP", 2, 0, 8192, [4, 128, 1, 1], 1], ["SP", 2, 5, 128, [1, 4, 1, 2], 1], ["SP", 2, 10, 1152, [4, 2], 1], ["RE", 2, [0, 5, 1, 6, 2, 7, 10, 11, 3, 8, 12, 4, 9]], ["FSP", 6, 0, 2, 3], ["FSP", 6, 4, 3, 3], ["RE", 6, [0, 4, 1, 5, 2, 6, 3, 7]], ["CA", 2, 6, 5], ["CHR", 1, "shared", [2]], ["CA", 2, 3, 6], ["CHR", 0, "shared", [3]], ["CA", 1, 4, 6], ["FU", 8, [0, 1]], ["AN", 8, 0, 5], ["FU", 8, [1, 2]], ["AN", 8, 1, 4], ["FU", 8, [2, 3]], ["AN", 8, 2, 6], ["FU", 3, [0, 1]], ["SP", 3, 0, 96, [1], 1], ["AN", 3, 1, 2], ["FFSP", 3, 0, [3, 2], 1, 1], ["AN", 3, 1, 6], ["FU", 1, [0, 1]], ["SP", 1, 0, 24, [1], 1], ["AN", 1, 1, 2], ["FFSP", 1, 0, [3, 2], 1, 1], ["AN", 1, 1, 6], ["PR", 4, 0, "auto_unroll_max_step$16"]]]], "r": [[0.000907416], 0, 2.06193, 1695331838], "v": "v0.6"}
{"i": [["[\"990586ac95c316d6af64e8ddc5165a26\", [8192, 1152], [128, 1152], [128], [8192, 128]]", "rocm -keys=rocm,gpu -max_num_threads=256 -max_shared_memory_per_block=65536 -max_threads_per_block=256 -mcpu=gfx908 -mtriple=amdgcn-amd-amdhsa-hcc -thread_warp_size=64", [-1, 16, 64, 65536, 2147483647, 1024, 16, 64], "", 0, []], [[], [["CI", 5], ["CI", 4], ["SP", 2, 0, 8192, [4, 16, 1, 1], 1], ["SP", 2, 5, 128, [4, 4, 1, 1], 1], ["SP", 2, 10, 1152, [2, 6], 1], ["RE", 2, [0, 5, 1, 6, 2, 7, 10, 11, 3, 8, 12, 4, 9]], ["FSP", 6, 0, 2, 3], ["FSP", 6, 4, 3, 3], ["RE", 6, [0, 4, 1, 5, 2, 6, 3, 7]], ["CA", 2, 6, 5], ["CHR", 1, "shared", [2]], ["CA", 2, 3, 6], ["CHR", 0, "shared", [3]], ["CA", 1, 4, 6], ["FU", 8, [0, 1]], ["AN", 8, 0, 5], ["FU", 8, [1, 2]], ["AN", 8, 1, 4], ["FU", 8, [2, 3]], ["AN", 8, 2, 6], ["FU", 3, [0, 1]], ["SP", 3, 0, 48, [48], 1], ["AN", 3, 1, 2], ["FFSP", 3, 0, [3, 2], 1, 1], ["AN", 3, 1, 6], ["FU", 1, [0, 1]], ["SP", 1, 0, 24, [1], 1], ["AN", 1, 1, 2], ["FFSP", 1, 0, [3, 2], 1, 1], ["AN", 1, 1, 6], ["PR", 4, 0, "auto_unroll_max_step$16"]]]], "r": [[0.00116431], 0, 1.98195, 1695331839], "v": "v0.6"}
{"i": [["[\"990586ac95c316d6af64e8ddc5165a26\", [8192, 1152], [128, 1152], [128], [8192, 128]]", "rocm -keys=rocm,gpu -max_num_threads=256 -max_shared_memory_per_block=65536 -max_threads_per_block=256 -mcpu=gfx908 -mtriple=amdgcn-amd-amdhsa-hcc -thread_warp_size=64", [-1, 16, 64, 65536, 2147483647, 1024, 16, 64], "", 0, []], [[], [["CI", 5], ["CI", 4], ["SP", 2, 0, 8192, [8, 128, 1, 2], 1], ["SP", 2, 5, 128, [1, 4, 8, 1], 1], ["SP", 2, 10, 1152, [1, 6], 1], ["RE", 2, [0, 5, 1, 6, 2, 7, 10, 11, 3, 8, 12, 4, 9]], ["FSP", 6, 0, 2, 3], ["FSP", 6, 4, 3, 3], ["RE", 6, [0, 4, 1, 5, 2, 6, 3, 7]], ["CA", 2, 6, 5], ["CHR", 1, "shared", [2]], ["CA", 2, 3, 6], ["CHR", 0, "shared", [3]], ["CA", 1, 4, 6], ["FU", 8, [0, 1]], ["AN", 8, 0, 5], ["FU", 8, [1, 2]], ["AN", 8, 1, 4], ["FU", 8, [2, 3]], ["AN", 8, 2, 6], ["FU", 3, [0, 1]], ["SP", 3, 0, 48, [2], 1], ["AN", 3, 1, 2], ["FFSP", 3, 0, [3, 2], 1, 1], ["AN", 3, 1, 6], ["FU", 1, [0, 1]], ["SP", 1, 0, 48, [1], 1], ["AN", 1, 1, 2], ["FFSP", 1, 0, [3, 2], 1, 1], ["AN", 1, 1, 6], ["PR", 4, 0, "auto_unroll_max_step$1024"]]]], "r": [[0.0131247], 0, 5.31126, 1695331841], "v": "v0.6"}
{"i": [["[\"990586ac95c316d6af64e8ddc5165a26\", [8192, 1152], [128, 1152], [128], [8192, 128]]", "rocm -keys=rocm,gpu -max_num_threads=256 -max_shared_memory_per_block=65536 -max_threads_per_block=256 -mcpu=gfx908 -mtriple=amdgcn-amd-amdhsa-hcc -thread_warp_size=64", [-1, 16, 64, 65536, 2147483647, 1024, 16, 64], "", 0, []], [[], [["CI", 5], ["CI", 4], ["SP", 2, 0, 8192, [1, 32, 1, 8], 1], ["SP", 2, 5, 128, [1, 16, 2, 2], 1], ["SP", 2, 10, 1152, [3, 1], 1], ["RE", 2, [0, 5, 1, 6, 2, 7, 10, 11, 3, 8, 12, 4, 9]], ["FSP", 6, 0, 2, 3], ["FSP", 6, 4, 3, 3], ["RE", 6, [0, 4, 1, 5, 2, 6, 3, 7]], ["CA", 2, 6, 5], ["CHR", 1, "shared", [2]], ["CA", 2, 3, 6], ["CHR", 0, "shared", [3]], ["CA", 1, 4, 6], ["FU", 8, [0, 1]], ["AN", 8, 0, 5], ["FU", 8, [1, 2]], ["AN", 8, 1, 4], ["FU", 8, [2, 3]], ["AN", 8, 2, 6], ["FU", 3, [0, 1]], ["SP", 3, 0, 12, [1], 1], ["AN", 3, 1, 2], ["FFSP", 3, 0, [3, 2], 1, 1], ["AN", 3, 1, 6], ["FU", 1, [0, 1]], ["SP", 1, 0, 6, [1], 1], ["AN", 1, 1, 2], ["FFSP", 1, 0, [3, 2], 1, 1], ["AN", 1, 1, 6], ["PR", 4, 0, "auto_unroll_max_step$512"]]]], "r": [[0.00090428], 0, 1.91996, 1695331842], "v": "v0.6"}
{"i": [["[\"990586ac95c316d6af64e8ddc5165a26\", [8192, 1152], [128, 1152], [128], [8192, 128]]", "rocm -keys=rocm,gpu -max_num_threads=256 -max_shared_memory_per_block=65536 -max_threads_per_block=256 -mcpu=gfx908 -mtriple=amdgcn-amd-amdhsa-hcc -thread_warp_size=64", [-1, 16, 64, 65536, 2147483647, 1024, 16, 64], "", 0, []], [[], [["CI", 5], ["CI", 4], ["SP", 2, 0, 8192, [2, 512, 1, 1], 1], ["SP", 2, 5, 128, [4, 2, 8, 2], 1], ["SP", 2, 10, 1152, [4, 3], 1], ["RE", 2, [0, 5, 1, 6, 2, 7, 10, 11, 3, 8, 12, 4, 9]], ["FSP", 6, 0, 2, 3], ["FSP", 6, 4, 3, 3], ["RE", 6, [0, 4, 1, 5, 2, 6, 3, 7]], ["CA", 2, 6, 5], ["CHR", 1, "shared", [2]], ["CA", 2, 3, 6], ["CHR", 0, "shared", [3]], ["CA", 1, 4, 6], ["FU", 8, [0, 1]], ["AN", 8, 0, 5], ["FU", 8, [1, 2]], ["AN", 8, 1, 4], ["FU", 8, [2, 3]], ["AN", 8, 2, 6], ["FU", 3, [0, 1]], ["SP", 3, 0, 192, [4], 1], ["AN", 3, 1, 2], ["FFSP", 3, 0, [3, 2], 1, 1], ["AN", 3, 1, 6], ["FU", 1, [0, 1]], ["SP", 1, 0, 12, [2], 1], ["AN", 1, 1, 2], ["FFSP", 1, 0, [3, 2], 1, 1], ["AN", 1, 1, 6], ["PR", 4, 0, "auto_unroll_max_step$0"]]]], "r": [[0.0131627], 0, 3.78602, 1695331844], "v": "v0.6"}
{"i": [["[\"990586ac95c316d6af64e8ddc5165a26\", [8192, 1152], [128, 1152], [128], [8192, 128]]", "rocm -keys=rocm,gpu -max_num_threads=256 -max_shared_memory_per_block=65536 -max_threads_per_block=256 -mcpu=gfx908 -mtriple=amdgcn-amd-amdhsa-hcc -thread_warp_size=64", [-1, 16, 64, 65536, 2147483647, 1024, 16, 64], "", 0, []], [[], [["CI", 5], ["CI", 4], ["SP", 2, 0, 8192, [2, 16, 4, 8], 1], ["SP", 2, 5, 128, [1, 4, 2, 16], 1], ["SP", 2, 10, 1152, [1, 3], 1], ["RE", 2, [0, 5, 1, 6, 2, 7, 10, 11, 3, 8, 12, 4, 9]], ["FSP", 6, 0, 2, 3], ["FSP", 6, 4, 3, 3], ["RE", 6, [0, 4, 1, 5, 2, 6, 3, 7]], ["CA", 2, 6, 5], ["CHR", 1, "shared", [2]], ["CA", 2, 3, 6], ["CHR", 0, "shared", [3]], ["CA", 1, 4, 6], ["FU", 8, [0, 1]], ["AN", 8, 0, 5], ["FU", 8, [1, 2]], ["AN", 8, 1, 4], ["FU", 8, [2, 3]], ["AN", 8, 2, 6], ["FU", 3, [0, 1]], ["SP", 3, 0, 48, [48], 1], ["AN", 3, 1, 2], ["FFSP", 3, 0, [3, 2], 1, 1], ["AN", 3, 1, 6], ["FU", 1, [0, 1]], ["SP", 1, 0, 96, [1], 1], ["AN", 1, 1, 2], ["FFSP", 1, 0, [3, 2], 1, 1], ["AN", 1, 1, 6], ["PR", 4, 0, "auto_unroll_max_step$0"]]]], "r": [[0.0768527], 0, 2.38012, 1695331845], "v": "v0.6"}
{"i": [["[\"990586ac95c316d6af64e8ddc5165a26\", [8192, 1152], [128, 1152], [128], [8192, 128]]", "rocm -keys=rocm,gpu -max_num_threads=256 -max_shared_memory_per_block=65536 -max_threads_per_block=256 -mcpu=gfx908 -mtriple=amdgcn-amd-amdhsa-hcc -thread_warp_size=64", [-1, 16, 64, 65536, 2147483647, 1024, 16, 64], "", 0, []], [[], [["CI", 5], ["CI", 4], ["SP", 2, 0, 8192, [4, 8, 2, 4], 1], ["SP", 2, 5, 128, [2, 8, 8, 1], 1], ["SP", 2, 10, 1152, [1, 12], 1], ["RE", 2, [0, 5, 1, 6, 2, 7, 10, 11, 3, 8, 12, 4, 9]], ["FSP", 6, 0, 2, 3], ["FSP", 6, 4, 3, 3], ["RE", 6, [0, 4, 1, 5, 2, 6, 3, 7]], ["CA", 2, 6, 5], ["CHR", 1, "shared", [2]], ["CA", 2, 3, 6], ["CHR", 0, "shared", [3]], ["CA", 1, 4, 6], ["FU", 8, [0, 1]], ["AN", 8, 0, 5], ["FU", 8, [1, 2]], ["AN", 8, 1, 4], ["FU", 8, [2, 3]], ["AN", 8, 2, 6], ["FU", 3, [0, 1]], ["SP", 3, 0, 24, [1], 1], ["AN", 3, 1, 2], ["FFSP", 3, 0, [3, 2], 1, 1], ["AN", 3, 1, 6], ["FU", 1, [0, 1]], ["SP", 1, 0, 24, [1], 1], ["AN", 1, 1, 2], ["FFSP", 1, 0, [3, 2], 1, 1], ["AN", 1, 1, 6], ["PR", 4, 0, "auto_unroll_max_step$16"]]]], "r": [[0.00838622], 0, 2.6188, 1695331847], "v": "v0.6"}
{"i": [["[\"990586ac95c316d6af64e8ddc5165a26\", [8192, 1152], [128, 1152], [128], [8192, 128]]", "rocm -keys=rocm,gpu -max_num_threads=256 -max_shared_memory_per_block=65536 -max_threads_per_block=256 -mcpu=gfx908 -mtriple=amdgcn-amd-amdhsa-hcc -thread_warp_size=64", [-1, 16, 64, 65536, 2147483647, 1024, 16, 64], "", 0, []], [[], [["CI", 5], ["CI", 4], ["SP", 2, 0, 8192, [4, 16, 1, 8], 1], ["SP", 2, 5, 128, [2, 32, 1, 2], 1], ["SP", 2, 10, 1152, [8, 3], 1], ["RE", 2, [0, 5, 1, 6, 2, 7, 10, 11, 3, 8, 12, 4, 9]], ["FSP", 6, 0, 2, 3], ["FSP", 6, 4, 3, 3], ["RE", 6, [0, 4, 1, 5, 2, 6, 3, 7]], ["CA", 2, 6, 5], ["CHR", 1, "shared", [2]], ["CA", 2, 3, 6], ["CHR", 0, "shared", [3]], ["CA", 1, 4, 6], ["FU", 8, [0, 1]], ["AN", 8, 0, 5], ["FU", 8, [1, 2]], ["AN", 8, 1, 4], ["FU", 8, [2, 3]], ["AN", 8, 2, 6], ["FU", 3, [0, 1]], ["SP", 3, 0, 48, [1], 1], ["AN", 3, 1, 2], ["FFSP", 3, 0, [3, 2], 1, 1], ["AN", 3, 1, 6], ["FU", 1, [0, 1]], ["SP", 1, 0, 192, [1], 1], ["AN", 1, 1, 2], ["FFSP", 1, 0, [3, 2], 1, 1], ["AN", 1, 1, 6], ["PR", 4, 0, "auto_unroll_max_step$64"]]]], "r": [[0.0125406], 0, 3.29538, 1695331848], "v": "v0.6"}
{"i": [["[\"990586ac95c316d6af64e8ddc5165a26\", [8192, 1152], [128, 1152], [128], [8192, 128]]", "rocm -keys=rocm,gpu -max_num_threads=256 -max_shared_memory_per_block=65536 -max_threads_per_block=256 -mcpu=gfx908 -mtriple=amdgcn-amd-amdhsa-hcc -thread_warp_size=64", [-1, 16, 64, 65536, 2147483647, 1024, 16, 64], "", 0, []], [[], [["CI", 5], ["CI", 4], ["SP", 2, 0, 8192, [1, 8, 16, 4], 1], ["SP", 2, 5, 128, [4, 8, 2, 1], 1], ["SP", 2, 10, 1152, [1, 9], 1], ["RE", 2, [0, 5, 1, 6, 2, 7, 10, 11, 3, 8, 12, 4, 9]], ["FSP", 6, 0, 2, 3], ["FSP", 6, 4, 3, 3], ["RE", 6, [0, 4, 1, 5, 2, 6, 3, 7]], ["CA", 2, 6, 5], ["CHR", 1, "shared", [2]], ["CA", 2, 3, 6], ["CHR", 0, "shared", [3]], ["CA", 1, 4, 6], ["FU", 8, [0, 1]], ["AN", 8, 0, 5], ["FU", 8, [1, 2]], ["AN", 8, 1, 4], ["FU", 8, [2, 3]], ["AN", 8, 2, 6], ["FU", 3, [0, 1]], ["SP", 3, 0, 18, [3], 1], ["AN", 3, 1, 2], ["FFSP", 3, 0, [3, 2], 1, 1], ["AN", 3, 1, 6], ["FU", 1, [0, 1]], ["SP", 1, 0, 576, [1], 1], ["AN", 1, 1, 2], ["FFSP", 1, 0, [3, 2], 1, 1], ["AN", 1, 1, 6], ["PR", 4, 0, "auto_unroll_max_step$512"]]]], "r": [[0.0162668], 0, 4.34102, 1695331850], "v": "v0.6"}
{"i": [["[\"990586ac95c316d6af64e8ddc5165a26\", [8192, 1152], [128, 1152], [128], [8192, 128]]", "rocm -keys=rocm,gpu -max_num_threads=256 -max_shared_memory_per_block=65536 -max_threads_per_block=256 -mcpu=gfx908 -mtriple=amdgcn-amd-amdhsa-hcc -thread_warp_size=64", [-1, 16, 64, 65536, 2147483647, 1024, 16, 64], "", 0, []], [[], [["CI", 5], ["CI", 4], ["SP", 2, 0, 8192, [1, 32, 1, 2], 1], ["SP", 2, 5, 128, [1, 16, 4, 2], 1], ["SP", 2, 10, 1152, [1, 3], 1], ["RE", 2, [0, 5, 1, 6, 2, 7, 10, 11, 3, 8, 12, 4, 9]], ["FSP", 6, 0, 2, 3], ["FSP", 6, 4, 3, 3], ["RE", 6, [0, 4, 1, 5, 2, 6, 3, 7]], ["CA", 2, 6, 5], ["CHR", 1, "shared", [2]], ["CA", 2, 3, 6], ["CHR", 0, "shared", [3]], ["CA", 1, 4, 6], ["FU", 8, [0, 1]], ["AN", 8, 0, 5], ["FU", 8, [1, 2]], ["AN", 8, 1, 4], ["FU", 8, [2, 3]], ["AN", 8, 2, 6], ["FU", 3, [0, 1]], ["SP", 3, 0, 12, [1], 1], ["AN", 3, 1, 2], ["FFSP", 3, 0, [3, 2], 1, 1], ["AN", 3, 1, 6], ["FU", 1, [0, 1]], ["SP", 1, 0, 6, [1], 1], ["AN", 1, 1, 2], ["FFSP", 1, 0, [3, 2], 1, 1], ["AN", 1, 1, 6], ["PR", 4, 0, "auto_unroll_max_step$512"]]]], "r": [[0.00069343], 0, 2.20581, 1695331851], "v": "v0.6"}
{"i": [["[\"990586ac95c316d6af64e8ddc5165a26\", [8192, 1152], [128, 1152], [128], [8192, 128]]", "rocm -keys=rocm,gpu -max_num_threads=256 -max_shared_memory_per_block=65536 -max_threads_per_block=256 -mcpu=gfx908 -mtriple=amdgcn-amd-amdhsa-hcc -thread_warp_size=64", [-1, 16, 64, 65536, 2147483647, 1024, 16, 64], "", 0, []], [[], [["CI", 5], ["CI", 4], ["SP", 2, 0, 8192, [1, 8, 32, 4], 1], ["SP", 2, 5, 128, [1, 8, 4, 4], 1], ["SP", 2, 10, 1152, [1, 6], 1], ["RE", 2, [0, 5, 1, 6, 2, 7, 10, 11, 3, 8, 12, 4, 9]], ["FSP", 6, 0, 2, 3], ["FSP", 6, 4, 3, 3], ["RE", 6, [0, 4, 1, 5, 2, 6, 3, 7]], ["CA", 2, 6, 5], ["CHR", 1, "shared", [2]], ["CA", 2, 3, 6], ["CHR", 0, "shared", [3]], ["CA", 1, 4, 6], ["FU", 8, [0, 1]], ["AN", 8, 0, 5], ["FU", 8, [1, 2]], ["AN", 8, 1, 4], ["FU", 8, [2, 3]], ["AN", 8, 2, 6], ["FU", 3, [0, 1]], ["SP", 3, 0, 96, [3], 1], ["AN", 3, 1, 2], ["FFSP", 3, 0, [3, 2], 1, 1], ["AN", 3, 1, 6], ["FU", 1, [0, 1]], ["SP", 1, 0, 768, [1], 1], ["AN", 1, 1, 2], ["FFSP", 1, 0, [3, 2], 1, 1], ["AN", 1, 1, 6], ["PR", 4, 0, "auto_unroll_max_step$64"]]]], "r": [[0.0363865], 0, 2.63178, 1695331853], "v": "v0.6"}
{"i": [["[\"990586ac95c316d6af64e8ddc5165a26\", [8192, 1152], [128, 1152], [128], [8192, 128]]", "rocm -keys=rocm,gpu -max_num_threads=256 -max_shared_memory_per_block=65536 -max_threads_per_block=256 -mcpu=gfx908 -mtriple=amdgcn-amd-amdhsa-hcc -thread_warp_size=64", [-1, 16, 64, 65536, 2147483647, 1024, 16, 64], "", 0, []], [[], [["CI", 5], ["CI", 4], ["SP", 2, 0, 8192, [1, 32, 1, 2], 1], ["SP", 2, 5, 128, [1, 16, 2, 2], 1], ["SP", 2, 10, 1152, [3, 1], 1], ["RE", 2, [0, 5, 1, 6, 2, 7, 10, 11, 3, 8, 12, 4, 9]], ["FSP", 6, 0, 2, 3], ["FSP", 6, 4, 3, 3], ["RE", 6, [0, 4, 1, 5, 2, 6, 3, 7]], ["CA", 2, 6, 5], ["CHR", 1, "shared", [2]], ["CA", 2, 3, 6], ["CHR", 0, "shared", [3]], ["CA", 1, 4, 6], ["FU", 8, [0, 1]], ["AN", 8, 0, 5], ["FU", 8, [1, 2]], ["AN", 8, 1, 4], ["FU", 8, [2, 3]], ["AN", 8, 2, 6], ["FU", 3, [0, 1]], ["SP", 3, 0, 12, [1], 1], ["AN", 3, 1, 2], ["FFSP", 3, 0, [3, 2], 1, 1], ["AN", 3, 1, 6], ["FU", 1, [0, 1]], ["SP", 1, 0, 6, [1], 1], ["AN", 1, 1, 2], ["FFSP", 1, 0, [3, 2], 1, 1], ["AN", 1, 1, 6], ["PR", 4, 0, "auto_unroll_max_step$512"]]]], "r": [[0.000456592], 0, 1.93667, 1695331855], "v": "v0.6"}
{"i": [["[\"990586ac95c316d6af64e8ddc5165a26\", [8192, 1152], [128, 1152], [128], [8192, 128]]", "rocm -keys=rocm,gpu -max_num_threads=256 -max_shared_memory_per_block=65536 -max_threads_per_block=256 -mcpu=gfx908 -mtriple=amdgcn-amd-amdhsa-hcc -thread_warp_size=64", [-1, 16, 64, 65536, 2147483647, 1024, 16, 64], "", 0, []], [[], [["CI", 5], ["CI", 4], ["SP", 2, 0, 8192, [2, 128, 2, 2], 1], ["SP", 2, 5, 128, [1, 4, 1, 32], 1], ["SP", 2, 10, 1152, [6, 1], 1], ["RE", 2, [0, 5, 1, 6, 2, 7, 10, 11, 3, 8, 12, 4, 9]], ["FSP", 6, 0, 2, 3], ["FSP", 6, 4, 3, 3], ["RE", 6, [0, 4, 1, 5, 2, 6, 3, 7]], ["CA", 2, 6, 5], ["CHR", 1, "shared", [2]], ["CA", 2, 3, 6], ["CHR", 0, "shared", [3]], ["CA", 1, 4, 6], ["FU", 8, [0, 1]], ["AN", 8, 0, 5], ["FU", 8, [1, 2]], ["AN", 8, 1, 4], ["FU", 8, [2, 3]], ["AN", 8, 2, 6], ["FU", 3, [0, 1]], ["SP", 3, 0, 192, [1], 1], ["AN", 3, 1, 2], ["FFSP", 3, 0, [3, 2], 1, 1], ["AN", 3, 1, 6], ["FU", 1, [0, 1]], ["SP", 1, 0, 48, [1], 1], ["AN", 1, 1, 2], ["FFSP", 1, 0, [3, 2], 1, 1], ["AN", 1, 1, 6], ["PR", 4, 0, "auto_unroll_max_step$64"]]]], "r": [[0.0746218], 0, 3.22599, 1695331856], "v": "v0.6"}
{"i": [["[\"990586ac95c316d6af64e8ddc5165a26\", [8192, 1152], [128, 1152], [128], [8192, 128]]", "rocm -keys=rocm,gpu -max_num_threads=256 -max_shared_memory_per_block=65536 -max_threads_per_block=256 -mcpu=gfx908 -mtriple=amdgcn-amd-amdhsa-hcc -thread_warp_size=64", [-1, 16, 64, 65536, 2147483647, 1024, 16, 64], "", 0, []], [[], [["CI", 5], ["CI", 4], ["SP", 2, 0, 8192, [2, 128, 1, 1], 1], ["SP", 2, 5, 128, [2, 1, 4, 2], 1], ["SP", 2, 10, 1152, [1, 18], 1], ["RE", 2, [0, 5, 1, 6, 2, 7, 10, 11, 3, 8, 12, 4, 9]], ["FSP", 6, 0, 2, 3], ["FSP", 6, 4, 3, 3], ["RE", 6, [0, 4, 1, 5, 2, 6, 3, 7]], ["CA", 2, 6, 5], ["CHR", 1, "shared", [2]], ["CA", 2, 3, 6], ["CHR", 0, "shared", [3]], ["CA", 1, 4, 6], ["FU", 8, [0, 1]], ["AN", 8, 0, 5], ["FU", 8, [1, 2]], ["AN", 8, 1, 4], ["FU", 8, [2, 3]], ["AN", 8, 2, 6], ["FU", 3, [0, 1]], ["SP", 3, 0, 144, [16], 1], ["AN", 3, 1, 2], ["FFSP", 3, 0, [3, 2], 1, 1], ["AN", 3, 1, 6], ["FU", 1, [0, 1]], ["SP", 1, 0, 18, [1], 1], ["AN", 1, 1, 2], ["FFSP", 1, 0, [3, 2], 1, 1], ["AN", 1, 1, 6], ["PR", 4, 0, "auto_unroll_max_step$1024"]]]], "r": [[0.00109372], 0, 3.112, 1695331857], "v": "v0.6"}
{"i": [["[\"990586ac95c316d6af64e8ddc5165a26\", [8192, 1152], [128, 1152], [128], [8192, 128]]", "rocm -keys=rocm,gpu -max_num_threads=256 -max_shared_memory_per_block=65536 -max_threads_per_block=256 -mcpu=gfx908 -mtriple=amdgcn-amd-amdhsa-hcc -thread_warp_size=64", [-1, 16, 64, 65536, 2147483647, 1024, 16, 64], "", 0, []], [[], [["CI", 5], ["CI", 4], ["SP", 2, 0, 8192, [2, 16, 1, 16], 1], ["SP", 2, 5, 128, [1, 1, 1, 4], 1], ["SP", 2, 10, 1152, [12, 1], 1], ["RE", 2, [0, 5, 1, 6, 2, 7, 10, 11, 3, 8, 12, 4, 9]], ["FSP", 6, 0, 2, 3], ["FSP", 6, 4, 3, 3], ["RE", 6, [0, 4, 1, 5, 2, 6, 3, 7]], ["CA", 2, 6, 5], ["CHR", 1, "shared", [2]], ["CA", 2, 3, 6], ["CHR", 0, "shared", [3]], ["CA", 1, 4, 6], ["FU", 8, [0, 1]], ["AN", 8, 0, 5], ["FU", 8, [1, 2]], ["AN", 8, 1, 4], ["FU", 8, [2, 3]], ["AN", 8, 2, 6], ["FU", 3, [0, 1]], ["SP", 3, 0, 48, [1], 1], ["AN", 3, 1, 2], ["FFSP", 3, 0, [3, 2], 1, 1], ["AN", 3, 1, 6], ["FU", 1, [0, 1]], ["SP", 1, 0, 192, [1], 1], ["AN", 1, 1, 2], ["FFSP", 1, 0, [3, 2], 1, 1], ["AN", 1, 1, 6], ["PR", 4, 0, "auto_unroll_max_step$512"]]]], "r": [[0.0721407], 0, 10.0509, 1695331860], "v": "v0.6"}
{"i": [["[\"990586ac95c316d6af64e8ddc5165a26\", [8192, 1152], [128, 1152], [128], [8192, 128]]", "rocm -keys=rocm,gpu -max_num_threads=256 -max_shared_memory_per_block=65536 -max_threads_per_block=256 -mcpu=gfx908 -mtriple=amdgcn-amd-amdhsa-hcc -thread_warp_size=64", [-1, 16, 64, 65536, 2147483647, 1024, 16, 64], "", 0, []], [[], [["CI", 5], ["CI", 4], ["SP", 2, 0, 8192, [8, 32, 4, 2], 1], ["SP", 2, 5, 128, [1, 2, 8, 2], 1], ["SP", 2, 10, 1152, [1, 1], 1], ["RE", 2, [0, 5, 1, 6, 2, 7, 10, 11, 3, 8, 12, 4, 9]], ["FSP", 6, 0, 2, 3], ["FSP", 6, 4, 3, 3], ["RE", 6, [0, 4, 1, 5, 2, 6, 3, 7]], ["CA", 2, 6, 5], ["CHR", 1, "shared", [2]], ["CA", 2, 3, 6], ["CHR", 0, "shared", [3]], ["CA", 1, 4, 6], ["FU", 8, [0, 1]], ["AN", 8, 0, 5], ["FU", 8, [1, 2]], ["AN", 8, 1, 4], ["FU", 8, [2, 3]], ["AN", 8, 2, 6], ["FU", 3, [0, 1]], ["SP", 3, 0, 48, [1], 1], ["AN", 3, 1, 2], ["FFSP", 3, 0, [3, 2], 1, 1], ["AN", 3, 1, 6], ["FU", 1, [0, 1]], ["SP", 1, 0, 48, [1], 1], ["AN", 1, 1, 2], ["FFSP", 1, 0, [3, 2], 1, 1], ["AN", 1, 1, 6], ["PR", 4, 0, "auto_unroll_max_step$1024"]]]], "r": [[0.27314], 0, 9.87379, 1695331862], "v": "v0.6"}
{"i": [["[\"990586ac95c316d6af64e8ddc5165a26\", [8192, 1152], [128, 1152], [128], [8192, 128]]", "rocm -keys=rocm,gpu -max_num_threads=256 -max_shared_memory_per_block=65536 -max_threads_per_block=256 -mcpu=gfx908 -mtriple=amdgcn-amd-amdhsa-hcc -thread_warp_size=64", [-1, 16, 64, 65536, 2147483647, 1024, 16, 64], "", 0, []], [[], [["CI", 5], ["CI", 4], ["SP", 2, 0, 8192, [4, 4, 4, 8], 1], ["SP", 2, 5, 128, [1, 64, 1, 2], 1], ["SP", 2, 10, 1152, [1, 2], 1], ["RE", 2, [0, 5, 1, 6, 2, 7, 10, 11, 3, 8, 12, 4, 9]], ["FSP", 6, 0, 2, 3], ["FSP", 6, 4, 3, 3], ["RE", 6, [0, 4, 1, 5, 2, 6, 3, 7]], ["CA", 2, 6, 5], ["CHR", 1, "shared", [2]], ["CA", 2, 3, 6], ["CHR", 0, "shared", [3]], ["CA", 1, 4, 6], ["FU", 8, [0, 1]], ["AN", 8, 0, 5], ["FU", 8, [1, 2]], ["AN", 8, 1, 4], ["FU", 8, [2, 3]], ["AN", 8, 2, 6], ["FU", 3, [0, 1]], ["SP", 3, 0, 4, [1], 1], ["AN", 3, 1, 2], ["FFSP", 3, 0, [3, 2], 1, 1], ["AN", 3, 1, 6], ["FU", 1, [0, 1]], ["SP", 1, 0, 64, [1], 1], ["AN", 1, 1, 2], ["FFSP", 1, 0, [3, 2], 1, 1], ["AN", 1, 1, 6], ["PR", 4, 0, "auto_unroll_max_step$64"]]]], "r": [[0.0140548], 0, 2.5469, 1695331863], "v": "v0.6"}
{"i": [["[\"990586ac95c316d6af64e8ddc5165a26\", [8192, 1152], [128, 1152], [128], [8192, 128]]", "rocm -keys=rocm,gpu -max_num_threads=256 -max_shared_memory_per_block=65536 -max_threads_per_block=256 -mcpu=gfx908 -mtriple=amdgcn-amd-amdhsa-hcc -thread_warp_size=64", [-1, 16, 64, 65536, 2147483647, 1024, 16, 64], "", 0, []], [[], [["CI", 5], ["CI", 4], ["SP", 2, 0, 8192, [4, 128, 1, 1], 1], ["SP", 2, 5, 128, [1, 4, 2, 1], 1], ["SP", 2, 10, 1152, [4, 6], 1], ["RE", 2, [0, 5, 1, 6, 2, 7, 10, 11, 3, 8, 12, 4, 9]], ["FSP", 6, 0, 2, 3], ["FSP", 6, 4, 3, 3], ["RE", 6, [0, 4, 1, 5, 2, 6, 3, 7]], ["CA", 2, 6, 5], ["CHR", 1, "shared", [2]], ["CA", 2, 3, 6], ["CHR", 0, "shared", [3]], ["CA", 1, 4, 6], ["FU", 8, [0, 1]], ["AN", 8, 0, 5], ["FU", 8, [1, 2]], ["AN", 8, 1, 4], ["FU", 8, [2, 3]], ["AN", 8, 2, 6], ["FU", 3, [0, 1]], ["SP", 3, 0, 96, [1], 1], ["AN", 3, 1, 2], ["FFSP", 3, 0, [3, 2], 1, 1], ["AN", 3, 1, 6], ["FU", 1, [0, 1]], ["SP", 1, 0, 24, [1], 1], ["AN", 1, 1, 2], ["FFSP", 1, 0, [3, 2], 1, 1], ["AN", 1, 1, 6], ["PR", 4, 0, "auto_unroll_max_step$16"]]]], "r": [[0.00120293], 0, 2.41356, 1695331864], "v": "v0.6"}
{"i": [["[\"990586ac95c316d6af64e8ddc5165a26\", [8192, 1152], [128, 1152], [128], [8192, 128]]", "rocm -keys=rocm,gpu -max_num_threads=256 -max_shared_memory_per_block=65536 -max_threads_per_block=256 -mcpu=gfx908 -mtriple=amdgcn-amd-amdhsa-hcc -thread_warp_size=64", [-1, 16, 64, 65536, 2147483647, 1024, 16, 64], "", 0, []], [[], [["CI", 5], ["CI", 4], ["SP", 2, 0, 8192, [1, 32, 4, 4], 1], ["SP", 2, 5, 128, [2, 4, 2, 1], 1], ["SP", 2, 10, 1152, [2, 1], 1], ["RE", 2, [0, 5, 1, 6, 2, 7, 10, 11, 3, 8, 12, 4, 9]], ["FSP", 6, 0, 2, 3], ["FSP", 6, 4, 3, 3], ["RE", 6, [0, 4, 1, 5, 2, 6, 3, 7]], ["CA", 2, 6, 5], ["CHR", 1, "shared", [2]], ["CA", 2, 3, 6], ["CHR", 0, "shared", [3]], ["CA", 1, 4, 6], ["FU", 8, [0, 1]], ["AN", 8, 0, 5], ["FU", 8, [1, 2]], ["AN", 8, 1, 4], ["FU", 8, [2, 3]], ["AN", 8, 2, 6], ["FU", 3, [0, 1]], ["SP", 3, 0, 4, [4], 1], ["AN", 3, 1, 2], ["FFSP", 3, 0, [3, 2], 1, 1], ["AN", 3, 1, 6], ["FU", 1, [0, 1]], ["SP", 1, 0, 32, [1], 1], ["AN", 1, 1, 2], ["FFSP", 1, 0, [3, 2], 1, 1], ["AN", 1, 1, 6], ["PR", 4, 0, "auto_unroll_max_step$64"]]]], "r": [[0.00186685], 0, 2.53164, 1695331866], "v": "v0.6"}
{"i": [["[\"990586ac95c316d6af64e8ddc5165a26\", [8192, 1152], [128, 1152], [128], [8192, 128]]", "rocm -keys=rocm,gpu -max_num_threads=256 -max_shared_memory_per_block=65536 -max_threads_per_block=256 -mcpu=gfx908 -mtriple=amdgcn-amd-amdhsa-hcc -thread_warp_size=64", [-1, 16, 64, 65536, 2147483647, 1024, 16, 64], "", 0, []], [[], [["CI", 5], ["CI", 4], ["SP", 2, 0, 8192, [1, 64, 8, 4], 1], ["SP", 2, 5, 128, [4, 16, 1, 1], 1], ["SP", 2, 10, 1152, [1, 1], 1], ["RE", 2, [0, 5, 1, 6, 2, 7, 10, 11, 3, 8, 12, 4, 9]], ["FSP", 6, 0, 2, 3], ["FSP", 6, 4, 3, 3], ["RE", 6, [0, 4, 1, 5, 2, 6, 3, 7]], ["CA", 2, 6, 5], ["CHR", 1, "shared", [2]], ["CA", 2, 3, 6], ["CHR", 0, "shared", [3]], ["CA", 1, 4, 6], ["FU", 8, [0, 1]], ["AN", 8, 0, 5], ["FU", 8, [1, 2]], ["AN", 8, 1, 4], ["FU", 8, [2, 3]], ["AN", 8, 2, 6], ["FU", 3, [0, 1]], ["SP", 3, 0, 3, [1], 1], ["AN", 3, 1, 2], ["FFSP", 3, 0, [3, 2], 1, 1], ["AN", 3, 1, 6], ["FU", 1, [0, 1]], ["SP", 1, 0, 192, [1], 1], ["AN", 1, 1, 2], ["FFSP", 1, 0, [3, 2], 1, 1], ["AN", 1, 1, 6], ["PR", 4, 0, "auto_unroll_max_step$512"]]]], "r": [[0.0131272], 0, 3.08375, 1695331868], "v": "v0.6"}
{"i": [["[\"990586ac95c316d6af64e8ddc5165a26\", [8192, 1152], [128, 1152], [128], [8192, 128]]", "rocm -keys=rocm,gpu -max_num_threads=256 -max_shared_memory_per_block=65536 -max_threads_per_block=256 -mcpu=gfx908 -mtriple=amdgcn-amd-amdhsa-hcc -thread_warp_size=64", [-1, 16, 64, 65536, 2147483647, 1024, 16, 64], "", 0, []], [[], [["CI", 5], ["CI", 4], ["SP", 2, 0, 8192, [4, 64, 1, 4], 1], ["SP", 2, 5, 128, [1, 1, 1, 32], 1], ["SP", 2, 10, 1152, [4, 3], 1], ["RE", 2, [0, 5, 1, 6, 2, 7, 10, 11, 3, 8, 12, 4, 9]], ["FSP", 6, 0, 2, 3], ["FSP", 6, 4, 3, 3], ["RE", 6, [0, 4, 1, 5, 2, 6, 3, 7]], ["CA", 2, 6, 5], ["CHR", 1, "shared", [2]], ["CA", 2, 3, 6], ["CHR", 0, "shared", [3]], ["CA", 1, 4, 6], ["FU", 8, [0, 1]], ["AN", 8, 0, 5], ["FU", 8, [1, 2]], ["AN", 8, 1, 4], ["FU", 8, [2, 3]], ["AN", 8, 2, 6], ["FU", 3, [0, 1]], ["SP", 3, 0, 768, [1], 1], ["AN", 3, 1, 2], ["FFSP", 3, 0, [3, 2], 1, 1], ["AN", 3, 1, 6], ["FU", 1, [0, 1]], ["SP", 1, 0, 48, [1], 1], ["AN", 1, 1, 2], ["FFSP", 1, 0, [3, 2], 1, 1], ["AN", 1, 1, 6], ["PR", 4, 0, "auto_unroll_max_step$16"]]]], "r": [[0.0201952], 0, 2.16707, 1695331869], "v": "v0.6"}
{"i": [["[\"990586ac95c316d6af64e8ddc5165a26\", [8192, 1152], [128, 1152], [128], [8192, 128]]", "rocm -keys=rocm,gpu -max_num_threads=256 -max_shared_memory_per_block=65536 -max_threads_per_block=256 -mcpu=gfx908 -mtriple=amdgcn-amd-amdhsa-hcc -thread_warp_size=64", [-1, 16, 64, 65536, 2147483647, 1024, 16, 64], "", 0, []], [[], [["CI", 5], ["CI", 4], ["SP", 2, 0, 8192, [1, 32, 1, 1], 1], ["SP", 2, 5, 128, [1, 16, 2, 2], 1], ["SP", 2, 10, 1152, [3, 1], 1], ["RE", 2, [0, 5, 1, 6, 2, 7, 10, 11, 3, 8, 12, 4, 9]], ["FSP", 6, 0, 2, 3], ["FSP", 6, 4, 3, 3], ["RE", 6, [0, 4, 1, 5, 2, 6, 3, 7]], ["CA", 2, 6, 5], ["CHR", 1, "shared", [2]], ["CA", 2, 3, 6], ["CHR", 0, "shared", [3]], ["CA", 1, 4, 6], ["FU", 8, [0, 1]], ["AN", 8, 0, 5], ["FU", 8, [1, 2]], ["AN", 8, 1, 4], ["FU", 8, [2, 3]], ["AN", 8, 2, 6], ["FU", 3, [0, 1]], ["SP", 3, 0, 12, [1], 1], ["AN", 3, 1, 2], ["FFSP", 3, 0, [3, 2], 1, 1], ["AN", 3, 1, 6], ["FU", 1, [0, 1]], ["SP", 1, 0, 6, [3], 1], ["AN", 1, 1, 2], ["FFSP", 1, 0, [3, 2], 1, 1], ["AN", 1, 1, 6], ["PR", 4, 0, "auto_unroll_max_step$512"]]]], "r": [[0.000813975], 0, 1.68634, 1695331870], "v": "v0.6"}
{"i": [["[\"990586ac95c316d6af64e8ddc5165a26\", [8192, 1152], [128, 1152], [128], [8192, 128]]", "rocm -keys=rocm,gpu -max_num_threads=256 -max_shared_memory_per_block=65536 -max_threads_per_block=256 -mcpu=gfx908 -mtriple=amdgcn-amd-amdhsa-hcc -thread_warp_size=64", [-1, 16, 64, 65536, 2147483647, 1024, 16, 64], "", 0, []], [[], [["CI", 5], ["CI", 4], ["SP", 2, 0, 8192, [4, 4, 8, 2], 1], ["SP", 2, 5, 128, [1, 4, 2, 2], 1], ["SP", 2, 10, 1152, [4, 9], 1], ["RE", 2, [0, 5, 1, 6, 2, 7, 10, 11, 3, 8, 12, 4, 9]], ["FSP", 6, 0, 2, 3], ["FSP", 6, 4, 3, 3], ["RE", 6, [0, 4, 1, 5, 2, 6, 3, 7]], ["CA", 2, 6, 5], ["CHR", 1, "shared", [2]], ["CA", 2, 3, 6], ["CHR", 0, "shared", [3]], ["CA", 1, 4, 6], ["FU", 8, [0, 1]], ["AN", 8, 0, 5], ["FU", 8, [1, 2]], ["AN", 8, 1, 4], ["FU", 8, [2, 3]], ["AN", 8, 2, 6], ["FU", 3, [0, 1]], ["SP", 3, 0, 144, [48], 1], ["AN", 3, 1, 2], ["FFSP", 3, 0, [3, 2], 1, 1], ["AN", 3, 1, 6], ["FU", 1, [0, 1]], ["SP", 1, 0, 576, [1], 1], ["AN", 1, 1, 2], ["FFSP", 1, 0, [3, 2], 1, 1], ["AN", 1, 1, 6], ["PR", 4, 0, "auto_unroll_max_step$64"]]]], "r": [[0.017922], 0, 2.96852, 1695331872], "v": "v0.6"}
{"i": [["[\"990586ac95c316d6af64e8ddc5165a26\", [8192, 1152], [128, 1152], [128], [8192, 128]]", "rocm -keys=rocm,gpu -max_num_threads=256 -max_shared_memory_per_block=65536 -max_threads_per_block=256 -mcpu=gfx908 -mtriple=amdgcn-amd-amdhsa-hcc -thread_warp_size=64", [-1, 16, 64, 65536, 2147483647, 1024, 16, 64], "", 0, []], [[], [["CI", 5], ["CI", 4], ["SP", 2, 0, 8192, [1, 64, 1, 32], 1], ["SP", 2, 5, 128, [1, 16, 1, 4], 1], ["SP", 2, 10, 1152, [1, 4], 1], ["RE", 2, [0, 5, 1, 6, 2, 7, 10, 11, 3, 8, 12, 4, 9]], ["FSP", 6, 0, 2, 3], ["FSP", 6, 4, 3, 3], ["RE", 6, [0, 4, 1, 5, 2, 6, 3, 7]], ["CA", 2, 6, 5], ["CHR", 1, "shared", [2]], ["CA", 2, 3, 6], ["CHR", 0, "shared", [3]], ["CA", 1, 4, 6], ["FU", 8, [0, 1]], ["AN", 8, 0, 5], ["FU", 8, [1, 2]], ["AN", 8, 1, 4], ["FU", 8, [2, 3]], ["AN", 8, 2, 6], ["FU", 3, [0, 1]], ["SP", 3, 0, 4, [1], 1], ["AN", 3, 1, 2], ["FFSP", 3, 0, [3, 2], 1, 1], ["AN", 3, 1, 6], ["FU", 1, [0, 1]], ["SP", 1, 0, 128, [1], 1], ["AN", 1, 1, 2], ["FFSP", 1, 0, [3, 2], 1, 1], ["AN", 1, 1, 6], ["PR", 4, 0, "auto_unroll_max_step$0"]]]], "r": [[0.0110502], 0, 3.06655, 1695331873], "v": "v0.6"}
{"i": [["[\"990586ac95c316d6af64e8ddc5165a26\", [8192, 1152], [128, 1152], [128], [8192, 128]]", "rocm -keys=rocm,gpu -max_num_threads=256 -max_shared_memory_per_block=65536 -max_threads_per_block=256 -mcpu=gfx908 -mtriple=amdgcn-amd-amdhsa-hcc -thread_warp_size=64", [-1, 16, 64, 65536, 2147483647, 1024, 16, 64], "", 0, []], [[], [["CI", 5], ["CI", 4], ["SP", 2, 0, 8192, [1, 8, 1, 1], 1], ["SP", 2, 5, 128, [1, 8, 1, 1], 1], ["SP", 2, 10, 1152, [16, 4], 1], ["RE", 2, [0, 5, 1, 6, 2, 7, 10, 11, 3, 8, 12, 4, 9]], ["FSP", 6, 0, 2, 3], ["FSP", 6, 4, 3, 3], ["RE", 6, [0, 4, 1, 5, 2, 6, 3, 7]], ["CA", 2, 6, 5], ["CHR", 1, "shared", [2]], ["CA", 2, 3, 6], ["CHR", 0, "shared", [3]], ["CA", 1, 4, 6], ["FU", 8, [0, 1]], ["AN", 8, 0, 5], ["FU", 8, [1, 2]], ["AN", 8, 1, 4], ["FU", 8, [2, 3]], ["AN", 8, 2, 6], ["FU", 3, [0, 1]], ["SP", 3, 0, 64, [2], 1], ["AN", 3, 1, 2], ["FFSP", 3, 0, [3, 2], 1, 1], ["AN", 3, 1, 6], ["FU", 1, [0, 1]], ["SP", 1, 0, 64, [1], 1], ["AN", 1, 1, 2], ["FFSP", 1, 0, [3, 2], 1, 1], ["AN", 1, 1, 6], ["PR", 4, 0, "auto_unroll_max_step$0"]]]], "r": [[0.00225807], 0, 2.07132, 1695331875], "v": "v0.6"}
{"i": [["[\"990586ac95c316d6af64e8ddc5165a26\", [8192, 1152], [128, 1152], [128], [8192, 128]]", "rocm -keys=rocm,gpu -max_num_threads=256 -max_shared_memory_per_block=65536 -max_threads_per_block=256 -mcpu=gfx908 -mtriple=amdgcn-amd-amdhsa-hcc -thread_warp_size=64", [-1, 16, 64, 65536, 2147483647, 1024, 16, 64], "", 0, []], [[], [["CI", 5], ["CI", 4], ["SP", 2, 0, 8192, [1, 64, 2, 1], 1], ["SP", 2, 5, 128, [8, 1, 1, 8], 1], ["SP", 2, 10, 1152, [1, 1], 1], ["RE", 2, [0, 5, 1, 6, 2, 7, 10, 11, 3, 8, 12, 4, 9]], ["FSP", 6, 0, 2, 3], ["FSP", 6, 4, 3, 3], ["RE", 6, [0, 4, 1, 5, 2, 6, 3, 7]], ["CA", 2, 6, 5], ["CHR", 1, "shared", [2]], ["CA", 2, 3, 6], ["CHR", 0, "shared", [3]], ["CA", 1, 4, 6], ["FU", 8, [0, 1]], ["AN", 8, 0, 5], ["FU", 8, [1, 2]], ["AN", 8, 1, 4], ["FU", 8, [2, 3]], ["AN", 8, 2, 6], ["FU", 3, [0, 1]], ["SP", 3, 0, 8, [1], 1], ["AN", 3, 1, 2], ["FFSP", 3, 0, [3, 2], 1, 1], ["AN", 3, 1, 6], ["FU", 1, [0, 1]], ["SP", 1, 0, 8, [1], 1], ["AN", 1, 1, 2], ["FFSP", 1, 0, [3, 2], 1, 1], ["AN", 1, 1, 6], ["PR", 4, 0, "auto_unroll_max_step$16"]]]], "r": [[0.00602484], 0, 2.45578, 1695331876], "v": "v0.6"}
