ansor_log/rocm-MI100/CNN/rocm-CNN-75.json
{"i": [["[\"990586ac95c316d6af64e8ddc5165a26\", [8192, 1152], [128, 1152], [128], [8192, 128]]", "rocm -keys=rocm,gpu -max_num_threads=256 -max_shared_memory_per_block=65536 -max_threads_per_block=256 -mcpu=gfx908 -mtriple=amdgcn-amd-amdhsa-hcc -thread_warp_size=64", [-1, 16, 64, 65536, 2147483647, 1024, 16, 64], "", 0, []], [[], [["CI", 5], ["CI", 4], ["SP", 2, 0, 8192, [2, 32, 1, 16], 1], ["SP", 2, 5, 128, [8, 2, 2, 1], 1], ["SP", 2, 10, 1152, [6, 1], 1], ["RE", 2, [0, 5, 1, 6, 2, 7, 10, 11, 3, 8, 12, 4, 9]], ["FSP", 6, 0, 2, 3], ["FSP", 6, 4, 3, 3], ["RE", 6, [0, 4, 1, 5, 2, 6, 3, 7]], ["CA", 2, 6, 5], ["CHR", 1, "shared", [2]], ["CA", 2, 3, 6], ["CHR", 0, "shared", [3]], ["CA", 1, 4, 6], ["FU", 8, [0, 1]], ["AN", 8, 0, 5], ["FU", 8, [1, 2]], ["AN", 8, 1, 4], ["FU", 8, [2, 3]], ["AN", 8, 2, 6], ["FU", 3, [0, 1]], ["SP", 3, 0, 12, [1], 1], ["AN", 3, 1, 2], ["FFSP", 3, 0, [3, 2], 1, 1], ["AN", 3, 1, 6], ["FU", 1, [0, 1]], ["SP", 1, 0, 96, [1], 1], ["AN", 1, 1, 2], ["FFSP", 1, 0, [3, 2], 1, 1], ["AN", 1, 1, 6], ["PR", 4, 0, "auto_unroll_max_step$1024"]]]], "r": [[0.190289], 0, 12.8997, 1695329481], "v": "v0.6"}
{"i": [["[\"990586ac95c316d6af64e8ddc5165a26\", [8192, 1152], [128, 1152], [128], [8192, 128]]", "rocm -keys=rocm,gpu -max_num_threads=256 -max_shared_memory_per_block=65536 -max_threads_per_block=256 -mcpu=gfx908 -mtriple=amdgcn-amd-amdhsa-hcc -thread_warp_size=64", [-1, 16, 64, 65536, 2147483647, 1024, 16, 64], "", 0, []], [[], [["CI", 5], ["CI", 4], ["SP", 2, 0, 8192, [4, 64, 1, 1], 1], ["SP", 2, 5, 128, [4, 4, 1, 8], 1], ["SP", 2, 10, 1152, [8, 3], 1], ["RE", 2, [0, 5, 1, 6, 2, 7, 10, 11, 3, 8, 12, 4, 9]], ["FSP", 6, 0, 2, 3], ["FSP", 6, 4, 3, 3], ["RE", 6, [0, 4, 1, 5, 2, 6, 3, 7]], ["CA", 2, 6, 5], ["CHR", 1, "shared", [2]], ["CA", 2, 3, 6], ["CHR", 0, "shared", [3]], ["CA", 1, 4, 6], ["FU", 8, [0, 1]], ["AN", 8, 0, 5], ["FU", 8, [1, 2]], ["AN", 8, 1, 4], ["FU", 8, [2, 3]], ["AN", 8, 2, 6], ["FU", 3, [0, 1]], ["SP", 3, 0, 192, [1], 1], ["AN", 3, 1, 2], ["FFSP", 3, 0, [3, 2], 1, 1], ["AN", 3, 1, 6], ["FU", 1, [0, 1]], ["SP", 1, 0, 24, [3], 1], ["AN", 1, 1, 2], ["FFSP", 1, 0, [3, 2], 1, 1], ["AN", 1, 1, 6], ["PR", 4, 0, "auto_unroll_max_step$64"]]]], "r": [[0.00975723], 0, 3.09555, 1695329482], "v": "v0.6"}
{"i": [["[\"990586ac95c316d6af64e8ddc5165a26\", [8192, 1152], [128, 1152], [128], [8192, 128]]", "rocm -keys=rocm,gpu -max_num_threads=256 -max_shared_memory_per_block=65536 -max_threads_per_block=256 -mcpu=gfx908 -mtriple=amdgcn-amd-amdhsa-hcc -thread_warp_size=64", [-1, 16, 64, 65536, 2147483647, 1024, 16, 64], "", 0, []], [[], [["CI", 5], ["CI", 4], ["SP", 2, 0, 8192, [1, 64, 2, 4], 1], ["SP", 2, 5, 128, [16, 1, 4, 1], 1], ["SP", 2, 10, 1152, [1, 1], 1], ["RE", 2, [0, 5, 1, 6, 2, 7, 10, 11, 3, 8, 12, 4, 9]], ["FSP", 6, 0, 2, 3], ["FSP", 6, 4, 3, 3], ["RE", 6, [0, 4, 1, 5, 2, 6, 3, 7]], ["CA", 2, 6, 5], ["CHR", 1, "shared", [2]], ["CA", 2, 3, 6], ["CHR", 0, "shared", [3]], ["CA", 1, 4, 6], ["FU", 8, [0, 1]], ["AN", 8, 0, 5], ["FU", 8, [1, 2]], ["AN", 8, 1, 4], ["FU", 8, [2, 3]], ["AN", 8, 2, 6], ["FU", 3, [0, 1]], ["SP", 3, 0, 4, [1], 1], ["AN", 3, 1, 2], ["FFSP", 3, 0, [3, 2], 1, 1], ["AN", 3, 1, 6], ["FU", 1, [0, 1]], ["SP", 1, 0, 8, [2], 1], ["AN", 1, 1, 2], ["FFSP", 1, 0, [3, 2], 1, 1], ["AN", 1, 1, 6], ["PR", 4, 0, "auto_unroll_max_step$512"]]]], "r": [[0.156422], 0, 6.72204, 1695329484], "v": "v0.6"}
{"i": [["[\"990586ac95c316d6af64e8ddc5165a26\", [8192, 1152], [128, 1152], [128], [8192, 128]]", "rocm -keys=rocm,gpu -max_num_threads=256 -max_shared_memory_per_block=65536 -max_threads_per_block=256 -mcpu=gfx908 -mtriple=amdgcn-amd-amdhsa-hcc -thread_warp_size=64", [-1, 16, 64, 65536, 2147483647, 1024, 16, 64], "", 0, []], [[], [["CI", 5], ["CI", 4], ["SP", 2, 0, 8192, [1, 512, 4, 2], 1], ["SP", 2, 5, 128, [8, 1, 1, 16], 1], ["SP", 2, 10, 1152, [3, 1], 1], ["RE", 2, [0, 5, 1, 6, 2, 7, 10, 11, 3, 8, 12, 4, 9]], ["FSP", 6, 0, 2, 3], ["FSP", 6, 4, 3, 3], ["RE", 6, [0, 4, 1, 5, 2, 6, 3, 7]], ["CA", 2, 6, 5], ["CHR", 1, "shared", [2]], ["CA", 2, 3, 6], ["CHR", 0, "shared", [3]], ["CA", 1, 4, 6], ["FU", 8, [0, 1]], ["AN", 8, 0, 5], ["FU", 8, [1, 2]], ["AN", 8, 1, 4], ["FU", 8, [2, 3]], ["AN", 8, 2, 6], ["FU", 3, [0, 1]], ["SP", 3, 0, 48, [2], 1], ["AN", 3, 1, 2], ["FFSP", 3, 0, [3, 2], 1, 1], ["AN", 3, 1, 6], ["FU", 1, [0, 1]], ["SP", 1, 0, 12, [1], 1], ["AN", 1, 1, 2], ["FFSP", 1, 0, [3, 2], 1, 1], ["AN", 1, 1, 6], ["PR", 4, 0, "auto_unroll_max_step$512"]]]], "r": [[0.33205], 0, 15.4424, 1695329486], "v": "v0.6"}
{"i": [["[\"990586ac95c316d6af64e8ddc5165a26\", [8192, 1152], [128, 1152], [128], [8192, 128]]", "rocm -keys=rocm,gpu -max_num_threads=256 -max_shared_memory_per_block=65536 -max_threads_per_block=256 -mcpu=gfx908 -mtriple=amdgcn-amd-amdhsa-hcc -thread_warp_size=64", [-1, 16, 64, 65536, 2147483647, 1024, 16, 64], "", 0, []], [[], [["CI", 5], ["CI", 4], ["SP", 2, 0, 8192, [4, 32, 2, 8], 1], ["SP", 2, 5, 128, [1, 4, 1, 1], 1], ["SP", 2, 10, 1152, [1, 6], 1], ["RE", 2, [0, 5, 1, 6, 2, 7, 10, 11, 3, 8, 12, 4, 9]], ["FSP", 6, 0, 2, 3], ["FSP", 6, 4, 3, 3], ["RE", 6, [0, 4, 1, 5, 2, 6, 3, 7]], ["CA", 2, 6, 5], ["CHR", 1, "shared", [2]], ["CA", 2, 3, 6], ["CHR", 0, "shared", [3]], ["CA", 1, 4, 6], ["FU", 8, [0, 1]], ["AN", 8, 0, 5], ["FU", 8, [1, 2]], ["AN", 8, 1, 4], ["FU", 8, [2, 3]], ["AN", 8, 2, 6], ["FU", 3, [0, 1]], ["SP", 3, 0, 6, [1], 1], ["AN", 3, 1, 2], ["FFSP", 3, 0, [3, 2], 1, 1], ["AN", 3, 1, 6], ["FU", 1, [0, 1]], ["SP", 1, 0, 48, [4], 1], ["AN", 1, 1, 2], ["FFSP", 1, 0, [3, 2], 1, 1], ["AN", 1, 1, 6], ["PR", 4, 0, "auto_unroll_max_step$64"]]]], "r": [[0.0373514], 0, 5.92909, 1695329488], "v": "v0.6"}
{"i": [["[\"990586ac95c316d6af64e8ddc5165a26\", [8192, 1152], [128, 1152], [128], [8192, 128]]", "rocm -keys=rocm,gpu -max_num_threads=256 -max_shared_memory_per_block=65536 -max_threads_per_block=256 -mcpu=gfx908 -mtriple=amdgcn-amd-amdhsa-hcc -thread_warp_size=64", [-1, 16, 64, 65536, 2147483647, 1024, 16, 64], "", 0, []], [[], [["CI", 5], ["CI", 4], ["SP", 2, 0, 8192, [2, 4, 1, 64], 1], ["SP", 2, 5, 128, [1, 16, 4, 1], 1], ["SP", 2, 10, 1152, [8, 2], 1], ["RE", 2, [0, 5, 1, 6, 2, 7, 10, 11, 3, 8, 12, 4, 9]], ["FSP", 6, 0, 2, 3], ["FSP", 6, 4, 3, 3], ["RE", 6, [0, 4, 1, 5, 2, 6, 3, 7]], ["CA", 2, 6, 5], ["CHR", 1, "shared", [2]], ["CA", 2, 3, 6], ["CHR", 0, "shared", [3]], ["CA", 1, 4, 6], ["FU", 8, [0, 1]], ["AN", 8, 0, 5], ["FU", 8, [1, 2]], ["AN", 8, 1, 4], ["FU", 8, [2, 3]], ["AN", 8, 2, 6], ["FU", 3, [0, 1]], ["SP", 3, 0, 64, [1], 1], ["AN", 3, 1, 2], ["FFSP", 3, 0, [3, 2], 1, 1], ["AN", 3, 1, 6], ["FU", 1, [0, 1]], ["SP", 1, 0, 256, [1], 1], ["AN", 1, 1, 2], ["FFSP", 1, 0, [3, 2], 1, 1], ["AN", 1, 1, 6], ["PR", 4, 0, "auto_unroll_max_step$1024"]]]], "r": [[0.247461], 0, 27.0849, 1695329490], "v": "v0.6"}
{"i": [["[\"990586ac95c316d6af64e8ddc5165a26\", [8192, 1152], [128, 1152], [128], [8192, 128]]", "rocm -keys=rocm,gpu -max_num_threads=256 -max_shared_memory_per_block=65536 -max_threads_per_block=256 -mcpu=gfx908 -mtriple=amdgcn-amd-amdhsa-hcc -thread_warp_size=64", [-1, 16, 64, 65536, 2147483647, 1024, 16, 64], "", 0, []], [[], [["CI", 5], ["CI", 4], ["SP", 2, 0, 8192, [1, 2, 8, 4], 1], ["SP", 2, 5, 128, [2, 32, 1, 1], 1], ["SP", 2, 10, 1152, [6, 2], 1], ["RE", 2, [0, 5, 1, 6, 2, 7, 10, 11, 3, 8, 12, 4, 9]], ["FSP", 6, 0, 2, 3], ["FSP", 6, 4, 3, 3], ["RE", 6, [0, 4, 1, 5, 2, 6, 3, 7]], ["CA", 2, 6, 5], ["CHR", 1, "shared", [2]], ["CA", 2, 3, 6], ["CHR", 0, "shared", [3]], ["CA", 1, 4, 6], ["FU", 8, [0, 1]], ["AN", 8, 0, 5], ["FU", 8, [1, 2]], ["AN", 8, 1, 4], ["FU", 8, [2, 3]], ["AN", 8, 2, 6], ["FU", 3, [0, 1]], ["SP", 3, 0, 12, [1], 1], ["AN", 3, 1, 2], ["FFSP", 3, 0, [3, 2], 1, 1], ["AN", 3, 1, 6], ["FU", 1, [0, 1]], ["SP", 1, 0, 384, [1], 1], ["AN", 1, 1, 2], ["FFSP", 1, 0, [3, 2], 1, 1], ["AN", 1, 1, 6], ["PR", 4, 0, "auto_unroll_max_step$512"]]]], "r": [[0.00120934], 0, 2.78555, 1695329492], "v": "v0.6"}
{"i": [["[\"990586ac95c316d6af64e8ddc5165a26\", [8192, 1152], [128, 1152], [128], [8192, 128]]", "rocm -keys=rocm,gpu -max_num_threads=256 -max_shared_memory_per_block=65536 -max_threads_per_block=256 -mcpu=gfx908 -mtriple=amdgcn-amd-amdhsa-hcc -thread_warp_size=64", [-1, 16, 64, 65536, 2147483647, 1024, 16, 64], "", 0, []], [[], [["CI", 5], ["CI", 4], ["SP", 2, 0, 8192, [1, 64, 4, 1], 1], ["SP", 2, 5, 128, [4, 8, 1, 1], 1], ["SP", 2, 10, 1152, [1, 12], 1], ["RE", 2, [0, 5, 1, 6, 2, 7, 10, 11, 3, 8, 12, 4, 9]], ["FSP", 6, 0, 2, 3], ["FSP", 6, 4, 3, 3], ["RE", 6, [0, 4, 1, 5, 2, 6, 3, 7]], ["CA", 2, 6, 5], ["CHR", 1, "shared", [2]], ["CA", 2, 3, 6], ["CHR", 0, "shared", [3]], ["CA", 1, 4, 6], ["FU", 8, [0, 1]], ["AN", 8, 0, 5], ["FU", 8, [1, 2]], ["AN", 8, 1, 4], ["FU", 8, [2, 3]], ["AN", 8, 2, 6], ["FU", 3, [0, 1]], ["SP", 3, 0, 12, [1], 1], ["AN", 3, 1, 2], ["FFSP", 3, 0, [3, 2], 1, 1], ["AN", 3, 1, 6], ["FU", 1, [0, 1]], ["SP", 1, 0, 48, [1], 1], ["AN", 1, 1, 2], ["FFSP", 1, 0, [3, 2], 1, 1], ["AN", 1, 1, 6], ["PR", 4, 0, "auto_unroll_max_step$64"]]]], "r": [[0.000445195], 0, 2.11006, 1695329493], "v": "v0.6"}
{"i": [["[\"990586ac95c316d6af64e8ddc5165a26\", [8192, 1152], [128, 1152], [128], [8192, 128]]", "rocm -keys=rocm,gpu -max_num_threads=256 -max_shared_memory_per_block=65536 -max_threads_per_block=256 -mcpu=gfx908 -mtriple=amdgcn-amd-amdhsa-hcc -thread_warp_size=64", [-1, 16, 64, 65536, 2147483647, 1024, 16, 64], "", 0, []], [[], [["CI", 5], ["CI", 4], ["SP", 2, 0, 8192, [1, 256, 1, 4], 1], ["SP", 2, 5, 128, [8, 4, 4, 1], 1], ["SP", 2, 10, 1152, [1, 3], 1], ["RE", 2, [0, 5, 1, 6, 2, 7, 10, 11, 3, 8, 12, 4, 9]], ["FSP", 6, 0, 2, 3], ["FSP", 6, 4, 3, 3], ["RE", 6, [0, 4, 1, 5, 2, 6, 3, 7]], ["CA", 2, 6, 5], ["CHR", 1, "shared", [2]], ["CA", 2, 3, 6], ["CHR", 0, "shared", [3]], ["CA", 1, 4, 6], ["FU", 8, [0, 1]], ["AN", 8, 0, 5], ["FU", 8, [1, 2]], ["AN", 8, 1, 4], ["FU", 8, [2, 3]], ["AN", 8, 2, 6], ["FU", 3, [0, 1]], ["SP", 3, 0, 12, [1], 1], ["AN", 3, 1, 2], ["FFSP", 3, 0, [3, 2], 1, 1], ["AN", 3, 1, 6], ["FU", 1, [0, 1]], ["SP", 1, 0, 12, [12], 1], ["AN", 1, 1, 2], ["FFSP", 1, 0, [3, 2], 1, 1], ["AN", 1, 1, 6], ["PR", 4, 0, "auto_unroll_max_step$64"]]]], "r": [[0.011422], 0, 3.39591, 1695329495], "v": "v0.6"}
{"i": [["[\"990586ac95c316d6af64e8ddc5165a26\", [8192, 1152], [128, 1152], [128], [8192, 128]]", "rocm -keys=rocm,gpu -max_num_threads=256 -max_shared_memory_per_block=65536 -max_threads_per_block=256 -mcpu=gfx908 -mtriple=amdgcn-amd-amdhsa-hcc -thread_warp_size=64", [-1, 16, 64, 65536, 2147483647, 1024, 16, 64], "", 0, []], [[], [["CI", 5], ["CI", 4], ["SP", 2, 0, 8192, [4, 16, 2, 4], 1], ["SP", 2, 5, 128, [4, 8, 2, 2], 1], ["SP", 2, 10, 1152, [1, 3], 1], ["RE", 2, [0, 5, 1, 6, 2, 7, 10, 11, 3, 8, 12, 4, 9]], ["FSP", 6, 0, 2, 3], ["FSP", 6, 4, 3, 3], ["RE", 6, [0, 4, 1, 5, 2, 6, 3, 7]], ["CA", 2, 6, 5], ["CHR", 1, "shared", [2]], ["CA", 2, 3, 6], ["CHR", 0, "shared", [3]], ["CA", 1, 4, 6], ["FU", 8, [0, 1]], ["AN", 8, 0, 5], ["FU", 8, [1, 2]], ["AN", 8, 1, 4], ["FU", 8, [2, 3]], ["AN", 8, 2, 6], ["FU", 3, [0, 1]], ["SP", 3, 0, 12, [1], 1], ["AN", 3, 1, 2], ["FFSP", 3, 0, [3, 2], 1, 1], ["AN", 3, 1, 6], ["FU", 1, [0, 1]], ["SP", 1, 0, 24, [2], 1], ["AN", 1, 1, 2], ["FFSP", 1, 0, [3, 2], 1, 1], ["AN", 1, 1, 6], ["PR", 4, 0, "auto_unroll_max_step$64"]]]], "r": [[0.146099], 0, 3.58543, 1695329497], "v": "v0.6"}
{"i": [["[\"990586ac95c316d6af64e8ddc5165a26\", [8192, 1152], [128, 1152], [128], [8192, 128]]", "rocm -keys=rocm,gpu -max_num_threads=256 -max_shared_memory_per_block=65536 -max_threads_per_block=256 -mcpu=gfx908 -mtriple=amdgcn-amd-amdhsa-hcc -thread_warp_size=64", [-1, 16, 64, 65536, 2147483647, 1024, 16, 64], "", 0, []], [[], [["CI", 5], ["CI", 4], ["SP", 2, 0, 8192, [8, 8, 1, 2], 1], ["SP", 2, 5, 128, [1, 8, 1, 1], 1], ["SP", 2, 10, 1152, [96, 1], 1], ["RE", 2, [0, 5, 1, 6, 2, 7, 10, 11, 3, 8, 12, 4, 9]], ["FSP", 6, 0, 2, 3], ["FSP", 6, 4, 3, 3], ["RE", 6, [0, 4, 1, 5, 2, 6, 3, 7]], ["CA", 2, 6, 5], ["CHR", 1, "shared", [2]], ["CA", 2, 3, 6], ["CHR", 0, "shared", [3]], ["CA", 1, 4, 6], ["FU", 8, [0, 1]], ["AN", 8, 0, 5], ["FU", 8, [1, 2]], ["AN", 8, 1, 4], ["FU", 8, [2, 3]], ["AN", 8, 2, 6], ["FU", 3, [0, 1]], ["SP", 3, 0, 384, [1], 1], ["AN", 3, 1, 2], ["FFSP", 3, 0, [3, 2], 1, 1], ["AN", 3, 1, 6], ["FU", 1, [0, 1]], ["SP", 1, 0, 192, [1], 1], ["AN", 1, 1, 2], ["FFSP", 1, 0, [3, 2], 1, 1], ["AN", 1, 1, 6], ["PR", 4, 0, "auto_unroll_max_step$1024"]]]], "r": [[0.00939665], 0, 5.77913, 1695329498], "v": "v0.6"}
{"i": [["[\"990586ac95c316d6af64e8ddc5165a26\", [8192, 1152], [128, 1152], [128], [8192, 128]]", "rocm -keys=rocm,gpu -max_num_threads=256 -max_shared_memory_per_block=65536 -max_threads_per_block=256 -mcpu=gfx908 -mtriple=amdgcn-amd-amdhsa-hcc -thread_warp_size=64", [-1, 16, 64, 65536, 2147483647, 1024, 16, 64], "", 0, []], [[], [["CI", 5], ["CI", 4], ["SP", 2, 0, 8192, [4, 32, 1, 1], 1], ["SP", 2, 5, 128, [4, 2, 4, 2], 1], ["SP", 2, 10, 1152, [1, 36], 1], ["RE", 2, [0, 5, 1, 6, 2, 7, 10, 11, 3, 8, 12, 4, 9]], ["FSP", 6, 0, 2, 3], ["FSP", 6, 4, 3, 3], ["RE", 6, [0, 4, 1, 5, 2, 6, 3, 7]], ["CA", 2, 6, 5], ["CHR", 1, "shared", [2]], ["CA", 2, 3, 6], ["CHR", 0, "shared", [3]], ["CA", 1, 4, 6], ["FU", 8, [0, 1]], ["AN", 8, 0, 5], ["FU", 8, [1, 2]], ["AN", 8, 1, 4], ["FU", 8, [2, 3]], ["AN", 8, 2, 6], ["FU", 3, [0, 1]], ["SP", 3, 0, 288, [1], 1], ["AN", 3, 1, 2], ["FFSP", 3, 0, [3, 2], 1, 1], ["AN", 3, 1, 6], ["FU", 1, [0, 1]], ["SP", 1, 0, 36, [1], 1], ["AN", 1, 1, 2], ["FFSP", 1, 0, [3, 2], 1, 1], ["AN", 1, 1, 6], ["PR", 4, 0, "auto_unroll_max_step$16"]]]], "r": [[0.00236701], 0, 3.4353, 1695329499], "v": "v0.6"}
{"i": [["[\"990586ac95c316d6af64e8ddc5165a26\", [8192, 1152], [128, 1152], [128], [8192, 128]]", "rocm -keys=rocm,gpu -max_num_threads=256 -max_shared_memory_per_block=65536 -max_threads_per_block=256 -mcpu=gfx908 -mtriple=amdgcn-amd-amdhsa-hcc -thread_warp_size=64", [-1, 16, 64, 65536, 2147483647, 1024, 16, 64], "", 0, []], [[], [["CI", 5], ["CI", 4], ["SP", 2, 0, 8192, [2, 8, 8, 2], 1], ["SP", 2, 5, 128, [1, 16, 1, 8], 1], ["SP", 2, 10, 1152, [4, 1], 1], ["RE", 2, [0, 5, 1, 6, 2, 7, 10, 11, 3, 8, 12, 4, 9]], ["FSP", 6, 0, 2, 3], ["FSP", 6, 4, 3, 3], ["RE", 6, [0, 4, 1, 5, 2, 6, 3, 7]], ["CA", 2, 6, 5], ["CHR", 1, "shared", [2]], ["CA", 2, 3, 6], ["CHR", 0, "shared", [3]], ["CA", 1, 4, 6], ["FU", 8, [0, 1]], ["AN", 8, 0, 5], ["FU", 8, [1, 2]], ["AN", 8, 1, 4], ["FU", 8, [2, 3]], ["AN", 8, 2, 6], ["FU", 3, [0, 1]], ["SP", 3, 0, 16, [1], 1], ["AN", 3, 1, 2], ["FFSP", 3, 0, [3, 2], 1, 1], ["AN", 3, 1, 6], ["FU", 1, [0, 1]], ["SP", 1, 0, 128, [1], 1], ["AN", 1, 1, 2], ["FFSP", 1, 0, [3, 2], 1, 1], ["AN", 1, 1, 6], ["PR", 4, 0, "auto_unroll_max_step$64"]]]], "r": [[0.00843089], 0, 2.80695, 1695329501], "v": "v0.6"}
{"i": [["[\"990586ac95c316d6af64e8ddc5165a26\", [8192, 1152], [128, 1152], [128], [8192, 128]]", "rocm -keys=rocm,gpu -max_num_threads=256 -max_shared_memory_per_block=65536 -max_threads_per_block=256 -mcpu=gfx908 -mtriple=amdgcn-amd-amdhsa-hcc -thread_warp_size=64", [-1, 16, 64, 65536, 2147483647, 1024, 16, 64], "", 0, []], [[], [["CI", 5], ["CI", 4], ["SP", 2, 0, 8192, [8, 4, 1, 16], 1], ["SP", 2, 5, 128, [1, 16, 4, 1], 1], ["SP", 2, 10, 1152, [8, 2], 1], ["RE", 2, [0, 5, 1, 6, 2, 7, 10, 11, 3, 8, 12, 4, 9]], ["FSP", 6, 0, 2, 3], ["FSP", 6, 4, 3, 3], ["RE", 6, [0, 4, 1, 5, 2, 6, 3, 7]], ["CA", 2, 6, 5], ["CHR", 1, "shared", [2]], ["CA", 2, 3, 6], ["CHR", 0, "shared", [3]], ["CA", 1, 4, 6], ["FU", 8, [0, 1]], ["AN", 8, 0, 5], ["FU", 8, [1, 2]], ["AN", 8, 1, 4], ["FU", 8, [2, 3]], ["AN", 8, 2, 6], ["FU", 3, [0, 1]], ["SP", 3, 0, 64, [1], 1], ["AN", 3, 1, 2], ["FFSP", 3, 0, [3, 2], 1, 1], ["AN", 3, 1, 6], ["FU", 1, [0, 1]], ["SP", 1, 0, 256, [4], 1], ["AN", 1, 1, 2], ["FFSP", 1, 0, [3, 2], 1, 1], ["AN", 1, 1, 6], ["PR", 4, 0, "auto_unroll_max_step$1024"]]]], "r": [[0.28256], 0, 19.9187, 1695329504], "v": "v0.6"}
{"i": [["[\"990586ac95c316d6af64e8ddc5165a26\", [8192, 1152], [128, 1152], [128], [8192, 128]]", "rocm -keys=rocm,gpu -max_num_threads=256 -max_shared_memory_per_block=65536 -max_threads_per_block=256 -mcpu=gfx908 -mtriple=amdgcn-amd-amdhsa-hcc -thread_warp_size=64", [-1, 16, 64, 65536, 2147483647, 1024, 16, 64], "", 0, []], [[], [["CI", 5], ["CI", 4], ["SP", 2, 0, 8192, [8, 8, 1, 2], 1], ["SP", 2, 5, 128, [1, 8, 1, 4], 1], ["SP", 2, 10, 1152, [32, 3], 1], ["RE", 2, [0, 5, 1, 6, 2, 7, 10, 11, 3, 8, 12, 4, 9]], ["FSP", 6, 0, 2, 3], ["FSP", 6, 4, 3, 3], ["RE", 6, [0, 4, 1, 5, 2, 6, 3, 7]], ["CA", 2, 6, 5], ["CHR", 1, "shared", [2]], ["CA", 2, 3, 6], ["CHR", 0, "shared", [3]], ["CA", 1, 4, 6], ["FU", 8, [0, 1]], ["AN", 8, 0, 5], ["FU", 8, [1, 2]], ["AN", 8, 1, 4], ["FU", 8, [2, 3]], ["AN", 8, 2, 6], ["FU", 3, [0, 1]], ["SP", 3, 0, 384, [2], 1], ["AN", 3, 1, 2], ["FFSP", 3, 0, [3, 2], 1, 1], ["AN", 3, 1, 6], ["FU", 1, [0, 1]], ["SP", 1, 0, 192, [1], 1], ["AN", 1, 1, 2], ["FFSP", 1, 0, [3, 2], 1, 1], ["AN", 1, 1, 6], ["PR", 4, 0, "auto_unroll_max_step$1024"]]]], "r": [[0.010039], 0, 8.58892, 1695329505], "v": "v0.6"}
{"i": [["[\"990586ac95c316d6af64e8ddc5165a26\", [8192, 1152], [128, 1152], [128], [8192, 128]]", "rocm -keys=rocm,gpu -max_num_threads=256 -max_shared_memory_per_block=65536 -max_threads_per_block=256 -mcpu=gfx908 -mtriple=amdgcn-amd-amdhsa-hcc -thread_warp_size=64", [-1, 16, 64, 65536, 2147483647, 1024, 16, 64], "", 0, []], [[], [["CI", 5], ["CI", 4], ["SP", 2, 0, 8192, [1, 32, 2, 16], 1], ["SP", 2, 5, 128, [4, 2, 4, 1], 1], ["SP", 2, 10, 1152, [1, 2], 1], ["RE", 2, [0, 5, 1, 6, 2, 7, 10, 11, 3, 8, 12, 4, 9]], ["FSP", 6, 0, 2, 3], ["FSP", 6, 4, 3, 3], ["RE", 6, [0, 4, 1, 5, 2, 6, 3, 7]], ["CA", 2, 6, 5], ["CHR", 1, "shared", [2]], ["CA", 2, 3, 6], ["CHR", 0, "shared", [3]], ["CA", 1, 4, 6], ["FU", 8, [0, 1]], ["AN", 8, 0, 5], ["FU", 8, [1, 2]], ["AN", 8, 1, 4], ["FU", 8, [2, 3]], ["AN", 8, 2, 6], ["FU", 3, [0, 1]], ["SP", 3, 0, 16, [1], 1], ["AN", 3, 1, 2], ["FFSP", 3, 0, [3, 2], 1, 1], ["AN", 3, 1, 6], ["FU", 1, [0, 1]], ["SP", 1, 0, 128, [1], 1], ["AN", 1, 1, 2], ["FFSP", 1, 0, [3, 2], 1, 1], ["AN", 1, 1, 6], ["PR", 4, 0, "auto_unroll_max_step$512"]]]], "r": [[0.115453], 0, 13.2877, 1695329507], "v": "v0.6"}
{"i": [["[\"990586ac95c316d6af64e8ddc5165a26\", [8192, 1152], [128, 1152], [128], [8192, 128]]", "rocm -keys=rocm,gpu -max_num_threads=256 -max_shared_memory_per_block=65536 -max_threads_per_block=256 -mcpu=gfx908 -mtriple=amdgcn-amd-amdhsa-hcc -thread_warp_size=64", [-1, 16, 64, 65536, 2147483647, 1024, 16, 64], "", 0, []], [[], [["CI", 5], ["CI", 4], ["SP", 2, 0, 8192, [1, 16, 4, 1], 1], ["SP", 2, 5, 128, [2, 1, 1, 64], 1], ["SP", 2, 10, 1152, [24, 1], 1], ["RE", 2, [0, 5, 1, 6, 2, 7, 10, 11, 3, 8, 12, 4, 9]], ["FSP", 6, 0, 2, 3], ["FSP", 6, 4, 3, 3], ["RE", 6, [0, 4, 1, 5, 2, 6, 3, 7]], ["CA", 2, 6, 5], ["CHR", 1, "shared", [2]], ["CA", 2, 3, 6], ["CHR", 0, "shared", [3]], ["CA", 1, 4, 6], ["FU", 8, [0, 1]], ["AN", 8, 0, 5], ["FU", 8, [1, 2]], ["AN", 8, 1, 4], ["FU", 8, [2, 3]], ["AN", 8, 2, 6], ["FU", 3, [0, 1]], ["SP", 3, 0, 96, [1], 1], ["AN", 3, 1, 2], ["FFSP", 3, 0, [3, 2], 1, 1], ["AN", 3, 1, 6], ["FU", 1, [0, 1]], ["SP", 1, 0, 96, [1], 1], ["AN", 1, 1, 2], ["FFSP", 1, 0, [3, 2], 1, 1], ["AN", 1, 1, 6], ["PR", 4, 0, "auto_unroll_max_step$0"]]]], "r": [[0.0258035], 0, 2.56128, 1695329509], "v": "v0.6"}
{"i": [["[\"990586ac95c316d6af64e8ddc5165a26\", [8192, 1152], [128, 1152], [128], [8192, 128]]", "rocm -keys=rocm,gpu -max_num_threads=256 -max_shared_memory_per_block=65536 -max_threads_per_block=256 -mcpu=gfx908 -mtriple=amdgcn-amd-amdhsa-hcc -thread_warp_size=64", [-1, 16, 64, 65536, 2147483647, 1024, 16, 64], "", 0, []], [[], [["CI", 5], ["CI", 4], ["SP", 2, 0, 8192, [1, 8, 1, 32], 1], ["SP", 2, 5, 128, [1, 1, 1, 32], 1], ["SP", 2, 10, 1152, [1, 1], 1], ["RE", 2, [0, 5, 1, 6, 2, 7, 10, 11, 3, 8, 12, 4, 9]], ["FSP", 6, 0, 2, 3], ["FSP", 6, 4, 3, 3], ["RE", 6, [0, 4, 1, 5, 2, 6, 3, 7]], ["CA", 2, 6, 5], ["CHR", 1, "shared", [2]], ["CA", 2, 3, 6], ["CHR", 0, "shared", [3]], ["CA", 1, 4, 6], ["FU", 8, [0, 1]], ["AN", 8, 0, 5], ["FU", 8, [1, 2]], ["AN", 8, 1, 4], ["FU", 8, [2, 3]], ["AN", 8, 2, 6], ["FU", 3, [0, 1]], ["SP", 3, 0, 32, [1], 1], ["AN", 3, 1, 2], ["FFSP", 3, 0, [3, 2], 1, 1], ["AN", 3, 1, 6], ["FU", 1, [0, 1]], ["SP", 1, 0, 32, [2], 1], ["AN", 1, 1, 2], ["FFSP", 1, 0, [3, 2], 1, 1], ["AN", 1, 1, 6], ["PR", 4, 0, "auto_unroll_max_step$64"]]]], "r": [[0.0780791], 0, 2.31161, 1695329510], "v": "v0.6"}
{"i": [["[\"990586ac95c316d6af64e8ddc5165a26\", [8192, 1152], [128, 1152], [128], [8192, 128]]", "rocm -keys=rocm,gpu -max_num_threads=256 -max_shared_memory_per_block=65536 -max_threads_per_block=256 -mcpu=gfx908 -mtriple=amdgcn-amd-amdhsa-hcc -thread_warp_size=64", [-1, 16, 64, 65536, 2147483647, 1024, 16, 64], "", 0, []], [[], [["CI", 5], ["CI", 4], ["SP", 2, 0, 8192, [2, 8, 2, 16], 1], ["SP", 2, 5, 128, [1, 32, 2, 1], 1], ["SP", 2, 10, 1152, [2, 3], 1], ["RE", 2, [0, 5, 1, 6, 2, 7, 10, 11, 3, 8, 12, 4, 9]], ["FSP", 6, 0, 2, 3], ["FSP", 6, 4, 3, 3], ["RE", 6, [0, 4, 1, 5, 2, 6, 3, 7]], ["CA", 2, 6, 5], ["CHR", 1, "shared", [2]], ["CA", 2, 3, 6], ["CHR", 0, "shared", [3]], ["CA", 1, 4, 6], ["FU", 8, [0, 1]], ["AN", 8, 0, 5], ["FU", 8, [1, 2]], ["AN", 8, 1, 4], ["FU", 8, [2, 3]], ["AN", 8, 2, 6], ["FU", 3, [0, 1]], ["SP", 3, 0, 24, [4], 1], ["AN", 3, 1, 2], ["FFSP", 3, 0, [3, 2], 1, 1], ["AN", 3, 1, 6], ["FU", 1, [0, 1]], ["SP", 1, 0, 24, [4], 1], ["AN", 1, 1, 2], ["FFSP", 1, 0, [3, 2], 1, 1], ["AN", 1, 1, 6], ["PR", 4, 0, "auto_unroll_max_step$1024"]]]], "r": [[0.0273199], 0, 7.08875, 1695329511], "v": "v0.6"}
{"i": [["[\"990586ac95c316d6af64e8ddc5165a26\", [8192, 1152], [128, 1152], [128], [8192, 128]]", "rocm -keys=rocm,gpu -max_num_threads=256 -max_shared_memory_per_block=65536 -max_threads_per_block=256 -mcpu=gfx908 -mtriple=amdgcn-amd-amdhsa-hcc -thread_warp_size=64", [-1, 16, 64, 65536, 2147483647, 1024, 16, 64], "", 0, []], [[], [["CI", 5], ["CI", 4], ["SP", 2, 0, 8192, [4, 64, 1, 1], 1], ["SP", 2, 5, 128, [4, 4, 1, 8], 1], ["SP", 2, 10, 1152, [8, 3], 1], ["RE", 2, [0, 5, 1, 6, 2, 7, 10, 11, 3, 8, 12, 4, 9]], ["FSP", 6, 0, 2, 3], ["FSP", 6, 4, 3, 3], ["RE", 6, [0, 4, 1, 5, 2, 6, 3, 7]], ["CA", 2, 6, 5], ["CHR", 1, "shared", [2]], ["CA", 2, 3, 6], ["CHR", 0, "shared", [3]], ["CA", 1, 4, 6], ["FU", 8, [0, 1]], ["AN", 8, 0, 5], ["FU", 8, [1, 2]], ["AN", 8, 1, 4], ["FU", 8, [2, 3]], ["AN", 8, 2, 6], ["FU", 3, [0, 1]], ["SP", 3, 0, 192, [1], 1], ["AN", 3, 1, 2], ["FFSP", 3, 0, [3, 2], 1, 1], ["AN", 3, 1, 6], ["FU", 1, [0, 1]], ["SP", 1, 0, 24, [4], 1], ["AN", 1, 1, 2], ["FFSP", 1, 0, [3, 2], 1, 1], ["AN", 1, 1, 6], ["PR", 4, 0, "auto_unroll_max_step$64"]]]], "r": [[0.0101759], 0, 3.07338, 1695329513], "v": "v0.6"}
{"i": [["[\"990586ac95c316d6af64e8ddc5165a26\", [8192, 1152], [128, 1152], [128], [8192, 128]]", "rocm -keys=rocm,gpu -max_num_threads=256 -max_shared_memory_per_block=65536 -max_threads_per_block=256 -mcpu=gfx908 -mtriple=amdgcn-amd-amdhsa-hcc -thread_warp_size=64", [-1, 16, 64, 65536, 2147483647, 1024, 16, 64], "", 0, []], [[], [["CI", 5], ["CI", 4], ["SP", 2, 0, 8192, [2, 16, 4, 4], 1], ["SP", 2, 5, 128, [4, 8, 2, 2], 1], ["SP", 2, 10, 1152, [1, 3], 1], ["RE", 2, [0, 5, 1, 6, 2, 7, 10, 11, 3, 8, 12, 4, 9]], ["FSP", 6, 0, 2, 3], ["FSP", 6, 4, 3, 3], ["RE", 6, [0, 4, 1, 5, 2, 6, 3, 7]], ["CA", 2, 6, 5], ["CHR", 1, "shared", [2]], ["CA", 2, 3, 6], ["CHR", 0, "shared", [3]], ["CA", 1, 4, 6], ["FU", 8, [0, 1]], ["AN", 8, 0, 5], ["FU", 8, [1, 2]], ["AN", 8, 1, 4], ["FU", 8, [2, 3]], ["AN", 8, 2, 6], ["FU", 3, [0, 1]], ["SP", 3, 0, 12, [1], 1], ["AN", 3, 1, 2], ["FFSP", 3, 0, [3, 2], 1, 1], ["AN", 3, 1, 6], ["FU", 1, [0, 1]], ["SP", 1, 0, 24, [4], 1], ["AN", 1, 1, 2], ["FFSP", 1, 0, [3, 2], 1, 1], ["AN", 1, 1, 6], ["PR", 4, 0, "auto_unroll_max_step$0"]]]], "r": [[0.0164966], 0, 3.18125, 1695329515], "v": "v0.6"}
{"i": [["[\"990586ac95c316d6af64e8ddc5165a26\", [8192, 1152], [128, 1152], [128], [8192, 128]]", "rocm -keys=rocm,gpu -max_num_threads=256 -max_shared_memory_per_block=65536 -max_threads_per_block=256 -mcpu=gfx908 -mtriple=amdgcn-amd-amdhsa-hcc -thread_warp_size=64", [-1, 16, 64, 65536, 2147483647, 1024, 16, 64], "", 0, []], [[], [["CI", 5], ["CI", 4], ["SP", 2, 0, 8192, [1, 32, 2, 16], 1], ["SP", 2, 5, 128, [4, 2, 4, 1], 1], ["SP", 2, 10, 1152, [1, 2], 1], ["RE", 2, [0, 5, 1, 6, 2, 7, 10, 11, 3, 8, 12, 4, 9]], ["FSP", 6, 0, 2, 3], ["FSP", 6, 4, 3, 3], ["RE", 6, [0, 4, 1, 5, 2, 6, 3, 7]], ["CA", 2, 6, 5], ["CHR", 1, "shared", [2]], ["CA", 2, 3, 6], ["CHR", 0, "shared", [3]], ["CA", 1, 4, 6], ["FU", 8, [0, 1]], ["AN", 8, 0, 5], ["FU", 8, [1, 2]], ["AN", 8, 1, 4], ["FU", 8, [2, 3]], ["AN", 8, 2, 6], ["FU", 3, [0, 1]], ["SP", 3, 0, 16, [8], 1], ["AN", 3, 1, 2], ["FFSP", 3, 0, [3, 2], 1, 1], ["AN", 3, 1, 6], ["FU", 1, [0, 1]], ["SP", 1, 0, 128, [1], 1], ["AN", 1, 1, 2], ["FFSP", 1, 0, [3, 2], 1, 1], ["AN", 1, 1, 6], ["PR", 4, 0, "auto_unroll_max_step$512"]]]], "r": [[0.121784], 0, 13.2386, 1695329516], "v": "v0.6"}
{"i": [["[\"990586ac95c316d6af64e8ddc5165a26\", [8192, 1152], [128, 1152], [128], [8192, 128]]", "rocm -keys=rocm,gpu -max_num_threads=256 -max_shared_memory_per_block=65536 -max_threads_per_block=256 -mcpu=gfx908 -mtriple=amdgcn-amd-amdhsa-hcc -thread_warp_size=64", [-1, 16, 64, 65536, 2147483647, 1024, 16, 64], "", 0, []], [[], [["CI", 5], ["CI", 4], ["SP", 2, 0, 8192, [1, 64, 4, 1], 1], ["SP", 2, 5, 128, [4, 8, 1, 1], 1], ["SP", 2, 10, 1152, [9, 4], 1], ["RE", 2, [0, 5, 1, 6, 2, 7, 10, 11, 3, 8, 12, 4, 9]], ["FSP", 6, 0, 2, 3], ["FSP", 6, 4, 3, 3], ["RE", 6, [0, 4, 1, 5, 2, 6, 3, 7]], ["CA", 2, 6, 5], ["CHR", 1, "shared", [2]], ["CA", 2, 3, 6], ["CHR", 0, "shared", [3]], ["CA", 1, 4, 6], ["FU", 8, [0, 1]], ["AN", 8, 0, 5], ["FU", 8, [1, 2]], ["AN", 8, 1, 4], ["FU", 8, [2, 3]], ["AN", 8, 2, 6], ["FU", 3, [0, 1]], ["SP", 3, 0, 12, [1], 1], ["AN", 3, 1, 2], ["FFSP", 3, 0, [3, 2], 1, 1], ["AN", 3, 1, 6], ["FU", 1, [0, 1]], ["SP", 1, 0, 48, [1], 1], ["AN", 1, 1, 2], ["FFSP", 1, 0, [3, 2], 1, 1], ["AN", 1, 1, 6], ["PR", 4, 0, "auto_unroll_max_step$16"]]]], "r": [[0.000716696], 0, 2.15739, 1695329517], "v": "v0.6"}
{"i": [["[\"990586ac95c316d6af64e8ddc5165a26\", [8192, 1152], [128, 1152], [128], [8192, 128]]", "rocm -keys=rocm,gpu -max_num_threads=256 -max_shared_memory_per_block=65536 -max_threads_per_block=256 -mcpu=gfx908 -mtriple=amdgcn-amd-amdhsa-hcc -thread_warp_size=64", [-1, 16, 64, 65536, 2147483647, 1024, 16, 64], "", 0, []], [[], [["CI", 5], ["CI", 4], ["SP", 2, 0, 8192, [1, 32, 2, 16], 1], ["SP", 2, 5, 128, [2, 2, 8, 1], 1], ["SP", 2, 10, 1152, [1, 4], 1], ["RE", 2, [0, 5, 1, 6, 2, 7, 10, 11, 3, 8, 12, 4, 9]], ["FSP", 6, 0, 2, 3], ["FSP", 6, 4, 3, 3], ["RE", 6, [0, 4, 1, 5, 2, 6, 3, 7]], ["CA", 2, 6, 5], ["CHR", 1, "shared", [2]], ["CA", 2, 3, 6], ["CHR", 0, "shared", [3]], ["CA", 1, 4, 6], ["FU", 8, [0, 1]], ["AN", 8, 0, 5], ["FU", 8, [1, 2]], ["AN", 8, 1, 4], ["FU", 8, [2, 3]], ["AN", 8, 2, 6], ["FU", 3, [0, 1]], ["SP", 3, 0, 16, [2], 1], ["AN", 3, 1, 2], ["FFSP", 3, 0, [3, 2], 1, 1], ["AN", 3, 1, 6], ["FU", 1, [0, 1]], ["SP", 1, 0, 128, [1], 1], ["AN", 1, 1, 2], ["FFSP", 1, 0, [3, 2], 1, 1], ["AN", 1, 1, 6], ["PR", 4, 0, "auto_unroll_max_step$64"]]]], "r": [[0.011116], 0, 2.70875, 1695329519], "v": "v0.6"}
{"i": [["[\"990586ac95c316d6af64e8ddc5165a26\", [8192, 1152], [128, 1152], [128], [8192, 128]]", "rocm -keys=rocm,gpu -max_num_threads=256 -max_shared_memory_per_block=65536 -max_threads_per_block=256 -mcpu=gfx908 -mtriple=amdgcn-amd-amdhsa-hcc -thread_warp_size=64", [-1, 16, 64, 65536, 2147483647, 1024, 16, 64], "", 0, []], [[], [["CI", 5], ["CI", 4], ["SP", 2, 0, 8192, [4, 8, 1, 16], 1], ["SP", 2, 5, 128, [1, 16, 4, 1], 1], ["SP", 2, 10, 1152, [8, 2], 1], ["RE", 2, [0, 5, 1, 6, 2, 7, 10, 11, 3, 8, 12, 4, 9]], ["FSP", 6, 0, 2, 3], ["FSP", 6, 4, 3, 3], ["RE", 6, [0, 4, 1, 5, 2, 6, 3, 7]], ["CA", 2, 6, 5], ["CHR", 1, "shared", [2]], ["CA", 2, 3, 6], ["CHR", 0, "shared", [3]], ["CA", 1, 4, 6], ["FU", 8, [0, 1]], ["AN", 8, 0, 5], ["FU", 8, [1, 2]], ["AN", 8, 1, 4], ["FU", 8, [2, 3]], ["AN", 8, 2, 6], ["FU", 3, [0, 1]], ["SP", 3, 0, 64, [32], 1], ["AN", 3, 1, 2], ["FFSP", 3, 0, [3, 2], 1, 1], ["AN", 3, 1, 6], ["FU", 1, [0, 1]], ["SP", 1, 0, 256, [1], 1], ["AN", 1, 1, 2], ["FFSP", 1, 0, [3, 2], 1, 1], ["AN", 1, 1, 6], ["PR", 4, 0, "auto_unroll_max_step$1024"]]]], "r": [[0.0609934], 0, 7.22135, 1695329521], "v": "v0.6"}
{"i": [["[\"990586ac95c316d6af64e8ddc5165a26\", [8192, 1152], [128, 1152], [128], [8192, 128]]", "rocm -keys=rocm,gpu -max_num_threads=256 -max_shared_memory_per_block=65536 -max_threads_per_block=256 -mcpu=gfx908 -mtriple=amdgcn-amd-amdhsa-hcc -thread_warp_size=64", [-1, 16, 64, 65536, 2147483647, 1024, 16, 64], "", 0, []], [[], [["CI", 5], ["CI", 4], ["SP", 2, 0, 8192, [16, 16, 2, 1], 1], ["SP", 2, 5, 128, [1, 32, 4, 1], 1], ["SP", 2, 10, 1152, [2, 3], 1], ["RE", 2, [0, 5, 1, 6, 2, 7, 10, 11, 3, 8, 12, 4, 9]], ["FSP", 6, 0, 2, 3], ["FSP", 6, 4, 3, 3], ["RE", 6, [0, 4, 1, 5, 2, 6, 3, 7]], ["CA", 2, 6, 5], ["CHR", 1, "shared", [2]], ["CA", 2, 3, 6], ["CHR", 0, "shared", [3]], ["CA", 1, 4, 6], ["FU", 8, [0, 1]], ["AN", 8, 0, 5], ["FU", 8, [1, 2]], ["AN", 8, 1, 4], ["FU", 8, [2, 3]], ["AN", 8, 2, 6], ["FU", 3, [0, 1]], ["SP", 3, 0, 24, [3], 1], ["AN", 3, 1, 2], ["FFSP", 3, 0, [3, 2], 1, 1], ["AN", 3, 1, 6], ["FU", 1, [0, 1]], ["SP", 1, 0, 24, [1], 1], ["AN", 1, 1, 2], ["FFSP", 1, 0, [3, 2], 1, 1], ["AN", 1, 1, 6], ["PR", 4, 0, "auto_unroll_max_step$1024"]]]], "r": [[0.0087834], 0, 5.34808, 1695329522], "v": "v0.6"}
{"i": [["[\"990586ac95c316d6af64e8ddc5165a26\", [8192, 1152], [128, 1152], [128], [8192, 128]]", "rocm -keys=rocm,gpu -max_num_threads=256 -max_shared_memory_per_block=65536 -max_threads_per_block=256 -mcpu=gfx908 -mtriple=amdgcn-amd-amdhsa-hcc -thread_warp_size=64", [-1, 16, 64, 65536, 2147483647, 1024, 16, 64], "", 0, []], [[], [["CI", 5], ["CI", 4], ["SP", 2, 0, 8192, [16, 16, 1, 2], 1], ["SP", 2, 5, 128, [1, 8, 4, 4], 1], ["SP", 2, 10, 1152, [2, 3], 1], ["RE", 2, [0, 5, 1, 6, 2, 7, 10, 11, 3, 8, 12, 4, 9]], ["FSP", 6, 0, 2, 3], ["FSP", 6, 4, 3, 3], ["RE", 6, [0, 4, 1, 5, 2, 6, 3, 7]], ["CA", 2, 6, 5], ["CHR", 1, "shared", [2]], ["CA", 2, 3, 6], ["CHR", 0, "shared", [3]], ["CA", 1, 4, 6], ["FU", 8, [0, 1]], ["AN", 8, 0, 5], ["FU", 8, [1, 2]], ["AN", 8, 1, 4], ["FU", 8, [2, 3]], ["AN", 8, 2, 6], ["FU", 3, [0, 1]], ["SP", 3, 0, 24, [4], 1], ["AN", 3, 1, 2], ["FFSP", 3, 0, [3, 2], 1, 1], ["AN", 3, 1, 6], ["FU", 1, [0, 1]], ["SP", 1, 0, 24, [1], 1], ["AN", 1, 1, 2], ["FFSP", 1, 0, [3, 2], 1, 1], ["AN", 1, 1, 6], ["PR", 4, 0, "auto_unroll_max_step$1024"]]]], "r": [[0.138504], 0, 10.5813, 1695329524], "v": "v0.6"}
{"i": [["[\"990586ac95c316d6af64e8ddc5165a26\", [8192, 1152], [128, 1152], [128], [8192, 128]]", "rocm -keys=rocm,gpu -max_num_threads=256 -max_shared_memory_per_block=65536 -max_threads_per_block=256 -mcpu=gfx908 -mtriple=amdgcn-amd-amdhsa-hcc -thread_warp_size=64", [-1, 16, 64, 65536, 2147483647, 1024, 16, 64], "", 0, []], [[], [["CI", 5], ["CI", 4], ["SP", 2, 0, 8192, [1, 64, 4, 16], 1], ["SP", 2, 5, 128, [4, 16, 1, 2], 1], ["SP", 2, 10, 1152, [2, 1], 1], ["RE", 2, [0, 5, 1, 6, 2, 7, 10, 11, 3, 8, 12, 4, 9]], ["FSP", 6, 0, 2, 3], ["FSP", 6, 4, 3, 3], ["RE", 6, [0, 4, 1, 5, 2, 6, 3, 7]], ["CA", 2, 6, 5], ["CHR", 1, "shared", [2]], ["CA", 2, 3, 6], ["CHR", 0, "shared", [3]], ["CA", 1, 4, 6], ["FU", 8, [0, 1]], ["AN", 8, 0, 5], ["FU", 8, [1, 2]], ["AN", 8, 1, 4], ["FU", 8, [2, 3]], ["AN", 8, 2, 6], ["FU", 3, [0, 1]], ["SP", 3, 0, 4, [1], 1], ["AN", 3, 1, 2], ["FFSP", 3, 0, [3, 2], 1, 1], ["AN", 3, 1, 6], ["FU", 1, [0, 1]], ["SP", 1, 0, 128, [1], 1], ["AN", 1, 1, 2], ["FFSP", 1, 0, [3, 2], 1, 1], ["AN", 1, 1, 6], ["PR", 4, 0, "auto_unroll_max_step$512"]]]], "r": [[0.161457], 0, 8.2368, 1695329525], "v": "v0.6"}
{"i": [["[\"990586ac95c316d6af64e8ddc5165a26\", [8192, 1152], [128, 1152], [128], [8192, 128]]", "rocm -keys=rocm,gpu -max_num_threads=256 -max_shared_memory_per_block=65536 -max_threads_per_block=256 -mcpu=gfx908 -mtriple=amdgcn-amd-amdhsa-hcc -thread_warp_size=64", [-1, 16, 64, 65536, 2147483647, 1024, 16, 64], "", 0, []], [[], [["CI", 5], ["CI", 4], ["SP", 2, 0, 8192, [1, 128, 32, 2], 1], ["SP", 2, 5, 128, [1, 4, 1, 4], 1], ["SP", 2, 10, 1152, [1, 1], 1], ["RE", 2, [0, 5, 1, 6, 2, 7, 10, 11, 3, 8, 12, 4, 9]], ["FSP", 6, 0, 2, 3], ["FSP", 6, 4, 3, 3], ["RE", 6, [0, 4, 1, 5, 2, 6, 3, 7]], ["CA", 2, 6, 5], ["CHR", 1, "shared", [2]], ["CA", 2, 3, 6], ["CHR", 0, "shared", [3]], ["CA", 1, 4, 6], ["FU", 8, [0, 1]], ["AN", 8, 0, 5], ["FU", 8, [1, 2]], ["AN", 8, 1, 4], ["FU", 8, [2, 3]], ["AN", 8, 2, 6], ["FU", 3, [0, 1]], ["SP", 3, 0, 4, [1], 1], ["AN", 3, 1, 2], ["FFSP", 3, 0, [3, 2], 1, 1], ["AN", 3, 1, 6], ["FU", 1, [0, 1]], ["SP", 1, 0, 32, [1], 1], ["AN", 1, 1, 2], ["FFSP", 1, 0, [3, 2], 1, 1], ["AN", 1, 1, 6], ["PR", 4, 0, "auto_unroll_max_step$64"]]]], "r": [[0.050807], 0, 2.33364, 1695329528], "v": "v0.6"}
{"i": [["[\"990586ac95c316d6af64e8ddc5165a26\", [8192, 1152], [128, 1152], [128], [8192, 128]]", "rocm -keys=rocm,gpu -max_num_threads=256 -max_shared_memory_per_block=65536 -max_threads_per_block=256 -mcpu=gfx908 -mtriple=amdgcn-amd-amdhsa-hcc -thread_warp_size=64", [-1, 16, 64, 65536, 2147483647, 1024, 16, 64], "", 0, []], [[], [["CI", 5], ["CI", 4], ["SP", 2, 0, 8192, [1, 2, 16, 1], 1], ["SP", 2, 5, 128, [1, 128, 1, 1], 1], ["SP", 2, 10, 1152, [12, 2], 1], ["RE", 2, [0, 5, 1, 6, 2, 7, 10, 11, 3, 8, 12, 4, 9]], ["FSP", 6, 0, 2, 3], ["FSP", 6, 4, 3, 3], ["RE", 6, [0, 4, 1, 5, 2, 6, 3, 7]], ["CA", 2, 6, 5], ["CHR", 1, "shared", [2]], ["CA", 2, 3, 6], ["CHR", 0, "shared", [3]], ["CA", 1, 4, 6], ["FU", 8, [0, 1]], ["AN", 8, 0, 5], ["FU", 8, [1, 2]], ["AN", 8, 1, 4], ["FU", 8, [2, 3]], ["AN", 8, 2, 6], ["FU", 3, [0, 1]], ["SP", 3, 0, 24, [1], 1], ["AN", 3, 1, 2], ["FFSP", 3, 0, [3, 2], 1, 1], ["AN", 3, 1, 6], ["FU", 1, [0, 1]], ["SP", 1, 0, 384, [1], 1], ["AN", 1, 1, 2], ["FFSP", 1, 0, [3, 2], 1, 1], ["AN", 1, 1, 6], ["PR", 4, 0, "auto_unroll_max_step$0"]]]], "r": [[0.000580744], 0, 2.29282, 1695329529], "v": "v0.6"}
{"i": [["[\"990586ac95c316d6af64e8ddc5165a26\", [8192, 1152], [128, 1152], [128], [8192, 128]]", "rocm -keys=rocm,gpu -max_num_threads=256 -max_shared_memory_per_block=65536 -max_threads_per_block=256 -mcpu=gfx908 -mtriple=amdgcn-amd-amdhsa-hcc -thread_warp_size=64", [-1, 16, 64, 65536, 2147483647, 1024, 16, 64], "", 0, []], [[], [["CI", 5], ["CI", 4], ["SP", 2, 0, 8192, [8, 4, 1, 16], 1], ["SP", 2, 5, 128, [1, 16, 4, 1], 1], ["SP", 2, 10, 1152, [2, 2], 1], ["RE", 2, [0, 5, 1, 6, 2, 7, 10, 11, 3, 8, 12, 4, 9]], ["FSP", 6, 0, 2, 3], ["FSP", 6, 4, 3, 3], ["RE", 6, [0, 4, 1, 5, 2, 6, 3, 7]], ["CA", 2, 6, 5], ["CHR", 1, "shared", [2]], ["CA", 2, 3, 6], ["CHR", 0, "shared", [3]], ["CA", 1, 4, 6], ["FU", 8, [0, 1]], ["AN", 8, 0, 5], ["FU", 8, [1, 2]], ["AN", 8, 1, 4], ["FU", 8, [2, 3]], ["AN", 8, 2, 6], ["FU", 3, [0, 1]], ["SP", 3, 0, 64, [1], 1], ["AN", 3, 1, 2], ["FFSP", 3, 0, [3, 2], 1, 1], ["AN", 3, 1, 6], ["FU", 1, [0, 1]], ["SP", 1, 0, 256, [1], 1], ["AN", 1, 1, 2], ["FFSP", 1, 0, [3, 2], 1, 1], ["AN", 1, 1, 6], ["PR", 4, 0, "auto_unroll_max_step$512"]]]], "r": [[0.0941528], 0, 9.22965, 1695329530], "v": "v0.6"}
{"i": [["[\"990586ac95c316d6af64e8ddc5165a26\", [8192, 1152], [128, 1152], [128], [8192, 128]]", "rocm -keys=rocm,gpu -max_num_threads=256 -max_shared_memory_per_block=65536 -max_threads_per_block=256 -mcpu=gfx908 -mtriple=amdgcn-amd-amdhsa-hcc -thread_warp_size=64", [-1, 16, 64, 65536, 2147483647, 1024, 16, 64], "", 0, []], [[], [["CI", 5], ["CI", 4], ["SP", 2, 0, 8192, [4, 32, 2, 2], 1], ["SP", 2, 5, 128, [1, 4, 1, 1], 1], ["SP", 2, 10, 1152, [2, 3], 1], ["RE", 2, [0, 5, 1, 6, 2, 7, 10, 11, 3, 8, 12, 4, 9]], ["FSP", 6, 0, 2, 3], ["FSP", 6, 4, 3, 3], ["RE", 6, [0, 4, 1, 5, 2, 6, 3, 7]], ["CA", 2, 6, 5], ["CHR", 1, "shared", [2]], ["CA", 2, 3, 6], ["CHR", 0, "shared", [3]], ["CA", 1, 4, 6], ["FU", 8, [0, 1]], ["AN", 8, 0, 5], ["FU", 8, [1, 2]], ["AN", 8, 1, 4], ["FU", 8, [2, 3]], ["AN", 8, 2, 6], ["FU", 3, [0, 1]], ["SP", 3, 0, 6, [1], 1], ["AN", 3, 1, 2], ["FFSP", 3, 0, [3, 2], 1, 1], ["AN", 3, 1, 6], ["FU", 1, [0, 1]], ["SP", 1, 0, 48, [1], 1], ["AN", 1, 1, 2], ["FFSP", 1, 0, [3, 2], 1, 1], ["AN", 1, 1, 6], ["PR", 4, 0, "auto_unroll_max_step$0"]]]], "r": [[0.00268605], 0, 2.57852, 1695329532], "v": "v0.6"}
{"i": [["[\"990586ac95c316d6af64e8ddc5165a26\", [8192, 1152], [128, 1152], [128], [8192, 128]]", "rocm -keys=rocm,gpu -max_num_threads=256 -max_shared_memory_per_block=65536 -max_threads_per_block=256 -mcpu=gfx908 -mtriple=amdgcn-amd-amdhsa-hcc -thread_warp_size=64", [-1, 16, 64, 65536, 2147483647, 1024, 16, 64], "", 0, []], [[], [["CI", 5], ["CI", 4], ["SP", 2, 0, 8192, [4, 32, 2, 4], 1], ["SP", 2, 5, 128, [1, 4, 1, 1], 1], ["SP", 2, 10, 1152, [3, 2], 1], ["RE", 2, [0, 5, 1, 6, 2, 7, 10, 11, 3, 8, 12, 4, 9]], ["FSP", 6, 0, 2, 3], ["FSP", 6, 4, 3, 3], ["RE", 6, [0, 4, 1, 5, 2, 6, 3, 7]], ["CA", 2, 6, 5], ["CHR", 1, "shared", [2]], ["CA", 2, 3, 6], ["CHR", 0, "shared", [3]], ["CA", 1, 4, 6], ["FU", 8, [0, 1]], ["AN", 8, 0, 5], ["FU", 8, [1, 2]], ["AN", 8, 1, 4], ["FU", 8, [2, 3]], ["AN", 8, 2, 6], ["FU", 3, [0, 1]], ["SP", 3, 0, 6, [1], 1], ["AN", 3, 1, 2], ["FFSP", 3, 0, [3, 2], 1, 1], ["AN", 3, 1, 6], ["FU", 1, [0, 1]], ["SP", 1, 0, 48, [1], 1], ["AN", 1, 1, 2], ["FFSP", 1, 0, [3, 2], 1, 1], ["AN", 1, 1, 6], ["PR", 4, 0, "auto_unroll_max_step$64"]]]], "r": [[0.00629932], 0, 3.44886, 1695329534], "v": "v0.6"}
{"i": [["[\"990586ac95c316d6af64e8ddc5165a26\", [8192, 1152], [128, 1152], [128], [8192, 128]]", "rocm -keys=rocm,gpu -max_num_threads=256 -max_shared_memory_per_block=65536 -max_threads_per_block=256 -mcpu=gfx908 -mtriple=amdgcn-amd-amdhsa-hcc -thread_warp_size=64", [-1, 16, 64, 65536, 2147483647, 1024, 16, 64], "", 0, []], [[], [["CI", 5], ["CI", 4], ["SP", 2, 0, 8192, [4, 4, 2, 4], 1], ["SP", 2, 5, 128, [1, 64, 2, 1], 1], ["SP", 2, 10, 1152, [6, 6], 1], ["RE", 2, [0, 5, 1, 6, 2, 7, 10, 11, 3, 8, 12, 4, 9]], ["FSP", 6, 0, 2, 3], ["FSP", 6, 4, 3, 3], ["RE", 6, [0, 4, 1, 5, 2, 6, 3, 7]], ["CA", 2, 6, 5], ["CHR", 1, "shared", [2]], ["CA", 2, 3, 6], ["CHR", 0, "shared", [3]], ["CA", 1, 4, 6], ["FU", 8, [0, 1]], ["AN", 8, 0, 5], ["FU", 8, [1, 2]], ["AN", 8, 1, 4], ["FU", 8, [2, 3]], ["AN", 8, 2, 6], ["FU", 3, [0, 1]], ["SP", 3, 0, 72, [8], 1], ["AN", 3, 1, 2], ["FFSP", 3, 0, [3, 2], 1, 1], ["AN", 3, 1, 6], ["FU", 1, [0, 1]], ["SP", 1, 0, 288, [1], 1], ["AN", 1, 1, 2], ["FFSP", 1, 0, [3, 2], 1, 1], ["AN", 1, 1, 6], ["PR", 4, 0, "auto_unroll_max_step$1024"]]]], "r": [[0.00412965], 0, 3.731, 1695329535], "v": "v0.6"}
{"i": [["[\"990586ac95c316d6af64e8ddc5165a26\", [8192, 1152], [128, 1152], [128], [8192, 128]]", "rocm -keys=rocm,gpu -max_num_threads=256 -max_shared_memory_per_block=65536 -max_threads_per_block=256 -mcpu=gfx908 -mtriple=amdgcn-amd-amdhsa-hcc -thread_warp_size=64", [-1, 16, 64, 65536, 2147483647, 1024, 16, 64], "", 0, []], [[], [["CI", 5], ["CI", 4], ["SP", 2, 0, 8192, [2, 4, 1, 16], 1], ["SP", 2, 5, 128, [1, 16, 4, 1], 1], ["SP", 2, 10, 1152, [8, 2], 1], ["RE", 2, [0, 5, 1, 6, 2, 7, 10, 11, 3, 8, 12, 4, 9]], ["FSP", 6, 0, 2, 3], ["FSP", 6, 4, 3, 3], ["RE", 6, [0, 4, 1, 5, 2, 6, 3, 7]], ["CA", 2, 6, 5], ["CHR", 1, "shared", [2]], ["CA", 2, 3, 6], ["CHR", 0, "shared", [3]], ["CA", 1, 4, 6], ["FU", 8, [0, 1]], ["AN", 8, 0, 5], ["FU", 8, [1, 2]], ["AN", 8, 1, 4], ["FU", 8, [2, 3]], ["AN", 8, 2, 6], ["FU", 3, [0, 1]], ["SP", 3, 0, 64, [1], 1], ["AN", 3, 1, 2], ["FFSP", 3, 0, [3, 2], 1, 1], ["AN", 3, 1, 6], ["FU", 1, [0, 1]], ["SP", 1, 0, 256, [4], 1], ["AN", 1, 1, 2], ["FFSP", 1, 0, [3, 2], 1, 1], ["AN", 1, 1, 6], ["PR", 4, 0, "auto_unroll_max_step$1024"]]]], "r": [[0.00265125], 0, 3.65598, 1695329536], "v": "v0.6"}
{"i": [["[\"990586ac95c316d6af64e8ddc5165a26\", [8192, 1152], [128, 1152], [128], [8192, 128]]", "rocm -keys=rocm,gpu -max_num_threads=256 -max_shared_memory_per_block=65536 -max_threads_per_block=256 -mcpu=gfx908 -mtriple=amdgcn-amd-amdhsa-hcc -thread_warp_size=64", [-1, 16, 64, 65536, 2147483647, 1024, 16, 64], "", 0, []], [[], [["CI", 5], ["CI", 4], ["SP", 2, 0, 8192, [4, 32, 2, 4], 1], ["SP", 2, 5, 128, [1, 4, 1, 1], 1], ["SP", 2, 10, 1152, [1, 6], 1], ["RE", 2, [0, 5, 1, 6, 2, 7, 10, 11, 3, 8, 12, 4, 9]], ["FSP", 6, 0, 2, 3], ["FSP", 6, 4, 3, 3], ["RE", 6, [0, 4, 1, 5, 2, 6, 3, 7]], ["CA", 2, 6, 5], ["CHR", 1, "shared", [2]], ["CA", 2, 3, 6], ["CHR", 0, "shared", [3]], ["CA", 1, 4, 6], ["FU", 8, [0, 1]], ["AN", 8, 0, 5], ["FU", 8, [1, 2]], ["AN", 8, 1, 4], ["FU", 8, [2, 3]], ["AN", 8, 2, 6], ["FU", 3, [0, 1]], ["SP", 3, 0, 6, [2], 1], ["AN", 3, 1, 2], ["FFSP", 3, 0, [3, 2], 1, 1], ["AN", 3, 1, 6], ["FU", 1, [0, 1]], ["SP", 1, 0, 48, [1], 1], ["AN", 1, 1, 2], ["FFSP", 1, 0, [3, 2], 1, 1], ["AN", 1, 1, 6], ["PR", 4, 0, "auto_unroll_max_step$64"]]]], "r": [[0.00529625], 0, 3.3123, 1695329537], "v": "v0.6"}
{"i": [["[\"990586ac95c316d6af64e8ddc5165a26\", [8192, 1152], [128, 1152], [128], [8192, 128]]", "rocm -keys=rocm,gpu -max_num_threads=256 -max_shared_memory_per_block=65536 -max_threads_per_block=256 -mcpu=gfx908 -mtriple=amdgcn-amd-amdhsa-hcc -thread_warp_size=64", [-1, 16, 64, 65536, 2147483647, 1024, 16, 64], "", 0, []], [[], [["CI", 5], ["CI", 4], ["SP", 2, 0, 8192, [1, 16, 4, 1], 1], ["SP", 2, 5, 128, [8, 4, 1, 4], 1], ["SP", 2, 10, 1152, [24, 1], 1], ["RE", 2, [0, 5, 1, 6, 2, 7, 10, 11, 3, 8, 12, 4, 9]], ["FSP", 6, 0, 2, 3], ["FSP", 6, 4, 3, 3], ["RE", 6, [0, 4, 1, 5, 2, 6, 3, 7]], ["CA", 2, 6, 5], ["CHR", 1, "shared", [2]], ["CA", 2, 3, 6], ["CHR", 0, "shared", [3]], ["CA", 1, 4, 6], ["FU", 8, [0, 1]], ["AN", 8, 0, 5], ["FU", 8, [1, 2]], ["AN", 8, 1, 4], ["FU", 8, [2, 3]], ["AN", 8, 2, 6], ["FU", 3, [0, 1]], ["SP", 3, 0, 96, [1], 1], ["AN", 3, 1, 2], ["FFSP", 3, 0, [3, 2], 1, 1], ["AN", 3, 1, 6], ["FU", 1, [0, 1]], ["SP", 1, 0, 96, [1], 1], ["AN", 1, 1, 2], ["FFSP", 1, 0, [3, 2], 1, 1], ["AN", 1, 1, 6], ["PR", 4, 0, "auto_unroll_max_step$64"]]]], "r": [[0.0146775], 0, 3.82117, 1695329540], "v": "v0.6"}
{"i": [["[\"990586ac95c316d6af64e8ddc5165a26\", [8192, 1152], [128, 1152], [128], [8192, 128]]", "rocm -keys=rocm,gpu -max_num_threads=256 -max_shared_memory_per_block=65536 -max_threads_per_block=256 -mcpu=gfx908 -mtriple=amdgcn-amd-amdhsa-hcc -thread_warp_size=64", [-1, 16, 64, 65536, 2147483647, 1024, 16, 64], "", 0, []], [[], [["CI", 5], ["CI", 4], ["SP", 2, 0, 8192, [1, 2, 2, 8], 1], ["SP", 2, 5, 128, [8, 16, 1, 1], 1], ["SP", 2, 10, 1152, [12, 2], 1], ["RE", 2, [0, 5, 1, 6, 2, 7, 10, 11, 3, 8, 12, 4, 9]], ["FSP", 6, 0, 2, 3], ["FSP", 6, 4, 3, 3], ["RE", 6, [0, 4, 1, 5, 2, 6, 3, 7]], ["CA", 2, 6, 5], ["CHR", 1, "shared", [2]], ["CA", 2, 3, 6], ["CHR", 0, "shared", [3]], ["CA", 1, 4, 6], ["FU", 8, [0, 1]], ["AN", 8, 0, 5], ["FU", 8, [1, 2]], ["AN", 8, 1, 4], ["FU", 8, [2, 3]], ["AN", 8, 2, 6], ["FU", 3, [0, 1]], ["SP", 3, 0, 24, [2], 1], ["AN", 3, 1, 2], ["FFSP", 3, 0, [3, 2], 1, 1], ["AN", 3, 1, 6], ["FU", 1, [0, 1]], ["SP", 1, 0, 384, [1], 1], ["AN", 1, 1, 2], ["FFSP", 1, 0, [3, 2], 1, 1], ["AN", 1, 1, 6], ["PR", 4, 0, "auto_unroll_max_step$0"]]]], "r": [[0.003424], 0, 3.47072, 1695329541], "v": "v0.6"}
{"i": [["[\"990586ac95c316d6af64e8ddc5165a26\", [8192, 1152], [128, 1152], [128], [8192, 128]]", "rocm -keys=rocm,gpu -max_num_threads=256 -max_shared_memory_per_block=65536 -max_threads_per_block=256 -mcpu=gfx908 -mtriple=amdgcn-amd-amdhsa-hcc -thread_warp_size=64", [-1, 16, 64, 65536, 2147483647, 1024, 16, 64], "", 0, []], [[], [["CI", 5], ["CI", 4], ["SP", 2, 0, 8192, [1, 64, 4, 1], 1], ["SP", 2, 5, 128, [4, 8, 1, 1], 1], ["SP", 2, 10, 1152, [1, 36], 1], ["RE", 2, [0, 5, 1, 6, 2, 7, 10, 11, 3, 8, 12, 4, 9]], ["FSP", 6, 0, 2, 3], ["FSP", 6, 4, 3, 3], ["RE", 6, [0, 4, 1, 5, 2, 6, 3, 7]], ["CA", 2, 6, 5], ["CHR", 1, "shared", [2]], ["CA", 2, 3, 6], ["CHR", 0, "shared", [3]], ["CA", 1, 4, 6], ["FU", 8, [0, 1]], ["AN", 8, 0, 5], ["FU", 8, [1, 2]], ["AN", 8, 1, 4], ["FU", 8, [2, 3]], ["AN", 8, 2, 6], ["FU", 3, [0, 1]], ["SP", 3, 0, 12, [1], 1], ["AN", 3, 1, 2], ["FFSP", 3, 0, [3, 2], 1, 1], ["AN", 3, 1, 6], ["FU", 1, [0, 1]], ["SP", 1, 0, 48, [4], 1], ["AN", 1, 1, 2], ["FFSP", 1, 0, [3, 2], 1, 1], ["AN", 1, 1, 6], ["PR", 4, 0, "auto_unroll_max_step$16"]]]], "r": [[0.000652609], 0, 2.8425, 1695329542], "v": "v0.6"}
{"i": [["[\"990586ac95c316d6af64e8ddc5165a26\", [8192, 1152], [128, 1152], [128], [8192, 128]]", "rocm -keys=rocm,gpu -max_num_threads=256 -max_shared_memory_per_block=65536 -max_threads_per_block=256 -mcpu=gfx908 -mtriple=amdgcn-amd-amdhsa-hcc -thread_warp_size=64", [-1, 16, 64, 65536, 2147483647, 1024, 16, 64], "", 0, []], [[], [["CI", 5], ["CI", 4], ["SP", 2, 0, 8192, [1, 16, 8, 4], 1], ["SP", 2, 5, 128, [1, 16, 1, 8], 1], ["SP", 2, 10, 1152, [4, 1], 1], ["RE", 2, [0, 5, 1, 6, 2, 7, 10, 11, 3, 8, 12, 4, 9]], ["FSP", 6, 0, 2, 3], ["FSP", 6, 4, 3, 3], ["RE", 6, [0, 4, 1, 5, 2, 6, 3, 7]], ["CA", 2, 6, 5], ["CHR", 1, "shared", [2]], ["CA", 2, 3, 6], ["CHR", 0, "shared", [3]], ["CA", 1, 4, 6], ["FU", 8, [0, 1]], ["AN", 8, 0, 5], ["FU", 8, [1, 2]], ["AN", 8, 1, 4], ["FU", 8, [2, 3]], ["AN", 8, 2, 6], ["FU", 3, [0, 1]], ["SP", 3, 0, 16, [1], 1], ["AN", 3, 1, 2], ["FFSP", 3, 0, [3, 2], 1, 1], ["AN", 3, 1, 6], ["FU", 1, [0, 1]], ["SP", 1, 0, 128, [4], 1], ["AN", 1, 1, 2], ["FFSP", 1, 0, [3, 2], 1, 1], ["AN", 1, 1, 6], ["PR", 4, 0, "auto_unroll_max_step$64"]]]], "r": [[0.0141833], 0, 2.38932, 1695329543], "v": "v0.6"}
{"i": [["[\"990586ac95c316d6af64e8ddc5165a26\", [8192, 1152], [128, 1152], [128], [8192, 128]]", "rocm -keys=rocm,gpu -max_num_threads=256 -max_shared_memory_per_block=65536 -max_threads_per_block=256 -mcpu=gfx908 -mtriple=amdgcn-amd-amdhsa-hcc -thread_warp_size=64", [-1, 16, 64, 65536, 2147483647, 1024, 16, 64], "", 0, []], [[], [["CI", 5], ["CI", 4], ["SP", 2, 0, 8192, [4, 64, 1, 1], 1], ["SP", 2, 5, 128, [4, 4, 1, 8], 1], ["SP", 2, 10, 1152, [8, 3], 1], ["RE", 2, [0, 5, 1, 6, 2, 7, 10, 11, 3, 8, 12, 4, 9]], ["FSP", 6, 0, 2, 3], ["FSP", 6, 4, 3, 3], ["RE", 6, [0, 4, 1, 5, 2, 6, 3, 7]], ["CA", 2, 6, 5], ["CHR", 1, "shared", [2]], ["CA", 2, 3, 6], ["CHR", 0, "shared", [3]], ["CA", 1, 4, 6], ["FU", 8, [0, 1]], ["AN", 8, 0, 5], ["FU", 8, [1, 2]], ["AN", 8, 1, 4], ["FU", 8, [2, 3]], ["AN", 8, 2, 6], ["FU", 3, [0, 1]], ["SP", 3, 0, 192, [3], 1], ["AN", 3, 1, 2], ["FFSP", 3, 0, [3, 2], 1, 1], ["AN", 3, 1, 6], ["FU", 1, [0, 1]], ["SP", 1, 0, 24, [2], 1], ["AN", 1, 1, 2], ["FFSP", 1, 0, [3, 2], 1, 1], ["AN", 1, 1, 6], ["PR", 4, 0, "auto_unroll_max_step$64"]]]], "r": [[0.00968054], 0, 3.17461, 1695329545], "v": "v0.6"}
{"i": [["[\"990586ac95c316d6af64e8ddc5165a26\", [8192, 1152], [128, 1152], [128], [8192, 128]]", "rocm -keys=rocm,gpu -max_num_threads=256 -max_shared_memory_per_block=65536 -max_threads_per_block=256 -mcpu=gfx908 -mtriple=amdgcn-amd-amdhsa-hcc -thread_warp_size=64", [-1, 16, 64, 65536, 2147483647, 1024, 16, 64], "", 0, []], [[], [["CI", 5], ["CI", 4], ["SP", 2, 0, 8192, [1, 1, 4, 8], 1], ["SP", 2, 5, 128, [1, 128, 1, 1], 1], ["SP", 2, 10, 1152, [3, 1], 1], ["RE", 2, [0, 5, 1, 6, 2, 7, 10, 11, 3, 8, 12, 4, 9]], ["FSP", 6, 0, 2, 3], ["FSP", 6, 4, 3, 3], ["RE", 6, [0, 4, 1, 5, 2, 6, 3, 7]], ["CA", 2, 6, 5], ["CHR", 1, "shared", [2]], ["CA", 2, 3, 6], ["CHR", 0, "shared", [3]], ["CA", 1, 4, 6], ["FU", 8, [0, 1]], ["AN", 8, 0, 5], ["FU", 8, [1, 2]], ["AN", 8, 1, 4], ["FU", 8, [2, 3]], ["AN", 8, 2, 6], ["FU", 3, [0, 1]], ["SP", 3, 0, 24, [1], 1], ["AN", 3, 1, 2], ["FFSP", 3, 0, [3, 2], 1, 1], ["AN", 3, 1, 6], ["FU", 1, [0, 1]], ["SP", 1, 0, 384, [1], 1], ["AN", 1, 1, 2], ["FFSP", 1, 0, [3, 2], 1, 1], ["AN", 1, 1, 6], ["PR", 4, 0, "auto_unroll_max_step$16"]]]], "r": [[0.00074492], 0, 1.98903, 1695329547], "v": "v0.6"}
{"i": [["[\"990586ac95c316d6af64e8ddc5165a26\", [8192, 1152], [128, 1152], [128], [8192, 128]]", "rocm -keys=rocm,gpu -max_num_threads=256 -max_shared_memory_per_block=65536 -max_threads_per_block=256 -mcpu=gfx908 -mtriple=amdgcn-amd-amdhsa-hcc -thread_warp_size=64", [-1, 16, 64, 65536, 2147483647, 1024, 16, 64], "", 0, []], [[], [["CI", 5], ["CI", 4], ["SP", 2, 0, 8192, [1, 512, 4, 1], 1], ["SP", 2, 5, 128, [8, 1, 1, 16], 1], ["SP", 2, 10, 1152, [1, 1], 1], ["RE", 2, [0, 5, 1, 6, 2, 7, 10, 11, 3, 8, 12, 4, 9]], ["FSP", 6, 0, 2, 3], ["FSP", 6, 4, 3, 3], ["RE", 6, [0, 4, 1, 5, 2, 6, 3, 7]], ["CA", 2, 6, 5], ["CHR", 1, "shared", [2]], ["CA", 2, 3, 6], ["CHR", 0, "shared", [3]], ["CA", 1, 4, 6], ["FU", 8, [0, 1]], ["AN", 8, 0, 5], ["FU", 8, [1, 2]], ["AN", 8, 1, 4], ["FU", 8, [2, 3]], ["AN", 8, 2, 6], ["FU", 3, [0, 1]], ["SP", 3, 0, 48, [1], 1], ["AN", 3, 1, 2], ["FFSP", 3, 0, [3, 2], 1, 1], ["AN", 3, 1, 6], ["FU", 1, [0, 1]], ["SP", 1, 0, 12, [6], 1], ["AN", 1, 1, 2], ["FFSP", 1, 0, [3, 2], 1, 1], ["AN", 1, 1, 6], ["PR", 4, 0, "auto_unroll_max_step$1024"]]]], "r": [[0.173153], 0, 6.76642, 1695329548], "v": "v0.6"}
{"i": [["[\"990586ac95c316d6af64e8ddc5165a26\", [8192, 1152], [128, 1152], [128], [8192, 128]]", "rocm -keys=rocm,gpu -max_num_threads=256 -max_shared_memory_per_block=65536 -max_threads_per_block=256 -mcpu=gfx908 -mtriple=amdgcn-amd-amdhsa-hcc -thread_warp_size=64", [-1, 16, 64, 65536, 2147483647, 1024, 16, 64], "", 0, []], [[], [["CI", 5], ["CI", 4], ["SP", 2, 0, 8192, [2, 128, 2, 8], 1], ["SP", 2, 5, 128, [4, 4, 1, 1], 1], ["SP", 2, 10, 1152, [3, 1], 1], ["RE", 2, [0, 5, 1, 6, 2, 7, 10, 11, 3, 8, 12, 4, 9]], ["FSP", 6, 0, 2, 3], ["FSP", 6, 4, 3, 3], ["RE", 6, [0, 4, 1, 5, 2, 6, 3, 7]], ["CA", 2, 6, 5], ["CHR", 1, "shared", [2]], ["CA", 2, 3, 6], ["CHR", 0, "shared", [3]], ["CA", 1, 4, 6], ["FU", 8, [0, 1]], ["AN", 8, 0, 5], ["FU", 8, [1, 2]], ["AN", 8, 1, 4], ["FU", 8, [2, 3]], ["AN", 8, 2, 6], ["FU", 3, [0, 1]], ["SP", 3, 0, 3, [1], 1], ["AN", 3, 1, 2], ["FFSP", 3, 0, [3, 2], 1, 1], ["AN", 3, 1, 6], ["FU", 1, [0, 1]], ["SP", 1, 0, 48, [1], 1], ["AN", 1, 1, 2], ["FFSP", 1, 0, [3, 2], 1, 1], ["AN", 1, 1, 6], ["PR", 4, 0, "auto_unroll_max_step$512"]]]], "r": [[0.0131443], 0, 4.63136, 1695329550], "v": "v0.6"}
{"i": [["[\"990586ac95c316d6af64e8ddc5165a26\", [8192, 1152], [128, 1152], [128], [8192, 128]]", "rocm -keys=rocm,gpu -max_num_threads=256 -max_shared_memory_per_block=65536 -max_threads_per_block=256 -mcpu=gfx908 -mtriple=amdgcn-amd-amdhsa-hcc -thread_warp_size=64", [-1, 16, 64, 65536, 2147483647, 1024, 16, 64], "", 0, []], [[], [["CI", 5], ["CI", 4], ["SP", 2, 0, 8192, [2, 16, 1, 2], 1], ["SP", 2, 5, 128, [4, 4, 1, 8], 1], ["SP", 2, 10, 1152, [4, 4], 1], ["RE", 2, [0, 5, 1, 6, 2, 7, 10, 11, 3, 8, 12, 4, 9]], ["FSP", 6, 0, 2, 3], ["FSP", 6, 4, 3, 3], ["RE", 6, [0, 4, 1, 5, 2, 6, 3, 7]], ["CA", 2, 6, 5], ["CHR", 1, "shared", [2]], ["CA", 2, 3, 6], ["CHR", 0, "shared", [3]], ["CA", 1, 4, 6], ["FU", 8, [0, 1]], ["AN", 8, 0, 5], ["FU", 8, [1, 2]], ["AN", 8, 1, 4], ["FU", 8, [2, 3]], ["AN", 8, 2, 6], ["FU", 3, [0, 1]], ["SP", 3, 0, 64, [1], 1], ["AN", 3, 1, 2], ["FFSP", 3, 0, [3, 2], 1, 1], ["AN", 3, 1, 6], ["FU", 1, [0, 1]], ["SP", 1, 0, 32, [1], 1], ["AN", 1, 1, 2], ["FFSP", 1, 0, [3, 2], 1, 1], ["AN", 1, 1, 6], ["PR", 4, 0, "auto_unroll_max_step$16"]]]], "r": [[0.00951268], 0, 3.41636, 1695329552], "v": "v0.6"}
{"i": [["[\"990586ac95c316d6af64e8ddc5165a26\", [8192, 1152], [128, 1152], [128], [8192, 128]]", "rocm -keys=rocm,gpu -max_num_threads=256 -max_shared_memory_per_block=65536 -max_threads_per_block=256 -mcpu=gfx908 -mtriple=amdgcn-amd-amdhsa-hcc -thread_warp_size=64", [-1, 16, 64, 65536, 2147483647, 1024, 16, 64], "", 0, []], [[], [["CI", 5], ["CI", 4], ["SP", 2, 0, 8192, [8, 4, 8, 1], 1], ["SP", 2, 5, 128, [1, 16, 1, 4], 1], ["SP", 2, 10, 1152, [2, 1], 1], ["RE", 2, [0, 5, 1, 6, 2, 7, 10, 11, 3, 8, 12, 4, 9]], ["FSP", 6, 0, 2, 3], ["FSP", 6, 4, 3, 3], ["RE", 6, [0, 4, 1, 5, 2, 6, 3, 7]], ["CA", 2, 6, 5], ["CHR", 1, "shared", [2]], ["CA", 2, 3, 6], ["CHR", 0, "shared", [3]], ["CA", 1, 4, 6], ["FU", 8, [0, 1]], ["AN", 8, 0, 5], ["FU", 8, [1, 2]], ["AN", 8, 1, 4], ["FU", 8, [2, 3]], ["AN", 8, 2, 6], ["FU", 3, [0, 1]], ["SP", 3, 0, 16, [1], 1], ["AN", 3, 1, 2], ["FFSP", 3, 0, [3, 2], 1, 1], ["AN", 3, 1, 6], ["FU", 1, [0, 1]], ["SP", 1, 0, 128, [32], 1], ["AN", 1, 1, 2], ["FFSP", 1, 0, [3, 2], 1, 1], ["AN", 1, 1, 6], ["PR", 4, 0, "auto_unroll_max_step$64"]]]], "r": [[0.00939787], 0, 2.40325, 1695329553], "v": "v0.6"}
{"i": [["[\"990586ac95c316d6af64e8ddc5165a26\", [8192, 1152], [128, 1152], [128], [8192, 128]]", "rocm -keys=rocm,gpu -max_num_threads=256 -max_shared_memory_per_block=65536 -max_threads_per_block=256 -mcpu=gfx908 -mtriple=amdgcn-amd-amdhsa-hcc -thread_warp_size=64", [-1, 16, 64, 65536, 2147483647, 1024, 16, 64], "", 0, []], [[], [["CI", 5], ["CI", 4], ["SP", 2, 0, 8192, [1, 256, 1, 32], 1], ["SP", 2, 5, 128, [1, 1, 4, 8], 1], ["SP", 2, 10, 1152, [1, 1], 1], ["RE", 2, [0, 5, 1, 6, 2, 7, 10, 11, 3, 8, 12, 4, 9]], ["FSP", 6, 0, 2, 3], ["FSP", 6, 4, 3, 3], ["RE", 6, [0, 4, 1, 5, 2, 6, 3, 7]], ["CA", 2, 6, 5], ["CHR", 1, "shared", [2]], ["CA", 2, 3, 6], ["CHR", 0, "shared", [3]], ["CA", 1, 4, 6], ["FU", 8, [0, 1]], ["AN", 8, 0, 5], ["FU", 8, [1, 2]], ["AN", 8, 1, 4], ["FU", 8, [2, 3]], ["AN", 8, 2, 6], ["FU", 3, [0, 1]], ["SP", 3, 0, 32, [4], 1], ["AN", 3, 1, 2], ["FFSP", 3, 0, [3, 2], 1, 1], ["AN", 3, 1, 6], ["FU", 1, [0, 1]], ["SP", 1, 0, 32, [2], 1], ["AN", 1, 1, 2], ["FFSP", 1, 0, [3, 2], 1, 1], ["AN", 1, 1, 6], ["PR", 4, 0, "auto_unroll_max_step$64"]]]], "r": [[0.0780043], 0, 4.19561, 1695329554], "v": "v0.6"}
{"i": [["[\"990586ac95c316d6af64e8ddc5165a26\", [8192, 1152], [128, 1152], [128], [8192, 128]]", "rocm -keys=rocm,gpu -max_num_threads=256 -max_shared_memory_per_block=65536 -max_threads_per_block=256 -mcpu=gfx908 -mtriple=amdgcn-amd-amdhsa-hcc -thread_warp_size=64", [-1, 16, 64, 65536, 2147483647, 1024, 16, 64], "", 0, []], [[], [["CI", 5], ["CI", 4], ["SP", 2, 0, 8192, [1, 256, 1, 4], 1], ["SP", 2, 5, 128, [8, 1, 1, 4], 1], ["SP", 2, 10, 1152, [1, 3], 1], ["RE", 2, [0, 5, 1, 6, 2, 7, 10, 11, 3, 8, 12, 4, 9]], ["FSP", 6, 0, 2, 3], ["FSP", 6, 4, 3, 3], ["RE", 6, [0, 4, 1, 5, 2, 6, 3, 7]], ["CA", 2, 6, 5], ["CHR", 1, "shared", [2]], ["CA", 2, 3, 6], ["CHR", 0, "shared", [3]], ["CA", 1, 4, 6], ["FU", 8, [0, 1]], ["AN", 8, 0, 5], ["FU", 8, [1, 2]], ["AN", 8, 1, 4], ["FU", 8, [2, 3]], ["AN", 8, 2, 6], ["FU", 3, [0, 1]], ["SP", 3, 0, 12, [3], 1], ["AN", 3, 1, 2], ["FFSP", 3, 0, [3, 2], 1, 1], ["AN", 3, 1, 6], ["FU", 1, [0, 1]], ["SP", 1, 0, 12, [1], 1], ["AN", 1, 1, 2], ["FFSP", 1, 0, [3, 2], 1, 1], ["AN", 1, 1, 6], ["PR", 4, 0, "auto_unroll_max_step$64"]]]], "r": [[0.0225738], 0, 3.68105, 1695329556], "v": "v0.6"}
{"i": [["[\"990586ac95c316d6af64e8ddc5165a26\", [8192, 1152], [128, 1152], [128], [8192, 128]]", "rocm -keys=rocm,gpu -max_num_threads=256 -max_shared_memory_per_block=65536 -max_threads_per_block=256 -mcpu=gfx908 -mtriple=amdgcn-amd-amdhsa-hcc -thread_warp_size=64", [-1, 16, 64, 65536, 2147483647, 1024, 16, 64], "", 0, []], [[], [["CI", 5], ["CI", 4], ["SP", 2, 0, 8192, [4, 256, 1, 8], 1], ["SP", 2, 5, 128, [1, 1, 4, 8], 1], ["SP", 2, 10, 1152, [1, 1], 1], ["RE", 2, [0, 5, 1, 6, 2, 7, 10, 11, 3, 8, 12, 4, 9]], ["FSP", 6, 0, 2, 3], ["FSP", 6, 4, 3, 3], ["RE", 6, [0, 4, 1, 5, 2, 6, 3, 7]], ["CA", 2, 6, 5], ["CHR", 1, "shared", [2]], ["CA", 2, 3, 6], ["CHR", 0, "shared", [3]], ["CA", 1, 4, 6], ["FU", 8, [0, 1]], ["AN", 8, 0, 5], ["FU", 8, [1, 2]], ["AN", 8, 1, 4], ["FU", 8, [2, 3]], ["AN", 8, 2, 6], ["FU", 3, [0, 1]], ["SP", 3, 0, 32, [1], 1], ["AN", 3, 1, 2], ["FFSP", 3, 0, [3, 2], 1, 1], ["AN", 3, 1, 6], ["FU", 1, [0, 1]], ["SP", 1, 0, 32, [1], 1], ["AN", 1, 1, 2], ["FFSP", 1, 0, [3, 2], 1, 1], ["AN", 1, 1, 6], ["PR", 4, 0, "auto_unroll_max_step$512"]]]], "r": [[0.350306], 0, 8.93756, 1695329559], "v": "v0.6"}
{"i": [["[\"990586ac95c316d6af64e8ddc5165a26\", [8192, 1152], [128, 1152], [128], [8192, 128]]", "rocm -keys=rocm,gpu -max_num_threads=256 -max_shared_memory_per_block=65536 -max_threads_per_block=256 -mcpu=gfx908 -mtriple=amdgcn-amd-amdhsa-hcc -thread_warp_size=64", [-1, 16, 64, 65536, 2147483647, 1024, 16, 64], "", 0, []], [[], [["CI", 5], ["CI", 4], ["SP", 2, 0, 8192, [4, 8, 2, 1], 1], ["SP", 2, 5, 128, [4, 2, 1, 16], 1], ["SP", 2, 10, 1152, [3, 4], 1], ["RE", 2, [0, 5, 1, 6, 2, 7, 10, 11, 3, 8, 12, 4, 9]], ["FSP", 6, 0, 2, 3], ["FSP", 6, 4, 3, 3], ["RE", 6, [0, 4, 1, 5, 2, 6, 3, 7]], ["CA", 2, 6, 5], ["CHR", 1, "shared", [2]], ["CA", 2, 3, 6], ["CHR", 0, "shared", [3]], ["CA", 1, 4, 6], ["FU", 8, [0, 1]], ["AN", 8, 0, 5], ["FU", 8, [1, 2]], ["AN", 8, 1, 4], ["FU", 8, [2, 3]], ["AN", 8, 2, 6], ["FU", 3, [0, 1]], ["SP", 3, 0, 192, [1], 1], ["AN", 3, 1, 2], ["FFSP", 3, 0, [3, 2], 1, 1], ["AN", 3, 1, 6], ["FU", 1, [0, 1]], ["SP", 1, 0, 24, [1], 1], ["AN", 1, 1, 2], ["FFSP", 1, 0, [3, 2], 1, 1], ["AN", 1, 1, 6], ["PR", 4, 0, "auto_unroll_max_step$16"]]]], "r": [[0.0163245], 0, 2.5447, 1695329560], "v": "v0.6"}
{"i": [["[\"990586ac95c316d6af64e8ddc5165a26\", [8192, 1152], [128, 1152], [128], [8192, 128]]", "rocm -keys=rocm,gpu -max_num_threads=256 -max_shared_memory_per_block=65536 -max_threads_per_block=256 -mcpu=gfx908 -mtriple=amdgcn-amd-amdhsa-hcc -thread_warp_size=64", [-1, 16, 64, 65536, 2147483647, 1024, 16, 64], "", 0, []], [[], [["CI", 5], ["CI", 4], ["SP", 2, 0, 8192, [2, 32, 1, 16], 1], ["SP", 2, 5, 128, [8, 2, 2, 1], 1], ["SP", 2, 10, 1152, [6, 1], 1], ["RE", 2, [0, 5, 1, 6, 2, 7, 10, 11, 3, 8, 12, 4, 9]], ["FSP", 6, 0, 2, 3], ["FSP", 6, 4, 3, 3], ["RE", 6, [0, 4, 1, 5, 2, 6, 3, 7]], ["CA", 2, 6, 5], ["CHR", 1, "shared", [2]], ["CA", 2, 3, 6], ["CHR", 0, "shared", [3]], ["CA", 1, 4, 6], ["FU", 8, [0, 1]], ["AN", 8, 0, 5], ["FU", 8, [1, 2]], ["AN", 8, 1, 4], ["FU", 8, [2, 3]], ["AN", 8, 2, 6], ["FU", 3, [0, 1]], ["SP", 3, 0, 12, [3], 1], ["AN", 3, 1, 2], ["FFSP", 3, 0, [3, 2], 1, 1], ["AN", 3, 1, 6], ["FU", 1, [0, 1]], ["SP", 1, 0, 96, [1], 1], ["AN", 1, 1, 2], ["FFSP", 1, 0, [3, 2], 1, 1], ["AN", 1, 1, 6], ["PR", 4, 0, "auto_unroll_max_step$0"]]]], "r": [[0.0224288], 0, 2.23923, 1695329561], "v": "v0.6"}
{"i": [["[\"990586ac95c316d6af64e8ddc5165a26\", [8192, 1152], [128, 1152], [128], [8192, 128]]", "rocm -keys=rocm,gpu -max_num_threads=256 -max_shared_memory_per_block=65536 -max_threads_per_block=256 -mcpu=gfx908 -mtriple=amdgcn-amd-amdhsa-hcc -thread_warp_size=64", [-1, 16, 64, 65536, 2147483647, 1024, 16, 64], "", 0, []], [[], [["CI", 5], ["CI", 4], ["SP", 2, 0, 8192, [2, 8, 1, 32], 1], ["SP", 2, 5, 128, [1, 16, 1, 4], 1], ["SP", 2, 10, 1152, [2, 1], 1], ["RE", 2, [0, 5, 1, 6, 2, 7, 10, 11, 3, 8, 12, 4, 9]], ["FSP", 6, 0, 2, 3], ["FSP", 6, 4, 3, 3], ["RE", 6, [0, 4, 1, 5, 2, 6, 3, 7]], ["CA", 2, 6, 5], ["CHR", 1, "shared", [2]], ["CA", 2, 3, 6], ["CHR", 0, "shared", [3]], ["CA", 1, 4, 6], ["FU", 8, [0, 1]], ["AN", 8, 0, 5], ["FU", 8, [1, 2]], ["AN", 8, 1, 4], ["FU", 8, [2, 3]], ["AN", 8, 2, 6], ["FU", 3, [0, 1]], ["SP", 3, 0, 16, [1], 1], ["AN", 3, 1, 2], ["FFSP", 3, 0, [3, 2], 1, 1], ["AN", 3, 1, 6], ["FU", 1, [0, 1]], ["SP", 1, 0, 128, [32], 1], ["AN", 1, 1, 2], ["FFSP", 1, 0, [3, 2], 1, 1], ["AN", 1, 1, 6], ["PR", 4, 0, "auto_unroll_max_step$64"]]]], "r": [[0.012215], 0, 2.21148, 1695329563], "v": "v0.6"}
{"i": [["[\"990586ac95c316d6af64e8ddc5165a26\", [8192, 1152], [128, 1152], [128], [8192, 128]]", "rocm -keys=rocm,gpu -max_num_threads=256 -max_shared_memory_per_block=65536 -max_threads_per_block=256 -mcpu=gfx908 -mtriple=amdgcn-amd-amdhsa-hcc -thread_warp_size=64", [-1, 16, 64, 65536, 2147483647, 1024, 16, 64], "", 0, []], [[], [["CI", 5], ["CI", 4], ["SP", 2, 0, 8192, [16, 1, 2, 2], 1], ["SP", 2, 5, 128, [1, 32, 4, 1], 1], ["SP", 2, 10, 1152, [2, 3], 1], ["RE", 2, [0, 5, 1, 6, 2, 7, 10, 11, 3, 8, 12, 4, 9]], ["FSP", 6, 0, 2, 3], ["FSP", 6, 4, 3, 3], ["RE", 6, [0, 4, 1, 5, 2, 6, 3, 7]], ["CA", 2, 6, 5], ["CHR", 1, "shared", [2]], ["CA", 2, 3, 6], ["CHR", 0, "shared", [3]], ["CA", 1, 4, 6], ["FU", 8, [0, 1]], ["AN", 8, 0, 5], ["FU", 8, [1, 2]], ["AN", 8, 1, 4], ["FU", 8, [2, 3]], ["AN", 8, 2, 6], ["FU", 3, [0, 1]], ["SP", 3, 0, 24, [1], 1], ["AN", 3, 1, 2], ["FFSP", 3, 0, [3, 2], 1, 1], ["AN", 3, 1, 6], ["FU", 1, [0, 1]], ["SP", 1, 0, 24, [1], 1], ["AN", 1, 1, 2], ["FFSP", 1, 0, [3, 2], 1, 1], ["AN", 1, 1, 6], ["PR", 4, 0, "auto_unroll_max_step$1024"]]]], "r": [[0.0617339], 0, 9.48439, 1695329565], "v": "v0.6"}
{"i": [["[\"990586ac95c316d6af64e8ddc5165a26\", [8192, 1152], [128, 1152], [128], [8192, 128]]", "rocm -keys=rocm,gpu -max_num_threads=256 -max_shared_memory_per_block=65536 -max_threads_per_block=256 -mcpu=gfx908 -mtriple=amdgcn-amd-amdhsa-hcc -thread_warp_size=64", [-1, 16, 64, 65536, 2147483647, 1024, 16, 64], "", 0, []], [[], [["CI", 5], ["CI", 4], ["SP", 2, 0, 8192, [2, 32, 1, 16], 1], ["SP", 2, 5, 128, [8, 2, 2, 2], 1], ["SP", 2, 10, 1152, [2, 1], 1], ["RE", 2, [0, 5, 1, 6, 2, 7, 10, 11, 3, 8, 12, 4, 9]], ["FSP", 6, 0, 2, 3], ["FSP", 6, 4, 3, 3], ["RE", 6, [0, 4, 1, 5, 2, 6, 3, 7]], ["CA", 2, 6, 5], ["CHR", 1, "shared", [2]], ["CA", 2, 3, 6], ["CHR", 0, "shared", [3]], ["CA", 1, 4, 6], ["FU", 8, [0, 1]], ["AN", 8, 0, 5], ["FU", 8, [1, 2]], ["AN", 8, 1, 4], ["FU", 8, [2, 3]], ["AN", 8, 2, 6], ["FU", 3, [0, 1]], ["SP", 3, 0, 12, [1], 1], ["AN", 3, 1, 2], ["FFSP", 3, 0, [3, 2], 1, 1], ["AN", 3, 1, 6], ["FU", 1, [0, 1]], ["SP", 1, 0, 96, [1], 1], ["AN", 1, 1, 2], ["FFSP", 1, 0, [3, 2], 1, 1], ["AN", 1, 1, 6], ["PR", 4, 0, "auto_unroll_max_step$0"]]]], "r": [[0.0278759], 0, 2.29567, 1695329566], "v": "v0.6"}
{"i": [["[\"990586ac95c316d6af64e8ddc5165a26\", [8192, 1152], [128, 1152], [128], [8192, 128]]", "rocm -keys=rocm,gpu -max_num_threads=256 -max_shared_memory_per_block=65536 -max_threads_per_block=256 -mcpu=gfx908 -mtriple=amdgcn-amd-amdhsa-hcc -thread_warp_size=64", [-1, 16, 64, 65536, 2147483647, 1024, 16, 64], "", 0, []], [[], [["CI", 5], ["CI", 4], ["SP", 2, 0, 8192, [1, 128, 32, 2], 1], ["SP", 2, 5, 128, [4, 2, 4, 1], 1], ["SP", 2, 10, 1152, [1, 1], 1], ["RE", 2, [0, 5, 1, 6, 2, 7, 10, 11, 3, 8, 12, 4, 9]], ["FSP", 6, 0, 2, 3], ["FSP", 6, 4, 3, 3], ["RE", 6, [0, 4, 1, 5, 2, 6, 3, 7]], ["CA", 2, 6, 5], ["CHR", 1, "shared", [2]], ["CA", 2, 3, 6], ["CHR", 0, "shared", [3]], ["CA", 1, 4, 6], ["FU", 8, [0, 1]], ["AN", 8, 0, 5], ["FU", 8, [1, 2]], ["AN", 8, 1, 4], ["FU", 8, [2, 3]], ["AN", 8, 2, 6], ["FU", 3, [0, 1]], ["SP", 3, 0, 4, [2], 1], ["AN", 3, 1, 2], ["FFSP", 3, 0, [3, 2], 1, 1], ["AN", 3, 1, 6], ["FU", 1, [0, 1]], ["SP", 1, 0, 256, [4], 1], ["AN", 1, 1, 2], ["FFSP", 1, 0, [3, 2], 1, 1], ["AN", 1, 1, 6], ["PR", 4, 0, "auto_unroll_max_step$0"]]]], "r": [[0.10372], 0, 2.48065, 1695329568], "v": "v0.6"}
{"i": [["[\"990586ac95c316d6af64e8ddc5165a26\", [8192, 1152], [128, 1152], [128], [8192, 128]]", "rocm -keys=rocm,gpu -max_num_threads=256 -max_shared_memory_per_block=65536 -max_threads_per_block=256 -mcpu=gfx908 -mtriple=amdgcn-amd-amdhsa-hcc -thread_warp_size=64", [-1, 16, 64, 65536, 2147483647, 1024, 16, 64], "", 0, []], [[], [["CI", 5], ["CI", 4], ["SP", 2, 0, 8192, [1, 16, 4, 1], 1], ["SP", 2, 5, 128, [8, 4, 1, 4], 1], ["SP", 2, 10, 1152, [6, 1], 1], ["RE", 2, [0, 5, 1, 6, 2, 7, 10, 11, 3, 8, 12, 4, 9]], ["FSP", 6, 0, 2, 3], ["FSP", 6, 4, 3, 3], ["RE", 6, [0, 4, 1, 5, 2, 6, 3, 7]], ["CA", 2, 6, 5], ["CHR", 1, "shared", [2]], ["CA", 2, 3, 6], ["CHR", 0, "shared", [3]], ["CA", 1, 4, 6], ["FU", 8, [0, 1]], ["AN", 8, 0, 5], ["FU", 8, [1, 2]], ["AN", 8, 1, 4], ["FU", 8, [2, 3]], ["AN", 8, 2, 6], ["FU", 3, [0, 1]], ["SP", 3, 0, 96, [1], 1], ["AN", 3, 1, 2], ["FFSP", 3, 0, [3, 2], 1, 1], ["AN", 3, 1, 6], ["FU", 1, [0, 1]], ["SP", 1, 0, 96, [1], 1], ["AN", 1, 1, 2], ["FFSP", 1, 0, [3, 2], 1, 1], ["AN", 1, 1, 6], ["PR", 4, 0, "auto_unroll_max_step$64"]]]], "r": [[0.012745], 0, 2.65439, 1695329569], "v": "v0.6"}
