ansor_log/rocm-MI100/CNN/rocm-CNN-50.json
{"i": [["[\"990586ac95c316d6af64e8ddc5165a26\", [8192, 1152], [128, 1152], [128], [8192, 128]]", "rocm -keys=rocm,gpu -max_num_threads=256 -max_shared_memory_per_block=65536 -max_threads_per_block=256 -mcpu=gfx908 -mtriple=amdgcn-amd-amdhsa-hcc -thread_warp_size=64", [-1, 16, 64, 65536, 2147483647, 1024, 16, 64], "", 0, []], [[], [["CI", 5], ["CI", 4], ["SP", 2, 0, 8192, [2, 64, 4, 1], 1], ["SP", 2, 5, 128, [8, 2, 4, 1], 1], ["SP", 2, 10, 1152, [9, 2], 1], ["RE", 2, [0, 5, 1, 6, 2, 7, 10, 11, 3, 8, 12, 4, 9]], ["FSP", 6, 0, 2, 3], ["FSP", 6, 4, 3, 3], ["RE", 6, [0, 4, 1, 5, 2, 6, 3, 7]], ["CA", 2, 6, 5], ["CHR", 1, "shared", [2]], ["CA", 2, 3, 6], ["CHR", 0, "shared", [3]], ["CA", 1, 4, 6], ["FU", 8, [0, 1]], ["AN", 8, 0, 5], ["FU", 8, [1, 2]], ["AN", 8, 1, 4], ["FU", 8, [2, 3]], ["AN", 8, 2, 6], ["FU", 3, [0, 1]], ["SP", 3, 0, 24, [24], 1], ["AN", 3, 1, 2], ["FFSP", 3, 0, [3, 2], 1, 1], ["AN", 3, 1, 6], ["FU", 1, [0, 1]], ["SP", 1, 0, 24, [1], 1], ["AN", 1, 1, 2], ["FFSP", 1, 0, [3, 2], 1, 1], ["AN", 1, 1, 6], ["PR", 4, 0, "auto_unroll_max_step$64"]]]], "r": [[0.00691512], 0, 2.91491, 1695326907], "v": "v0.6"}
{"i": [["[\"990586ac95c316d6af64e8ddc5165a26\", [8192, 1152], [128, 1152], [128], [8192, 128]]", "rocm -keys=rocm,gpu -max_num_threads=256 -max_shared_memory_per_block=65536 -max_threads_per_block=256 -mcpu=gfx908 -mtriple=amdgcn-amd-amdhsa-hcc -thread_warp_size=64", [-1, 16, 64, 65536, 2147483647, 1024, 16, 64], "", 0, []], [[], [["CI", 5], ["CI", 4], ["SP", 2, 0, 8192, [1, 32, 1, 16], 1], ["SP", 2, 5, 128, [2, 16, 2, 2], 1], ["SP", 2, 10, 1152, [1, 3], 1], ["RE", 2, [0, 5, 1, 6, 2, 7, 10, 11, 3, 8, 12, 4, 9]], ["FSP", 6, 0, 2, 3], ["FSP", 6, 4, 3, 3], ["RE", 6, [0, 4, 1, 5, 2, 6, 3, 7]], ["CA", 2, 6, 5], ["CHR", 1, "shared", [2]], ["CA", 2, 3, 6], ["CHR", 0, "shared", [3]], ["CA", 1, 4, 6], ["FU", 8, [0, 1]], ["AN", 8, 0, 5], ["FU", 8, [1, 2]], ["AN", 8, 1, 4], ["FU", 8, [2, 3]], ["AN", 8, 2, 6], ["FU", 3, [0, 1]], ["SP", 3, 0, 12, [1], 1], ["AN", 3, 1, 2], ["FFSP", 3, 0, [3, 2], 1, 1], ["AN", 3, 1, 6], ["FU", 1, [0, 1]], ["SP", 1, 0, 24, [1], 1], ["AN", 1, 1, 2], ["FFSP", 1, 0, [3, 2], 1, 1], ["AN", 1, 1, 6], ["PR", 4, 0, "auto_unroll_max_step$64"]]]], "r": [[0.0070381], 0, 3.69173, 1695326909], "v": "v0.6"}
{"i": [["[\"990586ac95c316d6af64e8ddc5165a26\", [8192, 1152], [128, 1152], [128], [8192, 128]]", "rocm -keys=rocm,gpu -max_num_threads=256 -max_shared_memory_per_block=65536 -max_threads_per_block=256 -mcpu=gfx908 -mtriple=amdgcn-amd-amdhsa-hcc -thread_warp_size=64", [-1, 16, 64, 65536, 2147483647, 1024, 16, 64], "", 0, []], [[], [["CI", 5], ["CI", 4], ["SP", 2, 0, 8192, [1, 128, 1, 1], 1], ["SP", 2, 5, 128, [1, 1, 1, 1], 1], ["SP", 2, 10, 1152, [12, 4], 1], ["RE", 2, [0, 5, 1, 6, 2, 7, 10, 11, 3, 8, 12, 4, 9]], ["FSP", 6, 0, 2, 3], ["FSP", 6, 4, 3, 3], ["RE", 6, [0, 4, 1, 5, 2, 6, 3, 7]], ["CA", 2, 6, 5], ["CHR", 1, "shared", [2]], ["CA", 2, 3, 6], ["CHR", 0, "shared", [3]], ["CA", 1, 4, 6], ["FU", 8, [0, 1]], ["AN", 8, 0, 5], ["FU", 8, [1, 2]], ["AN", 8, 1, 4], ["FU", 8, [2, 3]], ["AN", 8, 2, 6], ["FU", 3, [0, 1]], ["SP", 3, 0, 3072, [1], 1], ["AN", 3, 1, 2], ["FFSP", 3, 0, [3, 2], 1, 1], ["AN", 3, 1, 6], ["FU", 1, [0, 1]], ["SP", 1, 0, 48, [1], 1], ["AN", 1, 1, 2], ["FFSP", 1, 0, [3, 2], 1, 1], ["AN", 1, 1, 6], ["PR", 4, 0, "auto_unroll_max_step$0"]]]], "r": [[0.0215071], 0, 2.12497, 1695326910], "v": "v0.6"}
{"i": [["[\"990586ac95c316d6af64e8ddc5165a26\", [8192, 1152], [128, 1152], [128], [8192, 128]]", "rocm -keys=rocm,gpu -max_num_threads=256 -max_shared_memory_per_block=65536 -max_threads_per_block=256 -mcpu=gfx908 -mtriple=amdgcn-amd-amdhsa-hcc -thread_warp_size=64", [-1, 16, 64, 65536, 2147483647, 1024, 16, 64], "", 0, []], [[], [["CI", 5], ["CI", 4], ["SP", 2, 0, 8192, [1, 32, 1, 8], 1], ["SP", 2, 5, 128, [4, 8, 2, 2], 1], ["SP", 2, 10, 1152, [1, 3], 1], ["RE", 2, [0, 5, 1, 6, 2, 7, 10, 11, 3, 8, 12, 4, 9]], ["FSP", 6, 0, 2, 3], ["FSP", 6, 4, 3, 3], ["RE", 6, [0, 4, 1, 5, 2, 6, 3, 7]], ["CA", 2, 6, 5], ["CHR", 1, "shared", [2]], ["CA", 2, 3, 6], ["CHR", 0, "shared", [3]], ["CA", 1, 4, 6], ["FU", 8, [0, 1]], ["AN", 8, 0, 5], ["FU", 8, [1, 2]], ["AN", 8, 1, 4], ["FU", 8, [2, 3]], ["AN", 8, 2, 6], ["FU", 3, [0, 1]], ["SP", 3, 0, 12, [2], 1], ["AN", 3, 1, 2], ["FFSP", 3, 0, [3, 2], 1, 1], ["AN", 3, 1, 6], ["FU", 1, [0, 1]], ["SP", 1, 0, 24, [1], 1], ["AN", 1, 1, 2], ["FFSP", 1, 0, [3, 2], 1, 1], ["AN", 1, 1, 6], ["PR", 4, 0, "auto_unroll_max_step$512"]]]], "r": [[0.00351954], 0, 2.97049, 1695326911], "v": "v0.6"}
{"i": [["[\"990586ac95c316d6af64e8ddc5165a26\", [8192, 1152], [128, 1152], [128], [8192, 128]]", "rocm -keys=rocm,gpu -max_num_threads=256 -max_shared_memory_per_block=65536 -max_threads_per_block=256 -mcpu=gfx908 -mtriple=amdgcn-amd-amdhsa-hcc -thread_warp_size=64", [-1, 16, 64, 65536, 2147483647, 1024, 16, 64], "", 0, []], [[], [["CI", 5], ["CI", 4], ["SP", 2, 0, 8192, [2, 64, 4, 1], 1], ["SP", 2, 5, 128, [2, 2, 16, 1], 1], ["SP", 2, 10, 1152, [1, 2], 1], ["RE", 2, [0, 5, 1, 6, 2, 7, 10, 11, 3, 8, 12, 4, 9]], ["FSP", 6, 0, 2, 3], ["FSP", 6, 4, 3, 3], ["RE", 6, [0, 4, 1, 5, 2, 6, 3, 7]], ["CA", 2, 6, 5], ["CHR", 1, "shared", [2]], ["CA", 2, 3, 6], ["CHR", 0, "shared", [3]], ["CA", 1, 4, 6], ["FU", 8, [0, 1]], ["AN", 8, 0, 5], ["FU", 8, [1, 2]], ["AN", 8, 1, 4], ["FU", 8, [2, 3]], ["AN", 8, 2, 6], ["FU", 3, [0, 1]], ["SP", 3, 0, 24, [1], 1], ["AN", 3, 1, 2], ["FFSP", 3, 0, [3, 2], 1, 1], ["AN", 3, 1, 6], ["FU", 1, [0, 1]], ["SP", 1, 0, 24, [1], 1], ["AN", 1, 1, 2], ["FFSP", 1, 0, [3, 2], 1, 1], ["AN", 1, 1, 6], ["PR", 4, 0, "auto_unroll_max_step$64"]]]], "r": [[0.0157589], 0, 4.58658, 1695326913], "v": "v0.6"}
{"i": [["[\"990586ac95c316d6af64e8ddc5165a26\", [8192, 1152], [128, 1152], [128], [8192, 128]]", "rocm -keys=rocm,gpu -max_num_threads=256 -max_shared_memory_per_block=65536 -max_threads_per_block=256 -mcpu=gfx908 -mtriple=amdgcn-amd-amdhsa-hcc -thread_warp_size=64", [-1, 16, 64, 65536, 2147483647, 1024, 16, 64], "", 0, []], [[], [["CI", 5], ["CI", 4], ["SP", 2, 0, 8192, [2, 64, 2, 2], 1], ["SP", 2, 5, 128, [4, 4, 2, 1], 1], ["SP", 2, 10, 1152, [4, 2], 1], ["RE", 2, [0, 5, 1, 6, 2, 7, 10, 11, 3, 8, 12, 4, 9]], ["FSP", 6, 0, 2, 3], ["FSP", 6, 4, 3, 3], ["RE", 6, [0, 4, 1, 5, 2, 6, 3, 7]], ["CA", 2, 6, 5], ["CHR", 1, "shared", [2]], ["CA", 2, 3, 6], ["CHR", 0, "shared", [3]], ["CA", 1, 4, 6], ["FU", 8, [0, 1]], ["AN", 8, 0, 5], ["FU", 8, [1, 2]], ["AN", 8, 1, 4], ["FU", 8, [2, 3]], ["AN", 8, 2, 6], ["FU", 3, [0, 1]], ["SP", 3, 0, 16, [1], 1], ["AN", 3, 1, 2], ["FFSP", 3, 0, [3, 2], 1, 1], ["AN", 3, 1, 6], ["FU", 1, [0, 1]], ["SP", 1, 0, 32, [1], 1], ["AN", 1, 1, 2], ["FFSP", 1, 0, [3, 2], 1, 1], ["AN", 1, 1, 6], ["PR", 4, 0, "auto_unroll_max_step$1024"]]]], "r": [[0.00144459], 0, 3.32188, 1695326914], "v": "v0.6"}
{"i": [["[\"990586ac95c316d6af64e8ddc5165a26\", [8192, 1152], [128, 1152], [128], [8192, 128]]", "rocm -keys=rocm,gpu -max_num_threads=256 -max_shared_memory_per_block=65536 -max_threads_per_block=256 -mcpu=gfx908 -mtriple=amdgcn-amd-amdhsa-hcc -thread_warp_size=64", [-1, 16, 64, 65536, 2147483647, 1024, 16, 64], "", 0, []], [[], [["CI", 5], ["CI", 4], ["SP", 2, 0, 8192, [1, 64, 1, 16], 1], ["SP", 2, 5, 128, [4, 4, 2, 2], 1], ["SP", 2, 10, 1152, [2, 6], 1], ["RE", 2, [0, 5, 1, 6, 2, 7, 10, 11, 3, 8, 12, 4, 9]], ["FSP", 6, 0, 2, 3], ["FSP", 6, 4, 3, 3], ["RE", 6, [0, 4, 1, 5, 2, 6, 3, 7]], ["CA", 2, 6, 5], ["CHR", 1, "shared", [2]], ["CA", 2, 3, 6], ["CHR", 0, "shared", [3]], ["CA", 1, 4, 6], ["FU", 8, [0, 1]], ["AN", 8, 0, 5], ["FU", 8, [1, 2]], ["AN", 8, 1, 4], ["FU", 8, [2, 3]], ["AN", 8, 2, 6], ["FU", 3, [0, 1]], ["SP", 3, 0, 48, [2], 1], ["AN", 3, 1, 2], ["FFSP", 3, 0, [3, 2], 1, 1], ["AN", 3, 1, 6], ["FU", 1, [0, 1]], ["SP", 1, 0, 192, [1], 1], ["AN", 1, 1, 2], ["FFSP", 1, 0, [3, 2], 1, 1], ["AN", 1, 1, 6], ["PR", 4, 0, "auto_unroll_max_step$64"]]]], "r": [[0.0696904], 0, 4.14632, 1695326916], "v": "v0.6"}
{"i": [["[\"990586ac95c316d6af64e8ddc5165a26\", [8192, 1152], [128, 1152], [128], [8192, 128]]", "rocm -keys=rocm,gpu -max_num_threads=256 -max_shared_memory_per_block=65536 -max_threads_per_block=256 -mcpu=gfx908 -mtriple=amdgcn-amd-amdhsa-hcc -thread_warp_size=64", [-1, 16, 64, 65536, 2147483647, 1024, 16, 64], "", 0, []], [[], [["CI", 5], ["CI", 4], ["SP", 2, 0, 8192, [1, 16, 4, 2], 1], ["SP", 2, 5, 128, [4, 4, 8, 1], 1], ["SP", 2, 10, 1152, [4, 6], 1], ["RE", 2, [0, 5, 1, 6, 2, 7, 10, 11, 3, 8, 12, 4, 9]], ["FSP", 6, 0, 2, 3], ["FSP", 6, 4, 3, 3], ["RE", 6, [0, 4, 1, 5, 2, 6, 3, 7]], ["CA", 2, 6, 5], ["CHR", 1, "shared", [2]], ["CA", 2, 3, 6], ["CHR", 0, "shared", [3]], ["CA", 1, 4, 6], ["FU", 8, [0, 1]], ["AN", 8, 0, 5], ["FU", 8, [1, 2]], ["AN", 8, 1, 4], ["FU", 8, [2, 3]], ["AN", 8, 2, 6], ["FU", 3, [0, 1]], ["SP", 3, 0, 192, [1], 1], ["AN", 3, 1, 2], ["FFSP", 3, 0, [3, 2], 1, 1], ["AN", 3, 1, 6], ["FU", 1, [0, 1]], ["SP", 1, 0, 192, [1], 1], ["AN", 1, 1, 2], ["FFSP", 1, 0, [3, 2], 1, 1], ["AN", 1, 1, 6], ["PR", 4, 0, "auto_unroll_max_step$64"]]]], "r": [[0.00518904], 0, 3.4071, 1695326917], "v": "v0.6"}
{"i": [["[\"990586ac95c316d6af64e8ddc5165a26\", [8192, 1152], [128, 1152], [128], [8192, 128]]", "rocm -keys=rocm,gpu -max_num_threads=256 -max_shared_memory_per_block=65536 -max_threads_per_block=256 -mcpu=gfx908 -mtriple=amdgcn-amd-amdhsa-hcc -thread_warp_size=64", [-1, 16, 64, 65536, 2147483647, 1024, 16, 64], "", 0, []], [[], [["CI", 5], ["CI", 4], ["SP", 2, 0, 8192, [2, 8, 1, 4], 1], ["SP", 2, 5, 128, [2, 1, 64, 1], 1], ["SP", 2, 10, 1152, [2, 24], 1], ["RE", 2, [0, 5, 1, 6, 2, 7, 10, 11, 3, 8, 12, 4, 9]], ["FSP", 6, 0, 2, 3], ["FSP", 6, 4, 3, 3], ["RE", 6, [0, 4, 1, 5, 2, 6, 3, 7]], ["CA", 2, 6, 5], ["CHR", 1, "shared", [2]], ["CA", 2, 3, 6], ["CHR", 0, "shared", [3]], ["CA", 1, 4, 6], ["FU", 8, [0, 1]], ["AN", 8, 0, 5], ["FU", 8, [1, 2]], ["AN", 8, 1, 4], ["FU", 8, [2, 3]], ["AN", 8, 2, 6], ["FU", 3, [0, 1]], ["SP", 3, 0, 384, [1], 1], ["AN", 3, 1, 2], ["FFSP", 3, 0, [3, 2], 1, 1], ["AN", 3, 1, 6], ["FU", 1, [0, 1]], ["SP", 1, 0, 96, [2], 1], ["AN", 1, 1, 2], ["FFSP", 1, 0, [3, 2], 1, 1], ["AN", 1, 1, 6], ["PR", 4, 0, "auto_unroll_max_step$64"]]]], "r": [[0.0366301], 0, 2.65782, 1695326919], "v": "v0.6"}
{"i": [["[\"990586ac95c316d6af64e8ddc5165a26\", [8192, 1152], [128, 1152], [128], [8192, 128]]", "rocm -keys=rocm,gpu -max_num_threads=256 -max_shared_memory_per_block=65536 -max_threads_per_block=256 -mcpu=gfx908 -mtriple=amdgcn-amd-amdhsa-hcc -thread_warp_size=64", [-1, 16, 64, 65536, 2147483647, 1024, 16, 64], "", 0, []], [[], [["CI", 5], ["CI", 4], ["SP", 2, 0, 8192, [4, 256, 2, 1], 1], ["SP", 2, 5, 128, [1, 2, 32, 2], 1], ["SP", 2, 10, 1152, [1, 1], 1], ["RE", 2, [0, 5, 1, 6, 2, 7, 10, 11, 3, 8, 12, 4, 9]], ["FSP", 6, 0, 2, 3], ["FSP", 6, 4, 3, 3], ["RE", 6, [0, 4, 1, 5, 2, 6, 3, 7]], ["CA", 2, 6, 5], ["CHR", 1, "shared", [2]], ["CA", 2, 3, 6], ["CHR", 0, "shared", [3]], ["CA", 1, 4, 6], ["FU", 8, [0, 1]], ["AN", 8, 0, 5], ["FU", 8, [1, 2]], ["AN", 8, 1, 4], ["FU", 8, [2, 3]], ["AN", 8, 2, 6], ["FU", 3, [0, 1]], ["SP", 3, 0, 64, [16], 1], ["AN", 3, 1, 2], ["FFSP", 3, 0, [3, 2], 1, 1], ["AN", 3, 1, 6], ["FU", 1, [0, 1]], ["SP", 1, 0, 2, [1], 1], ["AN", 1, 1, 2], ["FFSP", 1, 0, [3, 2], 1, 1], ["AN", 1, 1, 6], ["PR", 4, 0, "auto_unroll_max_step$0"]]]], "r": [[0.0676649], 0, 2.46968, 1695326921], "v": "v0.6"}
{"i": [["[\"990586ac95c316d6af64e8ddc5165a26\", [8192, 1152], [128, 1152], [128], [8192, 128]]", "rocm -keys=rocm,gpu -max_num_threads=256 -max_shared_memory_per_block=65536 -max_threads_per_block=256 -mcpu=gfx908 -mtriple=amdgcn-amd-amdhsa-hcc -thread_warp_size=64", [-1, 16, 64, 65536, 2147483647, 1024, 16, 64], "", 0, []], [[], [["CI", 5], ["CI", 4], ["SP", 2, 0, 8192, [1, 32, 1, 2], 1], ["SP", 2, 5, 128, [2, 2, 32, 1], 1], ["SP", 2, 10, 1152, [8, 2], 1], ["RE", 2, [0, 5, 1, 6, 2, 7, 10, 11, 3, 8, 12, 4, 9]], ["FSP", 6, 0, 2, 3], ["FSP", 6, 4, 3, 3], ["RE", 6, [0, 4, 1, 5, 2, 6, 3, 7]], ["CA", 2, 6, 5], ["CHR", 1, "shared", [2]], ["CA", 2, 3, 6], ["CHR", 0, "shared", [3]], ["CA", 1, 4, 6], ["FU", 8, [0, 1]], ["AN", 8, 0, 5], ["FU", 8, [1, 2]], ["AN", 8, 1, 4], ["FU", 8, [2, 3]], ["AN", 8, 2, 6], ["FU", 3, [0, 1]], ["SP", 3, 0, 1536, [1], 1], ["AN", 3, 1, 2], ["FFSP", 3, 0, [3, 2], 1, 1], ["AN", 3, 1, 6], ["FU", 1, [0, 1]], ["SP", 1, 0, 96, [4], 1], ["AN", 1, 1, 2], ["FFSP", 1, 0, [3, 2], 1, 1], ["AN", 1, 1, 6], ["PR", 4, 0, "auto_unroll_max_step$0"]]]], "r": [[0.00383976], 0, 3.25211, 1695326922], "v": "v0.6"}
{"i": [["[\"990586ac95c316d6af64e8ddc5165a26\", [8192, 1152], [128, 1152], [128], [8192, 128]]", "rocm -keys=rocm,gpu -max_num_threads=256 -max_shared_memory_per_block=65536 -max_threads_per_block=256 -mcpu=gfx908 -mtriple=amdgcn-amd-amdhsa-hcc -thread_warp_size=64", [-1, 16, 64, 65536, 2147483647, 1024, 16, 64], "", 0, []], [[], [["CI", 5], ["CI", 4], ["SP", 2, 0, 8192, [1, 2, 16, 2], 1], ["SP", 2, 5, 128, [1, 32, 1, 2], 1], ["SP", 2, 10, 1152, [1, 6], 1], ["RE", 2, [0, 5, 1, 6, 2, 7, 10, 11, 3, 8, 12, 4, 9]], ["FSP", 6, 0, 2, 3], ["FSP", 6, 4, 3, 3], ["RE", 6, [0, 4, 1, 5, 2, 6, 3, 7]], ["CA", 2, 6, 5], ["CHR", 1, "shared", [2]], ["CA", 2, 3, 6], ["CHR", 0, "shared", [3]], ["CA", 1, 4, 6], ["FU", 8, [0, 1]], ["AN", 8, 0, 5], ["FU", 8, [1, 2]], ["AN", 8, 1, 4], ["FU", 8, [2, 3]], ["AN", 8, 2, 6], ["FU", 3, [0, 1]], ["SP", 3, 0, 12, [1], 1], ["AN", 3, 1, 2], ["FFSP", 3, 0, [3, 2], 1, 1], ["AN", 3, 1, 6], ["FU", 1, [0, 1]], ["SP", 1, 0, 192, [64], 1], ["AN", 1, 1, 2], ["FFSP", 1, 0, [3, 2], 1, 1], ["AN", 1, 1, 6], ["PR", 4, 0, "auto_unroll_max_step$512"]]]], "r": [[0.00227755], 0, 3.67064, 1695326923], "v": "v0.6"}
{"i": [["[\"990586ac95c316d6af64e8ddc5165a26\", [8192, 1152], [128, 1152], [128], [8192, 128]]", "rocm -keys=rocm,gpu -max_num_threads=256 -max_shared_memory_per_block=65536 -max_threads_per_block=256 -mcpu=gfx908 -mtriple=amdgcn-amd-amdhsa-hcc -thread_warp_size=64", [-1, 16, 64, 65536, 2147483647, 1024, 16, 64], "", 0, []], [[], [["CI", 5], ["CI", 4], ["SP", 2, 0, 8192, [4, 64, 1, 4], 1], ["SP", 2, 5, 128, [4, 4, 2, 1], 1], ["SP", 2, 10, 1152, [4, 2], 1], ["RE", 2, [0, 5, 1, 6, 2, 7, 10, 11, 3, 8, 12, 4, 9]], ["FSP", 6, 0, 2, 3], ["FSP", 6, 4, 3, 3], ["RE", 6, [0, 4, 1, 5, 2, 6, 3, 7]], ["CA", 2, 6, 5], ["CHR", 1, "shared", [2]], ["CA", 2, 3, 6], ["CHR", 0, "shared", [3]], ["CA", 1, 4, 6], ["FU", 8, [0, 1]], ["AN", 8, 0, 5], ["FU", 8, [1, 2]], ["AN", 8, 1, 4], ["FU", 8, [2, 3]], ["AN", 8, 2, 6], ["FU", 3, [0, 1]], ["SP", 3, 0, 16, [4], 1], ["AN", 3, 1, 2], ["FFSP", 3, 0, [3, 2], 1, 1], ["AN", 3, 1, 6], ["FU", 1, [0, 1]], ["SP", 1, 0, 32, [2], 1], ["AN", 1, 1, 2], ["FFSP", 1, 0, [3, 2], 1, 1], ["AN", 1, 1, 6], ["PR", 4, 0, "auto_unroll_max_step$16"]]]], "r": [[0.00220964], 0, 3.59611, 1695326925], "v": "v0.6"}
{"i": [["[\"990586ac95c316d6af64e8ddc5165a26\", [8192, 1152], [128, 1152], [128], [8192, 128]]", "rocm -keys=rocm,gpu -max_num_threads=256 -max_shared_memory_per_block=65536 -max_threads_per_block=256 -mcpu=gfx908 -mtriple=amdgcn-amd-amdhsa-hcc -thread_warp_size=64", [-1, 16, 64, 65536, 2147483647, 1024, 16, 64], "", 0, []], [[], [["CI", 5], ["CI", 4], ["SP", 2, 0, 8192, [16, 1, 1, 4], 1], ["SP", 2, 5, 128, [1, 32, 1, 1], 1], ["SP", 2, 10, 1152, [2, 1], 1], ["RE", 2, [0, 5, 1, 6, 2, 7, 10, 11, 3, 8, 12, 4, 9]], ["FSP", 6, 0, 2, 3], ["FSP", 6, 4, 3, 3], ["RE", 6, [0, 4, 1, 5, 2, 6, 3, 7]], ["CA", 2, 6, 5], ["CHR", 1, "shared", [2]], ["CA", 2, 3, 6], ["CHR", 0, "shared", [3]], ["CA", 1, 4, 6], ["FU", 8, [0, 1]], ["AN", 8, 0, 5], ["FU", 8, [1, 2]], ["AN", 8, 1, 4], ["FU", 8, [2, 3]], ["AN", 8, 2, 6], ["FU", 3, [0, 1]], ["SP", 3, 0, 2, [1], 1], ["AN", 3, 1, 2], ["FFSP", 3, 0, [3, 2], 1, 1], ["AN", 3, 1, 6], ["FU", 1, [0, 1]], ["SP", 1, 0, 16, [1], 1], ["AN", 1, 1, 2], ["FFSP", 1, 0, [3, 2], 1, 1], ["AN", 1, 1, 6], ["PR", 4, 0, "auto_unroll_max_step$1024"]]]], "r": [[0.00349105], 0, 2.66773, 1695326926], "v": "v0.6"}
{"i": [["[\"990586ac95c316d6af64e8ddc5165a26\", [8192, 1152], [128, 1152], [128], [8192, 128]]", "rocm -keys=rocm,gpu -max_num_threads=256 -max_shared_memory_per_block=65536 -max_threads_per_block=256 -mcpu=gfx908 -mtriple=amdgcn-amd-amdhsa-hcc -thread_warp_size=64", [-1, 16, 64, 65536, 2147483647, 1024, 16, 64], "", 0, []], [[], [["CI", 5], ["CI", 4], ["SP", 2, 0, 8192, [2, 32, 1, 16], 1], ["SP", 2, 5, 128, [8, 2, 2, 2], 1], ["SP", 2, 10, 1152, [2, 2], 1], ["RE", 2, [0, 5, 1, 6, 2, 7, 10, 11, 3, 8, 12, 4, 9]], ["FSP", 6, 0, 2, 3], ["FSP", 6, 4, 3, 3], ["RE", 6, [0, 4, 1, 5, 2, 6, 3, 7]], ["CA", 2, 6, 5], ["CHR", 1, "shared", [2]], ["CA", 2, 3, 6], ["CHR", 0, "shared", [3]], ["CA", 1, 4, 6], ["FU", 8, [0, 1]], ["AN", 8, 0, 5], ["FU", 8, [1, 2]], ["AN", 8, 1, 4], ["FU", 8, [2, 3]], ["AN", 8, 2, 6], ["FU", 3, [0, 1]], ["SP", 3, 0, 48, [1], 1], ["AN", 3, 1, 2], ["FFSP", 3, 0, [3, 2], 1, 1], ["AN", 3, 1, 6], ["FU", 1, [0, 1]], ["SP", 1, 0, 192, [1], 1], ["AN", 1, 1, 2], ["FFSP", 1, 0, [3, 2], 1, 1], ["AN", 1, 1, 6], ["PR", 4, 0, "auto_unroll_max_step$64"]]]], "r": [[0.0261061], 0, 3.36478, 1695326928], "v": "v0.6"}
{"i": [["[\"990586ac95c316d6af64e8ddc5165a26\", [8192, 1152], [128, 1152], [128], [8192, 128]]", "rocm -keys=rocm,gpu -max_num_threads=256 -max_shared_memory_per_block=65536 -max_threads_per_block=256 -mcpu=gfx908 -mtriple=amdgcn-amd-amdhsa-hcc -thread_warp_size=64", [-1, 16, 64, 65536, 2147483647, 1024, 16, 64], "", 0, []], [[], [["CI", 5], ["CI", 4], ["SP", 2, 0, 8192, [1, 128, 1, 2], 1], ["SP", 2, 5, 128, [16, 1, 1, 4], 1], ["SP", 2, 10, 1152, [1, 48], 1], ["RE", 2, [0, 5, 1, 6, 2, 7, 10, 11, 3, 8, 12, 4, 9]], ["FSP", 6, 0, 2, 3], ["FSP", 6, 4, 3, 3], ["RE", 6, [0, 4, 1, 5, 2, 6, 3, 7]], ["CA", 2, 6, 5], ["CHR", 1, "shared", [2]], ["CA", 2, 3, 6], ["CHR", 0, "shared", [3]], ["CA", 1, 4, 6], ["FU", 8, [0, 1]], ["AN", 8, 0, 5], ["FU", 8, [1, 2]], ["AN", 8, 1, 4], ["FU", 8, [2, 3]], ["AN", 8, 2, 6], ["FU", 3, [0, 1]], ["SP", 3, 0, 192, [16], 1], ["AN", 3, 1, 2], ["FFSP", 3, 0, [3, 2], 1, 1], ["AN", 3, 1, 6], ["FU", 1, [0, 1]], ["SP", 1, 0, 96, [1], 1], ["AN", 1, 1, 2], ["FFSP", 1, 0, [3, 2], 1, 1], ["AN", 1, 1, 6], ["PR", 4, 0, "auto_unroll_max_step$16"]]]], "r": [[0.025514], 0, 4.96273, 1695326929], "v": "v0.6"}
{"i": [["[\"990586ac95c316d6af64e8ddc5165a26\", [8192, 1152], [128, 1152], [128], [8192, 128]]", "rocm -keys=rocm,gpu -max_num_threads=256 -max_shared_memory_per_block=65536 -max_threads_per_block=256 -mcpu=gfx908 -mtriple=amdgcn-amd-amdhsa-hcc -thread_warp_size=64", [-1, 16, 64, 65536, 2147483647, 1024, 16, 64], "", 0, []], [[], [["CI", 5], ["CI", 4], ["SP", 2, 0, 8192, [4, 2, 8, 8], 1], ["SP", 2, 5, 128, [1, 64, 1, 1], 1], ["SP", 2, 10, 1152, [2, 8], 1], ["RE", 2, [0, 5, 1, 6, 2, 7, 10, 11, 3, 8, 12, 4, 9]], ["FSP", 6, 0, 2, 3], ["FSP", 6, 4, 3, 3], ["RE", 6, [0, 4, 1, 5, 2, 6, 3, 7]], ["CA", 2, 6, 5], ["CHR", 1, "shared", [2]], ["CA", 2, 3, 6], ["CHR", 0, "shared", [3]], ["CA", 1, 4, 6], ["FU", 8, [0, 1]], ["AN", 8, 0, 5], ["FU", 8, [1, 2]], ["AN", 8, 1, 4], ["FU", 8, [2, 3]], ["AN", 8, 2, 6], ["FU", 3, [0, 1]], ["SP", 3, 0, 16, [2], 1], ["AN", 3, 1, 2], ["FFSP", 3, 0, [3, 2], 1, 1], ["AN", 3, 1, 6], ["FU", 1, [0, 1]], ["SP", 1, 0, 1024, [1], 1], ["AN", 1, 1, 2], ["FFSP", 1, 0, [3, 2], 1, 1], ["AN", 1, 1, 6], ["PR", 4, 0, "auto_unroll_max_step$512"]]]], "r": [[0.00533999], 0, 4.91993, 1695326931], "v": "v0.6"}
{"i": [["[\"990586ac95c316d6af64e8ddc5165a26\", [8192, 1152], [128, 1152], [128], [8192, 128]]", "rocm -keys=rocm,gpu -max_num_threads=256 -max_shared_memory_per_block=65536 -max_threads_per_block=256 -mcpu=gfx908 -mtriple=amdgcn-amd-amdhsa-hcc -thread_warp_size=64", [-1, 16, 64, 65536, 2147483647, 1024, 16, 64], "", 0, []], [[], [["CI", 5], ["CI", 4], ["SP", 2, 0, 8192, [1, 16, 2, 2], 1], ["SP", 2, 5, 128, [2, 4, 1, 2], 1], ["SP", 2, 10, 1152, [9, 16], 1], ["RE", 2, [0, 5, 1, 6, 2, 7, 10, 11, 3, 8, 12, 4, 9]], ["FSP", 6, 0, 2, 3], ["FSP", 6, 4, 3, 3], ["RE", 6, [0, 4, 1, 5, 2, 6, 3, 7]], ["CA", 2, 6, 5], ["CHR", 1, "shared", [2]], ["CA", 2, 3, 6], ["CHR", 0, "shared", [3]], ["CA", 1, 4, 6], ["FU", 8, [0, 1]], ["AN", 8, 0, 5], ["FU", 8, [1, 2]], ["AN", 8, 1, 4], ["FU", 8, [2, 3]], ["AN", 8, 2, 6], ["FU", 3, [0, 1]], ["SP", 3, 0, 288, [1], 1], ["AN", 3, 1, 2], ["FFSP", 3, 0, [3, 2], 1, 1], ["AN", 3, 1, 6], ["FU", 1, [0, 1]], ["SP", 1, 0, 576, [1], 1], ["AN", 1, 1, 2], ["FFSP", 1, 0, [3, 2], 1, 1], ["AN", 1, 1, 6], ["PR", 4, 0, "auto_unroll_max_step$0"]]]], "r": [[0.00730982], 0, 2.81539, 1695326933], "v": "v0.6"}
{"i": [["[\"990586ac95c316d6af64e8ddc5165a26\", [8192, 1152], [128, 1152], [128], [8192, 128]]", "rocm -keys=rocm,gpu -max_num_threads=256 -max_shared_memory_per_block=65536 -max_threads_per_block=256 -mcpu=gfx908 -mtriple=amdgcn-amd-amdhsa-hcc -thread_warp_size=64", [-1, 16, 64, 65536, 2147483647, 1024, 16, 64], "", 0, []], [[], [["CI", 5], ["CI", 4], ["SP", 2, 0, 8192, [4, 4, 32, 1], 1], ["SP", 2, 5, 128, [1, 64, 2, 1], 1], ["SP", 2, 10, 1152, [2, 8], 1], ["RE", 2, [0, 5, 1, 6, 2, 7, 10, 11, 3, 8, 12, 4, 9]], ["FSP", 6, 0, 2, 3], ["FSP", 6, 4, 3, 3], ["RE", 6, [0, 4, 1, 5, 2, 6, 3, 7]], ["CA", 2, 6, 5], ["CHR", 1, "shared", [2]], ["CA", 2, 3, 6], ["CHR", 0, "shared", [3]], ["CA", 1, 4, 6], ["FU", 8, [0, 1]], ["AN", 8, 0, 5], ["FU", 8, [1, 2]], ["AN", 8, 1, 4], ["FU", 8, [2, 3]], ["AN", 8, 2, 6], ["FU", 3, [0, 1]], ["SP", 3, 0, 16, [1], 1], ["AN", 3, 1, 2], ["FFSP", 3, 0, [3, 2], 1, 1], ["AN", 3, 1, 6], ["FU", 1, [0, 1]], ["SP", 1, 0, 1024, [1], 1], ["AN", 1, 1, 2], ["FFSP", 1, 0, [3, 2], 1, 1], ["AN", 1, 1, 6], ["PR", 4, 0, "auto_unroll_max_step$512"]]]], "r": [[0.0035922], 0, 2.50756, 1695326934], "v": "v0.6"}
{"i": [["[\"990586ac95c316d6af64e8ddc5165a26\", [8192, 1152], [128, 1152], [128], [8192, 128]]", "rocm -keys=rocm,gpu -max_num_threads=256 -max_shared_memory_per_block=65536 -max_threads_per_block=256 -mcpu=gfx908 -mtriple=amdgcn-amd-amdhsa-hcc -thread_warp_size=64", [-1, 16, 64, 65536, 2147483647, 1024, 16, 64], "", 0, []], [[], [["CI", 5], ["CI", 4], ["SP", 2, 0, 8192, [2, 32, 1, 1], 1], ["SP", 2, 5, 128, [1, 8, 16, 1], 1], ["SP", 2, 10, 1152, [3, 4], 1], ["RE", 2, [0, 5, 1, 6, 2, 7, 10, 11, 3, 8, 12, 4, 9]], ["FSP", 6, 0, 2, 3], ["FSP", 6, 4, 3, 3], ["RE", 6, [0, 4, 1, 5, 2, 6, 3, 7]], ["CA", 2, 6, 5], ["CHR", 1, "shared", [2]], ["CA", 2, 3, 6], ["CHR", 0, "shared", [3]], ["CA", 1, 4, 6], ["FU", 8, [0, 1]], ["AN", 8, 0, 5], ["FU", 8, [1, 2]], ["AN", 8, 1, 4], ["FU", 8, [2, 3]], ["AN", 8, 2, 6], ["FU", 3, [0, 1]], ["SP", 3, 0, 48, [1], 1], ["AN", 3, 1, 2], ["FFSP", 3, 0, [3, 2], 1, 1], ["AN", 3, 1, 6], ["FU", 1, [0, 1]], ["SP", 1, 0, 6, [1], 1], ["AN", 1, 1, 2], ["FFSP", 1, 0, [3, 2], 1, 1], ["AN", 1, 1, 6], ["PR", 4, 0, "auto_unroll_max_step$16"]]]], "r": [[0.00244158], 0, 2.31298, 1695326935], "v": "v0.6"}
{"i": [["[\"990586ac95c316d6af64e8ddc5165a26\", [8192, 1152], [128, 1152], [128], [8192, 128]]", "rocm -keys=rocm,gpu -max_num_threads=256 -max_shared_memory_per_block=65536 -max_threads_per_block=256 -mcpu=gfx908 -mtriple=amdgcn-amd-amdhsa-hcc -thread_warp_size=64", [-1, 16, 64, 65536, 2147483647, 1024, 16, 64], "", 0, []], [[], [["CI", 5], ["CI", 4], ["SP", 2, 0, 8192, [1, 16, 1, 8], 1], ["SP", 2, 5, 128, [4, 4, 8, 1], 1], ["SP", 2, 10, 1152, [8, 6], 1], ["RE", 2, [0, 5, 1, 6, 2, 7, 10, 11, 3, 8, 12, 4, 9]], ["FSP", 6, 0, 2, 3], ["FSP", 6, 4, 3, 3], ["RE", 6, [0, 4, 1, 5, 2, 6, 3, 7]], ["CA", 2, 6, 5], ["CHR", 1, "shared", [2]], ["CA", 2, 3, 6], ["CHR", 0, "shared", [3]], ["CA", 1, 4, 6], ["FU", 8, [0, 1]], ["AN", 8, 0, 5], ["FU", 8, [1, 2]], ["AN", 8, 1, 4], ["FU", 8, [2, 3]], ["AN", 8, 2, 6], ["FU", 3, [0, 1]], ["SP", 3, 0, 192, [1], 1], ["AN", 3, 1, 2], ["FFSP", 3, 0, [3, 2], 1, 1], ["AN", 3, 1, 6], ["FU", 1, [0, 1]], ["SP", 1, 0, 192, [1], 1], ["AN", 1, 1, 2], ["FFSP", 1, 0, [3, 2], 1, 1], ["AN", 1, 1, 6], ["PR", 4, 0, "auto_unroll_max_step$1024"]]]], "r": [[0.00753572], 0, 5.52647, 1695326937], "v": "v0.6"}
{"i": [["[\"990586ac95c316d6af64e8ddc5165a26\", [8192, 1152], [128, 1152], [128], [8192, 128]]", "rocm -keys=rocm,gpu -max_num_threads=256 -max_shared_memory_per_block=65536 -max_threads_per_block=256 -mcpu=gfx908 -mtriple=amdgcn-amd-amdhsa-hcc -thread_warp_size=64", [-1, 16, 64, 65536, 2147483647, 1024, 16, 64], "", 0, []], [[], [["CI", 5], ["CI", 4], ["SP", 2, 0, 8192, [1, 4, 1, 2], 1], ["SP", 2, 5, 128, [1, 64, 1, 1], 1], ["SP", 2, 10, 1152, [96, 2], 1], ["RE", 2, [0, 5, 1, 6, 2, 7, 10, 11, 3, 8, 12, 4, 9]], ["FSP", 6, 0, 2, 3], ["FSP", 6, 4, 3, 3], ["RE", 6, [0, 4, 1, 5, 2, 6, 3, 7]], ["CA", 2, 6, 5], ["CHR", 1, "shared", [2]], ["CA", 2, 3, 6], ["CHR", 0, "shared", [3]], ["CA", 1, 4, 6], ["FU", 8, [0, 1]], ["AN", 8, 0, 5], ["FU", 8, [1, 2]], ["AN", 8, 1, 4], ["FU", 8, [2, 3]], ["AN", 8, 2, 6], ["FU", 3, [0, 1]], ["SP", 3, 0, 192, [1], 1], ["AN", 3, 1, 2], ["FFSP", 3, 0, [3, 2], 1, 1], ["AN", 3, 1, 6], ["FU", 1, [0, 1]], ["SP", 1, 0, 384, [1], 1], ["AN", 1, 1, 2], ["FFSP", 1, 0, [3, 2], 1, 1], ["AN", 1, 1, 6], ["PR", 4, 0, "auto_unroll_max_step$512"]]]], "r": [[0.00386484], 0, 3.92351, 1695326939], "v": "v0.6"}
{"i": [["[\"990586ac95c316d6af64e8ddc5165a26\", [8192, 1152], [128, 1152], [128], [8192, 128]]", "rocm -keys=rocm,gpu -max_num_threads=256 -max_shared_memory_per_block=65536 -max_threads_per_block=256 -mcpu=gfx908 -mtriple=amdgcn-amd-amdhsa-hcc -thread_warp_size=64", [-1, 16, 64, 65536, 2147483647, 1024, 16, 64], "", 0, []], [[], [["CI", 5], ["CI", 4], ["SP", 2, 0, 8192, [2, 8, 1, 1], 1], ["SP", 2, 5, 128, [4, 8, 4, 1], 1], ["SP", 2, 10, 1152, [2, 2], 1], ["RE", 2, [0, 5, 1, 6, 2, 7, 10, 11, 3, 8, 12, 4, 9]], ["FSP", 6, 0, 2, 3], ["FSP", 6, 4, 3, 3], ["RE", 6, [0, 4, 1, 5, 2, 6, 3, 7]], ["CA", 2, 6, 5], ["CHR", 1, "shared", [2]], ["CA", 2, 3, 6], ["CHR", 0, "shared", [3]], ["CA", 1, 4, 6], ["FU", 8, [0, 1]], ["AN", 8, 0, 5], ["FU", 8, [1, 2]], ["AN", 8, 1, 4], ["FU", 8, [2, 3]], ["AN", 8, 2, 6], ["FU", 3, [0, 1]], ["SP", 3, 0, 32, [1], 1], ["AN", 3, 1, 2], ["FFSP", 3, 0, [3, 2], 1, 1], ["AN", 3, 1, 6], ["FU", 1, [0, 1]], ["SP", 1, 0, 512, [1], 1], ["AN", 1, 1, 2], ["FFSP", 1, 0, [3, 2], 1, 1], ["AN", 1, 1, 6], ["PR", 4, 0, "auto_unroll_max_step$0"]]]], "r": [[0.00116314], 0, 2.11989, 1695326940], "v": "v0.6"}
{"i": [["[\"990586ac95c316d6af64e8ddc5165a26\", [8192, 1152], [128, 1152], [128], [8192, 128]]", "rocm -keys=rocm,gpu -max_num_threads=256 -max_shared_memory_per_block=65536 -max_threads_per_block=256 -mcpu=gfx908 -mtriple=amdgcn-amd-amdhsa-hcc -thread_warp_size=64", [-1, 16, 64, 65536, 2147483647, 1024, 16, 64], "", 0, []], [[], [["CI", 5], ["CI", 4], ["SP", 2, 0, 8192, [8, 2, 4, 1], 1], ["SP", 2, 5, 128, [1, 32, 2, 1], 1], ["SP", 2, 10, 1152, [1, 3], 1], ["RE", 2, [0, 5, 1, 6, 2, 7, 10, 11, 3, 8, 12, 4, 9]], ["FSP", 6, 0, 2, 3], ["FSP", 6, 4, 3, 3], ["RE", 6, [0, 4, 1, 5, 2, 6, 3, 7]], ["CA", 2, 6, 5], ["CHR", 1, "shared", [2]], ["CA", 2, 3, 6], ["CHR", 0, "shared", [3]], ["CA", 1, 4, 6], ["FU", 8, [0, 1]], ["AN", 8, 0, 5], ["FU", 8, [1, 2]], ["AN", 8, 1, 4], ["FU", 8, [2, 3]], ["AN", 8, 2, 6], ["FU", 3, [0, 1]], ["SP", 3, 0, 12, [1], 1], ["AN", 3, 1, 2], ["FFSP", 3, 0, [3, 2], 1, 1], ["AN", 3, 1, 6], ["FU", 1, [0, 1]], ["SP", 1, 0, 24, [12], 1], ["AN", 1, 1, 2], ["FFSP", 1, 0, [3, 2], 1, 1], ["AN", 1, 1, 6], ["PR", 4, 0, "auto_unroll_max_step$0"]]]], "r": [[0.00147003], 0, 2.74531, 1695326941], "v": "v0.6"}
{"i": [["[\"990586ac95c316d6af64e8ddc5165a26\", [8192, 1152], [128, 1152], [128], [8192, 128]]", "rocm -keys=rocm,gpu -max_num_threads=256 -max_shared_memory_per_block=65536 -max_threads_per_block=256 -mcpu=gfx908 -mtriple=amdgcn-amd-amdhsa-hcc -thread_warp_size=64", [-1, 16, 64, 65536, 2147483647, 1024, 16, 64], "", 0, []], [[], [["CI", 5], ["CI", 4], ["SP", 2, 0, 8192, [1, 4, 32, 1], 1], ["SP", 2, 5, 128, [2, 16, 1, 1], 1], ["SP", 2, 10, 1152, [6, 4], 1], ["RE", 2, [0, 5, 1, 6, 2, 7, 10, 11, 3, 8, 12, 4, 9]], ["FSP", 6, 0, 2, 3], ["FSP", 6, 4, 3, 3], ["RE", 6, [0, 4, 1, 5, 2, 6, 3, 7]], ["CA", 2, 6, 5], ["CHR", 1, "shared", [2]], ["CA", 2, 3, 6], ["CHR", 0, "shared", [3]], ["CA", 1, 4, 6], ["FU", 8, [0, 1]], ["AN", 8, 0, 5], ["FU", 8, [1, 2]], ["AN", 8, 1, 4], ["FU", 8, [2, 3]], ["AN", 8, 2, 6], ["FU", 3, [0, 1]], ["SP", 3, 0, 24, [1], 1], ["AN", 3, 1, 2], ["FFSP", 3, 0, [3, 2], 1, 1], ["AN", 3, 1, 6], ["FU", 1, [0, 1]], ["SP", 1, 0, 768, [1], 1], ["AN", 1, 1, 2], ["FFSP", 1, 0, [3, 2], 1, 1], ["AN", 1, 1, 6], ["PR", 4, 0, "auto_unroll_max_step$0"]]]], "r": [[0.00280796], 0, 3.35266, 1695326943], "v": "v0.6"}
{"i": [["[\"990586ac95c316d6af64e8ddc5165a26\", [8192, 1152], [128, 1152], [128], [8192, 128]]", "rocm -keys=rocm,gpu -max_num_threads=256 -max_shared_memory_per_block=65536 -max_threads_per_block=256 -mcpu=gfx908 -mtriple=amdgcn-amd-amdhsa-hcc -thread_warp_size=64", [-1, 16, 64, 65536, 2147483647, 1024, 16, 64], "", 0, []], [[], [["CI", 5], ["CI", 4], ["SP", 2, 0, 8192, [4, 4, 2, 1], 1], ["SP", 2, 5, 128, [1, 16, 1, 1], 1], ["SP", 2, 10, 1152, [1, 48], 1], ["RE", 2, [0, 5, 1, 6, 2, 7, 10, 11, 3, 8, 12, 4, 9]], ["FSP", 6, 0, 2, 3], ["FSP", 6, 4, 3, 3], ["RE", 6, [0, 4, 1, 5, 2, 6, 3, 7]], ["CA", 2, 6, 5], ["CHR", 1, "shared", [2]], ["CA", 2, 3, 6], ["CHR", 0, "shared", [3]], ["CA", 1, 4, 6], ["FU", 8, [0, 1]], ["AN", 8, 0, 5], ["FU", 8, [1, 2]], ["AN", 8, 1, 4], ["FU", 8, [2, 3]], ["AN", 8, 2, 6], ["FU", 3, [0, 1]], ["SP", 3, 0, 48, [4], 1], ["AN", 3, 1, 2], ["FFSP", 3, 0, [3, 2], 1, 1], ["AN", 3, 1, 6], ["FU", 1, [0, 1]], ["SP", 1, 0, 96, [1], 1], ["AN", 1, 1, 2], ["FFSP", 1, 0, [3, 2], 1, 1], ["AN", 1, 1, 6], ["PR", 4, 0, "auto_unroll_max_step$16"]]]], "r": [[0.00160092], 0, 2.36259, 1695326945], "v": "v0.6"}
{"i": [["[\"990586ac95c316d6af64e8ddc5165a26\", [8192, 1152], [128, 1152], [128], [8192, 128]]", "rocm -keys=rocm,gpu -max_num_threads=256 -max_shared_memory_per_block=65536 -max_threads_per_block=256 -mcpu=gfx908 -mtriple=amdgcn-amd-amdhsa-hcc -thread_warp_size=64", [-1, 16, 64, 65536, 2147483647, 1024, 16, 64], "", 0, []], [[], [["CI", 5], ["CI", 4], ["SP", 2, 0, 8192, [2, 2, 4, 16], 1], ["SP", 2, 5, 128, [2, 2, 2, 8], 1], ["SP", 2, 10, 1152, [1, 12], 1], ["RE", 2, [0, 5, 1, 6, 2, 7, 10, 11, 3, 8, 12, 4, 9]], ["FSP", 6, 0, 2, 3], ["FSP", 6, 4, 3, 3], ["RE", 6, [0, 4, 1, 5, 2, 6, 3, 7]], ["CA", 2, 6, 5], ["CHR", 1, "shared", [2]], ["CA", 2, 3, 6], ["CHR", 0, "shared", [3]], ["CA", 1, 4, 6], ["FU", 8, [0, 1]], ["AN", 8, 0, 5], ["FU", 8, [1, 2]], ["AN", 8, 1, 4], ["FU", 8, [2, 3]], ["AN", 8, 2, 6], ["FU", 3, [0, 1]], ["SP", 3, 0, 192, [1], 1], ["AN", 3, 1, 2], ["FFSP", 3, 0, [3, 2], 1, 1], ["AN", 3, 1, 6], ["FU", 1, [0, 1]], ["SP", 1, 0, 48, [1], 1], ["AN", 1, 1, 2], ["FFSP", 1, 0, [3, 2], 1, 1], ["AN", 1, 1, 6], ["PR", 4, 0, "auto_unroll_max_step$64"]]]], "r": [[1.1751], 0, 7.27746, 1695326951], "v": "v0.6"}
{"i": [["[\"990586ac95c316d6af64e8ddc5165a26\", [8192, 1152], [128, 1152], [128], [8192, 128]]", "rocm -keys=rocm,gpu -max_num_threads=256 -max_shared_memory_per_block=65536 -max_threads_per_block=256 -mcpu=gfx908 -mtriple=amdgcn-amd-amdhsa-hcc -thread_warp_size=64", [-1, 16, 64, 65536, 2147483647, 1024, 16, 64], "", 0, []], [[], [["CI", 5], ["CI", 4], ["SP", 2, 0, 8192, [8, 64, 2, 1], 1], ["SP", 2, 5, 128, [1, 2, 4, 8], 1], ["SP", 2, 10, 1152, [1, 1], 1], ["RE", 2, [0, 5, 1, 6, 2, 7, 10, 11, 3, 8, 12, 4, 9]], ["FSP", 6, 0, 2, 3], ["FSP", 6, 4, 3, 3], ["RE", 6, [0, 4, 1, 5, 2, 6, 3, 7]], ["CA", 2, 6, 5], ["CHR", 1, "shared", [2]], ["CA", 2, 3, 6], ["CHR", 0, "shared", [3]], ["CA", 1, 4, 6], ["FU", 8, [0, 1]], ["AN", 8, 0, 5], ["FU", 8, [1, 2]], ["AN", 8, 1, 4], ["FU", 8, [2, 3]], ["AN", 8, 2, 6], ["FU", 3, [0, 1]], ["SP", 3, 0, 16, [1], 1], ["AN", 3, 1, 2], ["FFSP", 3, 0, [3, 2], 1, 1], ["AN", 3, 1, 6], ["FU", 1, [0, 1]], ["SP", 1, 0, 4, [1], 1], ["AN", 1, 1, 2], ["FFSP", 1, 0, [3, 2], 1, 1], ["AN", 1, 1, 6], ["PR", 4, 0, "auto_unroll_max_step$0"]]]], "r": [[0.151651], 0, 8.01791, 1695326953], "v": "v0.6"}
{"i": [["[\"990586ac95c316d6af64e8ddc5165a26\", [8192, 1152], [128, 1152], [128], [8192, 128]]", "rocm -keys=rocm,gpu -max_num_threads=256 -max_shared_memory_per_block=65536 -max_threads_per_block=256 -mcpu=gfx908 -mtriple=amdgcn-amd-amdhsa-hcc -thread_warp_size=64", [-1, 16, 64, 65536, 2147483647, 1024, 16, 64], "", 0, []], [[], [["CI", 5], ["CI", 4], ["SP", 2, 0, 8192, [1, 4, 2, 64], 1], ["SP", 2, 5, 128, [2, 16, 2, 2], 1], ["SP", 2, 10, 1152, [8, 3], 1], ["RE", 2, [0, 5, 1, 6, 2, 7, 10, 11, 3, 8, 12, 4, 9]], ["FSP", 6, 0, 2, 3], ["FSP", 6, 4, 3, 3], ["RE", 6, [0, 4, 1, 5, 2, 6, 3, 7]], ["CA", 2, 6, 5], ["CHR", 1, "shared", [2]], ["CA", 2, 3, 6], ["CHR", 0, "shared", [3]], ["CA", 1, 4, 6], ["FU", 8, [0, 1]], ["AN", 8, 0, 5], ["FU", 8, [1, 2]], ["AN", 8, 1, 4], ["FU", 8, [2, 3]], ["AN", 8, 2, 6], ["FU", 3, [0, 1]], ["SP", 3, 0, 96, [2], 1], ["AN", 3, 1, 2], ["FFSP", 3, 0, [3, 2], 1, 1], ["AN", 3, 1, 6], ["FU", 1, [0, 1]], ["SP", 1, 0, 3072, [1], 1], ["AN", 1, 1, 2], ["FFSP", 1, 0, [3, 2], 1, 1], ["AN", 1, 1, 6], ["PR", 4, 0, "auto_unroll_max_step$1024"]]]], "r": [[0.333608], 0, 28.6001, 1695326956], "v": "v0.6"}
{"i": [["[\"990586ac95c316d6af64e8ddc5165a26\", [8192, 1152], [128, 1152], [128], [8192, 128]]", "rocm -keys=rocm,gpu -max_num_threads=256 -max_shared_memory_per_block=65536 -max_threads_per_block=256 -mcpu=gfx908 -mtriple=amdgcn-amd-amdhsa-hcc -thread_warp_size=64", [-1, 16, 64, 65536, 2147483647, 1024, 16, 64], "", 0, []], [[], [["CI", 5], ["CI", 4], ["SP", 2, 0, 8192, [1, 64, 2, 1], 1], ["SP", 2, 5, 128, [2, 1, 2, 32], 1], ["SP", 2, 10, 1152, [1, 1], 1], ["RE", 2, [0, 5, 1, 6, 2, 7, 10, 11, 3, 8, 12, 4, 9]], ["FSP", 6, 0, 2, 3], ["FSP", 6, 4, 3, 3], ["RE", 6, [0, 4, 1, 5, 2, 6, 3, 7]], ["CA", 2, 6, 5], ["CHR", 1, "shared", [2]], ["CA", 2, 3, 6], ["CHR", 0, "shared", [3]], ["CA", 1, 4, 6], ["FU", 8, [0, 1]], ["AN", 8, 0, 5], ["FU", 8, [1, 2]], ["AN", 8, 1, 4], ["FU", 8, [2, 3]], ["AN", 8, 2, 6], ["FU", 3, [0, 1]], ["SP", 3, 0, 64, [8], 1], ["AN", 3, 1, 2], ["FFSP", 3, 0, [3, 2], 1, 1], ["AN", 3, 1, 6], ["FU", 1, [0, 1]], ["SP", 1, 0, 2, [2], 1], ["AN", 1, 1, 2], ["FFSP", 1, 0, [3, 2], 1, 1], ["AN", 1, 1, 6], ["PR", 4, 0, "auto_unroll_max_step$512"]]]], "r": [[0.064915], 0, 4.5703, 1695326957], "v": "v0.6"}
{"i": [["[\"990586ac95c316d6af64e8ddc5165a26\", [8192, 1152], [128, 1152], [128], [8192, 128]]", "rocm -keys=rocm,gpu -max_num_threads=256 -max_shared_memory_per_block=65536 -max_threads_per_block=256 -mcpu=gfx908 -mtriple=amdgcn-amd-amdhsa-hcc -thread_warp_size=64", [-1, 16, 64, 65536, 2147483647, 1024, 16, 64], "", 0, []], [[], [["CI", 5], ["CI", 4], ["SP", 2, 0, 8192, [2, 8, 2, 4], 1], ["SP", 2, 5, 128, [1, 32, 1, 1], 1], ["SP", 2, 10, 1152, [4, 1], 1], ["RE", 2, [0, 5, 1, 6, 2, 7, 10, 11, 3, 8, 12, 4, 9]], ["FSP", 6, 0, 2, 3], ["FSP", 6, 4, 3, 3], ["RE", 6, [0, 4, 1, 5, 2, 6, 3, 7]], ["CA", 2, 6, 5], ["CHR", 1, "shared", [2]], ["CA", 2, 3, 6], ["CHR", 0, "shared", [3]], ["CA", 1, 4, 6], ["FU", 8, [0, 1]], ["AN", 8, 0, 5], ["FU", 8, [1, 2]], ["AN", 8, 1, 4], ["FU", 8, [2, 3]], ["AN", 8, 2, 6], ["FU", 3, [0, 1]], ["SP", 3, 0, 2, [1], 1], ["AN", 3, 1, 2], ["FFSP", 3, 0, [3, 2], 1, 1], ["AN", 3, 1, 6], ["FU", 1, [0, 1]], ["SP", 1, 0, 16, [1], 1], ["AN", 1, 1, 2], ["FFSP", 1, 0, [3, 2], 1, 1], ["AN", 1, 1, 6], ["PR", 4, 0, "auto_unroll_max_step$1024"]]]], "r": [[0.000864142], 0, 1.9303, 1695326959], "v": "v0.6"}
{"i": [["[\"990586ac95c316d6af64e8ddc5165a26\", [8192, 1152], [128, 1152], [128], [8192, 128]]", "rocm -keys=rocm,gpu -max_num_threads=256 -max_shared_memory_per_block=65536 -max_threads_per_block=256 -mcpu=gfx908 -mtriple=amdgcn-amd-amdhsa-hcc -thread_warp_size=64", [-1, 16, 64, 65536, 2147483647, 1024, 16, 64], "", 0, []], [[], [["CI", 5], ["CI", 4], ["SP", 2, 0, 8192, [1, 2, 64, 1], 1], ["SP", 2, 5, 128, [8, 8, 1, 1], 1], ["SP", 2, 10, 1152, [1, 3], 1], ["RE", 2, [0, 5, 1, 6, 2, 7, 10, 11, 3, 8, 12, 4, 9]], ["FSP", 6, 0, 2, 3], ["FSP", 6, 4, 3, 3], ["RE", 6, [0, 4, 1, 5, 2, 6, 3, 7]], ["CA", 2, 6, 5], ["CHR", 1, "shared", [2]], ["CA", 2, 3, 6], ["CHR", 0, "shared", [3]], ["CA", 1, 4, 6], ["FU", 8, [0, 1]], ["AN", 8, 0, 5], ["FU", 8, [1, 2]], ["AN", 8, 1, 4], ["FU", 8, [2, 3]], ["AN", 8, 2, 6], ["FU", 3, [0, 1]], ["SP", 3, 0, 36, [1], 1], ["AN", 3, 1, 2], ["FFSP", 3, 0, [3, 2], 1, 1], ["AN", 3, 1, 6], ["FU", 1, [0, 1]], ["SP", 1, 0, 1152, [1], 1], ["AN", 1, 1, 2], ["FFSP", 1, 0, [3, 2], 1, 1], ["AN", 1, 1, 6], ["PR", 4, 0, "auto_unroll_max_step$512"]]]], "r": [[0.0130698], 0, 2.45258, 1695326960], "v": "v0.6"}
{"i": [["[\"990586ac95c316d6af64e8ddc5165a26\", [8192, 1152], [128, 1152], [128], [8192, 128]]", "rocm -keys=rocm,gpu -max_num_threads=256 -max_shared_memory_per_block=65536 -max_threads_per_block=256 -mcpu=gfx908 -mtriple=amdgcn-amd-amdhsa-hcc -thread_warp_size=64", [-1, 16, 64, 65536, 2147483647, 1024, 16, 64], "", 0, []], [[], [["CI", 5], ["CI", 4], ["SP", 2, 0, 8192, [4, 2, 8, 8], 1], ["SP", 2, 5, 128, [1, 4, 1, 1], 1], ["SP", 2, 10, 1152, [1, 16], 1], ["RE", 2, [0, 5, 1, 6, 2, 7, 10, 11, 3, 8, 12, 4, 9]], ["FSP", 6, 0, 2, 3], ["FSP", 6, 4, 3, 3], ["RE", 6, [0, 4, 1, 5, 2, 6, 3, 7]], ["CA", 2, 6, 5], ["CHR", 1, "shared", [2]], ["CA", 2, 3, 6], ["CHR", 0, "shared", [3]], ["CA", 1, 4, 6], ["FU", 8, [0, 1]], ["AN", 8, 0, 5], ["FU", 8, [1, 2]], ["AN", 8, 1, 4], ["FU", 8, [2, 3]], ["AN", 8, 2, 6], ["FU", 3, [0, 1]], ["SP", 3, 0, 16, [2], 1], ["AN", 3, 1, 2], ["FFSP", 3, 0, [3, 2], 1, 1], ["AN", 3, 1, 6], ["FU", 1, [0, 1]], ["SP", 1, 0, 1024, [1], 1], ["AN", 1, 1, 2], ["FFSP", 1, 0, [3, 2], 1, 1], ["AN", 1, 1, 6], ["PR", 4, 0, "auto_unroll_max_step$512"]]]], "r": [[0.326405], 0, 7.92389, 1695326963], "v": "v0.6"}
{"i": [["[\"990586ac95c316d6af64e8ddc5165a26\", [8192, 1152], [128, 1152], [128], [8192, 128]]", "rocm -keys=rocm,gpu -max_num_threads=256 -max_shared_memory_per_block=65536 -max_threads_per_block=256 -mcpu=gfx908 -mtriple=amdgcn-amd-amdhsa-hcc -thread_warp_size=64", [-1, 16, 64, 65536, 2147483647, 1024, 16, 64], "", 0, []], [[], [["CI", 5], ["CI", 4], ["SP", 2, 0, 8192, [1, 32, 1, 8], 1], ["SP", 2, 5, 128, [4, 8, 2, 2], 1], ["SP", 2, 10, 1152, [1, 3], 1], ["RE", 2, [0, 5, 1, 6, 2, 7, 10, 11, 3, 8, 12, 4, 9]], ["FSP", 6, 0, 2, 3], ["FSP", 6, 4, 3, 3], ["RE", 6, [0, 4, 1, 5, 2, 6, 3, 7]], ["CA", 2, 6, 5], ["CHR", 1, "shared", [2]], ["CA", 2, 3, 6], ["CHR", 0, "shared", [3]], ["CA", 1, 4, 6], ["FU", 8, [0, 1]], ["AN", 8, 0, 5], ["FU", 8, [1, 2]], ["AN", 8, 1, 4], ["FU", 8, [2, 3]], ["AN", 8, 2, 6], ["FU", 3, [0, 1]], ["SP", 3, 0, 12, [1], 1], ["AN", 3, 1, 2], ["FFSP", 3, 0, [3, 2], 1, 1], ["AN", 3, 1, 6], ["FU", 1, [0, 1]], ["SP", 1, 0, 24, [3], 1], ["AN", 1, 1, 2], ["FFSP", 1, 0, [3, 2], 1, 1], ["AN", 1, 1, 6], ["PR", 4, 0, "auto_unroll_max_step$512"]]]], "r": [[0.00332731], 0, 2.90806, 1695326964], "v": "v0.6"}
{"i": [["[\"990586ac95c316d6af64e8ddc5165a26\", [8192, 1152], [128, 1152], [128], [8192, 128]]", "rocm -keys=rocm,gpu -max_num_threads=256 -max_shared_memory_per_block=65536 -max_threads_per_block=256 -mcpu=gfx908 -mtriple=amdgcn-amd-amdhsa-hcc -thread_warp_size=64", [-1, 16, 64, 65536, 2147483647, 1024, 16, 64], "", 0, []], [[], [["CI", 5], ["CI", 4], ["SP", 2, 0, 8192, [1, 8, 2, 2], 1], ["SP", 2, 5, 128, [1, 16, 1, 1], 1], ["SP", 2, 10, 1152, [2, 9], 1], ["RE", 2, [0, 5, 1, 6, 2, 7, 10, 11, 3, 8, 12, 4, 9]], ["FSP", 6, 0, 2, 3], ["FSP", 6, 4, 3, 3], ["RE", 6, [0, 4, 1, 5, 2, 6, 3, 7]], ["CA", 2, 6, 5], ["CHR", 1, "shared", [2]], ["CA", 2, 3, 6], ["CHR", 0, "shared", [3]], ["CA", 1, 4, 6], ["FU", 8, [0, 1]], ["AN", 8, 0, 5], ["FU", 8, [1, 2]], ["AN", 8, 1, 4], ["FU", 8, [2, 3]], ["AN", 8, 2, 6], ["FU", 3, [0, 1]], ["SP", 3, 0, 72, [2], 1], ["AN", 3, 1, 2], ["FFSP", 3, 0, [3, 2], 1, 1], ["AN", 3, 1, 6], ["FU", 1, [0, 1]], ["SP", 1, 0, 72, [4], 1], ["AN", 1, 1, 2], ["FFSP", 1, 0, [3, 2], 1, 1], ["AN", 1, 1, 6], ["PR", 4, 0, "auto_unroll_max_step$512"]]]], "r": [[0.00117817], 0, 2.22769, 1695326965], "v": "v0.6"}
{"i": [["[\"990586ac95c316d6af64e8ddc5165a26\", [8192, 1152], [128, 1152], [128], [8192, 128]]", "rocm -keys=rocm,gpu -max_num_threads=256 -max_shared_memory_per_block=65536 -max_threads_per_block=256 -mcpu=gfx908 -mtriple=amdgcn-amd-amdhsa-hcc -thread_warp_size=64", [-1, 16, 64, 65536, 2147483647, 1024, 16, 64], "", 0, []], [[], [["CI", 5], ["CI", 4], ["SP", 2, 0, 8192, [1, 4, 2, 64], 1], ["SP", 2, 5, 128, [2, 16, 2, 2], 1], ["SP", 2, 10, 1152, [8, 3], 1], ["RE", 2, [0, 5, 1, 6, 2, 7, 10, 11, 3, 8, 12, 4, 9]], ["FSP", 6, 0, 2, 3], ["FSP", 6, 4, 3, 3], ["RE", 6, [0, 4, 1, 5, 2, 6, 3, 7]], ["CA", 2, 6, 5], ["CHR", 1, "shared", [2]], ["CA", 2, 3, 6], ["CHR", 0, "shared", [3]], ["CA", 1, 4, 6], ["FU", 8, [0, 1]], ["AN", 8, 0, 5], ["FU", 8, [1, 2]], ["AN", 8, 1, 4], ["FU", 8, [2, 3]], ["AN", 8, 2, 6], ["FU", 3, [0, 1]], ["SP", 3, 0, 96, [1], 1], ["AN", 3, 1, 2], ["FFSP", 3, 0, [3, 2], 1, 1], ["AN", 3, 1, 6], ["FU", 1, [0, 1]], ["SP", 1, 0, 3072, [1], 1], ["AN", 1, 1, 2], ["FFSP", 1, 0, [3, 2], 1, 1], ["AN", 1, 1, 6], ["PR", 4, 0, "auto_unroll_max_step$0"]]]], "r": [[0.221963], 0, 3.13119, 1695326967], "v": "v0.6"}
{"i": [["[\"990586ac95c316d6af64e8ddc5165a26\", [8192, 1152], [128, 1152], [128], [8192, 128]]", "rocm -keys=rocm,gpu -max_num_threads=256 -max_shared_memory_per_block=65536 -max_threads_per_block=256 -mcpu=gfx908 -mtriple=amdgcn-amd-amdhsa-hcc -thread_warp_size=64", [-1, 16, 64, 65536, 2147483647, 1024, 16, 64], "", 0, []], [[], [["CI", 5], ["CI", 4], ["SP", 2, 0, 8192, [4, 8, 1, 32], 1], ["SP", 2, 5, 128, [1, 8, 8, 1], 1], ["SP", 2, 10, 1152, [1, 6], 1], ["RE", 2, [0, 5, 1, 6, 2, 7, 10, 11, 3, 8, 12, 4, 9]], ["FSP", 6, 0, 2, 3], ["FSP", 6, 4, 3, 3], ["RE", 6, [0, 4, 1, 5, 2, 6, 3, 7]], ["CA", 2, 6, 5], ["CHR", 1, "shared", [2]], ["CA", 2, 3, 6], ["CHR", 0, "shared", [3]], ["CA", 1, 4, 6], ["FU", 8, [0, 1]], ["AN", 8, 0, 5], ["FU", 8, [1, 2]], ["AN", 8, 1, 4], ["FU", 8, [2, 3]], ["AN", 8, 2, 6], ["FU", 3, [0, 1]], ["SP", 3, 0, 144, [16], 1], ["AN", 3, 1, 2], ["FFSP", 3, 0, [3, 2], 1, 1], ["AN", 3, 1, 6], ["FU", 1, [0, 1]], ["SP", 1, 0, 288, [1], 1], ["AN", 1, 1, 2], ["FFSP", 1, 0, [3, 2], 1, 1], ["AN", 1, 1, 6], ["PR", 4, 0, "auto_unroll_max_step$0"]]]], "r": [[0.0541164], 0, 2.97421, 1695326970], "v": "v0.6"}
{"i": [["[\"990586ac95c316d6af64e8ddc5165a26\", [8192, 1152], [128, 1152], [128], [8192, 128]]", "rocm -keys=rocm,gpu -max_num_threads=256 -max_shared_memory_per_block=65536 -max_threads_per_block=256 -mcpu=gfx908 -mtriple=amdgcn-amd-amdhsa-hcc -thread_warp_size=64", [-1, 16, 64, 65536, 2147483647, 1024, 16, 64], "", 0, []], [[], [["CI", 5], ["CI", 4], ["SP", 2, 0, 8192, [1, 32, 1, 8], 1], ["SP", 2, 5, 128, [4, 16, 2, 1], 1], ["SP", 2, 10, 1152, [1, 3], 1], ["RE", 2, [0, 5, 1, 6, 2, 7, 10, 11, 3, 8, 12, 4, 9]], ["FSP", 6, 0, 2, 3], ["FSP", 6, 4, 3, 3], ["RE", 6, [0, 4, 1, 5, 2, 6, 3, 7]], ["CA", 2, 6, 5], ["CHR", 1, "shared", [2]], ["CA", 2, 3, 6], ["CHR", 0, "shared", [3]], ["CA", 1, 4, 6], ["FU", 8, [0, 1]], ["AN", 8, 0, 5], ["FU", 8, [1, 2]], ["AN", 8, 1, 4], ["FU", 8, [2, 3]], ["AN", 8, 2, 6], ["FU", 3, [0, 1]], ["SP", 3, 0, 12, [1], 1], ["AN", 3, 1, 2], ["FFSP", 3, 0, [3, 2], 1, 1], ["AN", 3, 1, 6], ["FU", 1, [0, 1]], ["SP", 1, 0, 24, [1], 1], ["AN", 1, 1, 2], ["FFSP", 1, 0, [3, 2], 1, 1], ["AN", 1, 1, 6], ["PR", 4, 0, "auto_unroll_max_step$512"]]]], "r": [[0.00126034], 0, 2.26225, 1695326971], "v": "v0.6"}
{"i": [["[\"990586ac95c316d6af64e8ddc5165a26\", [8192, 1152], [128, 1152], [128], [8192, 128]]", "rocm -keys=rocm,gpu -max_num_threads=256 -max_shared_memory_per_block=65536 -max_threads_per_block=256 -mcpu=gfx908 -mtriple=amdgcn-amd-amdhsa-hcc -thread_warp_size=64", [-1, 16, 64, 65536, 2147483647, 1024, 16, 64], "", 0, []], [[], [["CI", 5], ["CI", 4], ["SP", 2, 0, 8192, [1, 4, 2, 2], 1], ["SP", 2, 5, 128, [1, 64, 1, 1], 1], ["SP", 2, 10, 1152, [6, 2], 1], ["RE", 2, [0, 5, 1, 6, 2, 7, 10, 11, 3, 8, 12, 4, 9]], ["FSP", 6, 0, 2, 3], ["FSP", 6, 4, 3, 3], ["RE", 6, [0, 4, 1, 5, 2, 6, 3, 7]], ["CA", 2, 6, 5], ["CHR", 1, "shared", [2]], ["CA", 2, 3, 6], ["CHR", 0, "shared", [3]], ["CA", 1, 4, 6], ["FU", 8, [0, 1]], ["AN", 8, 0, 5], ["FU", 8, [1, 2]], ["AN", 8, 1, 4], ["FU", 8, [2, 3]], ["AN", 8, 2, 6], ["FU", 3, [0, 1]], ["SP", 3, 0, 192, [1], 1], ["AN", 3, 1, 2], ["FFSP", 3, 0, [3, 2], 1, 1], ["AN", 3, 1, 6], ["FU", 1, [0, 1]], ["SP", 1, 0, 384, [1], 1], ["AN", 1, 1, 2], ["FFSP", 1, 0, [3, 2], 1, 1], ["AN", 1, 1, 6], ["PR", 4, 0, "auto_unroll_max_step$512"]]]], "r": [[0.000746944], 0, 1.87177, 1695326972], "v": "v0.6"}
{"i": [["[\"990586ac95c316d6af64e8ddc5165a26\", [8192, 1152], [128, 1152], [128], [8192, 128]]", "rocm -keys=rocm,gpu -max_num_threads=256 -max_shared_memory_per_block=65536 -max_threads_per_block=256 -mcpu=gfx908 -mtriple=amdgcn-amd-amdhsa-hcc -thread_warp_size=64", [-1, 16, 64, 65536, 2147483647, 1024, 16, 64], "", 0, []], [[], [["CI", 5], ["CI", 4], ["SP", 2, 0, 8192, [1, 64, 2, 1], 1], ["SP", 2, 5, 128, [4, 1, 1, 32], 1], ["SP", 2, 10, 1152, [1, 1], 1], ["RE", 2, [0, 5, 1, 6, 2, 7, 10, 11, 3, 8, 12, 4, 9]], ["FSP", 6, 0, 2, 3], ["FSP", 6, 4, 3, 3], ["RE", 6, [0, 4, 1, 5, 2, 6, 3, 7]], ["CA", 2, 6, 5], ["CHR", 1, "shared", [2]], ["CA", 2, 3, 6], ["CHR", 0, "shared", [3]], ["CA", 1, 4, 6], ["FU", 8, [0, 1]], ["AN", 8, 0, 5], ["FU", 8, [1, 2]], ["AN", 8, 1, 4], ["FU", 8, [2, 3]], ["AN", 8, 2, 6], ["FU", 3, [0, 1]], ["SP", 3, 0, 64, [1], 1], ["AN", 3, 1, 2], ["FFSP", 3, 0, [3, 2], 1, 1], ["AN", 3, 1, 6], ["FU", 1, [0, 1]], ["SP", 1, 0, 2, [1], 1], ["AN", 1, 1, 2], ["FFSP", 1, 0, [3, 2], 1, 1], ["AN", 1, 1, 6], ["PR", 4, 0, "auto_unroll_max_step$512"]]]], "r": [[0.07066], 0, 4.04281, 1695326974], "v": "v0.6"}
{"i": [["[\"990586ac95c316d6af64e8ddc5165a26\", [8192, 1152], [128, 1152], [128], [8192, 128]]", "rocm -keys=rocm,gpu -max_num_threads=256 -max_shared_memory_per_block=65536 -max_threads_per_block=256 -mcpu=gfx908 -mtriple=amdgcn-amd-amdhsa-hcc -thread_warp_size=64", [-1, 16, 64, 65536, 2147483647, 1024, 16, 64], "", 0, []], [[], [["CI", 5], ["CI", 4], ["SP", 2, 0, 8192, [8, 16, 1, 4], 1], ["SP", 2, 5, 128, [1, 16, 2, 2], 1], ["SP", 2, 10, 1152, [1, 4], 1], ["RE", 2, [0, 5, 1, 6, 2, 7, 10, 11, 3, 8, 12, 4, 9]], ["FSP", 6, 0, 2, 3], ["FSP", 6, 4, 3, 3], ["RE", 6, [0, 4, 1, 5, 2, 6, 3, 7]], ["CA", 2, 6, 5], ["CHR", 1, "shared", [2]], ["CA", 2, 3, 6], ["CHR", 0, "shared", [3]], ["CA", 1, 4, 6], ["FU", 8, [0, 1]], ["AN", 8, 0, 5], ["FU", 8, [1, 2]], ["AN", 8, 1, 4], ["FU", 8, [2, 3]], ["AN", 8, 2, 6], ["FU", 3, [0, 1]], ["SP", 3, 0, 16, [1], 1], ["AN", 3, 1, 2], ["FFSP", 3, 0, [3, 2], 1, 1], ["AN", 3, 1, 6], ["FU", 1, [0, 1]], ["SP", 1, 0, 16, [16], 1], ["AN", 1, 1, 2], ["FFSP", 1, 0, [3, 2], 1, 1], ["AN", 1, 1, 6], ["PR", 4, 0, "auto_unroll_max_step$64"]]]], "r": [[0.0110405], 0, 4.55447, 1695326976], "v": "v0.6"}
{"i": [["[\"990586ac95c316d6af64e8ddc5165a26\", [8192, 1152], [128, 1152], [128], [8192, 128]]", "rocm -keys=rocm,gpu -max_num_threads=256 -max_shared_memory_per_block=65536 -max_threads_per_block=256 -mcpu=gfx908 -mtriple=amdgcn-amd-amdhsa-hcc -thread_warp_size=64", [-1, 16, 64, 65536, 2147483647, 1024, 16, 64], "", 0, []], [[], [["CI", 5], ["CI", 4], ["SP", 2, 0, 8192, [4, 64, 1, 1], 1], ["SP", 2, 5, 128, [1, 2, 64, 1], 1], ["SP", 2, 10, 1152, [2, 16], 1], ["RE", 2, [0, 5, 1, 6, 2, 7, 10, 11, 3, 8, 12, 4, 9]], ["FSP", 6, 0, 2, 3], ["FSP", 6, 4, 3, 3], ["RE", 6, [0, 4, 1, 5, 2, 6, 3, 7]], ["CA", 2, 6, 5], ["CHR", 1, "shared", [2]], ["CA", 2, 3, 6], ["CHR", 0, "shared", [3]], ["CA", 1, 4, 6], ["FU", 8, [0, 1]], ["AN", 8, 0, 5], ["FU", 8, [1, 2]], ["AN", 8, 1, 4], ["FU", 8, [2, 3]], ["AN", 8, 2, 6], ["FU", 3, [0, 1]], ["SP", 3, 0, 2048, [1], 1], ["AN", 3, 1, 2], ["FFSP", 3, 0, [3, 2], 1, 1], ["AN", 3, 1, 6], ["FU", 1, [0, 1]], ["SP", 1, 0, 32, [1], 1], ["AN", 1, 1, 2], ["FFSP", 1, 0, [3, 2], 1, 1], ["AN", 1, 1, 6], ["PR", 4, 0, "auto_unroll_max_step$0"]]]], "r": [[0.00492053], 0, 3.06503, 1695326977], "v": "v0.6"}
{"i": [["[\"990586ac95c316d6af64e8ddc5165a26\", [8192, 1152], [128, 1152], [128], [8192, 128]]", "rocm -keys=rocm,gpu -max_num_threads=256 -max_shared_memory_per_block=65536 -max_threads_per_block=256 -mcpu=gfx908 -mtriple=amdgcn-amd-amdhsa-hcc -thread_warp_size=64", [-1, 16, 64, 65536, 2147483647, 1024, 16, 64], "", 0, []], [[], [["CI", 5], ["CI", 4], ["SP", 2, 0, 8192, [1, 2, 64, 1], 1], ["SP", 2, 5, 128, [1, 32, 1, 2], 1], ["SP", 2, 10, 1152, [1, 18], 1], ["RE", 2, [0, 5, 1, 6, 2, 7, 10, 11, 3, 8, 12, 4, 9]], ["FSP", 6, 0, 2, 3], ["FSP", 6, 4, 3, 3], ["RE", 6, [0, 4, 1, 5, 2, 6, 3, 7]], ["CA", 2, 6, 5], ["CHR", 1, "shared", [2]], ["CA", 2, 3, 6], ["CHR", 0, "shared", [3]], ["CA", 1, 4, 6], ["FU", 8, [0, 1]], ["AN", 8, 0, 5], ["FU", 8, [1, 2]], ["AN", 8, 1, 4], ["FU", 8, [2, 3]], ["AN", 8, 2, 6], ["FU", 3, [0, 1]], ["SP", 3, 0, 36, [4], 1], ["AN", 3, 1, 2], ["FFSP", 3, 0, [3, 2], 1, 1], ["AN", 3, 1, 6], ["FU", 1, [0, 1]], ["SP", 1, 0, 1152, [1], 1], ["AN", 1, 1, 2], ["FFSP", 1, 0, [3, 2], 1, 1], ["AN", 1, 1, 6], ["PR", 4, 0, "auto_unroll_max_step$512"]]]], "r": [[0.00304234], 0, 3.56657, 1695326978], "v": "v0.6"}
{"i": [["[\"990586ac95c316d6af64e8ddc5165a26\", [8192, 1152], [128, 1152], [128], [8192, 128]]", "rocm -keys=rocm,gpu -max_num_threads=256 -max_shared_memory_per_block=65536 -max_threads_per_block=256 -mcpu=gfx908 -mtriple=amdgcn-amd-amdhsa-hcc -thread_warp_size=64", [-1, 16, 64, 65536, 2147483647, 1024, 16, 64], "", 0, []], [[], [["CI", 5], ["CI", 4], ["SP", 2, 0, 8192, [2, 16, 4, 4], 1], ["SP", 2, 5, 128, [4, 4, 2, 2], 1], ["SP", 2, 10, 1152, [1, 9], 1], ["RE", 2, [0, 5, 1, 6, 2, 7, 10, 11, 3, 8, 12, 4, 9]], ["FSP", 6, 0, 2, 3], ["FSP", 6, 4, 3, 3], ["RE", 6, [0, 4, 1, 5, 2, 6, 3, 7]], ["CA", 2, 6, 5], ["CHR", 1, "shared", [2]], ["CA", 2, 3, 6], ["CHR", 0, "shared", [3]], ["CA", 1, 4, 6], ["FU", 8, [0, 1]], ["AN", 8, 0, 5], ["FU", 8, [1, 2]], ["AN", 8, 1, 4], ["FU", 8, [2, 3]], ["AN", 8, 2, 6], ["FU", 3, [0, 1]], ["SP", 3, 0, 36, [6], 1], ["AN", 3, 1, 2], ["FFSP", 3, 0, [3, 2], 1, 1], ["AN", 3, 1, 6], ["FU", 1, [0, 1]], ["SP", 1, 0, 144, [1], 1], ["AN", 1, 1, 2], ["FFSP", 1, 0, [3, 2], 1, 1], ["AN", 1, 1, 6], ["PR", 4, 0, "auto_unroll_max_step$0"]]]], "r": [[0.00910346], 0, 2.40904, 1695326980], "v": "v0.6"}
{"i": [["[\"990586ac95c316d6af64e8ddc5165a26\", [8192, 1152], [128, 1152], [128], [8192, 128]]", "rocm -keys=rocm,gpu -max_num_threads=256 -max_shared_memory_per_block=65536 -max_threads_per_block=256 -mcpu=gfx908 -mtriple=amdgcn-amd-amdhsa-hcc -thread_warp_size=64", [-1, 16, 64, 65536, 2147483647, 1024, 16, 64], "", 0, []], [[], [["CI", 5], ["CI", 4], ["SP", 2, 0, 8192, [1, 32, 4, 16], 1], ["SP", 2, 5, 128, [4, 8, 1, 4], 1], ["SP", 2, 10, 1152, [3, 2], 1], ["RE", 2, [0, 5, 1, 6, 2, 7, 10, 11, 3, 8, 12, 4, 9]], ["FSP", 6, 0, 2, 3], ["FSP", 6, 4, 3, 3], ["RE", 6, [0, 4, 1, 5, 2, 6, 3, 7]], ["CA", 2, 6, 5], ["CHR", 1, "shared", [2]], ["CA", 2, 3, 6], ["CHR", 0, "shared", [3]], ["CA", 1, 4, 6], ["FU", 8, [0, 1]], ["AN", 8, 0, 5], ["FU", 8, [1, 2]], ["AN", 8, 1, 4], ["FU", 8, [2, 3]], ["AN", 8, 2, 6], ["FU", 3, [0, 1]], ["SP", 3, 0, 24, [24], 1], ["AN", 3, 1, 2], ["FFSP", 3, 0, [3, 2], 1, 1], ["AN", 3, 1, 6], ["FU", 1, [0, 1]], ["SP", 1, 0, 384, [32], 1], ["AN", 1, 1, 2], ["FFSP", 1, 0, [3, 2], 1, 1], ["AN", 1, 1, 6], ["PR", 4, 0, "auto_unroll_max_step$64"]]]], "r": [[0.285783], 0, 4.1643, 1695326983], "v": "v0.6"}
{"i": [["[\"990586ac95c316d6af64e8ddc5165a26\", [8192, 1152], [128, 1152], [128], [8192, 128]]", "rocm -keys=rocm,gpu -max_num_threads=256 -max_shared_memory_per_block=65536 -max_threads_per_block=256 -mcpu=gfx908 -mtriple=amdgcn-amd-amdhsa-hcc -thread_warp_size=64", [-1, 16, 64, 65536, 2147483647, 1024, 16, 64], "", 0, []], [[], [["CI", 5], ["CI", 4], ["SP", 2, 0, 8192, [1, 16, 16, 16], 1], ["SP", 2, 5, 128, [1, 8, 1, 1], 1], ["SP", 2, 10, 1152, [2, 1], 1], ["RE", 2, [0, 5, 1, 6, 2, 7, 10, 11, 3, 8, 12, 4, 9]], ["FSP", 6, 0, 2, 3], ["FSP", 6, 4, 3, 3], ["RE", 6, [0, 4, 1, 5, 2, 6, 3, 7]], ["CA", 2, 6, 5], ["CHR", 1, "shared", [2]], ["CA", 2, 3, 6], ["CHR", 0, "shared", [3]], ["CA", 1, 4, 6], ["FU", 8, [0, 1]], ["AN", 8, 0, 5], ["FU", 8, [1, 2]], ["AN", 8, 1, 4], ["FU", 8, [2, 3]], ["AN", 8, 2, 6], ["FU", 3, [0, 1]], ["SP", 3, 0, 2, [1], 1], ["AN", 3, 1, 2], ["FFSP", 3, 0, [3, 2], 1, 1], ["AN", 3, 1, 6], ["FU", 1, [0, 1]], ["SP", 1, 0, 512, [4], 1], ["AN", 1, 1, 2], ["FFSP", 1, 0, [3, 2], 1, 1], ["AN", 1, 1, 6], ["PR", 4, 0, "auto_unroll_max_step$0"]]]], "r": [[0.0438877], 0, 2.26809, 1695326984], "v": "v0.6"}
{"i": [["[\"990586ac95c316d6af64e8ddc5165a26\", [8192, 1152], [128, 1152], [128], [8192, 128]]", "rocm -keys=rocm,gpu -max_num_threads=256 -max_shared_memory_per_block=65536 -max_threads_per_block=256 -mcpu=gfx908 -mtriple=amdgcn-amd-amdhsa-hcc -thread_warp_size=64", [-1, 16, 64, 65536, 2147483647, 1024, 16, 64], "", 0, []], [[], [["CI", 5], ["CI", 4], ["SP", 2, 0, 8192, [1, 4, 1, 8], 1], ["SP", 2, 5, 128, [4, 16, 1, 1], 1], ["SP", 2, 10, 1152, [8, 2], 1], ["RE", 2, [0, 5, 1, 6, 2, 7, 10, 11, 3, 8, 12, 4, 9]], ["FSP", 6, 0, 2, 3], ["FSP", 6, 4, 3, 3], ["RE", 6, [0, 4, 1, 5, 2, 6, 3, 7]], ["CA", 2, 6, 5], ["CHR", 1, "shared", [2]], ["CA", 2, 3, 6], ["CHR", 0, "shared", [3]], ["CA", 1, 4, 6], ["FU", 8, [0, 1]], ["AN", 8, 0, 5], ["FU", 8, [1, 2]], ["AN", 8, 1, 4], ["FU", 8, [2, 3]], ["AN", 8, 2, 6], ["FU", 3, [0, 1]], ["SP", 3, 0, 16, [1], 1], ["AN", 3, 1, 2], ["FFSP", 3, 0, [3, 2], 1, 1], ["AN", 3, 1, 6], ["FU", 1, [0, 1]], ["SP", 1, 0, 128, [1], 1], ["AN", 1, 1, 2], ["FFSP", 1, 0, [3, 2], 1, 1], ["AN", 1, 1, 6], ["PR", 4, 0, "auto_unroll_max_step$16"]]]], "r": [[0.000739079], 0, 2.07849, 1695326985], "v": "v0.6"}
{"i": [["[\"990586ac95c316d6af64e8ddc5165a26\", [8192, 1152], [128, 1152], [128], [8192, 128]]", "rocm -keys=rocm,gpu -max_num_threads=256 -max_shared_memory_per_block=65536 -max_threads_per_block=256 -mcpu=gfx908 -mtriple=amdgcn-amd-amdhsa-hcc -thread_warp_size=64", [-1, 16, 64, 65536, 2147483647, 1024, 16, 64], "", 0, []], [[], [["CI", 5], ["CI", 4], ["SP", 2, 0, 8192, [1, 4, 2, 64], 1], ["SP", 2, 5, 128, [2, 16, 2, 2], 1], ["SP", 2, 10, 1152, [8, 1], 1], ["RE", 2, [0, 5, 1, 6, 2, 7, 10, 11, 3, 8, 12, 4, 9]], ["FSP", 6, 0, 2, 3], ["FSP", 6, 4, 3, 3], ["RE", 6, [0, 4, 1, 5, 2, 6, 3, 7]], ["CA", 2, 6, 5], ["CHR", 1, "shared", [2]], ["CA", 2, 3, 6], ["CHR", 0, "shared", [3]], ["CA", 1, 4, 6], ["FU", 8, [0, 1]], ["AN", 8, 0, 5], ["FU", 8, [1, 2]], ["AN", 8, 1, 4], ["FU", 8, [2, 3]], ["AN", 8, 2, 6], ["FU", 3, [0, 1]], ["SP", 3, 0, 96, [1], 1], ["AN", 3, 1, 2], ["FFSP", 3, 0, [3, 2], 1, 1], ["AN", 3, 1, 6], ["FU", 1, [0, 1]], ["SP", 1, 0, 3072, [1], 1], ["AN", 1, 1, 2], ["FFSP", 1, 0, [3, 2], 1, 1], ["AN", 1, 1, 6], ["PR", 4, 0, "auto_unroll_max_step$512"]]]], "r": [[0.280348], 0, 24.8261, 1695326988], "v": "v0.6"}
{"i": [["[\"990586ac95c316d6af64e8ddc5165a26\", [8192, 1152], [128, 1152], [128], [8192, 128]]", "rocm -keys=rocm,gpu -max_num_threads=256 -max_shared_memory_per_block=65536 -max_threads_per_block=256 -mcpu=gfx908 -mtriple=amdgcn-amd-amdhsa-hcc -thread_warp_size=64", [-1, 16, 64, 65536, 2147483647, 1024, 16, 64], "", 0, []], [[], [["CI", 5], ["CI", 4], ["SP", 2, 0, 8192, [1, 8, 2, 32], 1], ["SP", 2, 5, 128, [1, 16, 4, 1], 1], ["SP", 2, 10, 1152, [2, 9], 1], ["RE", 2, [0, 5, 1, 6, 2, 7, 10, 11, 3, 8, 12, 4, 9]], ["FSP", 6, 0, 2, 3], ["FSP", 6, 4, 3, 3], ["RE", 6, [0, 4, 1, 5, 2, 6, 3, 7]], ["CA", 2, 6, 5], ["CHR", 1, "shared", [2]], ["CA", 2, 3, 6], ["CHR", 0, "shared", [3]], ["CA", 1, 4, 6], ["FU", 8, [0, 1]], ["AN", 8, 0, 5], ["FU", 8, [1, 2]], ["AN", 8, 1, 4], ["FU", 8, [2, 3]], ["AN", 8, 2, 6], ["FU", 3, [0, 1]], ["SP", 3, 0, 72, [1], 1], ["AN", 3, 1, 2], ["FFSP", 3, 0, [3, 2], 1, 1], ["AN", 3, 1, 6], ["FU", 1, [0, 1]], ["SP", 1, 0, 72, [1], 1], ["AN", 1, 1, 2], ["FFSP", 1, 0, [3, 2], 1, 1], ["AN", 1, 1, 6], ["PR", 4, 0, "auto_unroll_max_step$0"]]]], "r": [[0.00980084], 0, 2.63017, 1695326990], "v": "v0.6"}
{"i": [["[\"990586ac95c316d6af64e8ddc5165a26\", [8192, 1152], [128, 1152], [128], [8192, 128]]", "rocm -keys=rocm,gpu -max_num_threads=256 -max_shared_memory_per_block=65536 -max_threads_per_block=256 -mcpu=gfx908 -mtriple=amdgcn-amd-amdhsa-hcc -thread_warp_size=64", [-1, 16, 64, 65536, 2147483647, 1024, 16, 64], "", 0, []], [[], [["CI", 5], ["CI", 4], ["SP", 2, 0, 8192, [2, 16, 1, 1], 1], ["SP", 2, 5, 128, [1, 8, 8, 2], 1], ["SP", 2, 10, 1152, [3, 12], 1], ["RE", 2, [0, 5, 1, 6, 2, 7, 10, 11, 3, 8, 12, 4, 9]], ["FSP", 6, 0, 2, 3], ["FSP", 6, 4, 3, 3], ["RE", 6, [0, 4, 1, 5, 2, 6, 3, 7]], ["CA", 2, 6, 5], ["CHR", 1, "shared", [2]], ["CA", 2, 3, 6], ["CHR", 0, "shared", [3]], ["CA", 1, 4, 6], ["FU", 8, [0, 1]], ["AN", 8, 0, 5], ["FU", 8, [1, 2]], ["AN", 8, 1, 4], ["FU", 8, [2, 3]], ["AN", 8, 2, 6], ["FU", 3, [0, 1]], ["SP", 3, 0, 1152, [1], 1], ["AN", 3, 1, 2], ["FFSP", 3, 0, [3, 2], 1, 1], ["AN", 3, 1, 6], ["FU", 1, [0, 1]], ["SP", 1, 0, 72, [6], 1], ["AN", 1, 1, 2], ["FFSP", 1, 0, [3, 2], 1, 1], ["AN", 1, 1, 6], ["PR", 4, 0, "auto_unroll_max_step$64"]]]], "r": [[0.00300739], 0, 2.75856, 1695326991], "v": "v0.6"}
{"i": [["[\"990586ac95c316d6af64e8ddc5165a26\", [8192, 1152], [128, 1152], [128], [8192, 128]]", "rocm -keys=rocm,gpu -max_num_threads=256 -max_shared_memory_per_block=65536 -max_threads_per_block=256 -mcpu=gfx908 -mtriple=amdgcn-amd-amdhsa-hcc -thread_warp_size=64", [-1, 16, 64, 65536, 2147483647, 1024, 16, 64], "", 0, []], [[], [["CI", 5], ["CI", 4], ["SP", 2, 0, 8192, [2, 16, 2, 1], 1], ["SP", 2, 5, 128, [1, 8, 16, 1], 1], ["SP", 2, 10, 1152, [1, 3], 1], ["RE", 2, [0, 5, 1, 6, 2, 7, 10, 11, 3, 8, 12, 4, 9]], ["FSP", 6, 0, 2, 3], ["FSP", 6, 4, 3, 3], ["RE", 6, [0, 4, 1, 5, 2, 6, 3, 7]], ["CA", 2, 6, 5], ["CHR", 1, "shared", [2]], ["CA", 2, 3, 6], ["CHR", 0, "shared", [3]], ["CA", 1, 4, 6], ["FU", 8, [0, 1]], ["AN", 8, 0, 5], ["FU", 8, [1, 2]], ["AN", 8, 1, 4], ["FU", 8, [2, 3]], ["AN", 8, 2, 6], ["FU", 3, [0, 1]], ["SP", 3, 0, 48, [24], 1], ["AN", 3, 1, 2], ["FFSP", 3, 0, [3, 2], 1, 1], ["AN", 3, 1, 6], ["FU", 1, [0, 1]], ["SP", 1, 0, 6, [1], 1], ["AN", 1, 1, 2], ["FFSP", 1, 0, [3, 2], 1, 1], ["AN", 1, 1, 6], ["PR", 4, 0, "auto_unroll_max_step$16"]]]], "r": [[0.00167948], 0, 2.21322, 1695326992], "v": "v0.6"}
{"i": [["[\"990586ac95c316d6af64e8ddc5165a26\", [8192, 1152], [128, 1152], [128], [8192, 128]]", "rocm -keys=rocm,gpu -max_num_threads=256 -max_shared_memory_per_block=65536 -max_threads_per_block=256 -mcpu=gfx908 -mtriple=amdgcn-amd-amdhsa-hcc -thread_warp_size=64", [-1, 16, 64, 65536, 2147483647, 1024, 16, 64], "", 0, []], [[], [["CI", 5], ["CI", 4], ["SP", 2, 0, 8192, [4, 256, 2, 1], 1], ["SP", 2, 5, 128, [1, 2, 32, 2], 1], ["SP", 2, 10, 1152, [1, 1], 1], ["RE", 2, [0, 5, 1, 6, 2, 7, 10, 11, 3, 8, 12, 4, 9]], ["FSP", 6, 0, 2, 3], ["FSP", 6, 4, 3, 3], ["RE", 6, [0, 4, 1, 5, 2, 6, 3, 7]], ["CA", 2, 6, 5], ["CHR", 1, "shared", [2]], ["CA", 2, 3, 6], ["CHR", 0, "shared", [3]], ["CA", 1, 4, 6], ["FU", 8, [0, 1]], ["AN", 8, 0, 5], ["FU", 8, [1, 2]], ["AN", 8, 1, 4], ["FU", 8, [2, 3]], ["AN", 8, 2, 6], ["FU", 3, [0, 1]], ["SP", 3, 0, 64, [16], 1], ["AN", 3, 1, 2], ["FFSP", 3, 0, [3, 2], 1, 1], ["AN", 3, 1, 6], ["FU", 1, [0, 1]], ["SP", 1, 0, 2, [2], 1], ["AN", 1, 1, 2], ["FFSP", 1, 0, [3, 2], 1, 1], ["AN", 1, 1, 6], ["PR", 4, 0, "auto_unroll_max_step$64"]]]], "r": [[0.0637547], 0, 2.36092, 1695326993], "v": "v0.6"}
{"i": [["[\"990586ac95c316d6af64e8ddc5165a26\", [8192, 1152], [128, 1152], [128], [8192, 128]]", "rocm -keys=rocm,gpu -max_num_threads=256 -max_shared_memory_per_block=65536 -max_threads_per_block=256 -mcpu=gfx908 -mtriple=amdgcn-amd-amdhsa-hcc -thread_warp_size=64", [-1, 16, 64, 65536, 2147483647, 1024, 16, 64], "", 0, []], [[], [["CI", 5], ["CI", 4], ["SP", 2, 0, 8192, [1, 4, 8, 8], 1], ["SP", 2, 5, 128, [2, 16, 1, 1], 1], ["SP", 2, 10, 1152, [12, 2], 1], ["RE", 2, [0, 5, 1, 6, 2, 7, 10, 11, 3, 8, 12, 4, 9]], ["FSP", 6, 0, 2, 3], ["FSP", 6, 4, 3, 3], ["RE", 6, [0, 4, 1, 5, 2, 6, 3, 7]], ["CA", 2, 6, 5], ["CHR", 1, "shared", [2]], ["CA", 2, 3, 6], ["CHR", 0, "shared", [3]], ["CA", 1, 4, 6], ["FU", 8, [0, 1]], ["AN", 8, 0, 5], ["FU", 8, [1, 2]], ["AN", 8, 1, 4], ["FU", 8, [2, 3]], ["AN", 8, 2, 6], ["FU", 3, [0, 1]], ["SP", 3, 0, 24, [1], 1], ["AN", 3, 1, 2], ["FFSP", 3, 0, [3, 2], 1, 1], ["AN", 3, 1, 6], ["FU", 1, [0, 1]], ["SP", 1, 0, 768, [1], 1], ["AN", 1, 1, 2], ["FFSP", 1, 0, [3, 2], 1, 1], ["AN", 1, 1, 6], ["PR", 4, 0, "auto_unroll_max_step$0"]]]], "r": [[0.00920213], 0, 3.90626, 1695326996], "v": "v0.6"}
{"i": [["[\"990586ac95c316d6af64e8ddc5165a26\", [8192, 1152], [128, 1152], [128], [8192, 128]]", "rocm -keys=rocm,gpu -max_num_threads=256 -max_shared_memory_per_block=65536 -max_threads_per_block=256 -mcpu=gfx908 -mtriple=amdgcn-amd-amdhsa-hcc -thread_warp_size=64", [-1, 16, 64, 65536, 2147483647, 1024, 16, 64], "", 0, []], [[], [["CI", 5], ["CI", 4], ["SP", 2, 0, 8192, [1, 32, 8, 1], 1], ["SP", 2, 5, 128, [1, 8, 1, 16], 1], ["SP", 2, 10, 1152, [8, 4], 1], ["RE", 2, [0, 5, 1, 6, 2, 7, 10, 11, 3, 8, 12, 4, 9]], ["FSP", 6, 0, 2, 3], ["FSP", 6, 4, 3, 3], ["RE", 6, [0, 4, 1, 5, 2, 6, 3, 7]], ["CA", 2, 6, 5], ["CHR", 1, "shared", [2]], ["CA", 2, 3, 6], ["CHR", 0, "shared", [3]], ["CA", 1, 4, 6], ["FU", 8, [0, 1]], ["AN", 8, 0, 5], ["FU", 8, [1, 2]], ["AN", 8, 1, 4], ["FU", 8, [2, 3]], ["AN", 8, 2, 6], ["FU", 3, [0, 1]], ["SP", 3, 0, 512, [1], 1], ["AN", 3, 1, 2], ["FFSP", 3, 0, [3, 2], 1, 1], ["AN", 3, 1, 6], ["FU", 1, [0, 1]], ["SP", 1, 0, 256, [1], 1], ["AN", 1, 1, 2], ["FFSP", 1, 0, [3, 2], 1, 1], ["AN", 1, 1, 6], ["PR", 4, 0, "auto_unroll_max_step$0"]]]], "r": [[0.00476237], 0, 3.30897, 1695326997], "v": "v0.6"}
{"i": [["[\"990586ac95c316d6af64e8ddc5165a26\", [8192, 1152], [128, 1152], [128], [8192, 128]]", "rocm -keys=rocm,gpu -max_num_threads=256 -max_shared_memory_per_block=65536 -max_threads_per_block=256 -mcpu=gfx908 -mtriple=amdgcn-amd-amdhsa-hcc -thread_warp_size=64", [-1, 16, 64, 65536, 2147483647, 1024, 16, 64], "", 0, []], [[], [["CI", 5], ["CI", 4], ["SP", 2, 0, 8192, [16, 32, 2, 1], 1], ["SP", 2, 5, 128, [1, 2, 2, 32], 1], ["SP", 2, 10, 1152, [1, 1], 1], ["RE", 2, [0, 5, 1, 6, 2, 7, 10, 11, 3, 8, 12, 4, 9]], ["FSP", 6, 0, 2, 3], ["FSP", 6, 4, 3, 3], ["RE", 6, [0, 4, 1, 5, 2, 6, 3, 7]], ["CA", 2, 6, 5], ["CHR", 1, "shared", [2]], ["CA", 2, 3, 6], ["CHR", 0, "shared", [3]], ["CA", 1, 4, 6], ["FU", 8, [0, 1]], ["AN", 8, 0, 5], ["FU", 8, [1, 2]], ["AN", 8, 1, 4], ["FU", 8, [2, 3]], ["AN", 8, 2, 6], ["FU", 3, [0, 1]], ["SP", 3, 0, 144, [16], 1], ["AN", 3, 1, 2], ["FFSP", 3, 0, [3, 2], 1, 1], ["AN", 3, 1, 6], ["FU", 1, [0, 1]], ["SP", 1, 0, 18, [1], 1], ["AN", 1, 1, 2], ["FFSP", 1, 0, [3, 2], 1, 1], ["AN", 1, 1, 6], ["PR", 4, 0, "auto_unroll_max_step$64"]]]], "r": [[0.077401], 0, 2.52359, 1695326998], "v": "v0.6"}
{"i": [["[\"990586ac95c316d6af64e8ddc5165a26\", [8192, 1152], [128, 1152], [128], [8192, 128]]", "rocm -keys=rocm,gpu -max_num_threads=256 -max_shared_memory_per_block=65536 -max_threads_per_block=256 -mcpu=gfx908 -mtriple=amdgcn-amd-amdhsa-hcc -thread_warp_size=64", [-1, 16, 64, 65536, 2147483647, 1024, 16, 64], "", 0, []], [[], [["CI", 5], ["CI", 4], ["SP", 2, 0, 8192, [1, 64, 1, 4], 1], ["SP", 2, 5, 128, [1, 1, 64, 1], 1], ["SP", 2, 10, 1152, [1, 9], 1], ["RE", 2, [0, 5, 1, 6, 2, 7, 10, 11, 3, 8, 12, 4, 9]], ["FSP", 6, 0, 2, 3], ["FSP", 6, 4, 3, 3], ["RE", 6, [0, 4, 1, 5, 2, 6, 3, 7]], ["CA", 2, 6, 5], ["CHR", 1, "shared", [2]], ["CA", 2, 3, 6], ["CHR", 0, "shared", [3]], ["CA", 1, 4, 6], ["FU", 8, [0, 1]], ["AN", 8, 0, 5], ["FU", 8, [1, 2]], ["AN", 8, 1, 4], ["FU", 8, [2, 3]], ["AN", 8, 2, 6], ["FU", 3, [0, 1]], ["SP", 3, 0, 36, [1], 1], ["AN", 3, 1, 2], ["FFSP", 3, 0, [3, 2], 1, 1], ["AN", 3, 1, 6], ["FU", 1, [0, 1]], ["SP", 1, 0, 72, [1], 1], ["AN", 1, 1, 2], ["FFSP", 1, 0, [3, 2], 1, 1], ["AN", 1, 1, 6], ["PR", 4, 0, "auto_unroll_max_step$16"]]]], "r": [[0.00547289], 0, 2.76576, 1695326999], "v": "v0.6"}
